Category,Name,Address,ID
اجهزة كهرباء والكترونيات,يونيتك مصر لمواد البناء,"القطعة 235 أ, المحور الخدمى الثانى, المنطقة الصناعية الثالثة, السادس من اكتوبر, الجيزة.",44916
اجهزة كهرباء والكترونيات,الكتروميكانيك,", الدور 2, السوق التجارى, سموحة, الاسكندرية.",581184
اجهزة كهرباء والكترونيات,الملكة للتوريدات الكهربائية والاستيراد,"4 ش زكى, ميدان عرابى, التوفيقية, وسط البلد, القاهرة.",14087
اجهزة كهرباء والكترونيات,ايجيبت لايت للتوريدات الكهربائية,"12 ش البيدق, العتبة, القاهرة.",686349
اجهزة كهرباء والكترونيات,اتكس لانظمة التحكم,"18 ش سعد ظلام - المشتل سابقا, كورنيش المعادى, المعادى, القاهرة.",533774
اجهزة كهرباء والكترونيات,سيجما للتوريدات والمقاولات الكهربائية,", الاردنية - مركز المدينة, العاشر من رمضان, الشرقية.",146838
اجهزة كهرباء والكترونيات,الدولية لتكنولوجيا الطاقة,"369 عمارة بيتزا كينج ش الهرم, المساحة, الهرم, الجيزة.",624962
اجهزة كهرباء والكترونيات,اساد للتوريدات الكهربائية,"ش السنترال, الاردنية, العاشر من رمضان, الشرقية.",665068
اجهزة كهرباء والكترونيات,باور اليكتريك للتوريدات الكهربائية والميكانيكية - م. محمد راضى,"مساكن عثمان الطريق الرئيسى, سوق الخير, برج العرب, الاسكندرية.",322591
اجهزة كهرباء والكترونيات,شركة المهندس للادوات الكهربائية,"11 ش عطفه - مول العتبة, العتبة, القاهرة.",689287
اجهزة كهرباء والكترونيات,اعمار للهندسة الكهربائية ش. م. م,"13 ش عماد الدين, وسط البلد, القاهرة.",53903
اجهزة كهرباء والكترونيات,رويال بالاس انترناشيونال لصناعة الاجهزة الكهربائية - آر بى أى,"بلوك 9 ه, المنطقة الصناعية الاولى, جمصة, الدقهلية.",568567
اجهزة كهرباء والكترونيات,باور لوجيك للتوريدات الكهربائية,", محور ابو بكر الصديق, الاردنية, العاشر من رمضان, الشرقية.",601846
اجهزة كهرباء والكترونيات,هاى تكنولوجى اليكس,"20 ش ابراهيم نصير, متفرع من ش شعراوى, لوران, الاسكندرية.",627701
اجهزة كهرباء والكترونيات,الملكة للكهرباء,"22 ش عماد الدين, تقاطع نجيب الريحانى, وسط البلد, القاهرة.",624160
اجهزة كهرباء والكترونيات,الشناوى للكاميرا والموبايل,"41 ش النبى دانيال, محطة الرمل, الاسكندرية.",33700
اجهزة كهرباء والكترونيات,اوتوميشن سيستم ماشين,", المحور المركزى - ميدان ليلة القدر, الحى 12, السادس من اكتوبر, الجيزة.",651144
اجهزة كهرباء والكترونيات,الشركة الهندسية للنظم الكهربائية - الكتروسيس,"برج الملكة ش الفيومى, متفرع من شارع محمد فريد, بولكلى, الاسكندرية.",60902
اجهزة كهرباء والكترونيات,راديو مصر للتجارة والهندسة,"91 عمارات الشباب الجنوبى , ميدان الشباب, التجمع الاول, القاهرة الجديدة, القاهرة.",174276
اجهزة كهرباء والكترونيات,مركز خدمة الجاسر لإصلاح وصيانة الأجهزة الكهربائية,"46 ش النبى دانيال, محطة الرمل, الاسكندرية.",301161
اجهزة كهرباء والكترونيات,التركية للصناعات الكهربائية و الالكترونية,"المنطقة الصناعية الثانية, المنطقة الصناعية, الاسماعيلية.",606656
اجهزة كهرباء والكترونيات,الشركة الدولية للحلول الهندسية والخدمات - انتنسو,"عمارة 16 د - الطريق الدائرى - مشروع سما القاهرة شقة 3, القطامية, القاهرة.",152010
اجهزة كهرباء والكترونيات,العاشر للصناعات الالكترونية - ايجيترونك,"مجمع جرين لاند - المنطقة الصناعية الثالثة - مصنع 409 - 412, العاشر من رمضان, الشرقية.",127472
اجهزة كهرباء والكترونيات,العالمية للهندسة والتجارة - ايه اى تى,"9 ش الشيخ على محمود, الدور 4, ميدان المحكمة, مصر الجديدة, القاهرة.",502993
اجهزة كهرباء والكترونيات,الكو للصناعات الهندسية,", المنطقة الصناعية, ابو رواش, الجيزة.",17069
اجهزة كهرباء والكترونيات,المستقبل للتكنولوجيا المتقدمة,"231 ش ابو بكر الصديق متفرع من ش 18 - تقسيم عمر بن الخطاب - الدور 4, جسر السويس, القاهرة.",117120
اجهزة كهرباء والكترونيات,الهندسية للتوريدات الكهربائية والحلول المتقدمة - اسيك,"10 ش جمال الدين عفيفى, المنطقة السادسة, مدينة نصر, القاهرة.",507652
اجهزة كهرباء والكترونيات,روزيتا ليد,"فيلا 100 - - الحى الاول - المنطقة الثالثة, التجمع الخامس, القاهرة الجديدة, القاهرة.",551935
اجهزة كهرباء والكترونيات,شركة الامان للتوريدات والمقاولات العامة,"73 ش شبين, قويسنا, المنوفية.",605988
اجهزة كهرباء والكترونيات,شركة فكرى لماكينات الرخام,", البقلية, الزقازيق, الشرقية.",587204
اجهزة كهرباء والكترونيات,مؤسسة الساقية لقطع غيار الاجهزة المنزلية,"محل 10 - 11 سنتر الحسينى التجارى, المجاورة التاسعة, الحى السادس, السادس من اكتوبر, الجيزة.",602992
اجهزة كهرباء والكترونيات,مدى القابضة,"55 ش الاشجار - القطعة 8058, المقطم, القاهرة.",515906
اجهزة كهرباء والكترونيات,هاير لماكينات الرخام و الجرانيت,"طريق المنصورة المحلة, المنصورة, طلخا, الدقهلية.",607380
اجهزة كهرباء والكترونيات,2 ايه للادوات الكهربائية,"ش محمد حافظ, الاردنية - برج الاحلام, العاشر من رمضان, الشرقية.",641418
اجهزة كهرباء والكترونيات,4 ام للتوريدات الكهربائية,"المحور المركزى - ميدان ليلة القدر, الحى 12, السادس من اكتوبر, الجيزة.",623692
اجهزة كهرباء والكترونيات,اب تو ديت,"13 ش الاهرام, الكوربة, مصر الجديدة, القاهرة.",60489
اجهزة كهرباء والكترونيات,ابراهيم الشامى للتجارة,"7 ش المهدى متفرع من ش الجمهورية, الازبكية, القاهرة.",269890
اجهزة كهرباء والكترونيات,ابراهيم العالم,"15 ش الاهرام, المنشية, الاسكندرية.",30484
اجهزة كهرباء والكترونيات,ابراهيم بيومى ابراهيم,"1 ميدان الاوبرا - الدور 1, العتبة, القاهرة.",176493
اجهزة كهرباء والكترونيات,ابراهيم شاكر للاجهزة كهربائية,"ش محمد فتحى, متفرع من ش ابراهيم ابو السعود, المنصورة, الدقهلية.",638465
اجهزة كهرباء والكترونيات,ابراهيم محمد طعيمة,"كورنيش النيل, القناطر الخيرية, القليوبية.",302852
اجهزة كهرباء والكترونيات,ابل ستور,"المحور المركزى, الحى السابع, السادس من اكتوبر, الجيزة.",436860
اجهزة كهرباء والكترونيات,ابلاينس,"16 ش ابو العتاهية, امتداد ش عباس العقاد, الحى الثامن, مدينة نصر, القاهرة.",56653
اجهزة كهرباء والكترونيات,ابن البلد للادوات الكهربائية,"المجاورة الخامسة - عمارة 61, العاشر من رمضان, الشرقية.",619518
اجهزة كهرباء والكترونيات,ابن الخطاب,"ش محمد على العسيلى متفرع من طريق المعتمدية, ارض اللواء, الجيزة.",270097
اجهزة كهرباء والكترونيات,ابناء الخياط,"ش التحرير, كفر صقر, الشرقية.",351623
اجهزة كهرباء والكترونيات,ابناء الشرقاوى للتجارة,"كورنيش النيل, التبين, القاهرة.",106139
اجهزة كهرباء والكترونيات,ابناء الشوبكى للادوات الكهربائية,"المجاورة الخامسة, الحى الثالث, السادس من اكتوبر, الجيزة.",485398
اجهزة كهرباء والكترونيات,ابناء الصغير,"ش عمر بن الخطاب, مركز الاربعين, جسر السويس, القاهرة.",639008
اجهزة كهرباء والكترونيات,ابناء الطيب لتجارة الادوات الكهربائية والاضاءة الحديثة,"ش التسعين الجنوبى, التجمع الخامس, القاهرة الجديدة, القاهرة.",664529
اجهزة كهرباء والكترونيات,ابناء سالم,"28 ش النادى الرياضى, فيصل, الجيزة.",64849
اجهزة كهرباء والكترونيات,ابناء صلاح,"145 ش 15 مايو, شبرا الخيمة, القليوبية.",418256
اجهزة كهرباء والكترونيات,ابناء صلاح فرج,"23 ش الجهاد, حى غرب, سوهاج.",55101
اجهزة كهرباء والكترونيات,ابناء على عثمان,"2 ش الحجاز متفرع من ش 15 مايو, شبرا الخيمة, القليوبية.",283324
اجهزة كهرباء والكترونيات,ابناء عمرو,"ش مدرسة التجارة, شبراخيت, البحيرة.",368743
اجهزة كهرباء والكترونيات,ابناء كرداسة للاجهزة الكهربائية,"1 ش ارض شريف, وسط البلد, القاهرة.",176289
اجهزة كهرباء والكترونيات,ابو احمد للاجهزة الكهربائية,"14 ش مدرسة الاعدادى, الوراق, الجيزة.",277695
اجهزة كهرباء والكترونيات,ابو احمد للالكترونيات,"ش الامام على, كفر الزيات, الغربية.",343363
اجهزة كهرباء والكترونيات,ابو ادهم لاصلاح الاجهزة الكهربائية,"23 ش حسين عبد المنعم الصعيدى, المرج, القاهرة.",562661
اجهزة كهرباء والكترونيات,ابو اسلام للادوات الكهربائية,"7 ش عباس توفيق, عزبة النخل, القاهرة.",527838
اجهزة كهرباء والكترونيات,ابو اشرف لصيانة الالكترونيات,"4 ش على ابو الروس, الزاوية الحمراء, القاهرة.",567507
اجهزة كهرباء والكترونيات,ابو الحاج,"ش الدروس, فاقوس, الشرقية.",325089
اجهزة كهرباء والكترونيات,ابو الحصين,"كفر صقر, الزقازيق, الشرقية.",120652
اجهزة كهرباء والكترونيات,ابو الدهب للادوات الكهربائية,"3 ش صندوق التوفير, العتبة, القاهرة.",175434
اجهزة كهرباء والكترونيات,ابو العزم للالكترونيات,"32 ش مجلس الامة , لاظوغلى, القاهرة.",200113
اجهزة كهرباء والكترونيات,ابو العلا للالكترونيات,"92 ش ممفيس, الابراهيمية, الاسكندرية.",114899
اجهزة كهرباء والكترونيات,ابو العنين ترادينج,"3 ميدان العتبة, العتبة, القاهرة.",177895
اجهزة كهرباء والكترونيات,ابو الغيط,"209 ش فيصل, التعاون, فيصل, الجيزة.",173148
اجهزة كهرباء والكترونيات,ابو الفتوح,"ش بحر سنورس, وسط البلد, الفيوم.",313575
اجهزة كهرباء والكترونيات,ابو المكارم للالكترونيات,"28 ش اثار سقارة, البدرشين, الجيزة.",648717
اجهزة كهرباء والكترونيات,ابو النجا للالكترونيات,"ش الجيش, حى الاربعين, السويس.",295427
اجهزة كهرباء والكترونيات,ابو النصر,"8 ش البيدق, العتبة, القاهرة.",269089
اجهزة كهرباء والكترونيات,ابو الوليد,"5 ممر الحلو - ش حمام التلات, الموسكى, القاهرة.",209142
اجهزة كهرباء والكترونيات,ابو امين للاجهزة الكهربائية,"22 ش القلعة, الحلمية الجديدة, القاهرة.",200592
اجهزة كهرباء والكترونيات,ابو جبل,"2 عطفة شلبى - متفرع من ش كلوت بك, العتبة, القاهرة.",268417
اجهزة كهرباء والكترونيات,ابو جهاد,"6 ش الترعة الجديدة, المطرية, القاهرة.",477588
اجهزة كهرباء والكترونيات,ابو حسين للادوات الكهربائية,"كم 37 -, طريق اسكندرية مطروح الصحراوى, الساحل الشمالى.",444398
اجهزة كهرباء والكترونيات,ابو حمادة لصيانة الاجهزة الكهربائية,"55 ش المعز لدين الله, المنيب, الجيزة.",295160
اجهزة كهرباء والكترونيات,ابو حمامة الكتريك,"ش الثورة, المنصورة, الدقهلية.",263958
اجهزة كهرباء والكترونيات,ابو خالد,"14 ش الاندلس, الابراهيمية, الاسكندرية.",40835
اجهزة كهرباء والكترونيات,ابو خالد لصيانة الاجهزة الكهربائية,"20 ش الكنيسة الانجيلية, عين شمس الشرقية, القاهرة.",316777
اجهزة كهرباء والكترونيات,ابو خالد للادوات الكهربائية,"32 ش عجايبى واصف, عين شمس الغربية, القاهرة.",534899
اجهزة كهرباء والكترونيات,ابو ذكى,"ش احمد عرابى, فاقوس, الشرقية.",162717
اجهزة كهرباء والكترونيات,ابو روميه,"20 ش عبادة بن الصامت متفرع من ش المحطة, الجيزة, الجيزة.",455943
اجهزة كهرباء والكترونيات,ابو ريان,"ش الجمهورية, ههيا, الشرقية.",361835
اجهزة كهرباء والكترونيات,ابو زايد للاجهزة الكهربائية,"23 ش النصر, العزبة الشرقية, الحوامدية, الجيزة.",614823
اجهزة كهرباء والكترونيات,ابو زياد,"ش عباس انور, فيصل, الجيزة.",399558
اجهزة كهرباء والكترونيات,ابو زيد,"ش بورسعيد, دكرنس, الدقهلية.",354658
اجهزة كهرباء والكترونيات,ابو زيد لصيانة الالكترونيات,"12 ش السلام, ارض اللواء, الجيزة.",548292
اجهزة كهرباء والكترونيات,ابو زيد للالكترونيات,"ش شعراوى ندا, فيصل, الجيزة.",342811
اجهزة كهرباء والكترونيات,ابو سامح للاجهزة الكهربائية,"149 ش الخليل ابراهيم, عرب جسر السويس, جسر السويس, القاهرة.",653440
اجهزة كهرباء والكترونيات,ابو سمرة لصيانة الالكترونيات,"6 ش 19 - المنيرة الغربية, امبابة, الجيزة.",572702
اجهزة كهرباء والكترونيات,ابو سيف,"ش الرشاح - قرية طنان, قليوب, القليوبية.",363446
اجهزة كهرباء والكترونيات,ابو سيف,"28 ش السلام, الهرم, الجيزة.",406111
اجهزة كهرباء والكترونيات,ابو سيف النجوم,"57 ش ابراهيم الخليلى, مدينة قباء, القاهرة.",296527
اجهزة كهرباء والكترونيات,ابو سيف لقطع غيار الاجهزة الكهربائية,"22 ش حسين عبد المنعم الصعيدى, المرج, القاهرة.",562737
اجهزة كهرباء والكترونيات,ابو صلاح للادوات الكهربائية,"140 ش العروبة, الهرم, الجيزة.",307372
اجهزة كهرباء والكترونيات,ابو صلاح للالكترونيات,"مارينا 2, مارينا, الساحل الشمالى.",444792
اجهزة كهرباء والكترونيات,ابو طارق,"ش مكة, فيصل, الجيزة.",406841
اجهزة كهرباء والكترونيات,ابو عبد الرحمن,"ش المساكن, فيصل, الجيزة.",400364
اجهزة كهرباء والكترونيات,ابو عبد الله للادوات الكهربائية,"82 ش محمود عبد الله, عين شمس الغربية, القاهرة.",533750
اجهزة كهرباء والكترونيات,ابو عبد الله للادوات الكهربائية,"قرية الدقاديق, ادفو, اسوان.",506097
اجهزة كهرباء والكترونيات,ابو عبده للادوات الكهربائية,"3 ش طه حسين, عين شمس الغربية, القاهرة.",534782
اجهزة كهرباء والكترونيات,ابو عجوة ديجيتال,"35 ش اسكاروس, متفرع من ش طلعت حرب, شبين الكوم, المنوفية.",320804
اجهزة كهرباء والكترونيات,ابو عصام للادوات الكهربائية,"1 ش د. محمد فؤاد سعيد, العمرانية الغربية, الهرم, الجيزة.",487553
اجهزة كهرباء والكترونيات,ابو علاء,"ش النمس, فيصل, الجيزة.",340037
اجهزة كهرباء والكترونيات,ابو علاء للصيانة,"15 ش الجمعية الاستهلاكية - بركة الحاج, المرج, القاهرة.",565735
اجهزة كهرباء والكترونيات,ابو على للادوات الكهربائية,"15 ش حسن العربى - صفط اللبن, بولاق الدكرور, الجيزة.",587626
اجهزة كهرباء والكترونيات,ابو على للادوات الكهربائية,"11 ش سيد جوهر - مدينة الامل, امبابة, الجيزة.",537167
اجهزة كهرباء والكترونيات,ابو عماد للادوات الكهربائية,"75 ش مستشفى الصدر, العمرانية الغربية, الهرم, الجيزة.",487659
اجهزة كهرباء والكترونيات,ابو عمر,"14 ش يوسف الجندى, باب اللوق, القاهرة.",300084
اجهزة كهرباء والكترونيات,ابو عمر للالكترونيات,"13 ش الازهر, العتبة, القاهرة.",619993
اجهزة كهرباء والكترونيات,ابو عمرو للالكترونيات,"36 برج الاسراء - ش ملك حفنى, فيكتوريا, الاسكندرية.",210507
اجهزة كهرباء والكترونيات,ابو عنترة,"ش خالد بن الوليد, فيصل, الجيزة.",406319
اجهزة كهرباء والكترونيات,ابو عوف,"ش المركز, الحسينية, الشرقية.",365810
اجهزة كهرباء والكترونيات,ابو عيسى,"ش احمد الشريف, بولاق الدكرور, الجيزة.",268906
اجهزة كهرباء والكترونيات,ابو غالى,"ش الموقف الجديد, بنها, القليوبية.",305228
اجهزة كهرباء والكترونيات,ابو غانم,"24 ش ام الغلام, الحسين, القاهرة.",369109
اجهزة كهرباء والكترونيات,ابو غريب,"122 مساكن الزلزال -, القطامية, القاهرة.",328929
اجهزة كهرباء والكترونيات,ابو فارس لصيانة الاجهزة الكهربائية,"167 ش المركز الاجتماعى - كفر الشرفا, المرج, القاهرة.",563077
اجهزة كهرباء والكترونيات,ابو قمر للالكترونيات,"ش جمال عبد الناصر, كفر شكر, القليوبية.",310988
اجهزة كهرباء والكترونيات,ابو كرلس,"ش محمود عمار, عزبة الهجانة, مدينة نصر, القاهرة.",310046
اجهزة كهرباء والكترونيات,ابو كريم,"ش الجيش, حى الاربعين, السويس.",294879
اجهزة كهرباء والكترونيات,ابو لاشين,"ش بورسعيد, منيا القمح, الشرقية.",323986
اجهزة كهرباء والكترونيات,ابو لالا لاستريو السيارات,"5 ش كمال, عباسية, القاهرة.",277160
اجهزة كهرباء والكترونيات,ابو مؤمن,"85 ش 3, شبرا الخيمة, القليوبية.",416590
اجهزة كهرباء والكترونيات,ابو مازن,"ش حمد ياسين, فيصل, الجيزة.",407110
اجهزة كهرباء والكترونيات,ابو مغنم للادوات الكهربائية,"21 ش طه حسين - عرب الحصن, المطرية, القاهرة.",536313
اجهزة كهرباء والكترونيات,ابو مينا,"ش 14, الرأس السوداء, الاسكندرية.",145177
اجهزة كهرباء والكترونيات,ابو مينا للادوات الكهربائية,"2 ش زكى سعيد, الهرم, الجيزة.",197184
اجهزة كهرباء والكترونيات,ابو نادر لقطع غيار الاجهزة الكهربائية,"3 ش فاطمة النبوية متفرع من ش سلامة عفيفى - القصيرين, الزاوية الحمراء, القاهرة.",568500
اجهزة كهرباء والكترونيات,ابو نور,"ش عبد النبى الغرباوى, كفر الزيات, الغربية.",343554
اجهزة كهرباء والكترونيات,ابو هاجر,"7 ش كامل حلمى - صفط اللبن, بولاق الدكرور, الجيزة.",579632
اجهزة كهرباء والكترونيات,ابو هانى للادوات الكهربائية,"1 مساكن الجوازات -, الزقازيق, الشرقية.",114757
اجهزة كهرباء والكترونيات,ابو هانى للالكترونيات,"17 ش عمر زعفان, الابراهيمية, الاسكندرية.",300692
اجهزة كهرباء والكترونيات,ابو وليد للادوات الكهربائية,"133 ش عمان, جسر السويس, القاهرة.",653219
اجهزة كهرباء والكترونيات,ابو ياسين لصيانة الالكترونيات,"18 ش نفق ابو زارع, المنيب, الجيزة.",658833
اجهزة كهرباء والكترونيات,ابو ياسين للادوات الكهربائية,"46 ش سيدى بلال, جسر السويس, القاهرة.",657650
اجهزة كهرباء والكترونيات,ابو يوسف,"مساكن الصعيد أ -, مدينة السلام, القاهرة.",333429
اجهزة كهرباء والكترونيات,ابو يوسف للالكترونيات,"ش محمد سليمان, البساتين, القاهرة.",371581
اجهزة كهرباء والكترونيات,اتش ام للالكترونيات,"124 ش 105, حدائق المعادى, المعادى, القاهرة.",48690
اجهزة كهرباء والكترونيات,اتش ايماس,"18 ش زكريا احمد - التوفيقية, وسط البلد, القاهرة.",577496
اجهزة كهرباء والكترونيات,اتش بى جروب للالكترونيات,"ميدان الحصرى - المحور المركزى, الحى السابع, السادس من اكتوبر, الجيزة.",437462
اجهزة كهرباء والكترونيات,اتش تى لقطع غيار الاجهزة الكهربائية,"41 ش نجيب الريحانى, وسط البلد, القاهرة.",14711
اجهزة كهرباء والكترونيات,اتش زد,"117 ش النزهة, تريومف, مصر الجديدة, القاهرة.",195776
اجهزة كهرباء والكترونيات,اتش كية لاصلاح الالكترونيات,"27 عمارات رابعة الاستثمارى - , مدينة نصر, القاهرة.",597751
اجهزة كهرباء والكترونيات,اتقان للالكترونيات,"2047 - مدينة المعراج, زهراء المعادى, المعادى, القاهرة.",425362
