Category,Name,Address,ID
استشارات طبية وخدمات,الهاجر ار اند دى للاستشارات العلمية والهندسة الوراثية,"بلوك 101, الشقة 2, الحى الخامس - المنطقة الاولى, التجمع الخامس, القاهرة الجديدة, القاهرة.",695232
استشارات طبية وخدمات,اشحن صحتك,"30 ش السودان, المهندسين, الجيزة.",638768
استشارات طبية وخدمات,اطلب طبيب,"50 ش سوريا, المهندسين, الجيزة.",600657
استشارات طبية وخدمات,اكاديمية افاق للخدمات الطبية,"طريق الحرية, سيدى بشر, الاسكندرية.",637036
استشارات طبية وخدمات,الرازى جروب للخدمات الطبية المنزلية,"13 ش الاديب على ادهم, مساكن شيراتون, مصر الجديدة, القاهرة.",398393
استشارات طبية وخدمات,العيادة,", خدمات طبية اونلاين, الشيخ زايد, السادس من اكتوبر, الجيزة.",663973
استشارات طبية وخدمات,الفؤاد للخدمات الطبية,"5 ش المحروسة الجديدة, الدور 7, ابراج المحروسة - برج نماء, الملاحة, السويس.",594337
استشارات طبية وخدمات,الفريدة للخدمات المتكاملة,"ش القاسم, عمارة جولدن سيتى, السيوف, الاسكندرية.",678985
استشارات طبية وخدمات,المجموعة الاستشارية للخدمات الطبية,"24 ش الصفا والمروة, الطوابق, فيصل, الجيزة.",645713
استشارات طبية وخدمات,المستوصف,", خدمات طبية اونلاين, التجمع الخامس, القاهرة الجديدة, القاهرة.",656042
استشارات طبية وخدمات,انفينيديا,"3167 ش د. علاء بلبعالمعراج العلوى, المعادى, القاهرة.",623075
استشارات طبية وخدمات,ايجى كلينيك,"ش الطيار محود شكرى عبد المنعم - برج الفيروز 2 - الدور 7 شقة 4, سموحة, الاسكندرية.",564320
استشارات طبية وخدمات,ايه سى بى بى - المركز الامريكى للطب النفسى,"7 ش 252, تقاطع ش 210, دجلة, المعادى, القاهرة.",673067
استشارات طبية وخدمات,بصيرة,"ش عطية الصوالحى, ابراج السراج - برج 2 - مدخل 4 - الدور الثالث, الحى الثامن, مدينة نصر, القاهرة.",675477
استشارات طبية وخدمات,بلو كروس للخدمات الطبية,"9 ش سمير مرسى, متفرع من ش عباس العقاد, مدينة نصر, القاهرة.",687640
استشارات طبية وخدمات,بوك دوك,"10058 ش كارفور, المجاورة العاشرة, زهراء المعادى, المعادى, القاهرة.",637171
استشارات طبية وخدمات,بيت الدواء,"250 ش امتداد رمسيس 2, مدينة نصر, القاهرة.",629144
استشارات طبية وخدمات,بيو نيكسوس جروب,"فيلا 238, الحى التاسع, الشيخ زايد, السادس من اكتوبر, الجيزة.",668180
استشارات طبية وخدمات,جايا ويلبينج يوجا سنتر,"7, بفرلى هيلز, الشيخ زايد, السادس من اكتوبر, الجيزة.",673062
استشارات طبية وخدمات,حسن هيلث كير,"132 ش النيل - الدور 5 شقة 12, الدقى, الجيزة.",606454
استشارات طبية وخدمات,حكيم دار,"149 ش النصر ميدان الجزائر - الدور 2 شقة 10, المعادى الجديدة, المعادى, القاهرة.",604768
استشارات طبية وخدمات,حكيمة,"16 ش تحسين فرغلى, المنطقة الاولى, مدينة نصر, القاهرة.",626328
استشارات طبية وخدمات,حياة للخدمات الطبية,"25 ش يوسف الصحابى, النزهة, مصر الجديدة, القاهرة.",687403
استشارات طبية وخدمات,دامان مابس,"1 ش الجمهورية, المنصورة, الدقهلية.",687178
استشارات طبية وخدمات,دراب,", خدمات طبية اونلاين, السادس من اكتوبر, الجيزة.",670658
استشارات طبية وخدمات,دوايا.كوم,"57 ش الفتح - الدور 7, فلمينج, الاسكندرية.",577594
استشارات طبية وخدمات,دوكسبرت هيلث,"12 ش عز الدين طه, مدينة نصر, القاهرة.",671530
استشارات طبية وخدمات,ريكفرى للخدمات الطبية المنزلية,"21 هـ/1 ش احمد عبد العظيم, تقسيم اللاسلكى, المعادى الجديدة, المعادى, القاهرة.",630242
استشارات طبية وخدمات,سمارت,"ش ابو بكر الصديق, الاردنية - مركز المدينة, العاشر من رمضان, الشرقية.",619557
استشارات طبية وخدمات,سوجراس لحلول وخدمات الرعاية الصحية,"53 أ ابراج سيدى جابر, سموحة, الاسكندرية.",671337
استشارات طبية وخدمات,صحتك,", ., وسط البلد, القاهرة.",671285
استشارات طبية وخدمات,طبيب نت,", ., مدينة نصر, القاهرة.",598364
استشارات طبية وخدمات,طبيبى دوت نت,"خدمات طبية اون لاين, وسط البلد, القاهرة.",576407
استشارات طبية وخدمات,عيادات ميدى جو,"34 أ ش الحجاز, برج التجاريين, ميدان المحكمة, مصر الجديدة, القاهرة.",678079
استشارات طبية وخدمات,عيادة لافى للصحة العقلية,"6 مديرية التحرير, السيدة زينب, القاهرة.",685982
استشارات طبية وخدمات,فارماسيتيكال اينوفيشن للتنمية,"72 ش فريد سميكة, ميدان الحجاز, مصر الجديدة, القاهرة.",667412
استشارات طبية وخدمات,فاست هيلث كير,"372 ز, حدائق الاهرام, الهرم, الجيزة.",665905
استشارات طبية وخدمات,فاميلى نيدز,"111 ش جلال الدسوقى, كومباوند مدينة المستقبل, وابور المياه, الاسكندرية.",671658
استشارات طبية وخدمات,فى الكبسولة,", وسط البلد, القاهرة.",688886
استشارات طبية وخدمات,فيزيتا,", خدمات طبية اونلاين, مصر الجديدة, القاهرة.",423807
استشارات طبية وخدمات,فيزيتا,"124 ش عثمان بن عفان, ميدان عثمان بن عفان, مصر الجديدة, القاهرة.",679595
استشارات طبية وخدمات,كلين بروف,"90 ش احمد الزمر, الحى الثامن, مدينة نصر, القاهرة.",668191
استشارات طبية وخدمات,كلينى دو,"ش العسال, متفرع من ش الجمهورية, اسيوط, اسيوط.",693797
استشارات طبية وخدمات,كلينيك ات هوم,"5 ش المنصور, سابا باشا, الاسكندرية.",687517
استشارات طبية وخدمات,كونزيل ميد للاستشارات الطبية,"68 ش مكرم عبيد, مدينة نصر, القاهرة.",687806
استشارات طبية وخدمات,كونسلتو,"57 ش محيى الدين ابو العز - الدور 11, الدقى, الجيزة.",583221
استشارات طبية وخدمات,كويك كلينك,"ش عطية الصوالحى, ابراج السراج - برج 2 - مدخل 4 - الدور الثالث, الحى الثامن, مدينة نصر, القاهرة.",675474
استشارات طبية وخدمات,كويك كير اونلاين,"33 ش البطراوى, متفرع من ش عباس العقاد, المنطقة الاولى, مدينة نصر, القاهرة.",616549
استشارات طبية وخدمات,كير هاب,"696 طريق الحرية, الدور 8, عمارة الفيروزة, لوران, الاسكندرية.",676716
استشارات طبية وخدمات,لندن انترناشيونال,"ش انقرة, مساكن شيراتون, مصر الجديدة, القاهرة.",675967
استشارات طبية وخدمات,ليف هيلثى,"3 ش حسن صادق - المرغنى, مصر الجديدة, القاهرة.",541900
استشارات طبية وخدمات,ماكرو كير,", اركان بلازا - مبنى 4 - الدور الرابع, الشيخ زايد, الجيزة.",688868
استشارات طبية وخدمات,مركز جوى كلونى,"110/أ ش يحيى ابراهيم, متفرع من ش 26 يوليو, الزمالك, القاهرة.",629377
استشارات طبية وخدمات,ميدشور للخدمات الطبية,"15 ش البستان, مساكن شيراتون, مصر الجديدة, القاهرة.",675675
استشارات طبية وخدمات,ميدكا اوفرسيز,"برج القدس - - الدور 2, المنصورة, الدقهلية.",532179
استشارات طبية وخدمات,ميديكا هيلثى,", خدمات طبية اونلاين, الزمالك, القاهرة.",667393
استشارات طبية وخدمات,ميديكال تو سيرفيسيز,"24 ش الليثى اراهيم, روض الفرج, القاهرة.",635773
استشارات طبية وخدمات,ميديكال ديجيتال سوليوشن,"6 ش احمد فخرى, مدينة نصر, القاهرة.",685444
استشارات طبية وخدمات,ميديكال زون,"17 برج سارة, كورنيش النيل, حدائق حلوان, القاهرة.",653250
استشارات طبية وخدمات,ميديكال كير للتمريض المنزلى,"17 ش النيل الابيض, متفرع من ش احمد عرابى, المهندسين, الجيزة.",671698
استشارات طبية وخدمات,نبض الحياة للخدمات الطبية,"128 ش السودان, المهندسين, الجيزة.",591002
استشارات طبية وخدمات,هويدا الدمرداش للاستشارات الاسرية,"9 ش محمد توفيق وهبة, متفرع من ش حسن المأمون, المنطقة السادسة, مدينة نصر, القاهرة.",641280
استشارات طبية وخدمات,هيرو كيدزو,", ., وسط البلد, القاهرة.",692138
استشارات طبية وخدمات,هيلث كوين,"ش قنال المحمودية, ابراج الكرام - برج الكوثر, محرم بك, الاسكندرية.",564528
استشارات طبية وخدمات,هيلثكير بيزنيس كلوب,"487, محور محمد نجيب, التجمع الاول, القاهرة الجديدة, القاهرة.",672430
استشارات طبية وخدمات,يا دكتورى,", خدمات طبية اونلاين, مصر الجديدة, القاهرة.",563331
استشارات طبية وخدمات,يوسبيتال,", خدمات طبية اونلاين, وسط البلد, القاهرة.",638388
استشارات طبية وخدمات,يوميدا,", خدمة اونلاين, الجيزة, الجيزة.",673193
