Category,Name,Address,ID
اقسام الشرطة,قسم شرطة 15 مايو,", المجاورة الاولى, مدينة 15 مايو, القاهرة.",383125
اقسام الشرطة,قسم شرطة 6 اكتوبر اول,", منطقة خدمات الحى السابع, الحى السابع, السادس من اكتوبر, الجيزة.",383397
اقسام الشرطة,قسم شرطة 6 اكتوبر ثانى,"., السادس من اكتوبر, الجيزة.",383400
اقسام الشرطة,قسم شرطة اسوان,"ش ابطال التحرير, وسط البلد, اسوان.",383031
اقسام الشرطة,قسم شرطة اسيوط اول,"ش سعد زغلول, ميدان البندر, اسيوط, اسيوط.",350676
اقسام الشرطة,قسم شرطة اسيوط ثانى,"ش كورنيش النيل, اسيوط, اسيوط.",351416
اقسام الشرطة,قسم شرطة الازبكية,"ش الجلاء, الازبكية, القاهرة.",383232
اقسام الشرطة,قسم شرطة الاسماعيلية اول,"ش التحرير, وسط البلد, الاسماعيلية.",383411
اقسام الشرطة,قسم شرطة الاسماعيلية ثالث,"ش 7, الشيخ زايد, الاسماعيلية.",383416
اقسام الشرطة,قسم شرطة الاسماعيلية ثانى,"., حى السلام, الاسماعيلية.",383413
اقسام الشرطة,قسم شرطة الاقصر,"ش مديرية الامن, الاقصر, الاقصر.",385049
اقسام الشرطة,قسم شرطة الاهرام,"ش الهرم - المنطقة الاثرية, الهرم, الجيزة.",359110
اقسام الشرطة,قسم شرطة البساتين,"ش البساتين العمومى, المنطقة الصناعية, البساتين, القاهرة.",383135
اقسام الشرطة,قسم شرطة التبين,"., التبين, القاهرة.",383139
اقسام الشرطة,قسم شرطة الجمالية,"ش بيت القاضى, الجمالية, القاهرة.",383241
اقسام الشرطة,قسم شرطة الجمرك,"ش البحرية, تقاطع ش الجمرك القديم, الجمرك, الاسكندرية.",382966
اقسام الشرطة,قسم شرطة الجناين,", قرية عامر, الجناين, السويس.",385287
اقسام الشرطة,قسم شرطة الجيزة,"ش البحر الاعظم, الجيزة, الجيزة.",383388
اقسام الشرطة,قسم شرطة الحسنة,"., الحسنة, شمال سيناء.",385142
اقسام الشرطة,قسم شرطة الحمام,"ش القسم, حمامات كليوباترا, مرسى مطروح.",385064
اقسام الشرطة,قسم شرطة الخارجة,"., الخارجة, الوادى الجديد.",383317
اقسام الشرطة,قسم شرطة الخصوص,"ش المرج, الخصوص, القليوبية.",385012
اقسام الشرطة,قسم شرطة الخليفة,", ميدان صلاح الدين, الخليفة, القاهرة.",383142
اقسام الشرطة,قسم شرطة الدخيلة,"., الدخيلة, الاسكندرية.",382974
اقسام الشرطة,قسم شرطة الدرب الاحمر,", ميدان الحلمية الجديدة, الدرب الاحمر, القاهرة.",383242
اقسام الشرطة,قسم شرطة الدقى,"ش المساحة, ميدان الجلاء, الدقى, الجيزة.",383386
اقسام الشرطة,قسم شرطة الرحاب,"كم 24 طريق القاهرة السويس الصحراوى, مدينة الرحاب, القاهرة.",584742
اقسام الشرطة,قسم شرطة الرمل,"524 ش مصطفى كامل, سابا باشا, الاسكندرية.",382934
اقسام الشرطة,قسم شرطة الرمل ثانى,", مجمع المدارس, السيوف, الاسكندرية.",382935
اقسام الشرطة,قسم شرطة الزاوية الحمراء,"ش منشية الجمل, الزاوية الحمراء, القاهرة.",383199
اقسام الشرطة,قسم شرطة الزقازيق ثانى,"ش المركز, متفرع من ش الجلاء, الزقازيق, الشرقية.",385201
اقسام الشرطة,قسم شرطة الزهور,"مساكن عمر بن الخطاب, حى الزهور, بور سعيد.",385164
اقسام الشرطة,قسم شرطة الزيتون,"ش طومانباى, الزيتون, القاهرة.",383201
اقسام الشرطة,قسم شرطة الساحل,"ش شبرا, شبرا, القاهرة.",383205
اقسام الشرطة,قسم شرطة السلام,"ش السادات, مدينة السلام, القاهرة.",383152
اقسام الشرطة,قسم شرطة السلوم,"الطريق الرئيسى, السلوم, مرسى مطروح.",385066
اقسام الشرطة,قسم شرطة السويس,"ش طه الحكيم, ميدان المطافئ, حى السويس, السويس.",385283
اقسام الشرطة,قسم شرطة السيدة زينب,", ميدان السيدة زينب, السيدة زينب, القاهرة.",383145
اقسام الشرطة,قسم شرطة الشرابية,"ش الشركات, الشرابية, القاهرة.",383207
اقسام الشرطة,قسم شرطة الشرق,"ش رمسيس, تقاطع ش مصطفى كامل, حى الشرق, بور سعيد.",385153
اقسام الشرطة,قسم شرطة الشروق,"مساكن الشباب الاستثمارى, مدينة الشروق, القاهرة.",383164
اقسام الشرطة,قسم شرطة الشيخ زايد,", الحى العاشر, الشيخ زايد, السادس من اكتوبر, الجيزة.",383395
اقسام الشرطة,قسم شرطة الشيخ زويد,"., الشيخ زويد, شمال سيناء.",385147
اقسام الشرطة,قسم شرطة الصالحية الجديدة,"., الصالحية الجديدة, الشرقية.",385203
اقسام الشرطة,قسم شرطة الضواحى,", امتداد ش اسوان, حى الضواحى, بور سعيد.",385162
اقسام الشرطة,قسم شرطة الظاهر,"12 ش السكاكينى, الظاهر, القاهرة.",383219
اقسام الشرطة,قسم شرطة العاشر من رمضان ثانى,", المجاورة 40, العاشر من رمضان, الشرقية.",385204
اقسام الشرطة,قسم شرطة العامرية,"., العامرية, الاسكندرية.",382979
اقسام الشرطة,قسم شرطة العامرية ثانى,"مساكن الناصرية الجديدة, الناصرية, الاسكندرية.",382983
اقسام الشرطة,قسم شرطة العبور,"محلية 5, الحى الاول, مدينة العبور, القليوبية.",385014
اقسام الشرطة,قسم شرطة العجوزة,"ش نوال, العجوزة, الجيزة.",383383
اقسام الشرطة,قسم شرطة العرب,"ش صفية زغلول, العرب, بور سعيد.",385155
اقسام الشرطة,قسم شرطة العريش اول,"., العريش, شمال سيناء.",385129
اقسام الشرطة,قسم شرطة العريش ثالث,"ش اسيوط, العريش, شمال سيناء.",385133
اقسام الشرطة,قسم شرطة العريش ثانى,"., العريش, شمال سيناء.",385130
اقسام الشرطة,قسم شرطة العريش رابع,"ش قسم رابع, العريش, شمال سيناء.",385137
اقسام الشرطة,قسم شرطة العطارين,"ش فؤاد, العطارين, الاسكندرية.",382945
اقسام الشرطة,قسم شرطة العمرانية,"ش مستشفى الصدر, الهرم, الجيزة.",383393
اقسام الشرطة,قسم شرطة العياط,"ش المدبح, العياط, الجيزة.",359128
اقسام الشرطة,قسم شرطة الغردقة اول,"ش النصر, طريق القرى, الغردقة.",385189
اقسام الشرطة,قسم شرطة الغردقة ثانى,", حى حامد جوهر, وسط البلد, الغردقة.",385191
اقسام الشرطة,قسم شرطة الفيوم,"ش المديرية, متفرع من ش سعد زغلول, وسط البلد, الفيوم.",383332
اقسام الشرطة,قسم شرطة القاهرة الجديدة اول,"ش 1, الحى الرابع, القاهرة الجديدة, القاهرة.",383170
اقسام الشرطة,قسم شرطة القاهرة الجديدة ثالث,"., التجمع الثالث, القاهرة الجديدة, القاهرة.",383180
اقسام الشرطة,قسم شرطة القاهرة الجديدة ثانى,"., التجمع الخامس, القاهرة الجديدة, القاهرة.",383176
اقسام الشرطة,قسم شرطة القرين,"ش المركز, ميدان الشيخة حمدة, القرين, الشرقية.",385210
اقسام الشرطة,قسم شرطة القسيمة,"., الحسنة, شمال سيناء.",385150
اقسام الشرطة,قسم شرطة القصير,"., وسط البلد, القصير.",385192
اقسام الشرطة,قسم شرطة القنطرة شرق,"., قنطرة شرق, الاسماعيلية.",383418
اقسام الشرطة,قسم شرطة الكوثر,"ش اخناتون, الكوثر, سوهاج.",385251
اقسام الشرطة,قسم شرطة اللبان,"ش ابى الدرداء, تقاطع ش اسماعيل مهنا, اللبان, الاسكندرية.",382963
اقسام الشرطة,قسم شرطة المحلة الكبرى اول,"ش 23 يوليو, المحلة الكبرى, الغربية.",383361
اقسام الشرطة,قسم شرطة المحلة الكبرى ثانى,", ميدان الشون, المحلة الكبرى, الغربية.",383362
اقسام الشرطة,قسم شرطة المرج,"ش الترعة السلطوحية, المرج, القاهرة.",383153
اقسام الشرطة,قسم شرطة المطرية,"ش الكابلات, المطرية, القاهرة.",383155
اقسام الشرطة,قسم شرطة المعادى,", ميدان بورسعيد, المعادى, القاهرة.",383146
اقسام الشرطة,قسم شرطة المناخ,"ش محمد فريد, حى المناخ, بور سعيد.",385158
اقسام الشرطة,قسم شرطة المناصرة,"., المناصرة, بور سعيد.",385168
اقسام الشرطة,قسم شرطة المنتزة اول,"ش الجلاء, فيكتوريا, الاسكندرية.",382932
اقسام الشرطة,قسم شرطة المنتزة ثانى,"مساكن طوسون -, ابو قير, الاسكندرية.",382933
اقسام الشرطة,قسم شرطة المنزلة,"ش المنزلة الجديدة, المنطقة 114, المنزلة, الدقهلية.",437366
اقسام الشرطة,قسم شرطة المنشية,"ش الصحافة, المنشية, الاسكندرية.",382954
اقسام الشرطة,قسم شرطة المنصورة اول,"ش الجمهورية, المنصورة, الدقهلية.",383243
اقسام الشرطة,قسم شرطة المنصورة ثانى,"ش فخر الدين خالد, المنصورة, الدقهلية.",383245
اقسام الشرطة,قسم شرطة الموسكى,", ميدان العتبة, العتبة, القاهرة.",383218
اقسام الشرطة,قسم شرطة النخل,"., النخل, شمال سيناء.",385145
اقسام الشرطة,قسم شرطة النزهة,"ش عبد العزيز فهمى, ميدان هليوبوليس, مصر الجديدة, القاهرة.",383161
اقسام الشرطة,قسم شرطة الواحات البحرية,", الباويطى, الواحات البحرية, الواحات البحرية.",383401
اقسام الشرطة,قسم شرطة الوايلى,"101 ش العباسية, الوايلى, القاهرة.",383222
اقسام الشرطة,قسم شرطة الوراق,"كورنيش النيل, الوراق, الجيزة.",383392
اقسام الشرطة,قسم شرطة امبابة,"كورنيش النيل, امبابة, الجيزة.",383382
اقسام الشرطة,قسم شرطة اول العاشر من رمضان,"ش صيدناوى المجاورة الثانية, العاشر من رمضان, الشرقية.",359120
اقسام الشرطة,قسم شرطة اول مدينة نصر,"طريق النصر, مدينة نصر, القاهرة.",383188
اقسام الشرطة,قسم شرطة بئر العبد,"عمارات الغزلان, بئر العبد, شمال سيناء.",385139
اقسام الشرطة,قسم شرطة باب الشعرية,"152 ش الجيش, باب الشعرية, القاهرة.",383224
اقسام الشرطة,قسم شرطة باب شرق,"ش ابو قير, ميدان الاسكندر الاكبر, باب شرق, الاسكندرية.",382937
اقسام الشرطة,قسم شرطة بنها,"ش مجلس المدينة, متفرع من ش كورنيش النيل, بنها, القليوبية.",385006
اقسام الشرطة,قسم شرطة بور فؤاد,"ش التأميم, بور فؤاد, بور سعيد.",385159
اقسام الشرطة,قسم شرطة بور فؤاد ثانى,"ش محمد على, بور فؤاد, بور سعيد.",385161
اقسام الشرطة,قسم شرطة بولاق,"ش وكالة الخرنوب, بولاق, القاهرة.",383228
اقسام الشرطة,قسم شرطة بولاق الدكرور,"ش ترعة الزمر, بولاق الدكرور, الجيزة.",383390
اقسام الشرطة,قسم شرطة ثان مدينة نصر,"ش المخيم الدائم, مدينة نصر, القاهرة.",383191
اقسام الشرطة,قسم شرطة جرجا,"ش احمد عرابى, جرجا, سوهاج.",385248
اقسام الشرطة,قسم شرطة جنوب بورسعيد,"طريق بورسعيد اسماعيلية, جنوب بورسعيد, بور سعيد.",385163
اقسام الشرطة,قسم شرطة حدائق القبة,"ش ترعة الجندى, حدائق القبة, القاهرة.",383209
اقسام الشرطة,قسم شرطة حلوان,"ش رايل, تقاطع ش عبد الرحمن, حلوان, القاهرة.",383148
اقسام الشرطة,قسم شرطة دسوق,"ش التحرير, دسوق, كفر الشيخ.",383448
اقسام الشرطة,قسم شرطة دمنهور,", ميدان الجمهورية, دمنهور, البحيرة.",383067
اقسام الشرطة,قسم شرطة دمياط الجديدة,"ش الصعيدى, دمياط الجديدة, دمياط.",383298
اقسام الشرطة,قسم شرطة دمياط اول,"ش العروبة, دمياط, دمياط.",383294
اقسام الشرطة,قسم شرطة دمياط ثانى,"ش باب الحرس, دمياط, دمياط.",383295
اقسام الشرطة,قسم شرطة دهب,"., المسبط, دهب.",385280
اقسام الشرطة,قسم شرطة رأس البر,"., رأس البر, دمياط.",383300
اقسام الشرطة,قسم شرطة رأس سدر,"., رأس سدر, جنوب سيناء.",385277
اقسام الشرطة,قسم شرطة رأس غارب,"., رأس غارب, البحر الاحمر.",385198
اقسام الشرطة,قسم شرطة روض الفرج,"ش نشاطى, تقاطع ش بديع, شبرا, القاهرة.",383214
اقسام الشرطة,قسم شرطة سانت كاترين,"., سانت كاترين, شرم الشيخ.",385278
اقسام الشرطة,قسم شرطة سرس الليان,"ش بورسعيد, سرس الليان, المنوفية.",385099
اقسام الشرطة,قسم شرطة سفاجا,"., جزيرة سفاجا, سفاجا.",385194
اقسام الشرطة,قسم شرطة سوهاج اول,"ش العارف, سوهاج, سوهاج.",385242
اقسام الشرطة,قسم شرطة سوهاج ثانى,"ش اسيوط سوهاج, سوهاج, سوهاج.",385246
اقسام الشرطة,قسم شرطة سيدى جابر,"299 طريق الحرية, سبورتنج, الاسكندرية.",382936
اقسام الشرطة,قسم شرطة سيوة,"., واحات سيوة, واحة سيوة, واحة سيوة.",385069
اقسام الشرطة,قسم شرطة شبرا,"ش ارض الطويل, متفرع من ش الترعة البولاقية, شبرا, القاهرة.",383215
اقسام الشرطة,قسم شرطة شبرا الخيمة اول,"ش مجلس المدينة, شبرا الخيمة, القليوبية.",384997
اقسام الشرطة,قسم شرطة شبرا الخيمة ثانى,"ش 15 مايو, تقاطع ش العاشر من رمضان, شبرا الخيمة, القليوبية.",385000
اقسام الشرطة,قسم شرطة شبين الكوم,"., شبين الكوم, المنوفية.",385093
اقسام الشرطة,قسم شرطة شرق التفريعة,"., شرق التفريعة, بور سعيد.",385167
اقسام الشرطة,قسم شرطة شرم الشيخ,"ش البنوك, هضبة ام السيد, شرم الشيخ.",385279
اقسام الشرطة,قسم شرطة طابا,"., طريق نويبع طابا, طابا.",385282
اقسام الشرطة,قسم شرطة طنطا اول,", ميدان الساعة, طنطا, الغربية.",383356
اقسام الشرطة,قسم شرطة طنطا ثانى,"ش الحلو, تقاطع ش الجلاء, طنطا, الغربية.",383357
اقسام الشرطة,قسم شرطة طهطا,"ش السوق البرانى, طهطا, سوهاج.",385250
اقسام الشرطة,قسم شرطة طوخ,"ش البطل احمد عبد العزيز, طوخ, القليوبية.",359117
اقسام الشرطة,قسم شرطة عابدين,"ش باب باريس, عابدين, القاهرة.",383235
اقسام الشرطة,قسم شرطة عتاقة,"., عتاقة, السويس.",385285
اقسام الشرطة,قسم شرطة فاقوس,"ش المجمع, فاقوس, الشرقية.",385207
اقسام الشرطة,قسم شرطة فيصل,", الحرفيين, فيصل, السويس.",385286
اقسام الشرطة,قسم شرطة قصر النيل,"11 ش عائشة التيمورية, جاردن سيتى, القاهرة.",383237
اقسام الشرطة,قسم شرطة قليوب,"ش الرشاح, قليوب البلد, قليوب, القليوبية.",385009
اقسام الشرطة,قسم شرطة قنا,"ش الخزان, وسط البلد, قنا.",385169
اقسام الشرطة,قسم شرطة قها,"., قها, القليوبية.",385022
اقسام الشرطة,قسم شرطة كرموز,", مدينة العرائس, غيط العنب, الاسكندرية.",382959
اقسام الشرطة,قسم شرطة كفر الدوار,"., كفر الدوار, البحيرة.",383081
اقسام الشرطة,قسم شرطة كفر الشيخ,"ش المركز, وسط البلد, كفر الشيخ.",383439
اقسام الشرطة,قسم شرطة محرم بك,"ش الرصافة, محرم بك, الاسكندرية.",382941
اقسام الشرطة,قسم شرطة مدينة بدر,", الحى الثالث, مدينة بدر, القاهرة.",383184
اقسام الشرطة,قسم شرطة مدينة برج العرب الجديدة,", الحى الاول, برج العرب الجديدة, الاسكندرية.",382991
اقسام الشرطة,قسم شرطة مدينة طيبة الجديدة,"., الاقصر, الاقصر.",385058
اقسام الشرطة,قسم شرطة مدينة قنا الجديدة,"., طريق قنا سفاجا, قنا.",385170
اقسام الشرطة,قسم شرطة مرسى مطروح,"ش اسكندرية, وسط البلد, مرسى مطروح.",385060
اقسام الشرطة,قسم شرطة مصر الجديدة,"ش دمنهور, مصر الجديدة, القاهرة.",383195
اقسام الشرطة,قسم شرطة مصر القديمة,"كورنيش النيل, مصر القديمة, القاهرة.",383150
اقسام الشرطة,قسم شرطة ملوى,"., ملوى, المنيا.",385071
اقسام الشرطة,قسم شرطة منشأة ناصر,"طريق الاوتوستراد, منشية ناصر, القاهرة.",383239
اقسام الشرطة,قسم شرطة منوف,"., منوف, المنوفية.",385101
اقسام الشرطة,قسم شرطة ميت غمر,"ش البحر, ميت غمر, الدقهلية.",383283
اقسام الشرطة,قسم شرطة مينا البصل,"ش شريف, مينا البصل, الاسكندرية.",382971
اقسام الشرطة,قسم شرطة ميناء الاسكندرية,", الميناء الغربى, الجمرك, الاسكندرية.",382987
اقسام الشرطة,قسم شرطة نويبع,"., وسط البلد, نويبع.",385281
اقسام الشرطة,مركز شرطة ابو كبير,"ش عبد العزيز على, ابو كبير, الشرقية.",385215
اقسام الشرطة,مركز شرطة القوصية,"ش المركز, القوصية, اسيوط.",383016
