Category,Name,Address,ID
العاب موبايلات,ابس عربى,"19 ش الهلالى متفرع من ش الشافى, طنطا, الغربية.",461212
العاب موبايلات,ايه تى فيوتشر جروب,"19 ش المساحة, الدقى, الجيزة.",457436
العاب موبايلات,تيتو,"58 مساكن الدلتا -, مدينة السلام, القاهرة.",390542
العاب موبايلات,جيمس اونلاين,", ., السادس من اكتوبر, الجيزة.",673522
العاب موبايلات,سوليوشن,"31 مساكن اسبيكو القديم -, مدينة السلام, القاهرة.",390086
العاب موبايلات,فيرجن ميجا ستور,"ش عمر بن الخطاب, مدينة نصر, القاهرة.",120395
العاب موبايلات,كاريزما للمحمول,"5 ش محمدى نصار, زهراء عين شمس, عين شمس الشرقية, القاهرة.",650961
العاب موبايلات,ويكوليس,"ش بورسعيد, ميت غمر, الدقهلية.",675417
