Category,Name,Address,ID
بلاستيك ومطاط,فاروق طنطاوى,"القطعة 205 - - المنطقة الصناعية الثانية, السادس من اكتوبر, الجيزة.",159
بلاستيك ومطاط,فاروق عطا هارون,"ش قنال المحمودية, محرم بك, الاسكندرية.",23507
بلاستيك ومطاط,فالكون بلاست,"القطعة K5 - - المنطقة الصناعية الثانية B2, العاشر من رمضان, الشرقية.",469180
بلاستيك ومطاط,فايل باك,"القطعة 268, المجاورة السابعة, العاشر من رمضان, الشرقية.",600329
بلاستيك ومطاط,فجر الاسلام,"ش وليم ناشد, فيصل, الجيزة.",395674
بلاستيك ومطاط,فراتيلى بلاست لصناعة حبيبات PVC,"كم5 - قطعة 129 طريق بلبيس العاشر من رمضان, المنطقة الصناعية الجديدة, بلبيس, الشرقية.",530931
بلاستيك ومطاط,فرب مصر للصناعات المتطورة,"4 /13025 ش 51 متفرع من ش 100 - المنطقة الصناعية الاولى, مدينة العبور, القليوبية.",155716
بلاستيك ومطاط,فرست للصناعات البلاستيكية,"ميدان الطيارة, بلبيس, الشرقية.",625295
بلاستيك ومطاط,فرست للصناعات البلاستيكية والاستيراد,"القطعة 62, المنطقة الصناعية جنوب غرب A6 - الروبيكى, العاشر من رمضان, الشرقية.",686525
بلاستيك ومطاط,فرنا,"26 ش الفايز, محرم بك, الاسكندرية.",22619
بلاستيك ومطاط,فروح للبلاستيك,"22 ش ابو بكر الصديق, مدينة نصر, القاهرة.",125976
بلاستيك ومطاط,فرى باك - العاشر للصناعات الورقية والبلاستيكية,"القطعة 124 - المجاورة 45 - مجمع تبارك الصناعى, العاشر من رمضان, الشرقية.",127529
بلاستيك ومطاط,فلتا بترو,"المنطقة الصناعية الثالثة, برج العرب, الاسكندرية.",198261
بلاستيك ومطاط,فلسطين للبلاستيك,"42 ش ابراهيم عبد الرازق, عين شمس الشرقية, القاهرة.",671248
بلاستيك ومطاط,فنار اسكندرية لتصنيع البلاستيك,"كم 22.5 - طريق القاهرة اسكندرية الصحراوى, مرغم, الاسكندرية.",95852
بلاستيك ومطاط,فهد لتغليف الاسلاك الكهربائية,"ش مسجد المختار, باسوس, القليوبية.",176022
بلاستيك ومطاط,فيتو بلاست,"60 ش الطيران, الدور 5, المنطقة الاولى, مدينة نصر, القاهرة.",671278
بلاستيك ومطاط,فيرست للصناعات البلاستيكية,"المنطقة الصناعية, بلبيس, الشرقية.",176013
بلاستيك ومطاط,فينوس للبلاستيك,"نجع الشيخ فضيل, اسنا, الاقصر.",176040
بلاستيك ومطاط,قاصد كريم,"7 ش سيد مسعود, المطرية, القاهرة.",296480
بلاستيك ومطاط,قاصد كريم,"27 ش محمود صدقى المهندس, العجوزة, الجيزة.",390363
بلاستيك ومطاط,قاصد كريم,"96 ش كان كان المجاورة الخامسة, الحى 12, السادس من اكتوبر, الجيزة.",439161
بلاستيك ومطاط,قاصد كريم,"ش المدينة المنورة, امبابة, الجيزة.",266025
بلاستيك ومطاط,قاصد كريم للبلاستيك,"ش القومية العربية , امبابة, الجيزة.",201200
بلاستيك ومطاط,قصر الشوق بلاست,"45 ش المواردى, المنيرة, القاهرة.",521224
بلاستيك ومطاط,كادى بلاست,"12 ش حسين على - وراق العرب, الوراق, الجيزة.",597426
بلاستيك ومطاط,كافكو مصر للمنتجات المطاطية,"ش طوسون, ابو قير, الاسكندرية.",671111
بلاستيك ومطاط,كالتير لماكينات البلاستيك,"القطعة 63, المنطقة الصناعية السادسة, السادس من اكتوبر, الجيزة.",639590
بلاستيك ومطاط,كامل محمد حسنين,"6 ش السيد عثمان الساعى, كليوباترا, الاسكندرية.",265557
بلاستيك ومطاط,كايرو بلاست,"القطعة 60, المنطقة الصناعية الثالثة,, مدينة بدر, القاهرة.",429742
بلاستيك ومطاط,كايرو بلاستيك,"القطعة 33, المنطقة الصناعية الثالثة, المنطقة الصناعية, السادس من اكتوبر, الجيزة.",606482
بلاستيك ومطاط,كايرو ستارز,"22 ش الجيش, العتبة, القاهرة.",266236
بلاستيك ومطاط,كراس بلاست,"القطعة 137 - - المنطقة الصناعية 250 فدان, مدينة بدر, القاهرة.",359806
بلاستيك ومطاط,كراون مصر,"37 ش السبع سقايات متفرع من ش قصر العينى, قصر العينى, القاهرة.",16914
بلاستيك ومطاط,كرنفال نور,"18 ش الشيخ رمضان, العمرانية الشرقية, الهرم, الجيزة.",413632
بلاستيك ومطاط,كرنو بلاستيك,"كم 28، طريق مصر اسكندرية الصحراوى, ابو رواش, الجيزة.",154722
بلاستيك ومطاط,كرومبو للبلاستيك,"2 ش ابن مطروح, شبرا, القاهرة.",428139
بلاستيك ومطاط,كريستال لتصنيع البلاستيك,"بلوك 12 قطعة 33المنطقة الصناعية الثالثة, برج العرب, الاسكندرية.",611905
بلاستيك ومطاط,كريستال للبلاستيك,"القطعة 33 - بلوك 12 - - جنوب المنطقة الصناعية الثالثة, برج العرب, الاسكندرية.",434132
بلاستيك ومطاط,كلكنر بنتابلاست مصر - ش.م.م,"8 ابراج الصيادلة - ش مسجد حاتم - الدور 4 شقة 403, سموحة, الاسكندرية.",189009
بلاستيك ومطاط,كمبلاست,"126 ش النيل - الدور 2 شقة 6, العجوزة, الجيزة.",63355
بلاستيك ومطاط,كنزى بوتانكس,"3 عمارات العبور - طريق صلاح سالم, مدينة نصر, القاهرة.",129951
بلاستيك ومطاط,كنزى للشنط البلاستك,"23 ش الامام البخارى - السكة الوسطى, المحلة الكبرى, الغربية.",511629
بلاستيك ومطاط,كوفر,"ترسا, ابو النمرس, الجيزة.",388752
بلاستيك ومطاط,كوكى لاند,"38 ش بهجة الاسلام, مصر القديمة, القاهرة.",449180
بلاستيك ومطاط,كوين بلاست,"ش على بن ابى طالب, مدينة قباء, القاهرة.",296589
بلاستيك ومطاط,كوين بلاست,"47 ش عثمان بن عفان, الحرفيين, القاهرة.",478189
بلاستيك ومطاط,كوين بلاست,"قطعة ٣ - بلوك ٣٣ ب - المنطقة الصناعية الثانية, برج العرب الجديدة, الاسكندرية.",435690
بلاستيك ومطاط,كوين للبلاستيك,"كم 26 - طريق اسكندرية القاهرة الصحراوى, مرغم, الاسكندرية.",379230
بلاستيك ومطاط,كوين للبلاستيك,", مجمع الفرسان - المنطقة الصناعية الثانية, العاشر من رمضان, الشرقية.",430056
بلاستيك ومطاط,كيرلو بلاست,"القطعة 7/ب - بلوك 16 - - المنطقة الصناعية الثانية, برج العرب الجديدة, الاسكندرية.",56898
بلاستيك ومطاط,كيروتكس لمنتجات المطاط والبلاستيك,"6 ش محمد الشافعى متفرع من ش صلاح الدين, ابى الدرداء, الاسكندرية.",288291
بلاستيك ومطاط,كيم اوربيس للتجارة الالكترونية والخدمات المعلوماتية,"21 ش عباد الرحمن, مساكن شيراتون, مصر الجديدة, القاهرة.",148643
بلاستيك ومطاط,كيم ماتريال ليمتدد,"ش بركات زريق, القلج, القليوبية.",553531
بلاستيك ومطاط,كيما بلاست,", الخرقانية, القناطر الخيرية, القليوبية.",256090
بلاستيك ومطاط,كيمتكس مصر,"7 عمارات العبور - طريق صلاح سالم, مدينة نصر, القاهرة.",2214
بلاستيك ومطاط,كيمو بلاست,"ش المشروع, امبابة, الجيزة.",382584
بلاستيك ومطاط,كيمو للبلاستيك,"6 ش احمد الوكيل, دار السلام, القاهرة.",333255
بلاستيك ومطاط,كيميت لصناعة المواسير ولوازمها,"امتداد محور 26 يوليوعمارة 6، الدور 1, الشيخ زايد, السادس من اكتوبر, الجيزة.",609017
بلاستيك ومطاط,كيميكال بلاست,"طريق العبور بلبيس - المنطقة الصناعية -, مدينة العبور, القليوبية.",147899
بلاستيك ومطاط,كينج بروفايل,"القطعة 137/ب - - المنطقة الصناعية الاولى, مدينة بدر, القاهرة.",600506
بلاستيك ومطاط,كيه ام اتش انترناشونال,"طريق المريوطية, سقارة, الجيزة.",607607
بلاستيك ومطاط,لاشين بلاست,"المنطقة الصناعية الثالثة A1, العاشر من رمضان, الشرقية.",70484
بلاستيك ومطاط,لاشين لصناعات البلاستيك,"22 ش نهرو, المريلاند, مصر الجديدة, القاهرة.",2063
بلاستيك ومطاط,لانشى بلاست,"2 ش 4, عين شمس, القاهرة.",421031
بلاستيك ومطاط,لبنان للبلاستيك,"مجمع مبارك - المنطقة الصناعية الثالثة, السادس من اكتوبر, الجيزة.",407637
بلاستيك ومطاط,لبيبكو بلاست,"القطعة 131 - - المنطقة الصناعية الاولى, مدينة بدر, القاهرة.",617421
بلاستيك ومطاط,لوتس بلاست,"ارض جلال حبيب, الطابية, الاسكندرية.",150371
بلاستيك ومطاط,لوجى وعلى سيليكون,"3 ش سيد معوض, متفرع من ش اللبينى, المريوطية, فيصل, الجيزة.",679583
بلاستيك ومطاط,لوفر,"5 ش ابو بكر الصديق متفرع من ش 30, سيدى بشر, الاسكندرية.",522998
بلاستيك ومطاط,ليدواى لماكينات البلاستيك,"وحدة 71, المنطقة الصناعية السابعة, مدينة السادات, المنوفية.",655017
بلاستيك ومطاط,مؤسسة الشروق للبلاستيك,"1 ش البترول, عزبة الحفير, الخصوص, القليوبية.",552354
بلاستيك ومطاط,مؤسسة الشهباء الاستثمارية لتصنيع البلاستيك - ارتيلون,"كم 19 - - السكة الجديدة, مرغم قبلى, الاسكندرية.",241637
بلاستيك ومطاط,مؤسسة الطلبة لتصنيع عبوات البلاستيك,"ش بين الجبلين, البساتين, القاهرة.",150376
بلاستيك ومطاط,مؤسسة العشرى للتجارة والتوريدات,"23 ش يوسف عباس, مدينة نصر, القاهرة.",9236
بلاستيك ومطاط,مؤسسة المجد للبلاستيك,"طريق القناطر الخيرية - المنطقة الصناعية, باسوس, القليوبية.",417118
بلاستيك ومطاط,مؤسسة المعراج التجارية,"88 محلية 6 -, التجمع الثالث, القاهرة الجديدة, القاهرة.",134837
بلاستيك ومطاط,مؤسسة على جمعة للصناعات المتطورة,"101 ش أنابيب البترول - جسر السويس, مصر الجديدة, القاهرة.",576874
بلاستيك ومطاط,ماب للتوكيلات التجارية,"2 عمارات الشريف ش اسوان, الدور 3, ميدان المحكمة, مصر الجديدة, القاهرة.",119270
بلاستيك ومطاط,مابك - العبوات والمستلزمات الطبية,"المنطقة الصناعية الاولى B1, العاشر من رمضان, الشرقية.",146232
بلاستيك ومطاط,مابك - العبوات والمستلزمات الطيبة,"ش 47 - المنطقة الصناعية, عباسية, القاهرة.",48025
بلاستيك ومطاط,ماجيك باج,"190 - المنطقة الصناعية, زهراء المعادى, المعادى, القاهرة.",59010
بلاستيك ومطاط,ماجيك ستار بلاست,"15 ش المصانع, المرج الجديدة, القاهرة.",412087
بلاستيك ومطاط,مارسو للمطاط,"القطعة 34/3 ش نويبع, متفرع من ش قريش, المنطقة الصناعية الثالثة A1, العاشر من رمضان, الشرقية.",895
بلاستيك ومطاط,مارك بلاست,"بلوك 10 - القطعة 18 - - شرق المنطقة الصناعية الثانية, برج العرب, الاسكندرية.",239556
بلاستيك ومطاط,ماس بلاست,"ش المحطة, ابو زعبل, القليوبية.",356107
بلاستيك ومطاط,ماس للبلاستيك,"21 ش ترعة عنانى, متفرع من الطريق الدائرى, المرج الجديدة, القاهرة.",641878
بلاستيك ومطاط,ماسا باك - مكة للصناعة,"القطعة 221/4, المنطقة الصناعية الثانية, المنطقة الصناعية, السادس من اكتوبر, الجيزة.",140025
بلاستيك ومطاط,ماستر بت,"القطعه A1،Ixp, المنطقه الصناعيه الثالثة, العاشر من رمضان, الشرقية.",653688
بلاستيك ومطاط,ماستر للبلاستيك,"17 ش عباس العقاد, المنطقة الاولى, مدينة نصر, القاهرة.",191946
بلاستيك ومطاط,ماستر للصناعات المتطورة,"ش عثمان احمد عثمان - المريوطية - الحرانية, الهرم, الجيزة.",293112
بلاستيك ومطاط,ماسترز,"القطعة 36/9 - - المنطقة الصناعية الثانية, مدينة السادات, المنوفية.",383935
بلاستيك ومطاط,ماسة,"برج الاندلس - ش المشربية - الدور 2 شقة 21, المريوطية, فيصل, الجيزة.",425237
بلاستيك ومطاط,ماكينات ابو سيف,"كم 28 - طريق القاهرة اسكندرية الصحراوى, ابو رواش, الجيزة.",46640
بلاستيك ومطاط,مالتى تريد للاستيراد والتصدير والتوكيلات التجارية والصناعية,"المنطقة الصناعية الثانية, برج العرب الجديدة, الاسكندرية.",141516
بلاستيك ومطاط,مالك للبلاستيك,"1 ش المسجد الاقصى, متفرع من ش جمال عبد الناصر, المنيب, الجيزة.",658400
بلاستيك ومطاط,ماهر بلاست,"40 ش مجلع رومانى, العمرانية الغربية, الهرم, الجيزة.",306760
بلاستيك ومطاط,ماينتى,"بلوك 11 - هـ -, المنطقة الحرة, مدينة نصر, القاهرة.",56268
بلاستيك ومطاط,مايو بلاست,"المنطقة الصناعية, مدينة 15 مايو, القاهرة.",162432
بلاستيك ومطاط,متولى محمد عبد الهادى,"14 ش الفراخة, الزقازيق, الشرقية.",286616
بلاستيك ومطاط,مجد بلاست,"2 ش جبانة المسلمين, شبرا الخيمة, القليوبية.",21869
بلاستيك ومطاط,مجدى بلاست,"ش النقطة, الحى العاشر, مدينة نصر, القاهرة.",310486
بلاستيك ومطاط,مجدى بلاست,"11 ش سيد مسعود, المطرية, القاهرة.",296770
بلاستيك ومطاط,مجدى عزيز للبلاستيك,"13 ش معهد الابحاث البحرى - وراق الحضر, الوراق, الجيزة.",597036
بلاستيك ومطاط,مجدى للبلاستيك,"ش 3 متفرع من ش محمد نجيب, غبريال, الاسكندرية.",251558
بلاستيك ومطاط,مجموعة الاندلس للتجارة والصناعة,"4 ش على بن ابى طالب متفرع من ش الهرم, التعاون, الهرم, الجيزة.",133774
بلاستيك ومطاط,مجموعة الاندلس واشبيلية للاستثمار الزراعى واستصلاح الاراضى,"قرية النجاح, مدينة بدر, البحيرة.",573880
بلاستيك ومطاط,مجموعة الاهرام للبلاستيك,"2 عمارات الفرسان ش انقرة, الشقة 105, الدور 1, مجمع هليوبوليس روك, مصر الجديدة, القاهرة.",172643
بلاستيك ومطاط,مجموعة الاهرام للتجارة والصناعة,"القطعة 49 أ - - المنطقة الصناعية السادسة, السادس من اكتوبر, الجيزة.",141206
بلاستيك ومطاط,مجموعة القماش للاستيراد والتصدير,", الطريق الترابى – بجوار الطريق الدائرى – بجوار نفق الزهور – مؤسسه الزكاه, الخانكة, القليوبية.",656955
بلاستيك ومطاط,مجموعة المستقبل المتحدة للبلاستيك,"ش السادات - حاضنة الاعمال, تلا, المنوفية.",393785
بلاستيك ومطاط,مجموعة جولدن بلاست,"1 ش سيد محمد, امبابة, الجيزة.",481413
بلاستيك ومطاط,مجموعة ستار للبلاستيك - م. ابراهيم الشناوى,", طريق المنصورة بنها السريع, اجا, الدقهلية.",409075
بلاستيك ومطاط,مجموعة شركات جورج فلتس للبلاستيك,"81 ش الحجاز, مصر الجديدة, القاهرة.",16522
بلاستيك ومطاط,مجموعة ظنانة بلاست,"ش 9المنطقة الحرة العامة, العامرية, الاسكندرية.",583625
بلاستيك ومطاط,مجموعة مصانع الهاجر باك لتصنيع البولى ايثلين فوم,"القطعة 3 - 4 - 5 - بلوك 20030 - الامتداد الغربى - المنطقة الصناعية الاولى, مدينة العبور, القليوبية.",64349
بلاستيك ومطاط,مجموعة مصر الحجاز,"198 ش الحجاز, مصر الجديدة, القاهرة.",15690
بلاستيك ومطاط,محرم بلاست,"كم 23 - طريق البتروكيماويات - طريق القاهرة اسكندرية الصحراوى - منطقة النهضة الصناعية, مرغم, الاسكندرية.",260175
بلاستيك ومطاط,محفوظ جروب,"ش البحر, زفتى, الغربية.",213801
بلاستيك ومطاط,محمد الجمل,"ش فريد ندا, بنها, القليوبية.",304405
بلاستيك ومطاط,محمد رمضان للبلاسيتك,"ش مكة المكرمة المجاورة الاولى, الحى السابع, السادس من اكتوبر, الجيزة.",438098
بلاستيك ومطاط,محمد زكى فارس,"ش الثورة, المنصورة, الدقهلية.",278748
بلاستيك ومطاط,محمد عبد السميع,"ش الميثاق, البساتين, القاهرة.",371431
بلاستيك ومطاط,محمد عبد المنعم للبلاستيك,"12 ش منية السرج, شبرا, القاهرة.",230847
بلاستيك ومطاط,محمد عصران,"ش عطية الذكرى - المنطقة الصناعية, شبرا الخيمة, القليوبية.",232477
بلاستيك ومطاط,محمد يوسف,"ش عبد المنعم رياض, ابو حماد, الشرقية.",335730
بلاستيك ومطاط,محمود الجندى,"8 ش 287, المعادى الجديدة, المعادى, القاهرة.",11849
بلاستيك ومطاط,محمود محمد محمد وشركاه,"كم 23 - طريق اسكندرية القاهرة الصحراوى - طريق البتروكيماويات, مرغم, الاسكندرية.",65000
بلاستيك ومطاط,محمود مسعود لانتاج الكاوتشوك,"المنطقة الصناعية الثالثة, الصالحية الجديدة, الشرقية.",180439
بلاستيك ومطاط,محمود موسى للبلاستيك,"27 ش عبد الحافظ - كفر مناقر, بنها, القليوبية.",521865
بلاستيك ومطاط,محمود واسلام للبلاستيك,"15 ش سعد زغلول, متفرع من ش الجيش, الصف, الجيزة.",211720
بلاستيك ومطاط,مخلوف للبلاستيك,"طريق مصر اسماعيلية الصحراوى - سوق العبور - المنطقة الصناعية, مدينة العبور, القليوبية.",168200
بلاستيك ومطاط,مدستار للتجارة,"بلوك 12010 - القطعة 1 ,2 - - المنطقة الصناعية الشمالية, مدينة العبور, القليوبية.",142358
بلاستيك ومطاط,مدستار للصناعة,"القطعة التاسعة - ش مصر والسودان - المنطقة الصناعية الثانية b2, العاشر من رمضان, الشرقية.",101542
بلاستيك ومطاط,مدستار مصر,"القطعة 21 - - المنطقة الصناعية الثالثة A6, العاشر من رمضان, الشرقية.",101536
بلاستيك ومطاط,مدكو للبلاستيك,"المنطقة الصناعية الثالثة A2, العاشر من رمضان, الشرقية.",409887
بلاستيك ومطاط,مراد بلاست,"25 ش الفاروق عمر بن الخطاب - الطالبية, فيصل, الجيزة.",140034
بلاستيك ومطاط,مرجان للامدادات البلاستيكية,"ش مطروح, وسط البلد, مرسى مطروح.",138777
بلاستيك ومطاط,مركز البلاستيك والاستشارات,"60 تقسيم عمر بن الخطاب, طريق مصر الاسماعيلية الصحراوى, القاهرة.",46656
بلاستيك ومطاط,مركز الشرق الاوسط للتجارة,"414 ش الهرم, نصر الدين, الهرم, الجيزة.",176033
بلاستيك ومطاط,مركز المطصفى للبلاستيك,"13 ش الخليج المصرى, الاميرية, القاهرة.",255050
بلاستيك ومطاط,مركز تنمية صناعة البلاستيك,"25 ش زكى عطا الله ميدان الساعة , فيكتوريا, الاسكندرية.",35173
بلاستيك ومطاط,مسعد للبلاستيك,"132 ش سيف, سيدى بشر قبلى, الاسكندرية.",223630
بلاستيك ومطاط,مشرق بلاست,", المنطقة الصناعية الثالثة, المنطقة الصناعية, السادس من اكتوبر, الجيزة.",687244
بلاستيك ومطاط,مصانع الربيع بلاست,"مجمع الصناعات الصغيرة C2, العاشر من رمضان, الشرقية.",61846
بلاستيك ومطاط,مصانع اوريجينال,"كم 23.5 - طريق اسكندرية القاهرة الصحراوى, مرغم, الاسكندرية.",49231
بلاستيك ومطاط,مصانع سماحة للبلاستيك والصناعات الحديثة,"المنطقة الصناعية الثانية, برج العرب, الاسكندرية.",28349
بلاستيك ومطاط,مصر الخليج للبلاستيك,"القطعة 26 - 27, المنطقة الصناعية C2, العاشر من رمضان, الشرقية.",384208
بلاستيك ومطاط,مصر الدولية لصناعة الانابيب - ام تى ام,"القطعة 4/3 - ش الصفا والمروة - المنطقة الصناعية الثالثة A2 - الدور 1, العاشر من رمضان, الشرقية.",554159
بلاستيك ومطاط,مصر العليا للصناعات الهندسية,"القطعة 142 - - المنطقة الصناعية B3, العاشر من رمضان, الشرقية.",121171
بلاستيك ومطاط,مصر الفراعنة للاستيراد والتصدير,"17 ش الشيخ الامير متفرع من ش مصر والسودان, حدائق القبة, القاهرة.",453517
بلاستيك ومطاط,مصر القنال للصناعات البلاستيكية,"قطعة 76 - - المنطقة الصناعية الثانية, مدينة بدر, القاهرة.",534134
بلاستيك ومطاط,مصر بلاستيك لتصنيع العبوات,"13 ش محمود حسن, مصر الجديدة, القاهرة.",67940
بلاستيك ومطاط,مصر لصناعة منتجات التعبئة والتغليف,"المنطقة الصناعية الاولى - منطقة 3/2 - قطاع هـ, الصالحية الجديدة, الشرقية.",527970
بلاستيك ومطاط,مصر للكاوتشوك والسيليكون,"1 ش الدلتا متفرع من ش الطبجى, الدقى, الجيزة.",398981
بلاستيك ومطاط,مصنع الابراهيمية للبلاستيك,"ش عمر لطفى , الابراهيمية, الاسكندرية.",134170
بلاستيك ومطاط,مصنع الاتحاد الهندسى الدولى,"القطعة 1/181 - ش 5 - المنطقة الصناعية الثانية, السادس من اكتوبر, الجيزة.",63580
بلاستيك ومطاط,مصنع الاصدقاء للبلاستيك,"71 ش احمد عبد ربه, شبرا الخيمة, القليوبية.",160073
