Category,Name,Address,ID
بلاستيك ومطاط,كرا مصر,"قطعة 4 - 5 - بلوك 12016 ش 110, المنطقة الصناعية الاولى, مدينة العبور, القليوبية.",468321
بلاستيك ومطاط,المصطفى لتصنيع اللدائن والماستر باتش,"القطعة 8, المنطقة الصناعية الخامسة, مدينة بدر, القاهرة.",646401
بلاستيك ومطاط,الهندسية لتصنيع المواسير - يو بى فى سى,", المنطقة الصناعية السادسة, مدينة السادات, المنوفية.",688180
بلاستيك ومطاط,باك هاوس ايجيبت للصناعة والتجارة,"القطعة 104, المنطقة الصناعية A4, العاشر من رمضان, الشرقية.",636019
بلاستيك ومطاط,تراينجل ايجيبت,"16 ش العراق, متفرع من ش شهاب, المهندسين, الجيزة.",65728
بلاستيك ومطاط,الشركة المصرية لتكنولوجيا البلاستيك,"القطعة 46 - كم 5 طريق بلبيس, المنطقة الصناعية الثانية, بلبيس, الشرقية.",161816
بلاستيك ومطاط,الشركة الدولية للصناعات الحديثة - يورباك مصر,"بلوك 12007 القطعة 8 ش 500, المنطقة الصناعية الاولى, مدينة العبور, القليوبية.",143475
بلاستيك ومطاط,اسكندرية للبوليمر ش.م.م,", المنطقة الصناعية الرابعة - بلوك 22, برج العرب, الاسكندرية.",694157
بلاستيك ومطاط,برنت هوم لطباعة مواد التعبئة والتغليف,", المنطقة الصناعية الثانية - مدينة مبارك الصناعية, قويسنا, المنوفية.",101599
بلاستيك ومطاط,العبيدى للتجارة,"القطعة 105, المنطقة الصناعية الثالثة - المنطقة الصناعية A4, العاشر من رمضان, الشرقية.",690578
بلاستيك ومطاط,مصنع علاء الدين للبلاستيك,"طريق المريوطية, شبرامنت, الهرم, الجيزة.",7334
بلاستيك ومطاط,مصانع اولاد درويش مصطفى للبلاستيك,"القطعة الثامنة - بلوك 3 ش الجوهرة, المنطقة الصناعية الثانية, برج العرب الجديدة, الاسكندرية.",77504
بلاستيك ومطاط,شركة الاخلاص للصناعات البلاستيكية,"بلوك 19 - قطعة 7-8-27-28 ش البنزينة, المنطقة الصناعية الثالثة, برج العرب, الاسكندرية.",581309
بلاستيك ومطاط,ابناء مخلوف للبلاستيك,"56 كم 14 طريق مصر اسكندرية الزراعى, قليوب, القليوبية.",693796
بلاستيك ومطاط,الدلتا للصناعات المتكاملة - ماكلين,"17 ش زكريا احمد, وسط البلد, القاهرة.",625222
بلاستيك ومطاط,ميجا بلاست لمواد التعبئة والتغليف,"طريق مصر اسكندرية الزراعى, كفر الدوار, البحيرة.",692612
بلاستيك ومطاط,مودرن بلاست,", المنطقة الصناعية الثانية 78/64/63/57, مدينة بدر, القاهرة.",392858
بلاستيك ومطاط,المملوك للسخانات الصناعية وماكينات البلاستيك,", مركز اجا, منيه سمنود, الدقهلية.",503590
بلاستيك ومطاط,السيف لاستيراد خامات البلاستيك - هيثم حميد,"17 أ عمارات بيتشو امريكان سيتى, الدور 11, المرحلة الاولى, زهراء المعادى, المعادى, القاهرة.",396398
بلاستيك ومطاط,العبيد لصناعة البلاستيك,"بلوك 33 - القطعة 10, المنطقة الصناعية الرابعة, برج العرب الجديدة, الاسكندرية.",632308
بلاستيك ومطاط,اندستريز بلاست,"وحدة 313, المنطقة الصناعية الثالثة مجمع جرين لاند, العاشر من رمضان, الشرقية.",688837
بلاستيك ومطاط,ماف مولد لتصنيع الاسطمبات وحقن البلاستيك,"16 ش الطاقة الشمسية, مدينة السلام, القاهرة.",694919
بلاستيك ومطاط,هاى بلاست,", المنطقة الصناعية الثالثة B3 - مجمع تبارك الصناعى - وحدة 38، 39, العاشر من رمضان, الشرقية.",666206
بلاستيك ومطاط,غلاب مصر للتوريدات العامة والمقاولات,"12 ش احمد عرابي, حى الاربعين, السويس.",689468
بلاستيك ومطاط,المجد بلاست لصناعة عبوات البلاستيك,"القطعة 4، 7، 11, المنطقة الصناعية C2, العاشر من رمضان, الشرقية.",685316
بلاستيك ومطاط,جى بى للبلاستيك,"قطعة 205, المنطقة الصناعية ال 800 فدان, مدينة بدر, القاهرة.",144652
بلاستيك ومطاط,ديبكو للصناعات البلاستيكية,"22 ش ابراهيم سلطان, المنطقة الصناعية, قليوب, القليوبية.",671174
بلاستيك ومطاط,جدو كيم ايجيبت,"ك 20, طريق الاسكندرية القاهرة الصحراوى, الاسكندرية.",694022
بلاستيك ومطاط,الشركة المصرية الحديثة للتوريدات العمومية,"ش 25 من طريق بيجام, شبرا الخيمة, القليوبية.",695179
بلاستيك ومطاط,المتحدة بلاست,"ش ترعة المنصورية, زاوية ابو مسلم, الهرم, الجيزة.",584615
بلاستيك ومطاط,الزامل للاستيراد وتجارة خامات البلاستيك,", المنطقة الصناعية الثالثة 6A, العاشر من رمضان, الشرقية.",686964
بلاستيك ومطاط,قلعة صلاح الدين للبلاستيك,"3 ش المنتصر, شبرا الخيمة, القليوبية.",1302
بلاستيك ومطاط,التيسير جروب لتجارة وصناعة البلاستيك,"81 ش جوزيف تيتو, الدور 10, طريق المطار, النزهة الجديدة, القاهرة.",217993
بلاستيك ومطاط,الامل لصناعة البالتات البلاستيكية والخشبية والبرانيك,"القطعة 84 ش البنزينة, محور خدمى ثانى, المنطقة الصناعية الثالثة, المنطقة الصناعية, السادس من اكتوبر, الجيزة.",685447
بلاستيك ومطاط,القائد للصناعات البلاستيكية,"القطعة 11/7, المنطقة الصناعية الثالثة A2, العاشر من رمضان, الشرقية.",47896
بلاستيك ومطاط,اسكندرية للصناعات المعدنية والتجارة,"75 ش قناة السويس, محرم بك, الاسكندرية.",133035
بلاستيك ومطاط,داود باك لمواد التعبئة والتغليف,"القطعة 344, المنطقة الصناعية الثالثة - الروبيكى - جنوب غرب 6أ, العاشر من رمضان, الشرقية.",472586
بلاستيك ومطاط,ابناء البحقيرى للبلاستيك,"قطعة 104 ش البحقيرى, المنطقة الصناعية, ابو رواش, الجيزة.",278632
بلاستيك ومطاط,أر ك بى للصناعات البلاستيكية,", مجمع الصناعات البلاستيكية - وحدة 17-80, مرغم, الاسكندرية.",690445
بلاستيك ومطاط,مؤسسة الساقية لقطع غيار الاجهزة المنزلية,"القطعة 140, المنطقة الصناعية الثالثة, المنطقة الصناعية, السادس من اكتوبر, الجيزة.",604371
بلاستيك ومطاط,زينة باك لمواد التعبئة والتغليف,"ش العوادم, متفرع من الطريق البطئ, قليوب, القليوبية.",625890
بلاستيك ومطاط,اتش جي ايه لانتاج الاسترتش الصناعي وتجارة الخامات,", جنوب المنطقة الصناعية الثالثة - بلوك 13 - قطعة 16-23, برج العرب, الاسكندرية.",690890
بلاستيك ومطاط,العربية لصناعة البلاستيك,"25 ش الخرطوم, المنطقة الصناعية الثانية, العاشر من رمضان, الشرقية.",473603
بلاستيك ومطاط,مصنع رويال باك للتعبئة والتغليف,"الكيلو 27 طريق اسكتندرية القاهرة الصحراوى, مرغم, الاسكندرية.",690236
بلاستيك ومطاط,ارت بلاست,"القطعة 185, جنوب غرب 6أ - المنطقة الصناعية, العاشر من رمضان, الشرقية.",185863
بلاستيك ومطاط,مصنع العربى بلاست,", مجمع مرغم 1 للصناعات البلاستيكية, العامرية, الاسكندرية.",690011
بلاستيك ومطاط,نيومينا بلاست,"31 قطعة 4 - 5 - بلوك 12016 ش 110, المنطقة الصناعية الاولى, مدينة العبور, القليوبية.",366467
بلاستيك ومطاط,السعيد بلاست,"ش الصرف الصحى, طریق القناطر الخیریة, باسوس, القليوبية.",665492
بلاستيك ومطاط,ريبل باليت لايجار وبيع البالتات البلاستيك,"فيلا 35, المنطقة الرابعة - الحي التالت, التجمع الخامس, القاهرة الجديدة, القاهرة.",689289
بلاستيك ومطاط,الشرقية للدائن لمنتجات الكاوتشوك والسيليكون,"القطعة رقم 291 وحدة 26, العاشر من رمضان, الشرقية.",663647
بلاستيك ومطاط,لوج للعبوات البلاستيكية,"802 برج المعز ش الرياح التوفيقى, بنها, القليوبية.",621622
بلاستيك ومطاط,كرمكو للتجارة والتوريدات والتصنيع,"3 ش السبتية, بولاق, القاهرة.",447342
بلاستيك ومطاط,مكة بلاست,"15 ش ترعة الزيتون, باسوس, القليوبية.",612611
بلاستيك ومطاط,فيجن باك,"القطعة 371, امتداد المنطقة الصناعية الثالثة, السادس من اكتوبر, الجيزة.",396487
بلاستيك ومطاط,مصنع الزهراء لصناعة البلاستيك,"ش 6 اكتوبر , المنطقة الصناعية - البر القبلى, سموحة, الاسكندرية.",45240
بلاستيك ومطاط,لينك اب مصر,"25 برج الاكاديمية العربية - ادارى رقم 1 ش يحيي المشد, سموحة, الاسكندرية.",653677
بلاستيك ومطاط,جولدن للتوريدات العامة - بولى ايثيلين,"ش احمد السمان, الحى الثامن, مدينة نصر, القاهرة.",694178
بلاستيك ومطاط,مصنع الاتقان للبلاستيك,"القطعة 64, المجاورة 27 - منطقة الخدمات, المنطقة الصناعية الاولى, مدينة 15 مايو, القاهرة.",518577
بلاستيك ومطاط,دلتا النيل للصناعة,"القطعة 22/د, المنطقة الصناعية الاولى, الصالحية الجديدة, الشرقية.",183710
بلاستيك ومطاط,مصنع الفتح لصناعة الصناديق البلاستيك,", عزبة القصر الاخضر - الخط الوسطانى, كفر الدوار, البحيرة.",688762
بلاستيك ومطاط,مصنع العادل للبلاستيك والعبوات الحديثة,", بلوك 302 - المنطقة الصناعية الثانية, برج العرب, الاسكندرية.",689510
بلاستيك ومطاط,شركة مصر لمنتجات البلاستيك,"القطعة 37,38, المنطقة الصناعية الرابعة, مدينة السادات, المنوفية.",21214
بلاستيك ومطاط,الشركة المتحدة لشبك التظليل والحماية,"القطعة 19 - بلوك 20014, المنطقة الصناعية الاولى - الامتداد الغربى, مدينة العبور, القليوبية.",568306
بلاستيك ومطاط,سينا تك للصناعات البلاستيكية والمواسير - يو بى فى سى,", المنطقة الصناعية الرابعة, مدينة السادات, المنوفية.",455922
بلاستيك ومطاط,بيور لصناعة وتجارة الشنط البلاستيك,"برج الهنا ب, ميدان رسلان - نزلة الدائرى, المريوطية, فيصل, الجيزة.",694585
بلاستيك ومطاط,شركة اى - توب ثيرم لصناعة قطع ووصلات مياة الشرب,"قطعة 62, المنطقة الصناعية السادسة, مدينة السادات, المنوفية.",581959
بلاستيك ومطاط,الجميل للاستيراد والتصدير والتوكيلات التجارية,"ش 50, الحى الاول - منطقة 800 متر, مدينة العبور, القليوبية.",691213
بلاستيك ومطاط,ال يثرب للصناعة و التجارة,"كم 23 ش الرضوان, متفرع من طريق اسكندرية القاهرة الصحراوى, مرغم, الاسكندرية.",289737
بلاستيك ومطاط,ابو النمرس للبلاستيك,"القطعة 47 - وحدة 7, المنطقة الصناعية الرابعة - مجمع بدر الدين, السادس من اكتوبر, الجيزة.",242
بلاستيك ومطاط,الخليجية المصرية الاولى للتوريدات العمومية - إف إى جى,"18 ش الفراعنة, العطارين, الاسكندرية.",688605
بلاستيك ومطاط,الفريد لمنتجات المطاط والبلاستيك,"القطعة 132, المنطقة الصناعية الثانية, الصالحية الجديدة, الشرقية.",694301
بلاستيك ومطاط,الوادى للتعبئة والتغليف وتصنيع الكرتون,"وحدة 77, المنطقة الصناعية منطقة 6 مليون متر - مجمع ج, العاشر من رمضان, الشرقية.",686355
بلاستيك ومطاط,سيفين بلاست,"وحدة 77, المنطقة الصناعية منطقة 6 مليون متر - مجمع ج, العاشر من رمضان, الشرقية.",687879
بلاستيك ومطاط,ميتال جلفانو - سامبيرى وشركاه,"25 ش الفراهدة, اللبان, الاسكندرية.",20235
بلاستيك ومطاط,ايجى باك للصناعات,", مجمع تبارك الصناعى, العاشر من رمضان, الشرقية.",687300
بلاستيك ومطاط,مصنع النيل لمستحضرات التجميل,"82 ش الامام محمد عبده, الدور 4, توريل الجديدة, المنصورة, الدقهلية.",486296
بلاستيك ومطاط,وى باك للتعبئة والتغليف,"9 عمارات عبد المقصود, الاردنية, العاشر من رمضان, الشرقية.",691106
بلاستيك ومطاط,كرامة بلاست لصناعة وطباعة الاكياس والشنط البلاستيك,"الطريق الدائرى, مؤسسة الزكاة, مدينة السلام, القاهرة.",611967
بلاستيك ومطاط,النهى لعبوات البلاستيك وعبوات مستحضرات التجميل,"8 ش حسان بن ثابت, توريل الجديدة, المنصورة, الدقهلية.",568284
بلاستيك ومطاط,تارجت بلاست,"56 ش احمد محسن, السيوف شماعة, الاسكندرية.",173968
بلاستيك ومطاط,بوليمرز لصناعة منتجات الايفا والمطاط,"53 /A6, المنطقة الصناعية الثالثة, العاشر من رمضان, الشرقية.",426280
بلاستيك ومطاط,اماسيا للصناعات البلاستيكية,"القطعة 512, الروبيكى الجديدة, العاشر من رمضان, الشرقية.",625076
بلاستيك ومطاط,ابكو المتحدة للبلاستيك والكيماويات,"القطعة 4 - بلوك 22 - - المنطقة الصناعية الثانية, برج العرب الجديدة, الاسكندرية.",50399
بلاستيك ومطاط,الامين للبلاستيك,"63 برج الامين ش المقريزى, منشية البكرى, مصر الجديدة, القاهرة.",11226
بلاستيك ومطاط,الايمان للبلاستيك,"قطعة 46 أ, منطقة 75 فدان - المنطقة الصناعية, ابو رواش, الجيزة.",335312
بلاستيك ومطاط,الدلتا الجديدة للبلاستيك ش.م.م,"طريق القاهرة اسكندرية الزراعى, طنطا, الغربية.",45178
بلاستيك ومطاط,المتحدة لمنتجات البلاستيك وتصنيع الصوب الزراعية وشبك التظليل,", المنطقة الصناعية الرابعة - مجمع الصناعات - عنبر 24, مدينة السادات, المنوفية.",459584
بلاستيك ومطاط,ايه وان - باج,"مخازن الشباب - القطعة 782 - - المنطقة الصناعية السادسة, المنطقة الصناعية, السادس من اكتوبر, الجيزة.",612781
بلاستيك ومطاط,بلاست ماك جروب,"القطعة 38 أ 1 - - المنطقة الصناعية الثالثة A'1, العاشر من رمضان, الشرقية.",119312
بلاستيك ومطاط,بولى ايثيلين ماتريكس للتوريدات,"., شبرا, القاهرة.",151522
بلاستيك ومطاط,دلتا مصر للبلاستيك - دلباك ش.م.م,", ميت حواى, السنطة, الغربية.",437870
بلاستيك ومطاط,سوبر هاى بوينت للتوريدات الفندقية,"قطعة 6457 - ش الجامعة الحديثة - الهضبة الوسطى, المقطم, القاهرة.",611429
بلاستيك ومطاط,سيمبلكس للبرمجيات والحلول الصناعية,"20 ش محمد فريد ابو حديد, الحى السابع, مدينة نصر, القاهرة.",406825
بلاستيك ومطاط,شركة تى جى لصناعة العبوات البلاستيكية,", المنطقة الصناعية سى2 - مجمع الصناعات الصغيرة - وحدة 17ب, العاشر من رمضان, الشرقية.",599869
بلاستيك ومطاط,فايمس بلاست,", مجمع ابو هلال الصناعى - ابو سنة, قليوب, القليوبية.",53194
بلاستيك ومطاط,مؤسسة الساقية لقطع غيار الاجهزة المنزلية,"محل 10 - 11 سنتر الحسينى التجارى, المجاورة التاسعة, الحى السادس, السادس من اكتوبر, الجيزة.",602992
بلاستيك ومطاط,ماجستيك بلاست لقوالب الانترلوك وحوائط الفاكيوم,"طريق سقارة السياحى, شبرامنت, المريوطية, الهرم, الجيزة.",612160
بلاستيك ومطاط,6 اكتوبر للكيماويات والبلاستيك,"56 ش السبتيه, السبتية, القاهرة.",79078
بلاستيك ومطاط,ابتكس جروب للصناعات,"ش 9, المنطقة الحرة, مدينة نصر, القاهرة.",392815
بلاستيك ومطاط,ابكو بلاست,"84 ش الازهر, الازهر, القاهرة.",15305
بلاستيك ومطاط,ابناء اباظة بلاست,"12 ش نجيب معوض, المطرية, القاهرة.",460350
بلاستيك ومطاط,ابناء الحاج ابراهيم الخولى للبلاستيك,"ش ترعة الساحل, سمنود, الغربية.",177740
بلاستيك ومطاط,ابناء الشريف,"ش عبد المنعم, ميت غمر, الدقهلية.",339579
بلاستيك ومطاط,ابناء الشيخ للبلاستيك,"13 ش محمد عوض, شبرا الخيمة, القليوبية.",176026
بلاستيك ومطاط,ابناء خلف للبلاستيك,"ش التحرير, قليوب, القليوبية.",303292
بلاستيك ومطاط,ابناء خميس لصناعة البلاستيك,"8 ش سيد مسعود, المطرية, القاهرة.",296442
بلاستيك ومطاط,ابناء مجاهد للبلاستيك - السيد نصر مجاهد,"طريق طلخا دمياط السريع, قرية ميت عنتر, المنصورة, الدقهلية.",65092
بلاستيك ومطاط,ابناء محمد نجيب,"80 ش جسر الكنيسة, المنيب, الجيزة.",413052
بلاستيك ومطاط,ابو احمد للبلاستيك,"بلوك 14 - مساكن الجيزة -, الحى العاشر, مدينة نصر, القاهرة.",310325
بلاستيك ومطاط,ابو احمد للبلاستيك,"ش ابراهيم عبد الله, الطوابق, فيصل, الجيزة.",335674
بلاستيك ومطاط,ابو اسماعيل للاكياس,", كفر دميرة القديم, طلخا, الدقهلية.",674416
بلاستيك ومطاط,ابو اشرف للبلاستيك,"9 ش ترعة السواحل, امبابة, الجيزة.",481718
بلاستيك ومطاط,ابو السعود,"6 ش البنداقة متفرع من ش بورسعيد, الموسكى, القاهرة.",187178
بلاستيك ومطاط,ابو العز لتصنيع البلاستيك,"ش كورنيش النيل, ميت ابو غالب, دمياط.",176048
بلاستيك ومطاط,ابو النجا وشركاه,"القطعة 11 - بلوك 2 - - المنطقة الصناعية الثانية, برج العرب الجديدة, الاسكندرية.",28381
بلاستيك ومطاط,ابو حمدة للبلاستيك,"ش احمد بدوى, ابو النمرس, الجيزة.",272095
بلاستيك ومطاط,ابو حنفى للبلاستيك,"ش سليم نايل, كفر نصار, الهرم, الجيزة.",668977
بلاستيك ومطاط,ابو راضى بلاست,"12 ش السلام - المنطقة الصناعية, شبرا الخيمة, القليوبية.",403528
بلاستيك ومطاط,ابو شراقة,"1 حارة العمدة - متفرع من ش المطراوى, المطرية, القاهرة.",261923
بلاستيك ومطاط,ابو شوقى للبلاسيتك,"ش احمد بدوى, ابو النمرس, الجيزة.",426349
بلاستيك ومطاط,ابو عمار,"22 ش ابو بكر الصديق, امبابة, الجيزة.",360606
بلاستيك ومطاط,ابو عويضة للبلاستيك,"القطعة 132, المنطقة الصناعية B3, العاشر من رمضان, الشرقية.",61645
بلاستيك ومطاط,ابو غالى للصناعات البلاستيكية - غاليكو,"28 ش نجيب محفوظ, مدينة نصر, القاهرة.",176064
بلاستيك ومطاط,ابو وليد,"ش السكة الحديد, اولاد صقر, الشرقية.",366879
بلاستيك ومطاط,اتموس فير للبلاستيك,"القطعة 124 - طريق بلبيس العاشر من رمضان - المنطقة الصناعية, بلبيس, الشرقية.",460747
بلاستيك ومطاط,اجرينا بلاست,", المنطقة الصناعية الثالثة A4, العاشر من رمضان, الشرقية.",642809
بلاستيك ومطاط,اجو جروب لصناعة المطاط والكاوتشوك وقطع غيار السيارات,"3 ش يوسف كرم, الساحل, القاهرة.",639074
بلاستيك ومطاط,اجياد للبلاستيك,"ش المحجر, طره, القاهرة.",399117
بلاستيك ومطاط,احد للبلاستيك,"ش اطلس, حلوان, القاهرة.",336126
بلاستيك ومطاط,احمد جمعة,"ش الخديوى توفيق, المحلة الكبرى, الغربية.",303699
بلاستيك ومطاط,احمد جمعة وشريكه,"حارة جمعة, اوسيم, الجيزة.",139687
بلاستيك ومطاط,احمد حسن للبلاستيك,"22 عمارات الشركة الكويتية -, المعادى الجديدة, المعادى, القاهرة.",223466
بلاستيك ومطاط,احمد للبلاستيك,"250 ش عمر بن الخطاب, جسر السويس, القاهرة.",261071
بلاستيك ومطاط,احمد وعمر,"2 ش مدرسة بن خلدون, شبرا الخيمة, القليوبية.",414670
بلاستيك ومطاط,احمد ومريم,"12 ع ش الياسمين, شبرا الخيمة, القليوبية.",413453
بلاستيك ومطاط,اخر روشنة,"57 ش محمود مرسى الطالبية, فيصل, الجيزة.",381134
بلاستيك ومطاط,اخوان ابو العنين,"ش نصر أبو العينين, القناطر الخيرية, القليوبية.",47858
بلاستيك ومطاط,اخوان الشريف,"15 ش الخليج المصرى, حدائق القبة, القاهرة.",255025
بلاستيك ومطاط,اخوان بلاست,"17 ش عبد البارى شراب, الكوم الاخضر, فيصل, الجيزة.",424218
بلاستيك ومطاط,ادمكو بلاست,", المنطقة الصناعية الثانية - مجمع الصناعات الصغيرة, برج العرب, الاسكندرية.",687407
بلاستيك ومطاط,ار ام جروب للتجارة والهندسة,"عمارة 347 - شقة 1, مدينة السادات, المنوفية.",387593
بلاستيك ومطاط,ارت بلاست,"13 ش زايد, عباسية, القاهرة.",64446
بلاستيك ومطاط,ارت بلاست,"3 ش خالد قاسم, طنطا, الغربية.",330839
بلاستيك ومطاط,ارت بلاستيك,"القطعة 5/222 - - المنطقة الصناعية الثانية, السادس من اكتوبر, الجيزة.",246
