Category,Name,Address,ID
بلاستيك ومطاط,الحرايرى بلاست - الشركة المتحدة لتشكيل البلاستيك,"مدينة مبارك الصناعية الثانية, قويسنا, المنوفية.",63242
بلاستيك ومطاط,الحرم المكى للتجارة,"55 ش السكة الجديدة, المنشية, الاسكندرية.",202188
بلاستيك ومطاط,الحرم للبلاستيك,"1 ش جميلة بوحريد, ميدان الساعة, الاسكندرية.",300954
بلاستيك ومطاط,الحرمين للبلاستيك,"11 ش الخضيرى, السيدة زينب, القاهرة.",212282
بلاستيك ومطاط,الحرمين للبلاستيك,"135 ش عدوى سليم, العمرانية الغربية, الهرم, الجيزة.",423335
بلاستيك ومطاط,الحرية للبلاستيكات,"3 ش درويش البراجيلى, بولاق الدكرور, الجيزة.",442164
بلاستيك ومطاط,الحسام للبلاستيك,"60 ش عبد الله ابو دومه, الخصوص, القليوبية.",499648
بلاستيك ومطاط,الحسن,"ش ترعة الخشاب, حدائق حلوان, القاهرة.",378638
بلاستيك ومطاط,الحسين لعموم الاستيراد والتصدير,"31 ش د. حسن زكى, السيوف, الاسكندرية.",20678
بلاستيك ومطاط,الحسين للبلاستيك,"ش المشير احمد اسماعيل, دار السلام, القاهرة.",332806
بلاستيك ومطاط,الحكيم بلاست - عبد الحكيم هاشم,"65 ش مصطفى النحاس, الحى الثامن, مدينة نصر, القاهرة.",64484
بلاستيك ومطاط,الحمد,"ش احمد سلام, امبابة, الجيزة.",367333
بلاستيك ومطاط,الحمد,"14 ش داير الناحية, المنيب, الجيزة.",412291
بلاستيك ومطاط,الحمد,"13 ش صبرى, شبرا الخيمة, القليوبية.",412704
بلاستيك ومطاط,الحمد,"18 ش زين العابدين, شبرا الخيمة, القليوبية.",248724
بلاستيك ومطاط,الحمد بلاست,"71 ش المؤرخ محمد رفعت, النزهة الجديدة, القاهرة.",440802
بلاستيك ومطاط,الحمد بلاست,"ش 9, المقطم, القاهرة.",191521
بلاستيك ومطاط,الحمد للبلاستيك,"1 ش حسن جوهر, حدائق المعادى, المعادى, القاهرة.",220181
بلاستيك ومطاط,الحمد للبلاستيك,"12 ش الزعفران, فيصل, الجيزة.",644554
بلاستيك ومطاط,الحمد لله,"بلوك 11 - مساكن اطلس -, المقطم, القاهرة.",274187
بلاستيك ومطاط,الحمصانى للبلاستيك,"5 درب البرابرة, الموسكى, القاهرة.",188348
بلاستيك ومطاط,الحويطى لتصنيع وتجارة الخامات البلاستيك,"المنطقة الصناعية - شبرا الخيمة, مسطرد, القليوبية.",627970
بلاستيك ومطاط,الخباز للبلاستيك,"185 ش 9, متفرع من ش 4, الحى الخامس, السادس من اكتوبر, الجيزة.",545092
بلاستيك ومطاط,الخراز للبلاستيك,"23 ش ميخائيل شرقاوى - المنطقة الصناعية, منشية ناصر, القاهرة.",188016
بلاستيك ومطاط,الخضرى للبلاستيك,"ش باب البحر, متفرع من ش كلوت بك, باب الشعرية, القاهرة.",687112
بلاستيك ومطاط,الخليج للاستيراد والتصدير,"4 ش خليج الخور متفرع من ش رمسيس, وسط البلد, القاهرة.",125590
بلاستيك ومطاط,الخليج للعبوات البلاستيكية,"القطعة 106 - - المنطقة الصناعية الثالثة, السادس من اكتوبر, الجيزة.",134143
بلاستيك ومطاط,الخليلى للتجارة والتوريدات والتصدير,"24 أ ش مجرى السيل, حدائق حلوان, القاهرة.",284787
بلاستيك ومطاط,الخولى لتدوير البلاستيك,"ش حسين مدبولى - الطريق البطىء, قليوب, القليوبية.",172442
بلاستيك ومطاط,الخياط بلاست,"القطعة 1/232 - ش حمادة امام - المنطقة الصناعية الثانية, السادس من اكتوبر, الجيزة.",169405
بلاستيك ومطاط,الداود انترناشيونال,"7 ش عقبة متفرع من ش التحرير, الدقى, الجيزة.",326487
بلاستيك ومطاط,الدسوقى للبلاستيك,"47 ش الشهيد احمد عبد العزيز, جسر السويس, القاهرة.",276070
بلاستيك ومطاط,الدقاق لتجارة البلاستيك,"38 ش نجيب الريحانى, وسط البلد, القاهرة.",627004
بلاستيك ومطاط,الدقهلية للتجارة وتصنيع البلاستيك,"34 ش المسبك, طلخا, الدقهلية.",176343
بلاستيك ومطاط,الدلتا لتصنيع البلاستيك,"القطعة 12 - بلوك 20015 - طريق 155, مدينة العبور, القليوبية.",110754
بلاستيك ومطاط,الدلتا للكيماويات,"طريق كفر كلا الباب, السنطة, الغربية.",167583
بلاستيك ومطاط,الدلتا لمنتجات البلاستيك,"القطعة 4 أ - 4 ب, الامتداد الصناعى, مدينة بدر, القاهرة.",396404
بلاستيك ومطاط,الدمياطى,"66 ش 77, العرب, المعادى, القاهرة.",373998
بلاستيك ومطاط,الدمياطى بلاست,"ش الملكة, فيصل, الجيزة.",341767
بلاستيك ومطاط,الدولى بلاست,", المريوطية, فيصل, الجيزة.",631262
بلاستيك ومطاط,الدولية بلاست,"ارض وابور الثلج, المحلة الكبرى, الغربية.",125137
بلاستيك ومطاط,الدولية لتشكيل المعادن,"ش الجامع متفرع من ش ابراهيم بك - مدينة الامل, شبرا الخيمة, القليوبية.",334972
بلاستيك ومطاط,الدويرى,"الشارع العمومى, الخصوص, القليوبية.",332894
بلاستيك ومطاط,الديب للبلاستيك,"66 ش الصناديلى, الجيزة, الجيزة.",165910
بلاستيك ومطاط,الديرى,"8 ش صقر قريش, متفرع من ش المدينة المنورة, العمرانية الغربية, الهرم, الجيزة.",309234
بلاستيك ومطاط,الرائدة لتنمية الصناعات البلاستيكية,"القطعة 226, المنطقة الصناعية الثالثة, السادس من اكتوبر, الجيزة.",576719
بلاستيك ومطاط,الرابط,"42 ش ملعب الجامعة, الدقى, الجيزة.",118954
بلاستيك ومطاط,الراعى,"., السادس من اكتوبر, الجيزة.",358604
بلاستيك ومطاط,الراية للبلاستيك,"القطعة 27 ش السنترال, الاردنية, العاشر من رمضان, الشرقية.",620809
بلاستيك ومطاط,الرجاء بلاست,"1 ش عبد الحليم على, متفرع من ش جسر الكنيسة, المنيب, الجيزة.",640103
بلاستيك ومطاط,الرجاء للبلاستيك,"2 ش الوحدة, حدائق المعادى, المعادى, القاهرة.",414308
بلاستيك ومطاط,الرجاء للبلاستيك,"26 ش النصر متفرع من ش الترولى, عين شمس الغربية, القاهرة.",390623
بلاستيك ومطاط,الرجاء للبلاستيك,"ش على بن ابى طالب, المنيب, الجيزة.",294735
بلاستيك ومطاط,الرحاب لمنتجات الكاوتشوك,", المنطقة الصناعية الثالثة A5, العاشر من رمضان, الشرقية.",527371
بلاستيك ومطاط,الرحمة,"18 ش ترعة الخشاب, حلوان, القاهرة.",295921
بلاستيك ومطاط,الرمناوى بلاستيك,"ش الاسعاف, شربين, الدقهلية.",356759
بلاستيك ومطاط,الرواد بلاست,"طريق الباجور القناطر, الباجور, المنوفية.",607064
بلاستيك ومطاط,الرواد للبلاستيك,"64 ش معمر القذافى, طنطا, الغربية.",152020
بلاستيك ومطاط,الروان بلاست,"77 ش عبد الله ابو دومه, الخصوص, القليوبية.",500311
بلاستيك ومطاط,الرواى بلاست,"69 ش مسجد نور الاسلام, عين شمس الشرقية, القاهرة.",320551
بلاستيك ومطاط,الرومانى للبلاستيك,"1 ش حسين كامل, الخصوص, القليوبية.",495481
بلاستيك ومطاط,الزعفرونى للبلاستيك,"ش النقراشى, ابو كبير, الشرقية.",120655
بلاستيك ومطاط,الزعيم,"ش عبد الله النديم, المنزلة, الدقهلية.",358812
بلاستيك ومطاط,الزعيم,"21 ش الكوبرى, الطوابق, فيصل, الجيزة.",335564
بلاستيك ومطاط,الزعيم,"ابراهيم بك, بهتيم, القليوبية.",159763
بلاستيك ومطاط,الزهراء بلاست,"15 ش حامد الطنطاوى, المحلة الكبرى, الغربية.",187483
بلاستيك ومطاط,الزهراء لاكياس النايلون,"32 ش محمد قدرى, السيدة زينب, القاهرة.",7878
بلاستيك ومطاط,الزهراء للبلاستيك,"., طنطا, الغربية.",429750
بلاستيك ومطاط,الزهراء للبلاستيك,"27 ش معهد الابحاث البحرى متفرع من كورنيش النيل - وراق الحضر, الوراق, الجيزة.",596448
بلاستيك ومطاط,الزين باك للتوريدات العمومية والبلاستيك,", الرابعة الناصرية, شرق سموحة, الاسكندرية.",688502
بلاستيك ومطاط,السارة بلاست,"القطعة 191, المنطقة الصناعية - المرحلة الاولى, كوم اوشيم, الفيوم.",676378
بلاستيك ومطاط,السرسى للاستيراد والتصدير,"7 ش رمسيس - السبع بنات, المحلة الكبرى, الغربية.",513095
بلاستيك ومطاط,السعادة,"27 ش جلال معوض, شبرا الخيمة, القليوبية.",410463
بلاستيك ومطاط,السعادة بلاست,"ش احمد عرابى, تلا, المنوفية.",319544
بلاستيك ومطاط,السعد للصناعات البلاستيكية والمعدنية,"كم 26 - طريق القاهرة اسكندرية الصحراوى - المنطقة الصناعية الاولى, ابو رواش, الجيزة.",462213
بلاستيك ومطاط,السعودية المصرية للصناعات الكيميائية,"القطعة 154 - - امتداد المنطقة الصناعية الثالثة, المنطقة الصناعية, السادس من اكتوبر, الجيزة.",603905
بلاستيك ومطاط,السلام,"ش نصر نصار متفرع من ش العروبة, امبابة, الجيزة.",353826
بلاستيك ومطاط,السلام,"188 ش الهرم - الدور 1, التعاون, الهرم, الجيزة.",447721
بلاستيك ومطاط,السلام الحديث للبلاستيك,"25 ش نصر نصار - ارض الحداد, امبابة, الجيزة.",575461
بلاستيك ومطاط,السلام بلاست,"المنطقة الثانية - منطقة قويسنا الصناعية, قويسنا, المنوفية.",447213
بلاستيك ومطاط,السلام جى ايه لعبوات البلاستيك,"القطعة 492 - - امتداد المنطقة الصناعية السادسة - منطقة المخازن, المنطقة الصناعية, السادس من اكتوبر, الجيزة.",556050
بلاستيك ومطاط,السلام للبلاستيك,"كم 36 -, طريق مصر الاسماعيلية الصحراوى, القاهرة.",466788
بلاستيك ومطاط,السلام للبلاستيك,", المنطقة الصناعية A1, العاشر من رمضان, الشرقية.",666409
بلاستيك ومطاط,السلام للمطاط والبلاستيك,"القطعة 11 - بلوك 34 - - المنطقة الرابعة, برج العرب الجديدة, الاسكندرية.",43334
بلاستيك ومطاط,السلام للمنتجات البلاستيكية,"5 ش حسن زكى, الخصوص, القليوبية.",494233
بلاستيك ومطاط,السلام لمنتجات الكاوتشوك والبلاستيك,"القطعة 123 - - المنطقة الصناعية الاولى, السادس من اكتوبر, الجيزة.",154314
بلاستيك ومطاط,السماحة,"ش الجيش, الزاوية الحمراء, القاهرة.",402508
بلاستيك ومطاط,السمان للبلاستيك,"ش شهداء الثورة متفرع من ش جمال عبد الناصر - برج الاعسر, مدينة نصر, القاهرة.",443167
بلاستيك ومطاط,السنابل للتنمية الصناعية,"القطعة 26 - - المنطقة الصناعية الثالثة, العاشر من رمضان, الشرقية.",172282
بلاستيك ومطاط,السندباد بلاست,"94 الشارع الجديد, مدينة السلام, القاهرة.",418301
بلاستيك ومطاط,السوهاجى للبلاستيك,"ش نادى البلاستيك المنطقة الصناعية, شبرا الخيمة, القليوبية.",387910
بلاستيك ومطاط,السويس للصناعات المتضامنة - اس اى ايه,"برج بدر - طريق مصر حلوان الزراعى, المعادى, القاهرة.",151626
بلاستيك ومطاط,السيدة زينب,"ش مصطفى موسى - صفط اللبن, بولاق الدكرور, الجيزة.",340394
بلاستيك ومطاط,السيسى للبلاستيك,"21 ش حيدر باشا, حلوان, القاهرة.",246048
بلاستيك ومطاط,السيوف الحديثة للبلاستيك,"341 ش ابو الغنايم متفرع من ش مصطفى كامل, غبريال, الاسكندرية.",13008
بلاستيك ومطاط,السيوف للبلاستيك,"ش عبد الفتاح الصعيدى, السيوف شماعة, الاسكندرية.",51035
بلاستيك ومطاط,السيوى للبلاستيك,"15 ش احمد محمود متفرع من ش احمد زكى, حدائق المعادى, المعادى, القاهرة.",513098
بلاستيك ومطاط,الشاذلى للبلاستيك,"المنشية الجديدة, محرم بك, الاسكندرية.",50368
بلاستيك ومطاط,الشاهد للبلاستيك,"ش فهيم عبد الخالق, دار السلام, القاهرة.",391152
بلاستيك ومطاط,الشاوى بلاست,"ش ينابيع الخير - المجزر الالى, المنصورة, الدقهلية.",406538
بلاستيك ومطاط,الشبل,"33 ش شاهين, منوف, المنوفية.",348965
بلاستيك ومطاط,الشرق الاقصى للاستشارات الفنية - فيتكو,"30 ش مصطفى حمام متفرع من ش عباس العقاد, المنطقة الاولى, مدينة نصر, القاهرة.",10758
بلاستيك ومطاط,الشرق الاوسط للبلاستيك,"المنطقة الصناعية الثانية, برج العرب الجديدة, الاسكندرية.",409950
بلاستيك ومطاط,الشرق الاوسط للبلاستيك,"54 ش العشرين, فيصل, الجيزة.",213053
بلاستيك ومطاط,الشرق بلاست,"34 ش القنال, فارسكور, دمياط.",536792
بلاستيك ومطاط,الشرق لاعمال الكاوتشوك - محمد على الرشيدى,"مساكن القللى -, السبتية, القاهرة.",293898
بلاستيك ومطاط,الشرق للبلاستيك,"15 ش محمد عبد الرحمن, شبرا الخيمة, القليوبية.",1348
بلاستيك ومطاط,الشرق للكاوتشوك - اولاد كمال محمد ضرغام,"3 ش بولاق ابو العلا الجديد ميدان سيدى عبد الجواد, بولاق, القاهرة.",60363
بلاستيك ومطاط,الشرقية للبلاستيك,"ش الشون, بلبيس, الشرقية.",386205
بلاستيك ومطاط,الشركة الاسلامية لتجارة وتوزيع خامات البلاستيك,"طريق بلقاس تقسيم عمر يونس, طلخا, الدقهلية.",187700
بلاستيك ومطاط,الشركة الاسلامية لصناعة البلاستيك,", المنطقة الصناعية الثالثة A2, العاشر من رمضان, الشرقية.",176828
بلاستيك ومطاط,الشركة الايطالية المتحدة للصناعات البلاستيكية,"8 ش التروللى, مدينة السلام, القاهرة.",508860
بلاستيك ومطاط,الشركة الثلاثية لاعمال البلاستيك,"9 ش مسجد عماد الدين متفرع من ش الشركة, الحرفيين, القاهرة.",154440
بلاستيك ومطاط,الشركة الحديثة للصناعات البلاستيكية ومواد التعبئة والتغليف,"القطعة 97 - - جنوب المنطقة الجمركية A6, العاشر من رمضان, الشرقية.",297799
بلاستيك ومطاط,الشركة الدولية لاعادة التصنيع,"كم 23 - طريق اسكندرية القاهرة الصحراوى, مرغم, الاسكندرية.",167329
بلاستيك ومطاط,الشركة الدولية لصناعة خامات البلاستيك,"1 ش جسر البحر, باسوس, القليوبية.",680634
بلاستيك ومطاط,الشركة الدولية لصناعة وتجارة البتروكيماويات - سانت بلاست,"ش الشركات الجديد, متفرع من طريق مصر اسماعلية الزراعى, مسطرد, القليوبية.",619481
بلاستيك ومطاط,الشركة الدولية للاستيراد والتجارة,"14 عمارات العبور - طريق صلاح سالم - الدور 4 شقة 48, مدينة نصر, القاهرة.",55874
بلاستيك ومطاط,الشركة الدولية للبلاستيك والكهرباء,"31 أ ش 26 يوليو, وسط البلد, القاهرة.",130896
بلاستيك ومطاط,الشركة الدولية للصناعات البلاستيكية,"القطعة 94, المنطقة الصناعية C8, العاشر من رمضان, الشرقية.",623369
بلاستيك ومطاط,الشركة العالمية لتكنولوجيا التعبئة والتغليف - بلاست رافيا,"قطعة 407 - 409 - - امتداد المنطقة الصناعية الثالثة, السادس من اكتوبر, الجيزة.",214777
بلاستيك ومطاط,الشركة العالمية لصناعة البلاستيك,"1 ش الجامع - المنطقة الصناعية, مسطرد, القليوبية.",168215
بلاستيك ومطاط,الشركة العالمية للتجارة والتوريدات,"ش جسر النيل - باسوس, القناطر الخيرية, القليوبية.",512889
بلاستيك ومطاط,الشركة العالمية للكاوتشوك والايفا,"المنطقة الصناعية, بلبيس, الشرقية.",132574
بلاستيك ومطاط,الشركة العربية السعودية للبلاستيك,"القطعة 442منطقة الروبيكى - المنطقة الصناعية الثالثة - جنوب غرب 6أ, العاشر من رمضان, الشرقية.",576994
بلاستيك ومطاط,الشركة العربية لتصنيع وطباعة جميع انواع الاكياس البلاستيك,"كم 28 طريق اسكندرية القاهرة الصحراوى, خلف كمال سعد, مرغم, الاسكندرية.",636924
بلاستيك ومطاط,الشركة العربية للبلاستيك,"1 ش بدوى, متفرع من طريق بهتيم القديم, قرية ميت ناما, قليوب, القليوبية.",570073
بلاستيك ومطاط,الشركة العربية للصناعات البلاستيكية,"5 ش الحمد, مدينة السلام, القاهرة.",180128
بلاستيك ومطاط,الشركة الفلسطينية للبلاستيك,"القطعة 3/1 شرق , المنطقة الصناعية الثالثة, العاشر من رمضان, الشرقية.",133969
بلاستيك ومطاط,الشركة الفنية للبلاستيك,"15 ش الازهر, العتبة, القاهرة.",186988
بلاستيك ومطاط,الشركة المتحدة لاستيراد ماكينات البلاستيك,"الطريق الدائرى, قليوب, القليوبية.",293917
بلاستيك ومطاط,الشركة المتحدة لتجارة خامات البلاستيك,"25 أ برج الفيروز - طريق صلاح سالم - حدائق العبور - الدور 4, مدينة نصر, القاهرة.",142439
بلاستيك ومطاط,الشركة المتحدة للبلاستيك,"ش الشهيد احمد بدوى, ابو النمرس, الجيزة.",272362
بلاستيك ومطاط,الشركة المتحدة للتجارة العالمية,"126 ش النيل - الدور 2 شقة 5, العجوزة, الجيزة.",22144
بلاستيك ومطاط,الشركة المتحدة للكيماويات والمستحضرات الطبية,"طريق السلام ابو زعبل, المنطقة الصناعية الثانية, مدينة السلام, القاهرة.",57498
بلاستيك ومطاط,الشركة المتخصصة لمركبات البلاستيك,"8 ش كورنيش النيل - مجمع الغندورة, القناطر الخيرية, القليوبية.",411998
بلاستيك ومطاط,الشركة المتخصصة لمركبات البولى اثيلين,"القطعة 705 - ش 13 متفرع من طريق اسكندرية القاهرة الصحراوى - المنطقة الحرة, العامرية, الاسكندرية.",412000
بلاستيك ومطاط,الشركة المصرية الاردنية للصناعات البلاستيكية,"14 ش صقلية, متفرع من ش مكرم عبيد, مدينة نصر, القاهرة.",500385
بلاستيك ومطاط,الشركة المصرية الافريقية - جراند بلاست,"مجمع التطبيقيين الصناعى - مدينة الشروق الصناعية, الخانكة, القليوبية.",134747
بلاستيك ومطاط,الشركة المصرية الافريقية للعبوات الحديثة - افروباك,"القطعة 112, المنطقة الصناعية الاولى, مدينة بدر, القاهرة.",489592
بلاستيك ومطاط,الشركة المصرية الالمانية لصناعة ماكينات البلاستيك,"5 ش بركات, مدينة السلام, القاهرة.",100328
بلاستيك ومطاط,الشركة المصرية الالمانية للبراميل,"القطعة 42, امتداد المنطقة الصناعية الرابعة, مدينة بدر, القاهرة.",560626
بلاستيك ومطاط,الشركة المصرية الالمانية للصناعات الكيماوية - ايجسيكو,"القطعة 29 - بلوك 10 - امتداد المنطقة الصناعية, دمياط الجديدة, دمياط.",128354
بلاستيك ومطاط,الشركة المصرية الحديثة لصناعة البلاستيك,"كم 23 - طريق اسكندرية القاهرة الصحراوى, مرغم, الاسكندرية.",134138
بلاستيك ومطاط,الشركة المصرية الرومانية لتدوير البلاستيك,"قطعة رقم 439 - - المنطقة الصناعية الثالثة, السادس من اكتوبر, الجيزة.",153330
بلاستيك ومطاط,الشركة المصرية الكندية للصناعات الكيماوية - ش.م.م,"طريق القبارى السريع - المنطقة الصناعية - المنشية الجديدة, محرم بك, الاسكندرية.",20672
بلاستيك ومطاط,الشركة المصرية لتصنيع البلاستيك,"القطعة 62 - - المدينة الصناعية - المنطقة الثانية, قويسنا, المنوفية.",456484
بلاستيك ومطاط,الشركة المصرية لتوريد خامات البلاستيك,"زاوية ابو مسلم, الهرم, الجيزة.",506125
بلاستيك ومطاط,الشركة المصرية لشعر الفرش والمكانس - خالد خميس وشركاه,"ش مدبولى, قليوب, القليوبية.",368302
بلاستيك ومطاط,الشركة المصرية لصناعة تشكيل للبلاستيك,"ش 117, جسر السويس, القاهرة.",162251
بلاستيك ومطاط,الشركة المصرية للبلاستيك,"القطعة الثامنة - - المنطقة الصناعية, عباسية, القاهرة.",64445
بلاستيك ومطاط,الشركة المصرية للعدد والقوالب - ايجى مولد,", المنطقة الصناعية الثالثة, العاشر من رمضان, الشرقية.",630987
بلاستيك ومطاط,الشركة المصرية للمقاولات والخدمات الصناعية,"2 ش 607 متفرع من ش سيف - برج الخلفاء الراشيدين - الدور 2, سيدى بشر قبلى, الاسكندرية.",436646
بلاستيك ومطاط,الشركة الهندسية لتصنيع البلاستيك والكاوتشوك والسيور الناقلة,"26 عمارة الايموبيليا ش شريف, وسط البلد, القاهرة.",155202
