Category,Name,Address,ID
تجار ومصنعون طائرات,ابو العينين محركات تطبيقية - ابيما,"3 بلوك 54 - عمارات النصر الجديدة ش 9, الهضبة العليا, المقطم, القاهرة.",50315
تجار ومصنعون طائرات,اير باص ايجيبت,"5 ش دار الشفاء, جاردن سيتى, القاهرة.",19836
تجار ومصنعون طائرات,ايكام للطيران,"19 ش فاروق عامر, مساكن شيراتون, مصر الجديدة, القاهرة.",128272
تجار ومصنعون طائرات,مصنع الطائرات - الهيئة العربية للتصنيع,"2 ش عمر بن عبد العزيز, حلوان, القاهرة.",51453
تجار ومصنعون طائرات,مصنع المحركات,"ش عمر بن عبد العزيز - حمامات حلوان, حلوان, القاهرة.",62078
تجار ومصنعون طائرات,واى فلاى افياشن سوليوشنز,"13 مربع الوزراء - مربع 1165, الشقة 1, الدور 1, مساكن شيراتون, مصر الجديدة, القاهرة.",471558
