Category,Name,Address,ID
تعبئة وتغليف,كرتونك لتصنيع وطباعة الكرتون والتعبئة والتغليف,", المنطقة الصناعية الرابعة - مجمع CPC الصناعى, السادس من اكتوبر, الجيزة.",583657
تعبئة وتغليف,نيو باك للطباعة والكرتون,"54 ب, الدور 3, المحور المركزى - مركز المدينة التجارى, المنطقة الصناعية الاولى, السادس من اكتوبر, الجيزة.",530471
تعبئة وتغليف,باك فور باك,"ش دايو, المنطقة الصناعية الاولى, السادس من اكتوبر, الجيزة.",687313
تعبئة وتغليف,ايجى رول,"كم 19 طريق اسكندرية القاهرة الصحراوى, مرغم, الاسكندرية.",209394
تعبئة وتغليف,نيو جولدن باك لصناعة الكرتون,"القطعة 448 ش 6, امتداد المنطقة الصناعية الثالثة, المنطقة الصناعية, السادس من اكتوبر, الجيزة.",124264
تعبئة وتغليف,المشرق للتعبئة والتغليف,"16 ش عبد الحليم نويرة, النزهة الجديدة, القاهرة.",502725
تعبئة وتغليف,ايجى باليت لصناعة البالتات الخشبية,"طريق ترعة المنصورية, اول طريق كرداسة ابو رواش, كرداسة, الجيزة.",528170
تعبئة وتغليف,باك هاوس ايجيبت للصناعة والتجارة,"القطعة 104, المنطقة الصناعية A4, العاشر من رمضان, الشرقية.",636019
تعبئة وتغليف,جرين باك لتصنيع الكرتون,"114 ش حمادة امام, المنطقة الصناعية الثالثة, المنطقة الصناعية, السادس من اكتوبر, الجيزة.",169127
تعبئة وتغليف,الشركة المصرية لتكنولوجيا البلاستيك,"القطعة 46 - كم 5 طريق بلبيس, المنطقة الصناعية الثانية, بلبيس, الشرقية.",161816
تعبئة وتغليف,الاهرام لصناعة الورق والكرتون,"القطعة 187,186, مجمع سى بى سى الصناعى - التوسعات الشمالية, السادس من اكتوبر, الجيزة.",695044
تعبئة وتغليف,المستقبل ستار باك للكرتون والتعبئة والتغليف,"القطعة 217 ش حمادة امام, المنطقة الصناعية الثانية, السادس من اكتوبر, الجيزة.",293167
تعبئة وتغليف,جرين باك,", العكرشة, ابو زعبل, القليوبية.",693612
تعبئة وتغليف,الشركة الدولية للصناعات الحديثة - يورباك مصر,"بلوك 12007 القطعة 8 ش 500, المنطقة الصناعية الاولى, مدينة العبور, القليوبية.",143475
تعبئة وتغليف,الشركة الدولية للكرتون المضلع,"قطعة 20, محور خدمى ثان, المنطقة الصناعية الثانية, السادس من اكتوبر, الجيزة.",503613
تعبئة وتغليف,الفؤاد للتجارة والصناعة,"القطعة 4/92, المنطقة الصناعية الثالثة A3, العاشر من رمضان, الشرقية.",545801
تعبئة وتغليف,برنت هوم لطباعة مواد التعبئة والتغليف,", المنطقة الصناعية الثانية - مدينة مبارك الصناعية, قويسنا, المنوفية.",101599
تعبئة وتغليف,الافضل لتصنيع وطباعة الكرتون والتعبئة والتغليف,", المنطقة الصناعية الرابعة - مجمع CPC الصناعى, السادس من اكتوبر, الجيزة.",692257
تعبئة وتغليف,العبيدى للتجارة,"القطعة 105, المنطقة الصناعية الثالثة - المنطقة الصناعية A4, العاشر من رمضان, الشرقية.",690578
تعبئة وتغليف,تكنو رابد لصناعة الكرتون المضلع والحصيرة,", امتداد المنطقة الصناعية الثالثة, السادس من اكتوبر, الجيزة.",449629
تعبئة وتغليف,شركة الاخلاص للصناعات البلاستيكية,"بلوك 19 - قطعة 7-8-27-28 ش البنزينة, المنطقة الصناعية الثالثة, برج العرب, الاسكندرية.",581309
تعبئة وتغليف,الشركة المصرية الايطالية - ايروباك,", المنطقة الصناعية الثالثة A3 - ارض الشريف, العاشر من رمضان, الشرقية.",133952
تعبئة وتغليف,يونيون باك للكرتون والمنتجات الورقية,", الاردنية, العاشر من رمضان, الشرقية.",580568
تعبئة وتغليف,ميجا بلاست لمواد التعبئة والتغليف,"طريق مصر اسكندرية الزراعى, كفر الدوار, البحيرة.",692612
تعبئة وتغليف,النصر لخراطة وتشكيل المعادن وتصنيع القوالب البلاستيك,"الكيلو 23 طريق اسكندرية القاهرة الصحراوى, مرغم, الاسكندرية.",689421
تعبئة وتغليف,بولى تريد للصناعة,"قطعة 188 G, المنطقة الصناعية الثالثة - منطقة 6 مليون, العاشر من رمضان, الشرقية.",626674
تعبئة وتغليف,باك هوم لصناعة الكرتون,"القطعة 100, المنطقة الصناعية جنوب غرب 6أ, العاشر من رمضان, الشرقية.",564026
تعبئة وتغليف,بلوباك للطباعة والكرتون,"القطعة 290 /291, المنطقة الصناعية الثالثة, السادس من اكتوبر, الجيزة.",544976
تعبئة وتغليف,بروفيشنال برنت,"117 عمارات صقر قريش ش عبد الحميد بدوى, مساكن شيراتون, مصر الجديدة, القاهرة.",694275
تعبئة وتغليف,المملوك للسخانات الصناعية وماكينات البلاستيك,", مركز اجا, منيه سمنود, الدقهلية.",503590
تعبئة وتغليف,كواليتى ستيل للاعمال الهندسية,"ش الجوهرة, المنطقة الصناعية الثانية, برج العرب, الاسكندرية.",687174
تعبئة وتغليف,اندستريز بلاست,"وحدة 313, المنطقة الصناعية الثالثة مجمع جرين لاند, العاشر من رمضان, الشرقية.",688837
تعبئة وتغليف,باك فور يو,", المنطقة الصناعية الاولى, السادس من اكتوبر, الجيزة.",694014
تعبئة وتغليف,تكنو برنت للصناعات البلاستيكية,"69 ش النصر, مساكن شيراتون, مصر الجديدة, القاهرة.",694508
تعبئة وتغليف,بروديرما لعبوات مستحضرات التجميل المستوردة,"برج فيينا الطريق السريع, الدور 3, طنطا, الغربية.",670452
تعبئة وتغليف,يونايتد باك لصناعات التغليف,"ش سامى البيلى, متفرع من الطريق البطئ, قليوب, القليوبية.",565425
تعبئة وتغليف,ستاركو جروب,"القطعة ٦/٥/٣, المنطقة الصناعية A2, العاشر من رمضان, الشرقية.",112650
تعبئة وتغليف,العاشر للطباعة والنشر والتغليف - كارتبرس,"ش المدينة المنورة, المنطقة الصناعية C1, العاشر من رمضان, الشرقية.",44303
تعبئة وتغليف,اولتك الهندسية - مصر,"7 عمارات الفردوس, طريق المنصورية - غطاطى, الهرم, الجيزة.",120111
تعبئة وتغليف,ميكسى لصناعة الشنط والشكاير الورقية,"ك 17 طريق اسكندرية القاهرة الزراعى, طريق الاسكندرية القاهرة الزراعى, الاسكندرية.",693878
تعبئة وتغليف,باندا ميدل ايست للتوريد والتصدير,"ش المستقبل, الشيخ زايد, السادس من اكتوبر, الجيزة.",632389
تعبئة وتغليف,شركة الألمانية ماشين لصناعة ماكينات التعبئة والتغليف,"قطعة 298, مجمع الروبيكى الصناعى, العاشر من رمضان, الشرقية.",687840
تعبئة وتغليف,المتحدة بلاست,"ش ترعة المنصورية, زاوية ابو مسلم, الهرم, الجيزة.",584615
تعبئة وتغليف,العمرانية لحلول التغليف - او بى اس,"293 ش بورسعيد, سيدى جابر الشيخ, الاسكندرية.",151501
تعبئة وتغليف,ميرج للتغليف,"فيلا 23 ش الفحام, المجاورة 26, العاشر من رمضان, الشرقية.",691707
تعبئة وتغليف,شركة الرقية لماكينات التعبئة والتغليف,"قطعة 26, مدينة بدر, القاهرة.",680441
تعبئة وتغليف,الرحاب لزوايا الكرتون والاستيراد والتصدير,"طريق بنها الزقازيق, العزيزية, منيا القمح, الشرقية.",680019
تعبئة وتغليف,القائد للصناعات البلاستيكية,"القطعة 11/7, المنطقة الصناعية الثالثة A2, العاشر من رمضان, الشرقية.",47896
تعبئة وتغليف,اراب باك,"القطعة الرابعة - بلوك 27012 ش الشباب, المنطقة الصناعية ب، ج, مدينة العبور, القليوبية.",269058
تعبئة وتغليف,اسكندرية للصناعات المعدنية والتجارة,"75 ش قناة السويس, محرم بك, الاسكندرية.",133035
تعبئة وتغليف,الجوهرى لصناعة العبوات المعدنية,"كم 28 طريق القاهرة اسكندرية الصحراوى, ابو رواش, الجيزة.",137277
تعبئة وتغليف,داود باك لمواد التعبئة والتغليف,"القطعة 344, المنطقة الصناعية الثالثة - الروبيكى - جنوب غرب 6أ, العاشر من رمضان, الشرقية.",472586
تعبئة وتغليف,ابناء البحقيرى للبلاستيك,"قطعة 104 ش البحقيرى, المنطقة الصناعية, ابو رواش, الجيزة.",278632
تعبئة وتغليف,كريستال للنشا والاستيراد والتصدير والتوكيلات التجارية,"برج زقلط, الدور 6, منيا القمح, الشرقية.",694272
تعبئة وتغليف,حلوان لرقائق الالومنيوم,"طريق ميت حلفا الشرقاوية, قليوب, القليوبية.",126475
تعبئة وتغليف,مصنع الاتربى لانتاج الاسترتش الصناعى,"بلوك 20, المرحلة الاولى, المنطقة الصناعية, جمصة, الدقهلية.",649056
تعبئة وتغليف,أر ك بى للصناعات البلاستيكية,", مجمع الصناعات البلاستيكية - وحدة 17-80, مرغم, الاسكندرية.",690445
تعبئة وتغليف,زينة باك لمواد التعبئة والتغليف,"ش العوادم, متفرع من الطريق البطئ, قليوب, القليوبية.",625890
تعبئة وتغليف,اتش جي ايه لانتاج الاسترتش الصناعي وتجارة الخامات,", جنوب المنطقة الصناعية الثالثة - بلوك 13 - قطعة 16-23, برج العرب, الاسكندرية.",690890
تعبئة وتغليف,مصنع رويال باك للتعبئة والتغليف,"الكيلو 27 طريق اسكتندرية القاهرة الصحراوى, مرغم, الاسكندرية.",690236
تعبئة وتغليف,ارت بلاست,"القطعة 185, جنوب غرب 6أ - المنطقة الصناعية, العاشر من رمضان, الشرقية.",185863
تعبئة وتغليف,تراست للتجارة والصناعة,"القطعة 32 , 10, المنطقة الصناعية الاولى, دمياط الجديدة, دمياط.",618079
تعبئة وتغليف,جلوبال لتصنيع وتجميع الموازين وانظمة القياس والتحكم,", منطقة قويسنا الصناعية - المنطقة الثانية, قويسنا, المنوفية.",474217
تعبئة وتغليف,لوج للعبوات البلاستيكية,"802 برج المعز ش الرياح التوفيقى, بنها, القليوبية.",621622
تعبئة وتغليف,مكة بلاست,"15 ش ترعة الزيتون, باسوس, القليوبية.",612611
تعبئة وتغليف,فيجن باك,"القطعة 371, امتداد المنطقة الصناعية الثالثة, السادس من اكتوبر, الجيزة.",396487
تعبئة وتغليف,مصنع الزهراء لصناعة البلاستيك,"ش 6 اكتوبر , المنطقة الصناعية - البر القبلى, سموحة, الاسكندرية.",45240
تعبئة وتغليف,لينك اب مصر,"25 برج الاكاديمية العربية - ادارى رقم 1 ش يحيي المشد, سموحة, الاسكندرية.",653677
تعبئة وتغليف,الاقصى للتعبئة والتغليف,"106 الطريق الدائرى, عزبة ابو زيد - القرية العاشرة, ابيس, الاسكندرية.",439170
تعبئة وتغليف,جولدن للتوريدات العامة - بولى ايثيلين,"ش احمد السمان, الحى الثامن, مدينة نصر, القاهرة.",694178
تعبئة وتغليف,مصنع الاتقان للبلاستيك,"القطعة 64, المجاورة 27 - منطقة الخدمات, المنطقة الصناعية الاولى, مدينة 15 مايو, القاهرة.",518577
تعبئة وتغليف,مودرن ستيل - ام اس اف,"ك 25, طريق الاسكندرية القاهرة الصحراوى, الاسكندرية.",693866
تعبئة وتغليف,ال يثرب للصناعة و التجارة,"كم 23 ش الرضوان, متفرع من طريق اسكندرية القاهرة الصحراوى, مرغم, الاسكندرية.",289737
تعبئة وتغليف,اى بى ال مصر للعبوات المتطورة.,"القطعة 6, 7 - بلوك 12016, المنطقة الصناعية الاولى, مدينة العبور, القليوبية.",213933
تعبئة وتغليف,ايجى باك - المصرية للتعبئة والتغليف,"15 ش حسين خضر, متفرع من ش 6 اكتوبر - ش السد العالى, السلام, جسر السويس, القاهرة.",151708
تعبئة وتغليف,كرافتو للطباعة وتصنيع الكرتون والاكياس الورقية,", جنوب المنطقة الصناعية الثالثة - قطعة 7 - بلوك 9, برج العرب, الاسكندرية.",687871
تعبئة وتغليف,الوادى للتعبئة والتغليف وتصنيع الكرتون,"وحدة 77, المنطقة الصناعية منطقة 6 مليون متر - مجمع ج, العاشر من رمضان, الشرقية.",686355
تعبئة وتغليف,تريبل ارم للتعبئة,"97 ش الحسينى, تقسيم فريد زكى, حدائق حلوان, القاهرة.",133852
تعبئة وتغليف,اميلكو للتجارة والتصنيع,"38 ش مختار اباظة, متفرع من ش جسر السويس, جسر السويس, القاهرة.",67739
تعبئة وتغليف,وى باك للتعبئة والتغليف,"9 عمارات عبد المقصود, الاردنية, العاشر من رمضان, الشرقية.",691106
تعبئة وتغليف,النهى لعبوات البلاستيك وعبوات مستحضرات التجميل,"8 ش حسان بن ثابت, توريل الجديدة, المنصورة, الدقهلية.",568284
تعبئة وتغليف,تارجت بلاست,"56 ش احمد محسن, السيوف شماعة, الاسكندرية.",173968
تعبئة وتغليف,شركة ريوباك,"القطعة 2/5/8 - 2/5/7, المنطقة الصناعية الثالثة A2, العاشر من رمضان, الشرقية.",130025
تعبئة وتغليف,دريم فودز لتعبئة المواد الغذائية,", المجاورة 60, المنطقة الصناعية C8, العاشر من رمضان, الشرقية.",627296
تعبئة وتغليف,الميم للطباعة والكرتون,"قطعة 10 - بلوك 20039, الامتداد الغربى, المنطقة الصناعية, مدينة العبور, القليوبية.",530769
تعبئة وتغليف,سيلوباك لصناعات التغليف,"القطعة 94 ش 14, المنطقة الصناعية الثالثة, المنطقة الصناعية, السادس من اكتوبر, الجيزة.",146949
تعبئة وتغليف,اماسيا للصناعات البلاستيكية,"القطعة 512, الروبيكى الجديدة, العاشر من رمضان, الشرقية.",625076
تعبئة وتغليف,احفاد جميل ناجى,"1 ش الترجمان, متفرع من ش محمد على, العتبة, القاهرة.",273712
تعبئة وتغليف,اسبيرس للكرتون والتعبئة والتغليف,"24 ش محمد سعيد الحلوانى - طريق العروبة - ش صلاح سالم, مصر الجديدة, القاهرة.",575548
تعبئة وتغليف,الاسكندرية للعبوات الصناعية - اكيب,"القطعة الخامسة - بلوك21 - المنطقة الصناعية الرابعة, برج العرب الجديدة, الاسكندرية.",207278
تعبئة وتغليف,الايمان للبلاستيك,"قطعة 46 أ, منطقة 75 فدان - المنطقة الصناعية, ابو رواش, الجيزة.",335312
تعبئة وتغليف,الخليج لصناعة الكرتون,"القطعة 97 - شارع 6 محور خدمى 2 - المنطقة الصناعية الثالثة, السادس من اكتوبر, الجيزة.",183406
تعبئة وتغليف,الدلتا الجديدة للبلاستيك ش.م.م,"طريق القاهرة اسكندرية الزراعى, طنطا, الغربية.",45178
تعبئة وتغليف,الشركة الشرقية للصناعات المتطورة والتغليف ش.م.م,"القطعة V أ, المنطقة الصناعية B1, العاشر من رمضان, الشرقية.",45946
تعبئة وتغليف,الشركة الشرقية للعبوات,"القطعة 1, المنطقة الصناعية الثالثة أ 6, العاشر من رمضان, الشرقية.",530906
تعبئة وتغليف,الكرمة للتوريدات,"7 أ ش تنفيذ الاحكام متفرع من ش الخمسين, زهراء المعادى, المعادى, القاهرة.",614437
تعبئة وتغليف,النيل للمعارض والمؤتمرات الدولية,"19 ش عبد الحميد لطفى, متفرع من ش سمير عبد الرؤوف, الدور 8 - شقة 802, مدينة نصر, القاهرة.",258975
تعبئة وتغليف,بولى ايثيلين ماتريكس للتوريدات,"., شبرا, القاهرة.",151522
تعبئة وتغليف,دلتا مصر للبلاستيك - دلباك ش.م.م,", ميت حواى, السنطة, الغربية.",437870
تعبئة وتغليف,سوبر هاى بوينت للتوريدات الفندقية,"قطعة 6457 - ش الجامعة الحديثة - الهضبة الوسطى, المقطم, القاهرة.",611429
تعبئة وتغليف,شركة تى جى لصناعة العبوات البلاستيكية,", المنطقة الصناعية سى2 - مجمع الصناعات الصغيرة - وحدة 17ب, العاشر من رمضان, الشرقية.",599869
تعبئة وتغليف,نور الشام لانتاج مواد التعبئة والتغليف وطباعتها,"قطعة 13/ 3 - - المنطقة الصناعية الثالثة 1أ, العاشر من رمضان, الشرقية.",576669
تعبئة وتغليف,نيو فلاش باك مصر,"القطعة ك 1 - ش هوم كير - المنطقة الصناعية الاولى - محور خدمى ثانى, السادس من اكتوبر, الجيزة.",380016
تعبئة وتغليف,25 يناير لخامات التغليف,"طريق ترعة المنصورية, الهرم, الجيزة.",480362
تعبئة وتغليف,6 اكتوبر للصناعة,"المنطقة الصناعية الثانية, السادس من اكتوبر, الجيزة.",176017
تعبئة وتغليف,ابناء الشيخ لمواد التعبئة والتغليف,"3 ش ابو جعفر, البدرشين, الجيزة.",607546
تعبئة وتغليف,ابناء عبد المنعم احمد مصباح,"القطعة 65 - - المنطقه الصناعية A3, العاشر من رمضان, الشرقية.",440209
تعبئة وتغليف,ابناء مجاهد للبلاستيك - السيد نصر مجاهد,"طريق طلخا دمياط السريع, قرية ميت عنتر, المنصورة, الدقهلية.",65092
تعبئة وتغليف,ابو احمد لمواد التعبئة والتغليف,"5 ش سعد زغلول, كرداسة, الجيزة.",560822
تعبئة وتغليف,ابو اسلام,"31 ش محمد حسن, المرج, القاهرة.",563253
تعبئة وتغليف,ابو اشرف لمواد التعبئة والتغليف,"42 ش عشرة - وراق العرب, الوراق, الجيزة.",602130
تعبئة وتغليف,ابو اميرة بلاست,"2 ش مسجد النصر, متفرع من ش الحجار, عزبة النخل الشرقية, عزبة النخل, القاهرة.",660938
تعبئة وتغليف,ابو اية لمواد التعبئة والتغليف,"34 ش محطة المياه - مدينة الزهور, المرج, القاهرة.",561392
تعبئة وتغليف,ابو خالد لمستلزمات التغليف,"33 ش خالد بن الوليد, عرب جسر السويس, جسر السويس, القاهرة.",659209
تعبئة وتغليف,ابو زياد لمستلزمات التعبئة و التغليف,"32 ش على باشا اللاله, النعام, حلمية الزيتون, القاهرة.",654705
تعبئة وتغليف,ابو سمرة لمستلزمات التغليف,"12 ش شحات منطاوى, المرج, القاهرة.",664429
تعبئة وتغليف,ابو سمرة لمواد التعبئة والتغليف,"80 ش مكة المكرمة - صفط اللبن, بولاق الدكرور, الجيزة.",575797
تعبئة وتغليف,ابو سيفين لمواد التعبئة والتغليف,"2 ش معهد البحث الجنائى - وراق الحضر, الوراق, الجيزة.",598596
تعبئة وتغليف,ابو علوش لمواد التعبئة والتغليف,"27 ش سعيد مطر, ميت عقبة, المهندسين, الجيزة.",576311
تعبئة وتغليف,ابو على لمواد التعبئة والتغليف,"2 ش احمد عرابى - وراق الحضر, الوراق, الجيزة.",598489
تعبئة وتغليف,ابو قير للصناعات الهندسية,"1 ش بور سعيد, ابو قير, الاسكندرية.",644904
تعبئة وتغليف,ابو مالك للتعبئة والتغليف,"4 ش على الكرداسى, عين شمس الغربية, القاهرة.",662594
تعبئة وتغليف,ابو مروان لمواد التعبئة والتغليف,"4 ش احمد محمود, الطالبية, الهرم, الجيزة.",639361
تعبئة وتغليف,ابو هاشم,"20 ش بسيونى جمعة, عين شمس الشرقية, القاهرة.",480698
تعبئة وتغليف,ابو وائل لمواد التعبئة والتغليف,"2 ش حاتم رجب متفرع من ش عرب الطوايلة - عرب الطوايلة, عزبة النخل, القاهرة.",528228
تعبئة وتغليف,ابو يوسف لمواد التعبئة والتغليف,"4 ش محمد عبد العزيز القرشى - صفط اللبن, بولاق الدكرور, الجيزة.",580252
تعبئة وتغليف,اجرو باك للاستيراد والتصدير والتوكيلات التجارية,"14 ش كمال الدين صلاح متفرع من ش ادموند فيرمونت, سموحة, الاسكندرية.",96459
تعبئة وتغليف,اجياد,"طريق المريوطية, ناهيا البلد, المريوطية, فيصل, الجيزة.",664917
تعبئة وتغليف,احمد ابراهيم محسن للتعبئة والتغليف,"ش البحث الجنائىالاردنية, العاشر من رمضان, الشرقية.",620632
تعبئة وتغليف,احمد ابو غالى للتوريدات,"الشارع الجديد, الخانكة, القليوبية.",624338
تعبئة وتغليف,احمد سعيد لمواد التعبئة والتغليف,"28 ش عبد العظيم ابراهيم, متفرع من ش عشرة, الوايلى الكبير, حدائق القبة, القاهرة.",618267
تعبئة وتغليف,احمد شحاتة للتعبئة والتغليف,"60 ش الجمعية - ش الزاوية سابقا, القلج, القليوبية.",514765
تعبئة وتغليف,احمد فارس لمواد التعبئة والتغليف,"80 ش سعد زغلول, الحوامدية, الجيزة.",604186
تعبئة وتغليف,اخوان غندور للصناعات المعدنية,"القطعة 90 - 91المنطقة الصناعية - الحوض السمكى, جنوب بورسعيد, بور سعيد.",563143
تعبئة وتغليف,ادمس للصناعة والتجارة,", المنطقه الصناعية الثالثة مجمع مبارك الصناعى, الحى الثالث, السادس من اكتوبر, الجيزة.",666763
