Category,Name,Address,ID
تعبئة وتغليف,جينيوس للصناعات الهندسية والبلاستيكية,"قطعة رقم E4/E5 ش العروبة, المنطقة الصناعية الثانية B2, العاشر من رمضان, الشرقية.",487717
تعبئة وتغليف,حارس للتغليف,"2 ش جمعة احمد, حدائق المعادى, المعادى, القاهرة.",471604
تعبئة وتغليف,حارس لمواد التعبئة والتغليف,"21 ش عبده نصر الله, البساتين, القاهرة.",684161
تعبئة وتغليف,حازم بلاست لمواد التعبئة والتغليف,"15 ش عبد الرحيم عباس, الطالبية, الهرم, الجيزة.",314927
تعبئة وتغليف,حجاب بلاست,"3 ش احمد توفيق, زهراء عين شمس, عين شمس, القاهرة.",650827
تعبئة وتغليف,حجازى باك لمواد التعبئة والتغليف,"ش سرياقوس, المرج الجديدة, القاهرة.",463843
تعبئة وتغليف,حسام لمواد التعبئة والتغليف,"4 ش مدرسة النجاح - وراق العرب, الوراق, الجيزة.",596637
تعبئة وتغليف,حكيم بلاست للتعبئة والتغليف,"23 ش عين شمس, عزبة النخل, القاهرة.",658920
تعبئة وتغليف,حمزة باك,"8 ش العشرين, متفرع من ش احمد عصمت, عين شمس الشرقية, القاهرة.",655400
تعبئة وتغليف,حورس لمواد التعبئة والتغليف,"18 ش البوهى - وراق العرب, الوراق, الجيزة.",594166
تعبئة وتغليف,خبراء التغليف والبلاستيك,"9 ش عبد العزيز حلمى , متفرع من ش مصر والسودان, حدائق القبة, القاهرة.",172779
تعبئة وتغليف,خطاب لمواد التعبئة والتغليف,"28 طريق ابو صير, الحوامدية, الجيزة.",605769
تعبئة وتغليف,خلفاء عبد المعطى لمواد التعبئة,"22 ش الجزائر, اللبان, الاسكندرية.",25192
تعبئة وتغليف,دار عمر عبد العزيز للطباعة والنشر,"مبنى ج - - مجمع على الدين - الدور 1, السادس من اكتوبر, الجيزة.",581440
تعبئة وتغليف,دانى باك,"8 عمارات حدائق رامو - , مدينة نصر, القاهرة.",60391
تعبئة وتغليف,دبى فليكس باك,"11 ش الميرغنى, روكسى, مصر الجديدة, القاهرة.",177105
تعبئة وتغليف,دردير باك,"81 ش عين شمس, عزبة النخل, القاهرة.",148578
تعبئة وتغليف,دريد زون للتعبئة والتغليف,"34 ش عين شمس, حلمية الزيتون, القاهرة.",663515
تعبئة وتغليف,دريما للتعبئة والتغليف والتوريدات,"10 ش البشرى, حلمية الزيتون, القاهرة.",119687
تعبئة وتغليف,دعم بلدي لتعبئة وتوزيع المواد الغذائية,"ش الشهيد الجندى, الحى الغربى, شبين الكوم, المنوفية.",639301
تعبئة وتغليف,دنيا بلاست,"القطعة 11, المنطقة الصناعية C6, العاشر من رمضان, الشرقية.",637011
تعبئة وتغليف,دهب لتجارة مواد التعبئة والتغليف,"المرحلة الرابعة - الاردنية, العاشر من رمضان, الشرقية.",159332
تعبئة وتغليف,دهب لمواد التعبئة والتغليف,"الاردنية, العاشر من رمضان, الشرقية.",622193
تعبئة وتغليف,دوت بوينت,"1 ش قدرى, متفرع من ش جمال الدين, الهرم, الجيزة.",651282
تعبئة وتغليف,دودا,"58 ش محمود خاطر, حلوان, القاهرة.",452447
تعبئة وتغليف,دودو باك لمستلزمات التعبئة والتغليف,"41 ش احمد حسنى, الحى السادس, مدينة نصر, القاهرة.",669135
تعبئة وتغليف,دولفين للاسترتش,"القطعة 264س, المنطقة الصناعية الثالثة, العاشر من رمضان, الشرقية.",651764
تعبئة وتغليف,ديباج - التصميمات الحديثة للطباعة والتغليف,"بلوك هـ - القطعة 15، 16، 43، 44 - - المنطقة الصناعية الاولى, جمصة, الدقهلية.",212749
تعبئة وتغليف,ديباك - ديما لمواد التعبئة والتغليف,"17 ش المتحف الزراعى, العجوزة, الجيزة.",58970
تعبئة وتغليف,ديزاين برنت,"ش حلمي غالي, المحلة الكبرى, الغربية.",685487
تعبئة وتغليف,ديلز باك,"المجاورة الرابعة - عمارة 903, الحى الثانى, السادس من اكتوبر, الجيزة.",563708
تعبئة وتغليف,ديلز للتوريدات,"16 أ عمارات العبور - طريق صلاح سالم, مدينة نصر, القاهرة.",490053
تعبئة وتغليف,ديناس بلاست,"48 ش ابن فضل الله العمرى, شبرا, القاهرة.",624921
تعبئة وتغليف,راب بلاست لمواد التعبئة والتغليف,"عمارة 117 - المجاورة 11, العاشر من رمضان, الشرقية.",346063
تعبئة وتغليف,رحاب جولدن,"10 ش جامع الشيخ, المنشية, الاسكندرية.",454786
تعبئة وتغليف,رشيد للتوريدات,", المحور المركزى - ميدان ليلة القدر, الحى 12, السادس من اكتوبر, الجيزة.",460122
تعبئة وتغليف,رضا جاد لمواد التعبئة والتغليف,"126 ش احمد بدوى, ابو النمرس, الجيزة.",602442
تعبئة وتغليف,ركن الحفلات,"9 ش حجازى, شبين الكوم, المنوفية.",544197
تعبئة وتغليف,رودى باك للتجارة والتوريدات,"2 ش محمد ابو زيد متفرع من ش سكة المطار, امبابة, الجيزة.",565148
تعبئة وتغليف,روفا للاستيراد والتصدير,"25 ش التروللى, جسر السويس, القاهرة.",625348
تعبئة وتغليف,روما للتغليف,"376 ش الترعة البولاقية, شبرا, القاهرة.",689869
تعبئة وتغليف,رويال باك,"20 ش محمود غنيم, متفرع من ش احمد فخرى, الحى الثامن, مدينة نصر, القاهرة.",427917
تعبئة وتغليف,رويال باك,", المنطقة الصناعية الاولى, المنطقة الصناعية, السادس من اكتوبر, الجيزة.",687111
تعبئة وتغليف,رويال باك للتعبئة والتغليف,"المنطقة الاولى - المنطقة الصناعية, قويسنا, المنوفية.",443840
تعبئة وتغليف,ريباك للتعبئة والتغليف الصناعى,"المنطقة الصناعية الاولى A1, العاشر من رمضان, الشرقية.",916
تعبئة وتغليف,ريجولا باك,"40 ش البطراوى, متفرع من ش عباس العقاد, مدينة نصر, القاهرة.",677294
تعبئة وتغليف,ريد سى باك,"ش الحجاز, سقالة, الغردقة.",637793
تعبئة وتغليف,ريد لاين,"الاردنية, العاشر من رمضان, الشرقية.",578084
تعبئة وتغليف,ريدى باك تكنولوجى,"القطعة 45 - - مجمع الصناعات الصغيرة - المنطقة الصناعية ب,ج, مدينة العبور, القليوبية.",147572
تعبئة وتغليف,ريكرمان,"140 ش التحرير, الدقى, الجيزة.",50097
تعبئة وتغليف,زاهر لصناعة مواد التعبئة والتغليف الورقية والبلاستيكية,"القطعة 79 - - المنطقة الصناعية B4, العاشر من رمضان, الشرقية.",106223
تعبئة وتغليف,زمزم لتعبئة المواد الغذائية,"1 القطعة 8861 - ش 17 - المنطقة ج, المقطم, القاهرة.",133268
تعبئة وتغليف,زمزم للصناعات الغذائية,"اول طريق شوبر مع طريق طنطا الاسكندرية الزراعى, طنطا, الغربية.",581526
تعبئة وتغليف,زمكحل لتصنيع الاكياس,"وحدة 413 - - مجمع جرين لاند - المنطقة الصناعية الاولى, مدينة العبور, القليوبية.",134160
تعبئة وتغليف,ساس - سيلز اند سيرفيسز,"كورنيش النيل - برج القانونيين - الدور 25, كورنيش المعادى, المعادى, القاهرة.",153448
تعبئة وتغليف,ساسو بلاست,"6 المساكن الشعبية ش صلاح سالم, الحوامدية, الجيزة.",605042
تعبئة وتغليف,ساكو - الشركة المتحدة لانتاج الاكياس النايلون,"المنطقة الصناعية, الهايكستب, القاهرة.",235553
تعبئة وتغليف,سالم للتعبئة والتغليف,"15 ش شكرى القواتلى, العياط, الجيزة.",612603
تعبئة وتغليف,سبيد باك لمواد التعبئة والتغليف,", سنتريس, اشمون, المنوفية.",669488
تعبئة وتغليف,ستار باك,"3 ش ممتاز متفرع من ش محمد على, العتبة, القاهرة.",160957
تعبئة وتغليف,ستار باك - الشركة الدولية للصناعة والتعبئة والتغليف,"القطعة 27 - المحور الخدمى الاول - المنطقة الصناعية الاولى, المنطقة الصناعية, السادس من اكتوبر, الجيزة.",398069
تعبئة وتغليف,ستار ماشين,"3 ش جمال عبد الناصر, زهراء مدينة نصر, مدينة نصر, القاهرة.",336722
تعبئة وتغليف,ستار ميدو,"1 ش حسن صبحى متفرع من ش نبيل طه - المطبعة, فيصل, الجيزة.",467842
تعبئة وتغليف,ستاركو للكرتون,"طريق بلبيس الزقازيق, قرية الجرجور, بلبيس, الشرقية.",598870
تعبئة وتغليف,ستاندر باكنج لصناعة وتجارة مواد التعبئة والتغليف,"1054, الشقة 1, الدور 1, مجاورة الخامسة - محور الكفراوى, الحى الثالث, السادس من اكتوبر, الجيزة.",684119
تعبئة وتغليف,سترابكو - الطويل لانتاج شنابر الحزم,"5 ش احمد عرابى, المنشية, الاسكندرية.",539972
تعبئة وتغليف,ستيك باك,"منطقة مبارك الصناعية الاولى, قويسنا, المنوفية.",83913
تعبئة وتغليف,ستيل باك,"كم 15 - طريق القاهرة بلبيس الصحراوى, بلبيس, الشرقية.",579892
تعبئة وتغليف,سراج للتعبئة,"2 ش البترول, عزبة النخل, القاهرة.",533189
تعبئة وتغليف,سراج ورزق للتجارة - معدات,"26 ش 100, المعادى, القاهرة.",59261
تعبئة وتغليف,سرايا,"1 ش شريف شتا متفرع من ش 117 - منشية السد العالى, جسر السويس, القاهرة.",451522
تعبئة وتغليف,سعيد داوود للتعبئة والتغليف,"162 ش على سلامة, المنوات, الجيزة.",614503
تعبئة وتغليف,سكاندسوان مصر,"., مدينة العبور, القليوبية.",462098
تعبئة وتغليف,سكاى بلاست لمواد التعبئة والتغليف,"الاردنية, العاشر من رمضان, الشرقية.",622720
تعبئة وتغليف,سلام للتعبئة,"11 ش سالم خيزة - مدينة الامل, امبابة, الجيزة.",537538
تعبئة وتغليف,سلسبيل بلاست,"35 ش حمدى ابو اليزيد, شبين الكوم, المنوفية.",539082
تعبئة وتغليف,سلسبيل للتعبئة والتغليف,"75 ش محطة المياه, اوسيم, الجيزة.",561112
تعبئة وتغليف,سلمى بلاست لمواد التعبئة والتغليف,"9 ش طراد النيل - العزبة الشرقية, الحوامدية, الجيزة.",614789
تعبئة وتغليف,سمارت باج,", المجاورة الثانية, عمارة 387, الحى الثانى, السادس من اكتوبر, الجيزة.",603314
تعبئة وتغليف,سمارت باك لالات التعبئة والتغليف,"القطعة 371, المنطقة الصناعية الثالثة, العاشر من رمضان, الشرقية.",427848
تعبئة وتغليف,سمارت باك لتصنيع المنتجات البلاستيكة,"56 ش مكرم عبيد, مدينة نصر, القاهرة.",468118
تعبئة وتغليف,سمارت للأحبار و الكيماويات,"2 ش الامان, متفرع من ش سلطان خطاب, اللبينى, الهرم, الجيزة.",628561
تعبئة وتغليف,سمسم لمواد التعبئة والتغليف,"6 ش الحداد, اشمون, المنوفية.",560339
تعبئة وتغليف,سميح لمستلزمات التغليف,"طريق مصر اسيوط السريع, البدرشين, الجيزة.",664211
تعبئة وتغليف,سنام للصناعات الهندسية,"القطعة 75, المنطقة الصناعية B1 - مجمع الكينج الصناعى, العاشر من رمضان, الشرقية.",657897
تعبئة وتغليف,سوبر باك للصناعات الهندسية,"القطعة رقم 82 - - امتداد المنطقة الصناعية السادسة, السادس من اكتوبر, الجيزة.",189006
تعبئة وتغليف,سوبر هاى بوينت بلاست,"3127, الهضبة الوسطى - الحى الثانى, المقطم, القاهرة.",641106
تعبئة وتغليف,سوبر وومان للتعبئة والتغليف,"39 ش الثلاثينى الجديد, الهرم, الجيزة.",626262
تعبئة وتغليف,سوفى باك,"11 ش حسن علام متفرع من ش الميرغنى, مصر الجديدة, القاهرة.",383709
تعبئة وتغليف,سوكيما جروب,"11 ش حسن علام متفرع من ش الميرغنى, مصر الجديدة, القاهرة.",91340
تعبئة وتغليف,سوليفان للتعبئة والتغليف,"33 ميدان الروضة, المنيل, القاهرة.",287551
تعبئة وتغليف,سى اس اى - انظمة الغلق انترناشيونال ايجيبت,"153 /4 - المنطقة الصناعية الثالثة, المنطقة الصناعية, السادس من اكتوبر, الجيزة.",153885
تعبئة وتغليف,سيا تريد,"8 عمارات شباب المهندسين طريق النصر, مدينة نصر, القاهرة.",257484
تعبئة وتغليف,سيباك جروب,"القطعة 30, المنطقة الصناعية الثالثة ايه 6, العاشر من رمضان, الشرقية.",44379
تعبئة وتغليف,سيجما كور,"الكيلو 5 - القطعة 14 - بلوك هـ - طريق بلبيس العاشر من رمضان - المنطقة الصناعية - منطقة المستثمرين المصريين, بلبيس, الشرقية.",462981
تعبئة وتغليف,سيريا باك التجارية لمعدات التعبئة والتغليف,"عمارة جالاردنية - مجمع نجوم الصفا 2, العاشر من رمضان, الشرقية.",411752
تعبئة وتغليف,سيفتى باك,"87 ش صلاح الدين - القصيرين, الزاوية الحمراء, القاهرة.",568236
تعبئة وتغليف,سيلدباج للشكاير,"81 ش الحجاز, ميدان المحكمة, مصر الجديدة, القاهرة.",147893
تعبئة وتغليف,سيونج جى ايجيبت,"المنطقة الصناعية الاولى, كوم اوشيم, الفيوم.",622468
تعبئة وتغليف,شادو للبلاستيك,"72 ش عثمان بن عفان, ميدان سفير, مصر الجديدة, القاهرة.",192801
تعبئة وتغليف,شادى بلاست,"2 ش حكيم مرجان, العمرانية الغربية, الهرم, الجيزة.",488411
تعبئة وتغليف,شاديباك,"4 ب ش النزهة - الدور 4 شقة 11, ارض الجولف, مصر الجديدة, القاهرة.",11406
تعبئة وتغليف,شركة الاسماعيلية للكرتون ومواد التعبئة,"., المنطقة الصناعية, الاسماعيلية.",456469
تعبئة وتغليف,شركة الاصدقاء باك لماكينات التعبئة والتغليف,"., الحوامدية, الجيزة.",566681
تعبئة وتغليف,شركة الاقصى للتجارة الدولية,"21 ش 554, سيدى بشر بحرى, الاسكندرية.",124801
تعبئة وتغليف,شركة التيسير للعبوات البلاستيكية,"31 ش احمد حسنى امتداد ش البطراوى, مدينة نصر, القاهرة.",607010
تعبئة وتغليف,شركة الحرية تك لتصنيع ماكينات التعبئة والتغليف وخطوط الانتاج,"مصنع 131 - - المنطقة الصناعية C8, العاشر من رمضان, الشرقية.",394321
تعبئة وتغليف,شركة الصمدى لماكينات التعبئة والتغليف ومستلزماتها,"طريق مصر اسيوط الزراعى, الحوامدية, الجيزة.",686924
تعبئة وتغليف,شركة العاتك للبلاستيك,"ش جسر الصليب, متفرع من طريق سقارة, شبرامنت, السادس من اكتوبر, الجيزة.",325723
تعبئة وتغليف,شركة العمار للتجارة,"8 ش تكلا, بولكلى, الاسكندرية.",134226
تعبئة وتغليف,شركة الفتح لانتاج وتعبئة المواد الغذائية,"طريق المنصورة جمصة الساحلى, قرية الروضة, طلخا, الدقهلية.",632183
تعبئة وتغليف,شركة الفيروز للصناعة والتجارة الدولية - محمد السعيد شحاته وشركاه,"القطعة 2 أ - بلوك 22004حى الشباب - ميدان المستقبل، المنطقة الصناعية ب - ج, مدينة العبور, القليوبية.",57861
تعبئة وتغليف,شركة المجد للبلاستيك,"برج المدينة كريم, كفر الدوار, البحيرة.",688966
تعبئة وتغليف,شركة المصرية ماشين للتحكم الالى وماكينات التعبئة والتغليف,"ش عبد السلام عارف, المنصورة, الدقهلية.",453332
تعبئة وتغليف,شركة المصريون الشرقيون للتجارة والتوريدات,", الاردنية مجمع عبد المقصود, العاشر من رمضان, الشرقية.",690091
تعبئة وتغليف,شركة النجمة الذهبية لطباعه مواد التعبئه والتغليف,"نهاية ش كريستال عصفور, شبرا الخيمة, القليوبية.",578678
تعبئة وتغليف,شركة النجوم للتعبئة والتغليف,"الطريق الدائرى, ابيس, الاسكندرية.",506700
تعبئة وتغليف,شركة الهدى لماكينات التعبئة والتغليف,"قطعة 122 - - المنطقة الصناعية C1, العاشر من رمضان, الشرقية.",569273
تعبئة وتغليف,شركه الوسام باك لصناعه وطباعه الورق المقوى,"القطعة 6300 - - المنطقة الصناعية السادسة, مدينة السادات, المنوفية.",584504
تعبئة وتغليف,شركة الوفا للتجارة المواد الغذائية بالجملة,"509 محور الكفراوى, الحى الخامس, السادس من اكتوبر, الجيزة.",599811
تعبئة وتغليف,شركة اوليفيرا جروب للصناعات الغذائية,"المنطقة الصناعية الثانية, الصالحية الجديدة, الشرقية.",490727
تعبئة وتغليف,شركة اى اس ام لمعدات التغليف,"6 ش الكورنيش متفرع من ش نايف عماد, طنطا, الغربية.",466826
تعبئة وتغليف,شركة تك سيرفيس لماكينات التعبئة والتغليف والطباعة,"2 برج الشواف - ش المروة - مدينة مبارك - الدور 9, المنصورة, الدقهلية.",531777
تعبئة وتغليف,شركة جنرال باك لتصنيع ماكينات التعبئة والتغليف وخطوط الانتاج,"القطعة د - وحدة رقم 423 - - مجمع الزهراء الصناعى, العاشر من رمضان, الشرقية.",493417
تعبئة وتغليف,شركة سنابل للبلاستيك,"القطعة 45 ش 8, المنطقة الصناعية الثانية, مدينة بدر, القاهرة.",45857
تعبئة وتغليف,شركة فايتوميد للاعشاب الطبيعية والمواد الغذائية - فايتو - د. محمد موسى,"4 ش الشهيد متولى الهنداوى, متفرع من ش عبد السلام عارف, الاتوبيس الجديد, المنصورة, الدقهلية.",399736
تعبئة وتغليف,شركة فيرست للتنمية الصناعية - ش.م.م - فيرست برنت,"القطعة 4- بلوك 13021 - - المنطقة الصناعية الاولى, مدينة العبور, القليوبية.",458566
تعبئة وتغليف,شركة قاضيكو للتجارة الدولية ش.م.م - القاضى,", المنطقة الصناعية - القطعة 163 ب, التجمع الثالث, القاهرة الجديدة, القاهرة.",21051
تعبئة وتغليف,شركة مارينا للاكياس والعبوات البلاستيكية - مارينا بلاست,"قطعة 2 - بلوك 33 ب, المنطقة الصناعية الثانية, برج العرب الجديدة, الاسكندرية.",586974
تعبئة وتغليف,شركة مدا باك لصناعة العلب البلاستيكية بى اي تى,"امتداد المنطقة الصناعية الرابعة - قطعة 4 - بلوك 9, برج العرب الجديدة, الاسكندرية.",695204
تعبئة وتغليف,شركة مصر الدولية لصناعة البلاستيك - ميبكو ش. م. م.,"القطعة 3/4 ش الصفا والمروة, جنوب شرق المنطقة الصناعية الثالثة A2, العاشر من رمضان, الشرقية.",57567
تعبئة وتغليف,شركة وسط الدلتا لصناعة البلاستيك,"7 ش الزراق - كورنيش النيل, متفرع من ش ذو الفقار, ساحل روض الفرج, شبرا, القاهرة.",1087
تعبئة وتغليف,شروق بلاست لمواد التعبئة والتغليف,"18 ش البوستة, ابو النمرس, الجيزة.",602987
تعبئة وتغليف,شمس جروب,"2 ش د. محمد رضا متفرع من طريق المريوطية, المريوطية, فيصل, الجيزة.",534251
تعبئة وتغليف,شندى باك,"بلوك 13037, المنطقة الصناعية, مدينة العبور, القليوبية.",689188
تعبئة وتغليف,شهبا بلاست,"محلية 6 - - الحى الاول, مدينة العبور, القليوبية.",526062
تعبئة وتغليف,شوقى سنتر,"1 حارة خالد بن الوليد - متفرع من ش الامام الغزالى - المنيرة الغربية, امبابة, الجيزة.",484120
تعبئة وتغليف,صابر لمواد التعبئة والتغليف,"1 ش السلام, قرية بشتيل, اوسيم, الجيزة.",543734
تعبئة وتغليف,صديق بلاست لمواد التعبئة والتغليف,"77 ش الاتحاد - زنين, بولاق الدكرور, الجيزة.",589603
تعبئة وتغليف,صقر الصعيد لتجفيف وتعبئة التمور,"ابراج سيد زيان - ش البحر الاعظم - الدور 4, المنيب, الجيزة.",583702
تعبئة وتغليف,صلى على محمد لمواد التعبئة,"ش الشباب - حى الشباب, مدينة العبور, القليوبية.",526090
تعبئة وتغليف,صن فودز,"ش سعد الدين متفرع من ش النصر, ديرب نجم, الشرقية.",567798
تعبئة وتغليف,ضياء لمواد التعبئة والتغليف,"37 ش عبد العليم حميق, البراجيل, الجيزة.",547334
تعبئة وتغليف,ضياء لمواد التعبئة والتغليف,"9 ش المدينة المنورة, ارض اللواء, الجيزة.",548922
تعبئة وتغليف,طارق لمواد التعبئة والتغليف,"6 ش ابن طاهر, مصر القديمة, القاهرة.",518519
تعبئة وتغليف,طاويلكو - عمر الطويل وشركاه,"5 ش احمد عرابى, المنشية, الاسكندرية.",32916
تعبئة وتغليف,طنطاوى بلاست لمواد التعبئة والتغليف,"1 ش كوبرى العريشة, ابو النمرس, الجيزة.",602479
تعبئة وتغليف,طيبة باك,"القطعة 588, المنطقة الصناعية الثالثة, المنطقة الصناعية, السادس من اكتوبر, الجيزة.",644834
تعبئة وتغليف,طيبة باك للكرتون ومواد التغليف,"طريق سقارة السياحى - ش حسن حسنى, متفرع من طريق عاليا, المريوطية, الهرم, الجيزة.",274265
تعبئة وتغليف,طيبة بلاستينا,"4 ش المقطم, المقطم, القاهرة.",682241
