Category,Name,Address,ID
خدمة التوصيل,10 مينتس لخدمات الشحن والتوصيل,"ش الاصلاح الزراعى, المسلة, الفيوم.",669559
خدمة التوصيل,احمد عمران للخضروات والفاكهه,"126 عمارات التوفيق ش الطيران, مدينة نصر, القاهرة.",676083
خدمة التوصيل,اسماء كلين,"19 ش محمد كريم, مدينة نصر, القاهرة.",680202
خدمة التوصيل,اسواق ابو دياب,"240 ح, حدائق الاهرام, الهرم, الجيزة.",660808
خدمة التوصيل,اكازا,", اونلاين ستور, حدائق حلوان, القاهرة.",667136
خدمة التوصيل,الاسلامية للدواجن,"13 ش مكة, ش شمال سيناء 1, زهراء المعادى, المعادى, القاهرة.",678925
خدمة التوصيل,البان الاصدقاء,"18 الاسكان الحدائقى, محل رقم 4, الشيخ زايد, السادس من اكتوبر, الجيزة.",652654
خدمة التوصيل,البان الحلبى,"23 ش حمودة, حدائق حلوان, القاهرة.",379646
خدمة التوصيل,البان العامر,"6 ش الامام بن حنبل, الحى السابع, مدينة نصر, القاهرة.",672610
خدمة التوصيل,الريف,"ش المعهد الاشتراكى, المريلاند, مصر الجديدة, القاهرة.",654342
خدمة التوصيل,الصفا كلين,"41 ش ابو الفوارس, الحى السابع, مدينة نصر, القاهرة.",672592
خدمة التوصيل,العطارة السورية,"31 ش الفريق محمد ابراهيم, مدينة نصر, القاهرة.",454490
خدمة التوصيل,العمدة سموكينج شوب,"13 عمارات صقر قريش ش الحسن, مساكن شيراتون, مصر الجديدة, القاهرة.",680014
خدمة التوصيل,الغرباوى للبلاستيك,"1 ش حسنى محمود, متفرع من ش عبد الحميد مكى, حدائق المعادى, المعادى, القاهرة.",410994
خدمة التوصيل,الكريكى للتوريدات المكتبيه,"428 ش الشهداء, المجاوره التانية, الحى الاول, السادس من اكتوبر, الجيزة.",694702
خدمة التوصيل,المارد,"ش سعد زغلول, حى الشرق, بور سعيد.",687357
خدمة التوصيل,اولاد الحاج رجب للخضراوات والفواكه,"ش احمد بن حنبل, متفرع من ش الطيران, سوق 16, الحى السابع, مدينة نصر, القاهرة.",672547
خدمة التوصيل,اولاد الحاج رجب للخضروات والفاكهة,"68 ش محمد مقلد, الحى الثامن, مدينة نصر, القاهرة.",677532
خدمة التوصيل,اولاد جمال ماركت,"14 ش العزيز بالله, الزيتون, القاهرة.",661961
خدمة التوصيل,ايس لاند,"199 ب ش العشرين, متفرع من ش جاردنيا, حدائق الاهرام, الهرم, الجيزة.",675163
خدمة التوصيل,بسرعة البرق,", اعمال حرة, حى الاربعين, السويس.",669486
خدمة التوصيل,بلاك هورس ان,"ش المشير احمد اسماعيل, ميدان القومية, الزقازيق, الشرقية.",686290
خدمة التوصيل,بلدينا,"22 عمارات التعاونيات ش افريقيا, الحى الثامن, مدينة نصر, القاهرة.",190612
خدمة التوصيل,بن الشامى,"119 ش النزهة, تريومف, مصر الجديدة, القاهرة.",489997
خدمة التوصيل,بن الغنيمى,"9, الشطر 13, برج الندا, زهراء المعادى, المعادى, القاهرة.",618797
خدمة التوصيل,بيت العطارة الهندية,"30 ش الزعيم غاندى, عرب جسر السويس, عين شمس الشرقية, القاهرة.",274507
خدمة التوصيل,بيت اللحم,"110 ش عمار بن ياسر, مصر الجديدة, القاهرة.",680420
خدمة التوصيل,تبارك,"15 عمارات بنك الاسكان والتعمير ش حسن المأمون, الحى الثامن, مدينة نصر, القاهرة.",674763
خدمة التوصيل,تيستلى,", ., وسط البلد, القاهرة.",677519
خدمة التوصيل,تيماز ديلايتس,", ., وسط البلد, القاهرة.",674519
خدمة التوصيل,جزارة التيسير,"6 ش محمد كريم, مدينة نصر, القاهرة.",680267
خدمة التوصيل,جزارة النصر,"21 ش دمنهور, مصر الجديدة, القاهرة.",680520
خدمة التوصيل,جزارة النور السورية,"4 ش محمد مقلد, الحى الثامن, مدينة نصر, القاهرة.",677482
خدمة التوصيل,جزارة عباد الرحمن,"15 ش الدندراوى, حدائق المعادى, المعادى, القاهرة.",676198
خدمة التوصيل,حراز للصناعات الغذائية والمنتجات الطبيعية,"1 ش احمد ماهر, ميدان باب الخلق, باب الخلق, القاهرة.",63313
خدمة التوصيل,خضراوات وفواكة عباد الرحمن,"19 ش الدندراوى, متفرع من ش 9, حدائق المعادى, المعادى, القاهرة.",676496
خدمة التوصيل,خضروات ابناء سوهاج,"123 عمارات التوفيق, مدينة نصر, القاهرة.",678225
خدمة التوصيل,خضروات الحرمين,"121 عمارات التوفيق, بجوار مطعم الشبراوى, مدينة نصر, القاهرة.",678190
خدمة التوصيل,خضروات وفواكه الشريف,"58 عمارات التوفيق ش المدينة الجديدة, مدينة نصر, القاهرة.",676073
خدمة التوصيل,دايزى فلاور,"ش التسعين الجنوبى, القاهرة الجديدة, القاهرة.",668966
خدمة التوصيل,دراى كلين الاخلاص 4,"125 عمارات التوفيق ش الطيران, مدينة نصر, القاهرة.",678217
خدمة التوصيل,دراى كلين التوحيد,"10 ش عباس زعزوع, متفرع من ش الطيران, الحى السابع, مدينة نصر, القاهرة.",315063
خدمة التوصيل,دراى كلين الزهور,"66 ش حلمى حسن على, متفرع من ش محمد مقلد, الحى الثامن, مدينة نصر, القاهرة.",677484
خدمة التوصيل,دراى كلين حمزة,"1 ش رفعت العمدة, متفرع من ش مزرعة البط, البساتين, القاهرة.",677472
خدمة التوصيل,دريم هوم,"58 عمارات التوفيق ش المدينة الجديدة, مدينة نصر, القاهرة.",676035
خدمة التوصيل,ذا شيف هاوس,", ., القاهرة الجديدة, القاهرة.",674777
خدمة التوصيل,ريف بلدنا للخضروات,"408 مساكن ضباط القوات المسلحة, زهراء مدينة نصر, مدينة نصر, القاهرة.",676526
خدمة التوصيل,زيزى كيتشن,"25 ش 199, دجلة, المعادى, القاهرة.",614904
خدمة التوصيل,سيف هوم,"9 المساكن التعاونية ش الدوحة, الزقازيق, الشرقية.",667428
خدمة التوصيل,سين لخدمات المحمول,"76 ش الحجاز, ميدان هليوبوليس, مصر الجديدة, القاهرة.",678090
خدمة التوصيل,شام الاصيل للحلويات,", المجاورة الثانية, الحى 12, الشيخ زايد, السادس من اكتوبر, الجيزة.",651486
خدمة التوصيل,طبيعى للالبان,"304 ش الميثاق, زهراء مدينة نصر, مدينة نصر, القاهرة.",676667
خدمة التوصيل,طيبة كلين,"56 عمارات صقر قريش, مساكن شيراتون, مصر الجديدة, القاهرة.",679520
خدمة التوصيل,طيور الارزاق,"41 ش ابو الفوارس, الحى السابع, مدينة نصر, القاهرة.",672508
خدمة التوصيل,طيور البركة,"68 ش محمد مقلد, الحى الثامن, مدينة نصر, القاهرة.",677529
خدمة التوصيل,طيور الحرمين,"4 ش اسيوط, عين شمس الشرقية, القاهرة.",657668
خدمة التوصيل,طيور الحمد,"5 عمارات اول مايو, مدينة نصر, القاهرة.",676830
خدمة التوصيل,طيور الحمد,"4 ش عبد السلام عارف, متفرع من ش جمال عبد الناصر, المنيب, الجيزة.",654546
خدمة التوصيل,طيور الرحمة,"6 ش الاحمص, الحى السابع, مدينة نصر, القاهرة.",672415
خدمة التوصيل,طيور الصعيدى,"1 ش الفخرانى, متفرع من ش جسر الكونيسة, المنيب, الجيزة.",654599
خدمة التوصيل,طيور المهندس,"6 ش الدندراوى, حدائق المعادى, المعادى, القاهرة.",676495
خدمة التوصيل,طيور الهدى,", الحى السويسرى ب - عمارة 56, الحى العاشر, مدينة نصر, القاهرة.",677322
خدمة التوصيل,عصائر عباد الرحمن,"28 ش سمير عبد الرؤوف, امتداد ش مكرم عبيد, الحى الثامن, مدينة نصر, القاهرة.",643210
خدمة التوصيل,عطارة الشيخ حبهان,"65 عمارات رابعة الاستثمارى ش عبد العظيم وزير, مدينة نصر, القاهرة.",672979
خدمة التوصيل,عطارة المهدى,"55 ش عبد الحميد مكى, حدائق المعادى, المعادى, القاهرة.",411698
خدمة التوصيل,فريش للدواجن,"851 ش الميثاق, زهراء مدينة نصر, مدينة نصر, القاهرة.",676668
خدمة التوصيل,فواكه وخضروات على بابا,"8 عمارات بيتشو امريكان سيتى ش عبد الرحمن بن عوف, المرحلة الاولى, زهراء المعادى, المعادى, القاهرة.",537072
خدمة التوصيل,فود تانك,"., وسط البلد, القاهرة.",681100
خدمة التوصيل,قاصد كريم للدواجن,"75 ش مصطفى النحاس, الحى الثامن, مدينة نصر, القاهرة.",461439
خدمة التوصيل,كوكى شوب,"60 ش ذاكر حسين, مدينة نصر, القاهرة.",187090
خدمة التوصيل,لحوم البركة,"75 ع ش الخزان, حدائق الاهرام, الهرم, الجيزة.",650814
خدمة التوصيل,ماركت اولاد عامر,"11 ابراج بدر الطريق الدائرى, زهراء المعادى, المعادى, القاهرة.",456490
خدمة التوصيل,مانو للفضيات,"32 ش فلسطين, عرب جسر السويس, عين شمس الشرقية, القاهرة.",652261
خدمة التوصيل,محمصات الرحاب,"28 ش سمير عبد الرؤوف, امتداد ش مكرم عبيد, مدينة نصر, القاهرة.",315269
خدمة التوصيل,محمصة الاسماعيلية الكبرى,"ش السكة الحديد, وسط البلد, الاسماعيلية.",655832
خدمة التوصيل,محمصة السعادة,"1030 مساكن ضباط القوات المسلحة ش العيادة, زهراء مدينة نصر, مدينة نصر, القاهرة.",676532
خدمة التوصيل,مستر بى,"11 ش مكرم عبيد, مدينة نصر, القاهرة.",669434
خدمة التوصيل,مطعم شوكو تشيز,", ., مدينة نصر, القاهرة.",674030
خدمة التوصيل,مغسلة السندباد,"8 ش كابول, امتداد ش مكرم عبيد, مدينة نصر, القاهرة.",315103
خدمة التوصيل,مكة للتعبئة والتغليف,"52 ش حلمى حسن على, الحى الثامن, مدينة نصر, القاهرة.",677542
خدمة التوصيل,منظفات مكة,"3 ش شمال سيناء 1, تقسيم شمال سيناء, زهراء المعادى, المعادى, القاهرة.",678922
خدمة التوصيل,هابى لايف,"14 عمارات الهيئة العربية للتصنيع ش حسن المأمون, الحى الثامن, مدينة نصر, القاهرة.",674760
خدمة التوصيل,هوفو لنقل البضائع,"52 ش امين الخولى, الحى المتميز, السادس من اكتوبر, الجيزة.",686555
