Category,Name,Address,ID
دكتور عيون,د. عادل صبحى,"12 ش احمد تيسير, مصر الجديدة, القاهرة.",423259
دكتور عيون,د. عادل عبد الرازق,"22 ش السادات ميدان الكوبرى الجديد - الدور 4, الزقازيق, الشرقية.",185188
دكتور عيون,د. عادل عبد الرحمن عثمان,"2 ش رشدى, ميدان سفير, مصر الجديدة, القاهرة.",209579
دكتور عيون,د. عادل عبد الشفيق,"27 أ ش بغداد, الدور 7, برج الاطباء, الكوربة, مصر الجديدة, القاهرة.",109657
دكتور عيون,د. عادل عبد العزيز حسونة,"76 ش العباسية - الدور 1, عباسية, القاهرة.",155071
دكتور عيون,د. عادل عطية,"91 ش المنيل, المنيل, القاهرة.",563017
دكتور عيون,د. عادل على الدين,"33 ش القصر العينى, قصر العينى, القاهرة.",109690
دكتور عيون,د. عادل عمر عزت,"ش محمد على - برج القرعلى - حى اول, وسط البلد, الاسماعيلية.",574871
دكتور عيون,د. عادل كمال,"32 ش الرشيد متفرع من ش احمد عرابى - الدور 1 شقة 2, المهندسين, الجيزة.",438686
دكتور عيون,د. عادل كمال,"عمارة الحريرى - ش البوسطة - الدور 4, الزقازيق, الشرقية.",185191
دكتور عيون,د. عادل محمد عبد الوهاب,"2 ش الفيوم - برج الاطباء, الكوربة, مصر الجديدة, القاهرة.",334767
دكتور عيون,د. عادل محمد فتحى,"55 ش النادى الرياضى - برج الاطباء - الدور 3, فيصل, الجيزة.",235165
دكتور عيون,د. عاطف فراج,"1 ميدان المطرية, الزيتون, القاهرة.",512295
دكتور عيون,د. عبد البارى المحمدى سلطان,"104 عمارات الاوقاف - ش ابن سندر, سراى القبة, القاهرة.",235167
دكتور عيون,د. عبد الحكيم حسين المشد,"ش السوق العمومى, بلقاس, الدقهلية.",356653
دكتور عيون,د. عبد الحميد خليف,"ش الجيش, كفر الدوار, البحيرة.",586822
دكتور عيون,د. عبد الرحمن السباعى,"ش جمال عبد الناصر, شبين الكوم, المنوفية.",317546
دكتور عيون,د. عبد الرحمن جابر,"96 ش مصطفى النحاس, الشقة 207, الدور 2, برج الاطباء, مدينة نصر, القاهرة.",449806
دكتور عيون,د. عبد الرحمن رفاعى,"2 ش صابر جمعة, فيصل, الجيزة.",683774
دكتور عيون,د. عبد الرحمن شريف,"11 ش الحكيم متفرع من ش سعد زغلول, الجيزة, الجيزة.",596570
دكتور عيون,د. عبد الرحمن على هلال,"5 ش السادات, كرداسة, الجيزة.",361253
دكتور عيون,د. عبد العزيز امام,"29 ش مصطفى كامل, الشقة 219, الدور 2, المعادى, القاهرة.",53192
دكتور عيون,د. عبد العزيز على,"33 ش القصر العينى, قصر العينى, القاهرة.",177280
دكتور عيون,د. عبد العظيم يوسف,"40 ش الحجاز, الدور 3, ميدان المحكمة, مصر الجديدة, القاهرة.",53236
دكتور عيون,د. عبد الغنى ابراهيم,"1 ش احمد عرابى, شبرا الخيمة, القليوبية.",246220
دكتور عيون,د. عبد الفتاح ابراهيم الغايش,"ش 23 يوليو, بسيون, الغربية.",347683
دكتور عيون,د. عبد القادر سيد شعبان,"ش الجيش, العياط, الجيزة.",275218
دكتور عيون,د. عبد القادر عبد المنعم,"87 ش روض الفرج, شبرا, القاهرة.",431630
دكتور عيون,د. عبد القادر محمد مصطفى,"45 ش الجيش, دير مواس, المنيا.",277640
دكتور عيون,د. عبد اللطيف محمد شتا,"ش سعد زغلول, دسوق, كفر الشيخ.",347254
دكتور عيون,د. عبد الله الحسينى,"154 ش جسر السويس, جسر السويس, القاهرة.",275349
دكتور عيون,د. عبد الله الحسينى,"4 عمارات الاوقاف - ش الجيش, وسط البلد, كفر الشيخ.",115786
دكتور عيون,د. عبد الله حامد خضر,"13 ش الخليفة المأمون - الدور 2 شقة 4, روكسى, مصر الجديدة, القاهرة.",359401
دكتور عيون,د. عبد الله حمور,"القطعة 9127 - ش 9, المقطم, القاهرة.",530187
دكتور عيون,د. عبد الله صفوت نور الدين,"الاردنية - مركز المدينة, العاشر من رمضان, الشرقية.",619051
دكتور عيون,د. عبد الله عبد الوهاب,"ش الجيش, ابو حماد, الشرقية.",364428
دكتور عيون,د. عبد الله محمد الامين,"45 ش ابن الحكم, حلمية الزيتون, القاهرة.",337981
دكتور عيون,د. عبد الله محمود,"ش المدارس, وسط البلد, اسوان.",278158
دكتور عيون,د. عبد الله نصير,"حارة الوسط, منيا القمح, الشرقية.",324225
دكتور عيون,د. عبد المجيد البوهى,"62 ش سعد زغلول, اشمون, المنوفية.",561212
دكتور عيون,د. عبد المجيد محمد تاج الدين,"41 ش ابو الفتوح عبد الله - زهراء عين شمس, عين شمس, القاهرة.",204049
دكتور عيون,د. عبد المجيد محمد تاج الدين,"43 ش ابو الفتوح عبد الله, عين شمس الشرقية, القاهرة.",205002
دكتور عيون,د. عبد المحسن البرعى,"12 ش الجمهورية, الحوامدية, الجيزة.",375689
دكتور عيون,د. عبد المعز حداد احمد ابراهيم,"53 برج الاطباء - ش المقريزى, منشية البكرى, مصر الجديدة, القاهرة.",235173
دكتور عيون,د. عبد المنجى السيد,"4 ش ترعة السواحل متفرع من ش السودان - برج المحكمة, امبابة, الجيزة.",570280
دكتور عيون,د. عبد الهادى محمد,"54 ش عين شمس, المطرية, القاهرة.",376609
دكتور عيون,د. عبد الهادى محمد عبد الهادى,"52 ش عين شمس, عين شمس, القاهرة.",416918
دكتور عيون,د. عبدالله كامل عبد الله حسونة,"40 ش كليوباترا, الدور 4, مصر الجديدة, القاهرة.",211259
دكتور عيون,د. عبده نعمان عبده,"18 ش احمد عرابى, المنشية, الاسكندرية.",34022
دكتور عيون,د. عبير فؤاد البدرى,"14 ش شريف, مصر الجديدة, القاهرة.",419876
دكتور عيون,د. عثمان على عثمان,"143 ش مصر والسودان, حدائق القبة, القاهرة.",235177
دكتور عيون,د. عز الدين خالد,"38 ش ربيع الجيزى, الجيزة, الجيزة.",53136
دكتور عيون,د. عزت شهدى ناروز,"31 ش عين شمس, عين شمس, القاهرة.",125681
دكتور عيون,د. عزت عبد الرحمن شاهين,"19 ش صلاح الدين متفرع من ش سعد زغلول, بنها, القليوبية.",521432
دكتور عيون,د. عزة صلاح الدين عبد الحميد,"10 ع عمارات اول مايو طريق النصر, الدور 2, مدينة نصر, القاهرة.",235181
دكتور عيون,د. عصام الدين شهيب,"19 ش وزارة الزراعة, الدقى, الجيزة.",96361
دكتور عيون,د. عصام الدين شهيب,"19 ش وزارة الزراعة, الدقى, الجيزة.",393266
دكتور عيون,د. عصام الدين على عزقول,"ميدان المحطة, طنطا, الغربية.",276755
دكتور عيون,د. عصام الدين عمر,"62 ش سعد زغلول, اشمون, المنوفية.",561222
دكتور عيون,د. عصام خضر,"الشارع التجارى, الشيخ زايد, الاسماعيلية.",296223
دكتور عيون,د. عصام عبد الغفار,"60 عمارات ابو الفتوح ش الهرم, الهرم, الجيزة.",53209
دكتور عيون,د. عصام عبد الغفار متولى,"برج الحرية - تقسيم الحرية, بنى سويف, بنى سويف.",273675
دكتور عيون,د. عصام قطب شلبى,"فيلا 81 - - الحى الثالث, الشيخ زايد, السادس من اكتوبر, الجيزة.",534004
دكتور عيون,د. عصام محمد,", ميدان سعد زغلول, بنها, القليوبية.",277325
دكتور عيون,د. عفت عبد النبى,"19 ش وزارة الزراعة, الدقى, الجيزة.",393263
دكتور عيون,د. علاء الدين حسين,"ش سعد زغلول, دسوق, كفر الشيخ.",343857
دكتور عيون,د. علاء الدين زكى حسن,"29 ش مصطفى كامل, الشقة 109, الدور 1, المعادى, القاهرة.",235196
دكتور عيون,د. علاء الدين محمد عثمان الزواوى,"6 ش رشدى باشا, رشدى, الاسكندرية.",355074
دكتور عيون,د. علاء السيد الطوخى,"قرية سنديون, قليوب, القليوبية.",395911
دكتور عيون,د. علاء الفرماوى,"عمارات الاوقاف - ش الجيش, وسط البلد, كفر الشيخ.",360423
دكتور عيون,د. علاء عامر الضرغامى,"26 ش عثمان محمد, طنطا, الغربية.",276753
دكتور عيون,د. علاء عبد العظيم,"26 ش امتداد رمسيس, مدينة نصر, القاهرة.",300472
دكتور عيون,د. علاء غباشى,"59 ش بورسعيد, الشهداء, المنوفية.",314039
دكتور عيون,د. علاء فتحى,"91 برج الاطباء - ش العباسية - الدور 8, عباسية, القاهرة.",183204
دكتور عيون,د. على السيد هاشم,"35 ش المديرية, طنطا, الغربية.",276750
دكتور عيون,د. على المنصورى,"ش جمال عبد الناصر, المنتزة, المنتزه, الاسكندرية.",591941
دكتور عيون,د. على حسن الداى,"ش الكوبرى العلوى, دمياط, دمياط.",277761
دكتور عيون,د. على حسن سعد,"24 ش عمر بن الخطاب, ميدان الاسماعيلية, مصر الجديدة, القاهرة.",440135
دكتور عيون,د. على خليفة,"37 ش بغداد, الكوربة, مصر الجديدة, القاهرة.",109514
دكتور عيون,د. على صقر,"28 ش الجلاء, فيكتوريا, الاسكندرية.",220241
دكتور عيون,د. على عثمان,"ش الحسين بن على, ميدان هليوبوليس, مصر الجديدة, القاهرة.",593220
دكتور عيون,د. على غالى,"عمارات المحاربين - ش الخلفاء الراشدين, وسط البلد, كفر الشيخ.",360380
دكتور عيون,د. على محمد الرماوى,"37 ش الترعة السلطوحية, المرج, القاهرة.",443770
دكتور عيون,د. على محمد طه,"27 ش السودان, المهندسين, الجيزة.",53139
دكتور عيون,د. عليمى السيد,"89 ش صلاح سالم, قويسنا, المنوفية.",572913
دكتور عيون,د. عماد الدين عرفة عبد اللطيف,"ش الرياضى, بنى سويف, بنى سويف.",273679
دكتور عيون,د. عماد برسوم سلامة,"116 ش راغب باشا, كرموز, الاسكندرية.",24542
دكتور عيون,د. عماد جمعة الخولى,"19 ش العشرين, فيصل, الجيزة.",213047
دكتور عيون,د. عماد طلعت الفقى,"المحور المركزى, السادس من اكتوبر, الجيزة.",484573
دكتور عيون,د. عماد عبد العال صوابى,"104 ش التحرير, الدقى, الجيزة.",235197
دكتور عيون,د. عماد فايق,"270 ش جمال عبد الناصر - الدور 4, ميامى, الاسكندرية.",602884
دكتور عيون,د. عماد فوزى,"81 ش سليم الاول, حلمية الزيتون, القاهرة.",204929
دكتور عيون,د. عماد محمد رزق,"252 ش فيصل, فيصل, الجيزة.",53210
دكتور عيون,د. عمر جمال العطار,"41 ش العيسوى, سيدى بشر بحرى, الاسكندرية.",673491
دكتور عيون,د. عمر فتحى,"4 ش احمد خيرى - زهراء مصر القديمة, مصر القديمة, القاهرة.",518967
دكتور عيون,د. عمر محمد قنديل,"ش عرابى, منية النصر, الدقهلية.",354549
دكتور عيون,د. عمرو ابراهيم,"133 ب ش مصر والسودان, حدائق القبة, القاهرة.",53216
دكتور عيون,د. عمرو احمد البكرى,"32 ش مصدق, الدقى, الجيزة.",116135
دكتور عيون,د. عمرو العوامرى,"168 ش النزهة, الدور 3, مصر الجديدة, القاهرة.",678854
دكتور عيون,د. عمرو جمال الدين زكى,"9 ش البوسطة, الكوربة, مصر الجديدة, القاهرة.",235198
دكتور عيون,د. عمرو حسن السمرة,"19 ش وزارة الزراعة, الدقى, الجيزة.",99902
دكتور عيون,د. عمرو حسين,"ش احمد شوقى, مدينة الرحاب, القاهرة.",589680
دكتور عيون,د. عمرو حسين,"1 ش احمد عرابى, شبرا الخيمة, القليوبية.",246222
دكتور عيون,د. عمرو حسين رشاد,"139 أ ش التحرير, الدقى, الجيزة.",53140
دكتور عيون,د. عمرو سليمان,"34 ش صعب صالح, عين شمس الشرقية, القاهرة.",96027
دكتور عيون,د. عمرو صلاح الدين,"40 ش مصدق, الدقى, الجيزة.",18869
دكتور عيون,د. عمرو عبد البارى,"126 ش محيى الدين ابو العز, المهندسين, الجيزة.",53200
دكتور عيون,د. عمرو عبد العزيز عزب,"17 ش التحرير تقاطع ش محيى الدين ابو العز - الدور 3, الدقى, الجيزة.",109629
دكتور عيون,د. عمرو عبد الفتاح,"11 أ ش شبين الكوم, وسط البلد, الاسماعيلية.",291541
دكتور عيون,د. عمرو عبد اللطيف الشافعى,"المحور المركزى - ميدان النجدة, الحى الثالث, السادس من اكتوبر, الجيزة.",589605
دكتور عيون,د. عمرو عطية,"286 ش ترعة الجبل, الزيتون, القاهرة.",404089
دكتور عيون,د. عمرو محمد فوزى,"50 ش الخليفة المأمون, الدور 8, منشية البكرى, مصر الجديدة, القاهرة.",235216
دكتور عيون,د. عمرو محيى الدين,"16 ش النيل السعيد, البدرشين, الجيزة.",665052
دكتور عيون,د. عمرو نايل,"31 ش البطل احمد عبد العزيز, المهندسين, الجيزة.",461955
دكتور عيون,د. عمرو ياسين,"1 ش على بن ابى طالب متفرع من ش الهرم - الدور 4, التعاون, الهرم, الجيزة.",602623
دكتور عيون,د. عواض محمد الخولى,"14 ش مسجد العوام, قليوب, القليوبية.",525829
دكتور عيون,د. غادة محمد على عطا,"ش اللوكاندة, روكسى, مصر الجديدة, القاهرة.",588790
دكتور عيون,د. فادى ثروت فهمى,"34 ش سنان, الزيتون, القاهرة.",596211
دكتور عيون,د. فادى فارس,"2 ش فتحى عمر خطاب, الهرم, الجيزة.",507589
دكتور عيون,د. فادى محمد عبد المقصود,"7 ش احمد الزمر, الحى العاشر, مدينة نصر, القاهرة.",445262
دكتور عيون,د. فادى وحيد,"53 ش المقريزى, الشقة 412, الدور 4, برج الاطباء, منشية البكرى, مصر الجديدة, القاهرة.",666619
دكتور عيون,د. فادية الجندى,"37 ش الخليفة المأمون - الدور 6, روكسى, مصر الجديدة, القاهرة.",440134
دكتور عيون,د. فادية انيس,"ش دار المعلمين, اسيوط, اسيوط.",564323
دكتور عيون,د. فارس حسن,"16 ش الاقبال - برج الخير, فيكتوريا, الاسكندرية.",595145
دكتور عيون,د. فارس عزيز,"17 ش محمود بسيونى, وسط البلد, القاهرة.",168798
دكتور عيون,د. فازع بدر الدين,"ش الجلاء - الدور 3, الدلنجات, البحيرة.",127642
دكتور عيون,د. فاطمة ابو العز,"ش عمر زعفان, طنطا, الغربية.",337995
دكتور عيون,د. فايزة عبد الله زكى,"48 ش سليم الاول, الزيتون, القاهرة.",235222
دكتور عيون,د. فتحى فوزى,"33 ش محمد شفيق, ميدان هليوبوليس, مصر الجديدة, القاهرة.",16422
دكتور عيون,د. فريد محمد وجدى,"2 ش احمد تيسير, الدور 2, ارض الجولف, مصر الجديدة, القاهرة.",683248
دكتور عيون,د. فريد محمد وجدى,"2 ش احمد تيسير، متفرع من ش الميرغنى, كلية البنات, مصر الجديدة, القاهرة.",617254
دكتور عيون,د. فريد محمد وجدى,"ميدان شرف - برج الحكمة, شبين الكوم, المنوفية.",322659
دكتور عيون,د. فضيلة انور,"49 ش الحرية, المطرية, القاهرة.",481162
دكتور عيون,د. فكرى جورج اسكندر,"20 ش عدلى عمارة كوداك - الدور 1, وسط البلد, القاهرة.",448444
دكتور عيون,د. فكرى زاهر,"3 ش النصر, مساكن شيراتون, مصر الجديدة, القاهرة.",2833
دكتور عيون,د. فوزى السيد الشاهد,"8 ش الدقى, الدقى, الجيزة.",235224
دكتور عيون,د. فيروز احمد عرنسة,"7 ش محمد امين ابو يوسف, دمياط, دمياط.",507541
دكتور عيون,د. فيكتور عبد المسيح,"محلية 6 - محور السادات - الحى الاول, مدينة العبور, القليوبية.",522656
دكتور عيون,د. قصدى يوسف عطية,"152 ش شبرا, شبرا, القاهرة.",235226
دكتور عيون,د. كارم عبده عبد العزيز قلقيلة,"43 ش عثمان بن عفان, ميدان الاسماعيلية, مصر الجديدة, القاهرة.",235229
دكتور عيون,د. كامل جمعة,"31 ش عبد المنعم رياض - وراق الحضر, الوراق, الجيزة.",597718
دكتور عيون,د. كريم سلام,"ش لبنان, المهندسين, الجيزة.",587045
دكتور عيون,د. كريم عبد الحميد رزق,"1 /2 ش اللاسلكى, المعادى, القاهرة.",445707
دكتور عيون,د. كريم مجدى,"7 ش نخلة المطيعى, ميدان سفير, مصر الجديدة, القاهرة.",670303
دكتور عيون,د. كمال سليمان,"ش بورسعيد, منيا القمح, الشرقية.",323742
دكتور عيون,د. كمال على ابو الغيط,"31 ش الفردوس - ش الدرى سابقا, العجوزة, الجيزة.",390478
دكتور عيون,د. لبنى خزبك,"9 ش التحرير , الدقى, الجيزة.",179773
دكتور عيون,د. لبنى عبد الله,"14 ش المقياس شقة 6, الروضة, القاهرة.",235233
دكتور عيون,د. لطفى جرجس عبد الله,"ش زين بن الخطاب, جرجا, سوهاج.",240433
دكتور عيون,د. لوسى ادوارد نسيم,"الحى الاول - مركز المدينة, العاشر من رمضان, الشرقية.",623550
دكتور عيون,د. ليلى عثمان,"87 ش 9 , المعادى, القاهرة.",53193
دكتور عيون,د. ليلى محمد حموده,"2 ش عبد المنعم رياض ميدان عرب المعادى, حدائق المعادى, المعادى, القاهرة.",171651
دكتور عيون,د. مؤمن محمود حمدى,"16 ش النزهة ميدان الساعة, مدينة نصر, القاهرة.",593689
دكتور عيون,د. مؤنس عبد الله,"45 ش بهاء الدين الغتورى - الدور 4 شقة 16, سموحة, الاسكندرية.",601887
دكتور عيون,د. ماجد عدلى نجيب,"130 ش النزهة, الدور 2, تريومف, مصر الجديدة, القاهرة.",678205
دكتور عيون,د. ماجد كامل,"ش الجمهورية, بيلا, كفر الشيخ.",362893
دكتور عيون,د. ماجد كمال يوسف,"91 ش العباسية - الدور 4, عباسية, القاهرة.",53257
دكتور عيون,د. ماجد ماهر صليب,"107 ش النزهة ميدان تريومف, تريومف, مصر الجديدة, القاهرة.",235236
دكتور عيون,د. ماجد ميخائيل,"168 ش النزهة, الدور 6, تريومف, مصر الجديدة, القاهرة.",192595
دكتور عيون,د. ماجد يوسف,"6 ابراج عثمان - ش السعادة - الدور 3 شقة 32, روكسى, مصر الجديدة, القاهرة.",552697
دكتور عيون,د. ماجدة محمود سامى,"49 ش محمد فريد, مصر الجديدة, القاهرة.",426044
دكتور عيون,د. مارك انانيان,"ش الالفى, وسط البلد, القاهرة.",586973
دكتور عيون,د. مالك عبد العزيز,"170 ش شبرا, شبرا, القاهرة.",604328
دكتور عيون,د. مالك محمد القط,"ش سعد زغلول, الحوامدية, الجيزة.",372869
دكتور عيون,د. مايكل انسى,"263 ش شبرا ميدان الخلفاوى, شبرا, القاهرة.",231985
دكتور عيون,د. مجدى البربرى,"58 ش الحجاز, ميدان هليوبوليس, مصر الجديدة, القاهرة.",53238
دكتور عيون,د. مجدى الدين الدسوقى,"32 ش جزيرة العرب, المهندسين, الجيزة.",53201
دكتور عيون,د. مجدى النجدى,"34 /20 ش حسب الله الكفراوى المجاورة الرابعة - الحى الثانى, دمياط الجديدة, دمياط.",530125
دكتور عيون,د. مجدى خلاف,"48 ش عباس العقاد, المنطقة السادسة, مدينة نصر, القاهرة.",53228
دكتور عيون,د. مجدى صلاح احمد موسى,"ش عثمان محمد, طنطا, الغربية.",331840
دكتور عيون,د. مجدى عزيز كيرلس بباوى,"73 ش عثمان بن عفان, ميدان سفير, مصر الجديدة, القاهرة.",235241
دكتور عيون,د. مجدى عطيفة,"43 ش نخلة المطيعى, تريومف, مصر الجديدة, القاهرة.",53239
دكتور عيون,د. مجدى ميخائيل,"ش 20, العامرية, الاسكندرية.",113405
دكتور عيون,د. مجدى هلال,"38 ش حسن المأمون, مدينة نصر, القاهرة.",430856
دكتور عيون,د. محسن عماد الدين سالم,"17 ش محمد محمود, باب اللوق, القاهرة.",235246
دكتور عيون,د. محسن عماد الدين سالم,"1, الشقة 905, الدور 9, ميدان الحجاز, برج الصفا الطبى, المهندسين, الجيزة.",381032
دكتور عيون,د. محسن نصيف جرس,"27 ش مصطفى النحاس, الحى الثامن, مدينة نصر, القاهرة.",126313
دكتور عيون,د. محفوظ غنيم,", المنطقة الادارية, مدينة الرحاب, القاهرة.",214783
دكتور عيون,د. محمد ابراهيم,"32 بلوك 21 ش احمد الزمر, الحى العاشر, مدينة نصر, القاهرة.",678720
دكتور عيون,د. محمد ابراهيم,"4 عمارات اسكندرية ش 9, المقطم, القاهرة.",682731
دكتور عيون,د. محمد ابراهيم سالم,"ش الجناين - برج الاطباء, الزقازيق, الشرقية.",590581
دكتور عيون,د. محمد ابو العنين,"79 ش عين شمس, عين شمس الشرقية, القاهرة.",660082
دكتور عيون,د. محمد ابو الفتوح عطية,"ش بيومى نصر, القلج, القليوبية.",421571
دكتور عيون,د. محمد ابو ذكرى,"محور السادات, التجمع الاول, القاهرة الجديدة, القاهرة.",588991
دكتور عيون,د. محمد ابو طالب,"ش البحر, طنطا, الغربية.",653042
دكتور عيون,د. محمد احمد اسماعيل,"ش بورسعيد, سرس الليان, المنوفية.",376226
دكتور عيون,د. محمد احمد السادة,"55 ش عبد المنعم رياض, الشقة 706, الدور 7, برج القاهرة الطبى, المهندسين, الجيزة.",152514
دكتور عيون,د. محمد احمد حسنى,"16 ش الخصوص العمومى, المرج, القاهرة.",483973
دكتور عيون,د. محمد احمد خلف,"ش السكة الجديدة, المنصورة, الدقهلية.",279195
دكتور عيون,د. محمد احمد عبد العظيم,"38 ش الفالوجا, العجوزة, الجيزة.",53186
دكتور عيون,د. محمد احمد عوض الله,"30 برج الاهلى - ش مراد, الجيزة, الجيزة.",235254
