Category,Name,Address,ID
دكتور عيون,عساف للعيون والليزك,"52 ش ابو العتاهية, امتداد ش عباس العقاد, مدينة نصر, القاهرة.",396846
دكتور عيون,د. ايمن الغنيمى - استشارى عيون الاطفال والحول,"8 ش 153, ميدان الحرية, المعادى, القاهرة.",435895
دكتور عيون,مركز عناية العيون,"1 ش دمشق, متفرع من ميدان سوارس, المعادى, القاهرة.",96410
دكتور عيون,عيادة د. اسامة فاروق للعيون,"2 ش شعراوى تقاطع ش ابو قير, لوران, الاسكندرية.",213498
دكتور عيون,عيادة د. كرم كليم نجيب,"115 ش شبرا - الدور 2 شقة 5, شبرا, القاهرة.",591050
دكتور عيون,عيادة د. هالة على ابو غريب استشارى طب و جراحة العيون,"عمارة ج ش احمد شوقى, الدور 1, المدينة الطبية, مصطفى كامل, الاسكندرية.",236477
دكتور عيون,مستشفى دنيا العيون - د. ايهاب سعد عثمان,"6 ش التحرير, الدقى, الجيزة.",130431
دكتور عيون,احمد حسام عبد الله,"22 ش الغرفة التجارية, محطة الرمل, الاسكندرية.",29471
دكتور عيون,احمد سالم,"187 ش ملك حفنى, سيدى بشر, الاسكندرية.",35513
دكتور عيون,الحوفى كلينيك,"103 برج بانوراما الشرق - ش سيدى جابر - الدور 3, سيدى جابر الشيخ, الاسكندرية.",265163
دكتور عيون,الدولية للعدسات,"40 ش 265, المعادى الجديدة, المعادى, القاهرة.",114743
دكتور عيون,الرحاب كلينك للعيون والليزك,"المنطقة الادارية, مدينة الرحاب, القاهرة.",544994
دكتور عيون,العين كلينيك,"ميدان الجيزة, الجيزة, الجيزة.",591839
دكتور عيون,المجموعة المصرية للعيون,"1, الشقة 902, الدور 9, ميدان الحجاز, برج الصفا الطبى, المهندسين, الجيزة.",84556
دكتور عيون,المرزوق,"المحور المركزى - ميدان ليلة القدر, الحى 12, السادس من اكتوبر, الجيزة.",623526
دكتور عيون,المركز الاستشارى للعيون وجراحات الشبكية والليزر - د. احمد لبيب,"القطعة 82 ش اخناتون, الحى الاول, التجمع الخامس, القاهرة الجديدة, القاهرة.",358465
دكتور عيون,المركز التخصصى الدولى للعيون,"8 برج مراد الإدارى ش مراد, الدور 14,, الجيزة, الجيزة.",623204
دكتور عيون,المركز الدولى,"1 ميدان المطرية, الزيتون, القاهرة.",512292
دكتور عيون,المركز الدولى لطب العيون,"125 ش عبد العزيز فهمى, ميدان عثمان بن عفان, مصر الجديدة, القاهرة.",99167
دكتور عيون,المركز السويسرى للعيون,"اول ش شكور, داخل مول مصر - الدور الثالث - امام مطعم محمد احمد, محطة الرمل, الاسكندرية.",627086
دكتور عيون,المركز العربى للعيون,"21 ش المعهد الاشتراكى, روكسى, مصر الجديدة, القاهرة.",668400
دكتور عيون,المركز المصري للعيون,"14 عمارات حدائق رامو طريق النصر, الدور 2, تقاطع ش عمر بن الخطاب, مدينة نصر, القاهرة.",675321
دكتور عيون,المركز الملكى للعيون والليزك,"6 أ ش السباق, متفرع من ش الحجاز, مصر الجديدة, القاهرة.",389932
دكتور عيون,المستشفى الوطنى للعيون,", امتداد ش الثورة, الماظة, مصر الجديدة, القاهرة.",544675
دكتور عيون,الملكى للعيون,"ش عبد السلام الشاذلى - برج تبارك - الدور 3 شقة 4, دمنهور, البحيرة.",585144
دكتور عيون,المنير لرعاية عيون مرضى السكر,"92 ش التحرير, الدور 4, برج ساريدار الطبى, الدقى, الجيزة.",467110
دكتور عيون,النيل للعيون والليزك,"ش ياسر جعفر - المشاية, المنصورة, الدقهلية.",503586
دكتور عيون,امين سليمان نصر,"2 ش استامبول, محطة الرمل, الاسكندرية.",32853
دكتور عيون,اوبتميستك للعيون,"54 ش نزية خليفة البستان, ميدان هليوبوليس, مصر الجديدة, القاهرة.",635180
دكتور عيون,اوبتميستك للعيون,"خدمة العملاء, ميدان هليوبوليس, مصر الجديدة, القاهرة.",635185
دكتور عيون,اى كلينيك,"المنطقة الادارية, مدينة الرحاب, القاهرة.",455380
دكتور عيون,اى كير,"34 ش البطراوى, متفرع من ش عباس العقاد, مدينة نصر, القاهرة.",330283
دكتور عيون,اى كير كلينيك - د. معتز غيث,"6 /1 ش اللاسلكى - الدور 1 شقة 11, المعادى الجديدة, المعادى, القاهرة.",171133
دكتور عيون,اى كيور كلينيك,"107 طريق مصر حلوان الزراعى - برج الاندلس - الدور 1, حدائق المعادى, المعادى, القاهرة.",476603
دكتور عيون,برايت اى كلينك,"1 عمارات شباب المهندسين طريق النصر, الدور 2, مدينة نصر, القاهرة.",462722
دكتور عيون,بيرفيكت فيجين,"74 ش النزهة, مصر الجديدة, القاهرة.",597009
دكتور عيون,ثريا عز الدين محمد,"41 ش الشمرلى, الجمرك, الاسكندرية.",30778
دكتور عيون,حسام الدين فرحات,"73 /4 ش حسب الله الكفراوى المجاورة الثانية - الحى الثانى - الدور 3, دمياط الجديدة, دمياط.",528421
دكتور عيون,حورس لتصحيح الابصار,"20 برج سقارة ش سوريا, الدور 1, رشدى, الاسكندرية.",58571
دكتور عيون,د . هانى عباس الجمال,"القطعة 17 - ش المحمدى حويدق, الكوثر, الغردقة.",142397
دكتور عيون,د. حمدى نصار,"القطعة 162 ش التسعين الشمالى, التجمع الخامس, القاهرة الجديدة, القاهرة.",641003
دكتور عيون,د. ابراهيم اسماعيل,"10 ش الجمهورية, وسط البلد, القاهرة.",53249
دكتور عيون,د. ابراهيم بلبع,"168 ش التحرير, باب اللوق, القاهرة.",440152
دكتور عيون,د. ابراهيم حسن العبد,"13 ش جمال عبد الناصر, كفر شكر, القليوبية.",519690
دكتور عيون,د. ابراهيم صبرى,"20 ش امين فكرى, محطة الرمل, الاسكندرية.",32548
دكتور عيون,د. ابراهيم فتحى ابراهيم,"108 ش فيصل, الكوم الاخضر, فيصل, الجيزة.",510836
دكتور عيون,د. ابراهيم محيى الدين طاهر,"209 ش 26 يوليو, المهندسين, الجيزة.",234116
دكتور عيون,د. ابراهيم يحيى,"22 عمارات ضباط القوات المسلحة -, سيدى جابر, الاسكندرية.",236278
دكتور عيون,د. ابو الحسن البدوى,"ش المدرسة, قطور, الغربية.",346080
دكتور عيون,د. ابو الخير هنرى ماضى,"30 ش سعد زغلول, محطة الرمل, الاسكندرية.",49948
دكتور عيون,د. ابو النصر ابراهيم,"عمارة الفوال - ش سعد, دسوق, كفر الشيخ.",277282
دكتور عيون,د. ابو بكر محمد,"18 ش كابول, المنطقة السادسة, مدينة نصر, القاهرة.",53224
دكتور عيون,د. احمد ابراهيم,"511 ش الاهرام ميدان الجيزة - عمارة النصر - الدور 11, الجيزة, الجيزة.",616732
دكتور عيون,د. احمد ابراهيم ابو العنين,"53 ش عثمان بن عفان, ميدان الاسماعيلية, مصر الجديدة, القاهرة.",53229
دكتور عيون,د. احمد ابراهيم ابو النجا,"16 ش اسماعيل رمزى, ميدان الجامع, مصر الجديدة, القاهرة.",53230
دكتور عيون,د. احمد ابراهيم الدسوقى,"ش بورسعيد, السنطة, الغربية.",349327
دكتور عيون,د. احمد ابراهيم جلهوم,"37 ش المبتديان - برج السراج - الدور 4 شقة 403, السيدة زينب, القاهرة.",223310
دكتور عيون,د. احمد ابراهيم حرحش,"80 ب ش مصدق متفرع من ش محيى الدين ابو العز, الدقى, الجيزة.",96369
دكتور عيون,د. احمد ابو ليلة,"96 ش جسر السويسالالف مسكن, جسر السويس, القاهرة.",623850
دكتور عيون,د. احمد اسماعيل احمد,"84 ش الرشاح, الخصوص, القليوبية.",498259
دكتور عيون,د. احمد الحريرى,"33 ش جامعة الدول العربية, المهندسين, الجيزة.",458512
دكتور عيون,د. احمد الدمرداش,"18 ش محمد نجيب - مدينة الاحرار, المرج, القاهرة.",561597
دكتور عيون,د. احمد الرفاعى,"63 ش النبى دانيال, محطة الرمل, الاسكندرية.",33261
دكتور عيون,د. احمد السيد هديب,"ش ابو الفضل, الزاوية الحمراء, القاهرة.",410156
دكتور عيون,د. احمد السيد هديب,"3 ش ذاكر حسين, مدينة نصر, القاهرة.",686172
دكتور عيون,د. احمد الصاوى حبيب,"45 ش جامعة الدول العربية تقاطع ش شهاب - الدور 5, المهندسين, الجيزة.",541696
دكتور عيون,د. احمد العادلى,"29 ش عمر بن الخطاب - ارض الجمعية, امبابة, الجيزة.",570017
دكتور عيون,د. احمد العربى,"1 ش الجلاء البحرى, شبين الكوم, المنوفية.",538315
دكتور عيون,د. احمد العشرى,"ش القومية, الزقازيق, الشرقية.",586981
دكتور عيون,د. احمد القاضى,"3 ش جمال عبد الناصر - قرية المعتمدية, كرداسة, الجيزة.",553400
دكتور عيون,د. احمد الكاتب,"55 ش عبد المنعم رياض, الشقة 807, الدور 8, برج القاهرة الطبى, المهندسين, الجيزة.",67456
دكتور عيون,د. احمد المعتصم,"75 ش ابو بكر الصديق, ميدان سفير, مصر الجديدة, القاهرة.",448323
دكتور عيون,د. احمد الهجع,"77 ش كمال الشاذلى - ش الجيش سابقا, الباجور, المنوفية.",559187
دكتور عيون,د. احمد اليمانى,"55 ش المشروع, عين شمس الغربية, القاهرة.",649638
دكتور عيون,د. احمد انور عبد الغنى,"161 ش الاسكندرية واسماعيل سرى, وسط البلد, الاسماعيلية.",162415
دكتور عيون,د. احمد بكر محفوظ,"عمارة الاندلس - ش 23 يوليو, وسط البلد, قنا.",277804
دكتور عيون,د. احمد بهى الدين شلش,"8 ش قصر النيل, وسط البلد, القاهرة.",234125
دكتور عيون,د. احمد جمال,"378 ش الهرم, الدور 6, برج الماسة - برج 4, الهرم, الجيزة.",672620
دكتور عيون,د. احمد جمال برهومة,"عمارة الاتحاد الاشتراكى - , حلوان, القاهرة.",173486
دكتور عيون,د. احمد جمعة المهدى,"2 ش انيس حنا متفرع من ش منشية الجمل, الزاوية الحمراء, القاهرة.",565787
دكتور عيون,د. احمد جمعة المهدى,"26 ش 15 متفرع من ش سلامة عفيفى, الزاوية الحمراء, القاهرة.",566128
دكتور عيون,د. احمد جمعة المهدى,"2 عمارات اول مايو طريق النصر, الدور 1, مدينة نصر, القاهرة.",676750
دكتور عيون,د. احمد حبيب,"12 ب ش بطرس غالى, مصر الجديدة, القاهرة.",592790
دكتور عيون,د. احمد حسن,"40 ش ترعة السواحل, امبابة, الجيزة.",481426
دكتور عيون,د. احمد حسن حلمى,"15 أ ش شريف - الدور 3, وسط البلد, القاهرة.",438714
دكتور عيون,د. احمد حسنى عبد الحميد,"6 أ ش بطرس غالى, روكسى, مصر الجديدة, القاهرة.",234127
دكتور عيون,د. احمد حسنين عبيد,"92 برج ساريدار الادارى - ش التحرير ميدان الدقى, الدقى, الجيزة.",272457
دكتور عيون,د. احمد حنون,"20 ش مصدق, الدقى, الجيزة.",525709
دكتور عيون,د. احمد خطاب,"430 ش فيصل, المساحة, فيصل, الجيزة.",474064
دكتور عيون,د. احمد خطاب,"خلف 29 ش فوزى معاذ، برج العلميين, سموحة, الاسكندرية.",593170
دكتور عيون,د. احمد خليفة,"31 ش 9, المقطم, القاهرة.",444311
دكتور عيون,د. احمد درويش,"الشارع العمومى, قليوب, القليوبية.",362842
دكتور عيون,د. احمد رسلان,"532 ش الشعراوى - حى الشباب 100 متر, مدينة العبور, القليوبية.",534302
دكتور عيون,د. احمد رسمى عامر,"147 ش ام السلطان, الورديان, الاسكندرية.",502415
دكتور عيون,د. احمد رضا عوضين,"48 ش السودان, الدقى, الجيزة.",459001
دكتور عيون,د. احمد سامر احمد,"16 ش سيد عبد الواحد, روكسى, مصر الجديدة, القاهرة.",272459
دكتور عيون,د. احمد سامى,"12 ش بطرس غالى, روكسى, مصر الجديدة, القاهرة.",334855
دكتور عيون,د. احمد سعيد,"ش المشير احمد اسماعيل - برج المصرى, الزقازيق, الشرقية.",597649
دكتور عيون,د. احمد سلطان,"ميدان المحطة, المنصورة, الدقهلية.",184114
دكتور عيون,د. احمد سمير الفقى,"105 ش ابراهيم مدكور, ابو النمرس, الجيزة.",603346
دكتور عيون,د. احمد سمير منتصر,"88 ش الميرغنى, كلية البنات, مصر الجديدة, القاهرة.",588155
دكتور عيون,د. احمد سيد سيف,"برج صفوة الاطباء - ش الجمهورية, الحادقة, الفيوم.",330111
دكتور عيون,د. احمد شامة,"ش فوزى معاذ تقاطع ش البرت الاول - ابراج ازهار السرايا - برج البسنت - الدور 1, سموحة, الاسكندرية.",477081
دكتور عيون,د. احمد شبانة,"1 ش عمر بن الخطاب, حدائق المعادى, المعادى, القاهرة.",507143
دكتور عيون,د. احمد شعراوى,"97 ش التحرير, الدور 7, الدقى, الجيزة.",588770
دكتور عيون,د. احمد شفيق الريدى,"7 ب عمارات الهيئة العربية للتصنيع - ش مكرم عبيد تقاطع ش حافظ رمضان - الدور 1 شقة 11, مدينة نصر, القاهرة.",577597
دكتور عيون,د. احمد شفيق عبد الله,"44 ش عبد المجيد اللبان, السيدة زينب, القاهرة.",234131
دكتور عيون,د. احمد شلش,"69 ش 9, الدور 4, المعادى, القاهرة.",475469
دكتور عيون,د. احمد شوكت,"ش ناصر, سمالوط, المنيا.",114856
دكتور عيون,د. احمد صقر,"102 ش البساتين العمومى, البساتين, القاهرة.",504499
دكتور عيون,د. احمد صقر,"4 بلوك 86, الدور 2, الشطر 13, زهراء المعادى, المعادى, القاهرة.",679223
دكتور عيون,د. احمد عاطف,"ش فخرى زكى, متفرع من ش ابو الوفا, حدائق المعادى, المعادى, القاهرة.",685902
دكتور عيون,د. احمد عاطف زكى,"4 ش 151 - الدور 5, المعادى, القاهرة.",99911
دكتور عيون,د. احمد عبد الباقى,"2 ش هشام لبيب, الدور 1, الحى الثامن, مدينة نصر, القاهرة.",672756
دكتور عيون,د. احمد عبد الرحمن,"27 كورنيش النيل - القيراطيين, اوسيم, الجيزة.",591934
دكتور عيون,د. احمد عبد الرحمن يوسف,"84 ش صلاح سالم, قويسنا, المنوفية.",314317
دكتور عيون,د. احمد عبد العزيز,"ش الجيش, حدائق حلوان, القاهرة.",379505
دكتور عيون,د. احمد عبد العظيم,"96 ش مصطفى النحاس, الشقة 409, الدور 4, برج الاطباء, مدينة نصر, القاهرة.",314937
دكتور عيون,د. احمد عبد العليم محمد,"52 ش ابو بكر الصديق, ميدان سفير, مصر الجديدة, القاهرة.",239109
دكتور عيون,د. احمد عبد الغفار,"14 ش فريد سميكة, الدور 2, ميدان بقطر, الالف مسكن, مصر الجديدة, القاهرة.",674903
دكتور عيون,د. احمد عبد الغنى سالم,"ش ملك حفنى, سيدى بشر, الاسكندرية.",38299
دكتور عيون,د. احمد عبد الفتاح,"52 ش لمعى المطيعى, مدينة الهدى, حدائق حلوان, القاهرة.",642456
دكتور عيون,د. احمد عبد الله,"96 ش التحرير, الشقة 604, الدور 6, برج الاطباء, الدقى, الجيزة.",661286
دكتور عيون,د. احمد عبد المحسن ايوب,"2 ش ترعة السواحل - وراق الحضر, الوراق, الجيزة.",597830
دكتور عيون,د. احمد عبد المنصف,"1 ش عمر بن الخطاب ميدان هارون الرشيد, ميدان الاسماعيلية, مصر الجديدة, القاهرة.",272456
دكتور عيون,د. احمد عبد المنعم,"الشارع الجديد, الباجور, المنوفية.",299198
دكتور عيون,د. احمد عبد المنعم نور الدين,"5 ش ترعة الطوالة, عزبة النخل, القاهرة.",527735
دكتور عيون,د. احمد عبد الهادى عرمه,"ش الترعة - برج الحرمين - الدور 3 شقة 10, المنصورة, الدقهلية.",587004
دكتور عيون,د. احمد عبد الوارث محمد,"ش النيل السعيد, البدرشين, الجيزة.",646407
دكتور عيون,د. احمد عبد الوهاب,"ش الجمهورية, ههيا, الشرقية.",361573
دكتور عيون,د. احمد عليان,"ش التحرير, ابو كبير, الشرقية.",332235
دكتور عيون,د. احمد فؤاد ابو زيد,"2 ش مصطفى عطية, الزاوية الحمراء, القاهرة.",298020
دكتور عيون,د. احمد فؤاد الحلوجى,"2 ش العشرين, مدكور, فيصل, الجيزة.",416889
دكتور عيون,د. احمد كامل,"51 ش الترعة السلطوحية, المرج, القاهرة.",486659
دكتور عيون,د. احمد لبيب الليثى,"41 ش 23 يوليو, الباجور, المنوفية.",556308
دكتور عيون,د. احمد ماهر سلامة,"13 ميدان السيدة زينب, السيدة زينب, القاهرة.",366871
دكتور عيون,د. احمد مجدى ابو شوشة,"ش جمال عبد الناصر, سيدى بشر بحرى, الاسكندرية.",589114
دكتور عيون,د. احمد مجدى بده,"88 ش عبد السلام عارف - الدور 2, جليم, الاسكندرية.",438713
دكتور عيون,د. احمد محمد حبيب,"ش الاستاد, شبين الكوم, المنوفية.",275986
دكتور عيون,د. احمد محمد شريف,"41 ش البطل احمد عبد العزيز, المهندسين, الجيزة.",257713
دكتور عيون,د. احمد محمد عثمان,"ش فوزى معاذ - ابراج ازهار السرايا - برج تيوليب - الدور 4, سموحة, الاسكندرية.",472492
دكتور عيون,د. احمد مصطفى شرف,"ش نقابة المحامين, دمنهور, البحيرة.",356926
دكتور عيون,د. احمد مصطفى عبد الرحمن,"8 برج مراد - ش مراد, الجيزة, الجيزة.",234136
دكتور عيون,د. احمد مصطفى عبد العزيز,"42 ش مصدق, الدقى, الجيزة.",562904
دكتور عيون,د. احمد مصطفى كمال,"114 ش التحرير, الدقى, الجيزة.",234140
دكتور عيون,د. احمد مصطفى موسى,"2 عمارات الاوقاف - ش الجيش, وسط البلد, كفر الشيخ.",345115
دكتور عيون,د. احمد مكى,"61 ش النهضة, ميدان المحطة, سرايات المعادى, المعادى, القاهرة.",683140
دكتور عيون,د. احمد منير شلبى,"70 ش المنيل, المنيل, القاهرة.",195757
دكتور عيون,د. احمد مهيب,"42 ش مصدق, الدقى, الجيزة.",483001
دكتور عيون,د. احمد نبيل شرابى,"15 ش سيف الدين الكاتب, دمنهور, البحيرة.",591596
دكتور عيون,د. احمد هشام منير,"27 ميدان رامو, الحى المتميز, السادس من اكتوبر, الجيزة.",589688
دكتور عيون,د. احمد يحيى ثروت,"62 ش عبد الهادى خطاب, مصر الجديدة, القاهرة.",234141
دكتور عيون,د. ادمون اسعد,"58 ش سليم الاول, الزيتون, القاهرة.",53143
دكتور عيون,د. ادمون اسعد جيد,"161 ش النزهة, مصر الجديدة, القاهرة.",422543
دكتور عيون,د. ادوارد الفونس,"ش البنك الاهلى, الفشن, بنى سويف.",318364
دكتور عيون,د. ارنست امين شنودة,"ش امين بك - الدور 2, وسط البلد, الفيوم.",278331
دكتور عيون,د. اسامة ابراهيم سيد,"52 ش توت عنخ امون - ابراج سيدى جابر - برج الزهراء, سيدى جابر, الاسكندرية.",132839
دكتور عيون,د. اسامة احمد النجار,"143 ش مصر والسودان, حدائق القبة, القاهرة.",233784
دكتور عيون,د. اسامة الحوفى,"54 ش البطل احمد عبد العزيز, المهندسين, الجيزة.",93951
دكتور عيون,د. اسامة حافظ جلال,"1 ش يونس صالح, قويسنا, المنوفية.",572899
دكتور عيون,د. اسامة رسلان,"5 ش النور والامل, مصر الجديدة, القاهرة.",233786
دكتور عيون,د. اسامة سالم,"14 أ ش شريف, روكسى, مصر الجديدة, القاهرة.",233787
دكتور عيون,د. اسامة عبد الهادى,"ش الجلاء, الزقازيق, الشرقية.",587147
دكتور عيون,د. اسامة يوسف راغب فرج,"2 ش جمال ابو المال, عزبة النخل, القاهرة.",125677
دكتور عيون,د. اسحق منير صليب,"90 ب ش شبرا دوران شبرا - الدور 8 شقة 19, شبرا, القاهرة.",431607
دكتور عيون,د. اسر احمد احسان,"446 ش فيصل - برج النصر, فيصل, الجيزة.",233789
دكتور عيون,د. اسلام البيه,"148 ش جسر السويس, جسر السويس, القاهرة.",623206
دكتور عيون,د. اسلام الحديدى,"54 ش البطل احمد عبد العزيز, تقاطع ش جامعة الدول العربية, المهندسين, الجيزة.",576758
دكتور عيون,د. اسلام حسن,"27 ش ابن الحكم, حلمية الزيتون, القاهرة.",511357
دكتور عيون,د. اسلام سلامة,"1 ش سكة حديد الدلتا, شبين القناطر, القليوبية.",517125
دكتور عيون,د. اسلام عبد المنعم ابو زيد,"كم 17.5 - طريق اسكندرية مطروح الصحراوى, ابو يوسف, الاسكندرية.",595062
دكتور عيون,د. اسلام عزت عطا الله,"115 ش الوحدة, امبابة, الجيزة.",569664
دكتور عيون,د. اسماعيل جودت,"17 ش الاخشيد, منيل الروضة, القاهرة.",6996
دكتور عيون,د. اسماعيل حسونة,"14 ش عبد الحميد لطفى, المهندسين, الجيزة.",122070
دكتور عيون,د. اسماعيل حمزة,"50 ش نخلة المطيعى, متفرع من ش عثمان بن عفان, تريومف, مصر الجديدة, القاهرة.",574043
دكتور عيون,د. اسماعيل عبد اللطيف صلاح,"34 ش شريف, حلوان, القاهرة.",384274
دكتور عيون,د. اسماعيل فلى,"10 ش البلسم, المطرية, القاهرة.",448667
دكتور عيون,د. اسماعيل كامل,"234 ش سعد زغلول, الجيزة, الجيزة.",461305
دكتور عيون,د. اسماعيل محمد موسى,"39 ش الجيش, قليوب, القليوبية.",477817
دكتور عيون,د. اسماعيل مصطفى اسماعيل,"ش الجمهورية, السنطة, الغربية.",349917
