Category,Name,Address,ID
دكتور تغذية وتخسيس,د. هشام الطنبولى,"ش البحر, اجا, الدقهلية.",668737
دكتور تغذية وتخسيس,د. هشام فاروق العامرى,"14 ش مصدق, الدقى, الجيزة.",270431
دكتور تغذية وتخسيس,د. هشام محمد شوقى البدرى,"15 ش الاديب على ادهم شقة 3, مساكن شيراتون, مصر الجديدة, القاهرة.",127573
دكتور تغذية وتخسيس,د. هناء بدير,"ش زهير, الابراهيمية, الاسكندرية.",301893
دكتور تغذية وتخسيس,د. هند رشاد,"5 ش 153 ميدان الحرية - برج الحرية - الدور 10, المعادى, القاهرة.",379909
دكتور تغذية وتخسيس,د. وائل الطويل,"128 ش السودان - برج الاطباء, المهندسين, الجيزة.",587180
دكتور تغذية وتخسيس,د. وائل شرف,"1 ش محمد حلمى, السيوف, الاسكندرية.",427433
دكتور تغذية وتخسيس,د. وائل صلاح,"7 عمارات الفتح - المحور المركزى, الحى الثالث, السادس من اكتوبر, الجيزة.",474141
دكتور تغذية وتخسيس,د. وائل كمال سمنة ونحافة وامراض ضغط الدم,"1 /13 شارع زهراء المعادى الرئيسى, زهراء المعادى, المعادى, القاهرة.",455667
دكتور تغذية وتخسيس,د. وائل نبيل,"5 ش محمد مطاوع, الازاريطة, الاسكندرية.",616677
دكتور تغذية وتخسيس,د. وحيد منير,"ش الزيتون, الزيتون, القاهرة.",404621
دكتور تغذية وتخسيس,د. وفاء احمد فهمى,"33 ش قصر العينى, قصر العينى, القاهرة.",625700
دكتور تغذية وتخسيس,د. وفاء فهمى,"31 ش قصر العينى, قصر العينى, القاهرة.",589677
دكتور تغذية وتخسيس,د. وليد عسكر,"ش قناة السويس, المنصورة, الدقهلية.",489483
دكتور تغذية وتخسيس,د. ياسمين لاشين,"31 ش عزت سلامة, مدينة نصر, القاهرة.",598076
دكتور تغذية وتخسيس,د. ياسمين نبيل علام,"28 ش سوريا - الدور 2, رشدى, الاسكندرية.",597208
دكتور تغذية وتخسيس,د. يحيى مهران,"ابراج المدينة سنتر - برج أ, السادس من اكتوبر, الجيزة.",436817
دكتور تغذية وتخسيس,د.طارق رشدى,"56 ش متحف المنيل, المنيل, القاهرة.",161329
دكتور تغذية وتخسيس,دايت اكس,"ش النصر متفرع من ش طراد النيل, الحوامدية, الجيزة.",431406
دكتور تغذية وتخسيس,دايت رايت,"12 عمارات العبور ش صلاح سالم, مدينة نصر, القاهرة.",454340
دكتور تغذية وتخسيس,دايت سنتر,"فيلا 4 - ش حسنى زكريا المصرى, سبورتنج, الاسكندرية.",66096
دكتور تغذية وتخسيس,دايت سنتر للتخسيس - د. نهى عبد الرحمن,"1 ش رياض الصالحين متفرع من ش الترعة, المنصورة, الدقهلية.",391164
دكتور تغذية وتخسيس,دايت كلينيك,"45 ش الشيهاوى, القبارى, الاسكندرية.",103337
دكتور تغذية وتخسيس,دايت كير كلينيك,"24 عمارات تعاونيات سموحة, سموحة, الاسكندرية.",36743
دكتور تغذية وتخسيس,دايت هوم - د. هانى ابو النجا,"3 ش د. طه حسين, الزمالك, القاهرة.",574033
دكتور تغذية وتخسيس,دايموند كلينك - د. جمال محمد سامى الحداد,"31 برج الاسكندرية - ميدان فيكتور عمانويل, سموحة, الاسكندرية.",506885
دكتور تغذية وتخسيس,دكتور محمد شرشر,"491 برج اراك طريق الحرية, ماجيستك بلازا, بولكلى, الاسكندرية.",521996
دكتور تغذية وتخسيس,دهب كلينيك,"16 ش احمد قاسم جودة, الدور 1, المنطقة الاولى, مدينة نصر, القاهرة.",489653
دكتور تغذية وتخسيس,رافائيل كلينيك,"9 أ ش الاعناب متفرع من ش جامعة الدول, المهندسين, الجيزة.",599344
دكتور تغذية وتخسيس,روماتيك مديكال كلينيك,"60 ش عباس العقاد, الدور 7, مدينة نصر, القاهرة.",437738
دكتور تغذية وتخسيس,رويال سنتر,"201 طريق الجيش, الدور 3, رشدى, الاسكندرية.",596382
دكتور تغذية وتخسيس,ريشب كلينك - د. عزة شعبان جودة,"ش امين حسونة تقاطع امين عارف دوران السيوف - الدور 2, السيوف, الاسكندرية.",502784
دكتور تغذية وتخسيس,ريفيندوز ويلنس سنتر,"34 مبنى بلازا - - الشيخ زايد, الحى الثالث, السادس من اكتوبر, الجيزة.",471937
دكتور تغذية وتخسيس,زكرى ايليت كلينيك,"11 ش نادى الصيد - الدور 1 شقة 102, المهندسين, الجيزة.",453026
دكتور تغذية وتخسيس,ستار سنتر - عيادة د. هاجر عبد الدايم,"166 ش الهرم - العريش - الدور 2, الهرم, الجيزة.",568184
دكتور تغذية وتخسيس,سليم اند بيوتيفول كلينيك لجراحة السمنة,"11 ش 26 يوليو ميدان لبنان, المهندسين, الجيزة.",513078
دكتور تغذية وتخسيس,سليم بلس كلينيك,"13 ش الثمار ميدان مصطفى محمود, المهندسين, الجيزة.",422370
دكتور تغذية وتخسيس,سمارت لايف,"49 أ ش عباس العقاد - الدور 6, مدينة نصر, القاهرة.",486567
دكتور تغذية وتخسيس,شجرة الحياة,"طريق الاوتوستراد - حى الملتقى العربى - عمارة 42أ, مساكن شيراتون, مصر الجديدة, القاهرة.",573420
دكتور تغذية وتخسيس,عكاشة دايت سنتر,"13 ش عبد الرازق السنهورى, متفرع من ش عباس العقاد, الحى السابع, مدينة نصر, القاهرة.",270871
دكتور تغذية وتخسيس,علاج طبيعى وتخسيس,"9 ش على جاد الحق, مساكن شيراتون, مصر الجديدة, القاهرة.",181765
دكتور تغذية وتخسيس,عيادات اكسچين الطبية,"19 ش رياض, الشقة 208, الدور 2, تقاطع ش شريف, برج الاسراء, حلوان, القاهرة.",564785
دكتور تغذية وتخسيس,عيادات ألترا كير التخصصية,"121 ش محمد المقريفى, متفرع من ش ابو داوود الظاهرى, مدينة نصر, القاهرة.",466915
دكتور تغذية وتخسيس,عيادات الحياة,"211 ش شبرا, الدور 3, شبرا, القاهرة.",599586
دكتور تغذية وتخسيس,عيادات الفراعنة,"7 ش عبد القادر المازنى, كامب شيزار, الاسكندرية.",438552
دكتور تغذية وتخسيس,عيادات القمة التخصصية,"55 ش رمسيس - الدور 2, روكسى, مصر الجديدة, القاهرة.",430224
دكتور تغذية وتخسيس,عيادات المغربى للتغذية - د. حسن المغربى,"32 ش شجرة الدر, الزمالك, القاهرة.",466811
دكتور تغذية وتخسيس,عيادات المغربي للتغذية - د. حسن المغربي,"32 ش شجرة الدر - الدور 1, الزمالك, القاهرة.",428349
دكتور تغذية وتخسيس,عيادات اوربيت,"75 برج سموحة بالاس - برج ب - ش فوزى معاذ - الدور 2, سموحة, الاسكندرية.",603604
دكتور تغذية وتخسيس,عيادات حنينة التخصصية,"القطعة 5- بلوك 18 - ش انور المفتى متفرع من ش عباس العقاد, مدينة نصر, القاهرة.",580710
دكتور تغذية وتخسيس,عيادات دكتور محمد ابو الخير,", شارع البنك الاهلى المصرى, ميدان كفر شكر, كفر شكر, القليوبية.",654648
دكتور تغذية وتخسيس,عيادات فنان الرشاقة,"107 ش الحجاز, ميدان الحجاز, مصر الجديدة, القاهرة.",552223
دكتور تغذية وتخسيس,عيادات يمامة للتغذية العلاجية,"35 ش مكة, متفرع من ش الخمسين, زهراء المعادى, المعادى, القاهرة.",577469
دكتور تغذية وتخسيس,عيادات يمامة للتغذية العلاجية,"القطعة 8385 ش 9, الدور 2, المقطم, القاهرة.",577676
دكتور تغذية وتخسيس,عيادة أ. د. احمد طلحة استشارى جراحة الاورام والمناظير والسمنة المفرطة,"178 ش عمر لطفى, سبورتنج, الاسكندرية.",525992
دكتور تغذية وتخسيس,عيادة اكسجين,"ش المحكمة, تلا, المنوفية.",650736
دكتور تغذية وتخسيس,عيادة الدكتور محمد البنا,"عياده 331 ش التسعين الشمالي, الدور 3, عيادات CMC كايرو ميديكال سنتر, التجمع الخامس, القاهرة الجديدة, القاهرة.",685486
دكتور تغذية وتخسيس,عيادة الماسة,"81 ش سليم الاول, حلمية الزيتون, القاهرة.",511310
دكتور تغذية وتخسيس,عيادة بى بست,"ميدان الحصرى, الحى السابع, السادس من اكتوبر, الجيزة.",473662
دكتور تغذية وتخسيس,عيادة بى يونيك,"2 ش عبد الله العربى, الدور 2, امتداد ش الطيران, الحى السابع, مدينة نصر, القاهرة.",602968
دكتور تغذية وتخسيس,عيادة د. احمد عبد السلام لجراحات السمنة,"87 ش المنيل ميدان الباشا - الدور 2 شقة 6, المنيل, القاهرة.",522061
دكتور تغذية وتخسيس,عيادة د. خالد,"10 /5 ش 216, دجلة, المعادى, القاهرة.",175948
دكتور تغذية وتخسيس,عيادة د. دايت للصحة والتغذية - د. رفعت البنا & د. ايمان عصر,"ابراج القطن - برج الزهور - برج ج1 - ميدان فيكتور عمانويل - الدور 2, سموحة, الاسكندرية.",420259
دكتور تغذية وتخسيس,عيادة د. سوزان السعيد اخصائية التغذية العلاجية والصحة العامة,"4 شارع حسين محمود الشامى - ابراج العزيزية - الدور 1, جناكليس, الاسكندرية.",578905
دكتور تغذية وتخسيس,عيادة د. ليلى حسن عجاج استشارى تغذية علاجية,"24 ش عزيز كحيل, ناصية ش عبد الحميد الديب, ثروت, الاسكندرية.",581308
دكتور تغذية وتخسيس,عيادة د. هند حسين,"114 ش بورسعيد, كامب شيزار, الاسكندرية.",519370
دكتور تغذية وتخسيس,عيادة سان استيفانوا للعلاج الطبيعى والتخسيس,"397 طريق الجيش - برج الزهراء, سان استيفانو, الاسكندرية.",567829
دكتور تغذية وتخسيس,عيادة سو سلم,"16 /13 الشارع التجارى, زهراء المعادى, المعادى, القاهرة.",519348
دكتور تغذية وتخسيس,عيادة قوام,"74 ش النزهة, ميدان السبع عمارات, الماظة, مصر الجديدة, القاهرة.",557525
دكتور تغذية وتخسيس,عيادة ماى هيلث للتخسيس,"., مدينتى, القاهرة.",603135
دكتور تغذية وتخسيس,عيادة نيوتري ديرم - د. ضحى النجومى و د. نيللى شمس,"52 ش توت عنخ امون, سموحة, الاسكندرية.",546734
دكتور تغذية وتخسيس,عیادات العامریة للعلاج الطبیعي والسمنة وتنسیق القوام والتجمیل,"ش مستشفى العامرية العام, العامرية, الاسكندرية.",670059
دكتور تغذية وتخسيس,فاى شيب,"دوران نادى المعلمين, طنطا, الغربية.",548355
دكتور تغذية وتخسيس,فورموست بوسك,"82 ش وادى النيل, المهندسين, الجيزة.",49910
دكتور تغذية وتخسيس,فولكانو فات بيرنينج سنتر,"22 ش طهران متفرع من ش مصدق, الدقى, الجيزة.",504393
دكتور تغذية وتخسيس,فى كلينك,"فيلا 151 ش 27, التجمع الخامس, القاهرة الجديدة, القاهرة.",677938
دكتور تغذية وتخسيس,فيتل ويلنس كلينيك,"بلوك 167/1 ش التسعين الشمالى, قطاع 1, مركز المدينة, التجمع الخامس, القاهرة الجديدة, القاهرة.",621010
دكتور تغذية وتخسيس,فيتنس كلينيك,"50 ش حمام الورشة, المنشية, الاسكندرية.",587097
دكتور تغذية وتخسيس,فيزيو ان للعلاج الطبيعى,"12 ش بطرس غالى, روكسى, مصر الجديدة, القاهرة.",666935
دكتور تغذية وتخسيس,فيزيو مقار كلينيك,"17 ش محمد حسنين هيكل متفرع من ش عباس العقاد, المنطقة الاولى, مدينة نصر, القاهرة.",595508
دكتور تغذية وتخسيس,كارلاين,"14 ش احمد وصفى متفرع من ش الثورة, مصر الجديدة, القاهرة.",392126
دكتور تغذية وتخسيس,كاريزما كلينك لزراعة الشعر,"ش قناة السويس, المنصورة, الدقهلية.",475040
دكتور تغذية وتخسيس,كايرو دايت,"2 عمارات العبور - طريق صلاح سالم, مدينة نصر, القاهرة.",597962
دكتور تغذية وتخسيس,كايرو سكين كلينك,"40 ش الثورة متفرع من ش البطل احمد عبد العزيز - الدور 7, الدقى, الجيزة.",532787
دكتور تغذية وتخسيس,كلينيكا,"61 ش مصطفى النحاس, مدينة نصر, القاهرة.",486783
دكتور تغذية وتخسيس,كنترول سنتر,"2 /4 ش انور المفتى, متفرع من ش عباس العقاد, المنطقة الاولى, مدينة نصر, القاهرة.",546127
دكتور تغذية وتخسيس,كوشى سنتر مصر,"34 ش السنترال متفرع من ش 9, المقطم, القاهرة.",111934
دكتور تغذية وتخسيس,كوين سنتر,"ش 26 يوليو, اسيوط, اسيوط.",596736
دكتور تغذية وتخسيس,كيور اند سليم,"6 ابراج صفوة الميثاق ش الميثاق, زهراء مدينة نصر, مدينة نصر, القاهرة.",603132
دكتور تغذية وتخسيس,كيور ميديكال سنتر,"12 عمارات العبور - طريق صلاح سالم - الدور 7, مدينة نصر, القاهرة.",542339
دكتور تغذية وتخسيس,كيورا كلينك,"16 ابراج عثمان - - الدور 3 شقة 32, كورنيش المعادى, المعادى, القاهرة.",422672
دكتور تغذية وتخسيس,لا بيل كلينيك,"92 ش التحرير ميدان الدقى - برج ساريدار الطبى, الدقى, الجيزة.",599309
دكتور تغذية وتخسيس,لايت كلينيك,"3 ش محمد الدهان, متفرع من ش نبيل الوقاد, ارض الجولف, مصر الجديدة, القاهرة.",126243
دكتور تغذية وتخسيس,لايف استايل كلينك,"ميدان الازهر, اسيوط, اسيوط.",596082
دكتور تغذية وتخسيس,لايف ستايل كلينيك,"22 ش مكرم عبيد - الدور 6, مدينة نصر, القاهرة.",486843
دكتور تغذية وتخسيس,لايف ستايل نيوترشن,"60 ش الخليفة المأمون, الدور 6, برج كوين سنتر, منشية البكرى, مصر الجديدة, القاهرة.",680505
دكتور تغذية وتخسيس,ليف ويل كلينيك,"42 ش عباس العقاد, الحى السادس, مدينة نصر, القاهرة.",591625
دكتور تغذية وتخسيس,مارفل للعلاج الطبيعى,"القطعة 18, منطقة خدمات الحى الاول, التجمع الخامس, القاهرة الجديدة, القاهرة.",452605
دكتور تغذية وتخسيس,ماكرو بيوتك بيوتى,"2 ش 253, سرايات المعادى, المعادى, القاهرة.",495767
دكتور تغذية وتخسيس,ماكس كير كلينيك,"ش مصطفى كامل - برج الصفا, الطالبية, الهرم, الجيزة.",596686
دكتور تغذية وتخسيس,مجمع دار الشفاء التخصصى,"3 ش 6 متفرع من ش 45, العصافرة, الاسكندرية.",251873
دكتور تغذية وتخسيس,محمد نصر الدين,"14 ش خضر التونى من ش بورسعيد, كليوباترا, الاسكندرية.",36111
دكتور تغذية وتخسيس,مراكز الحياة,"41 ش اسراء المعلمين ميدان لبنان, المهندسين, الجيزة.",235012
دكتور تغذية وتخسيس,مراكز النور للعلاج الطبيعى,"77 ش مصر والسودان شقة 5, حدائق القبة, القاهرة.",55002
دكتور تغذية وتخسيس,مراكز د. محمد خيرى لعلاج السمنة والنحافة,"6 ش 9, ميدان النافورة, المقطم, القاهرة.",438001
دكتور تغذية وتخسيس,مراكز دايت اكاديمى,"36 ش محمد فريد ابو حديد, متفرع من ش ذاكر حسين, الحى السابع, مدينة نصر, القاهرة.",344013
دكتور تغذية وتخسيس,مراكز ويلنيس,"12 ش مسجد السلام, القومية, الزقازيق, الشرقية.",324944
دكتور تغذية وتخسيس,مركز الاسكندرية لتنسيق القوام,"28 ش المعسكر الرومانى, رشدى, الاسكندرية.",488241
دكتور تغذية وتخسيس,مركز الاكسير للجهاز الهضمى والكبد,"5 ش سوريا متفرع من ش جامعة الدول العربية - ميدان مصطفى محمود - برج مصر بلازا - الدور 1, المهندسين, الجيزة.",448199
دكتور تغذية وتخسيس,مركز الاهرام للعلاج الطبيعى والسمنة,"13 ش حسب النبى, الشقة 3, الدور 1, متفرع من ش احمد كمال, الهرم, الجيزة.",599326
دكتور تغذية وتخسيس,مركز البرج للعلاج الطبيعى والتخسيس,"10 ش محمد فريد, متفرع من ش المنيل, المنيل, القاهرة.",206587
دكتور تغذية وتخسيس,مركز البستان للعلاج الطبيعى والتخسيس,"30 ش ابو حنيفة, متفرع من ش عبد الله العربى, الحى السابع, مدينة نصر, القاهرة.",629964
دكتور تغذية وتخسيس,مركز البشير للعلاج الطبيعى والسمنة,"عمارة جومانا روز - الحى الاول - الدور 1, مدينة العبور, القليوبية.",513381
دكتور تغذية وتخسيس,مركز الجربى,"1 /1 ش اللاسلكى متفرع من ش النصر, المعادى الجديدة, المعادى, القاهرة.",589364
دكتور تغذية وتخسيس,مركز الجولف للعلاج الطبيعى,"9 ش جلال حجاج, متفرع من ش احمد تيسير, ارض الجولف, مصر الجديدة, القاهرة.",293144
دكتور تغذية وتخسيس,مركز الحرية,"ش المساكن, فيصل, الجيزة.",397620
دكتور تغذية وتخسيس,مركز الحياة للعلاج الطبيعى,"29 أ ش ابو بكر الصديق مجاورة 1, الحى السابع, السادس من اكتوبر, الجيزة.",420369
دكتور تغذية وتخسيس,مركز الحياة للعلاج الطبيعى والسمنة والنحافة,"124 ش مصر والسودان - برج الاطباء - الدور 1 شقة 104, حدائق القبة, القاهرة.",509391
دكتور تغذية وتخسيس,مركز الخلاص لعلاج السمنة,"9 ش عبد الله صالح, شبرا, القاهرة.",435280
دكتور تغذية وتخسيس,مركز الرعاية الطبية,"ش مدارس القدس, ميامى الجديدة, الاسكندرية.",683627
دكتور تغذية وتخسيس,مركز السراج للعلاج الطبيعى والسمنة,"179 ص, حدائق الاهرام, الهرم, الجيزة.",397395
دكتور تغذية وتخسيس,مركز السلام للعلاج الطبيعى والتغذية العلاجية,", ميدان الكوبرى, بنها, القليوبية.",669347
دكتور تغذية وتخسيس,مركز الشمس للتخسيس ببصمة الدم,"130 ش عثمان بن عفان, مصر الجديدة, القاهرة.",411220
دكتور تغذية وتخسيس,مركز الصفوة للعلاج الطبيعى,"23 ش المنشية, الطوابق, فيصل, الجيزة.",159085
دكتور تغذية وتخسيس,مركز الصفوة للعلاج الطبيعى والتخسيس والنحافة والعناية بالبشرة والشعر,"برج الزهراء - ش احمد عرابى - الدور 4, بنى سويف, بنى سويف.",514433
دكتور تغذية وتخسيس,مركز الطوخى,"1 ش 6 اكتوبر متفرع من ش جسر السويس - الدور 2 شقة 4, جسر السويس, القاهرة.",260862
دكتور تغذية وتخسيس,مركز القاهرة للتغذية,"2 ش الفيوم متفرع من ش كليوباترا - برج الاطباء, الكوربة, مصر الجديدة, القاهرة.",451913
دكتور تغذية وتخسيس,مركز الكرمة الطبى للعلاج الطبيعى,"336 ش الترعة البولاقية, الدور 2, شبرا, القاهرة.",433292
دكتور تغذية وتخسيس,مركز المحلاوى للعلاج الطبيعى والسمنة,"ش التحرير, قليوب, القليوبية.",512549
دكتور تغذية وتخسيس,مركز النصر للعلاج الطبيعى,"19 ش النصر - الدور 4, المعادى الجديدة, المعادى, القاهرة.",586875
دكتور تغذية وتخسيس,مركز النيل الطبى,"ش طلبة عويضة - برج الندى, الزقازيق, الشرقية.",589331
دكتور تغذية وتخسيس,مركز النيل للعلاج الطبيعى,"46 ش ترعة الخشاب, الدواجن, حدائق حلوان, القاهرة.",447258
دكتور تغذية وتخسيس,مركز النيل للعلاج الطبيعى,"ش مصطفى كامل, وسط البلد, قنا.",626751
دكتور تغذية وتخسيس,مركز الورا - د. وحيد السيسى,"353 ن, حدائق الاهرام, الهرم, الجيزة.",439046
دكتور تغذية وتخسيس,مركز امان,"6 ش 77, المعادى, القاهرة.",683892
دكتور تغذية وتخسيس,مركز تبارك للعلاج الطبيعى,"35 ش محمد فريد, مصر الجديدة, القاهرة.",235682
دكتور تغذية وتخسيس,مركز تيوليب,"92 ش مكرم عبيد, المنطقة السادسة, مدينة نصر, القاهرة.",667481
دكتور تغذية وتخسيس,مركز جريس للعلاج الطبيعى والتأهيل وعلاج السمنة والنحافة,"., الحى الاول, السادس من اكتوبر, الجيزة.",409092
دكتور تغذية وتخسيس,مركز حكاية دريم,"5 ش ثابت الاسيوطى, المرج, القاهرة.",484926
دكتور تغذية وتخسيس,مركز د. احمد العسال للعلاج الطبيعى,"44 ش القومية متفرع من ميدان القومية, الزقازيق, الشرقية.",560769
دكتور تغذية وتخسيس,مركز د. ايناس راجح للعلاج الطبيعى,"30 ش كامل محمد حسين, النزهة الجديدة, القاهرة.",564073
دكتور تغذية وتخسيس,مركز د. عمرو الشوربجى للعلاج الطبيعى والتخسيس,"ش اللبينى نفق المريوطية, الهرم, الجيزة.",577464
دكتور تغذية وتخسيس,مركز د. عمرو حامد لجراحات السمنة المفرطة والمناظير,"65 ش رابعة الاستثمارى متفرع من ش النزهه, مدينة نصر, القاهرة.",489737
دكتور تغذية وتخسيس,مركز د. كريمة عبد الرحمن موسى,"1 عمارات التوفيق ش يوسف عباس, المنطقة الاولى, مدينة نصر, القاهرة.",448711
دكتور تغذية وتخسيس,مركز د. محمد حلمى للتخسيس والعلاج الطبيعى,"ش الجلاء, المنصورة, الدقهلية.",279511
دكتور تغذية وتخسيس,مركز د. نهى للتخسيس والعلاج الطبيعى,"425 ش السودان - الدور 1 شقة 3, المهندسين, الجيزة.",356395
دكتور تغذية وتخسيس,مركز د. هانى زهران,"برج الشرطة - ش نوال, العجوزة, الجيزة.",51854
