Category,Name,Address,ID
دكتور تغذية وتخسيس,د. سامى ابو ذكرى,"27 ش سمير عبد الرؤوف, الحى الثامن, مدينة نصر, القاهرة.",53093
دكتور تغذية وتخسيس,د. سامية بباوى,"15 ش المشتل - مدينة عامر, بولاق الدكرور, الجيزة.",589990
دكتور تغذية وتخسيس,د. سامية بيباوى,"66 ش مصدق, الدقى, الجيزة.",387139
دكتور تغذية وتخسيس,د. سعيد حمدى الشريف,"21 ش النصر, الحوامدية, الجيزة.",459213
دكتور تغذية وتخسيس,د. سعيد محمد عصر,"ش شعراوى مراد, فيصل, الجيزة.",342890
دكتور تغذية وتخسيس,د. سماح كمال,"128 ش فيصل, الكوم الاخضر, فيصل, الجيزة.",510839
دكتور تغذية وتخسيس,د. سمر علام,"2 ش مسجد ابو خليل, متفرع من طريق البراجيل, البراجيل, الجيزة.",657941
دكتور تغذية وتخسيس,د. سمر محمود عباس,"5 /3 ش اللاسلكى, المعادى الجديدة, المعادى, القاهرة.",482463
دكتور تغذية وتخسيس,د. سند نظمى,"ش ابراهيم خلة, امبابة, الجيزة.",353985
دكتور تغذية وتخسيس,د. سهير السيد,"60 ش نخلة المطيعى, تريومف, مصر الجديدة, القاهرة.",454441
دكتور تغذية وتخسيس,د. شادى لبيب,"6 ش محمد جلال متفرع من ش اسكندر الاكبر, الكوربة, مصر الجديدة, القاهرة.",465808
دكتور تغذية وتخسيس,د. شروق عبد العال رزق,"المجاورة الرابعة - الحى الاول - عمارة رقم 738, الحى الاول, السادس من اكتوبر, الجيزة.",455274
دكتور تغذية وتخسيس,د. شريف العوضى,"القطعة 43 - - منطقة خدمات الحى الاول, التجمع الخامس, القاهرة الجديدة, القاهرة.",546355
دكتور تغذية وتخسيس,د. شريف عزمى,"15 ش محمد زكى, الدور 3, تقاطع ش مكرم عبيد, الحى السادس, مدينة نصر, القاهرة.",439235
دكتور تغذية وتخسيس,د. شريف موافى,"ش الشعراوى, الزقازيق, الشرقية.",592832
دكتور تغذية وتخسيس,د. شريهان سيلفيدا ابراهيم,"29 ش عبد المنعم رياض ميدان العرب, العرب, المعادى, القاهرة.",587561
دكتور تغذية وتخسيس,د. شيرى انسى نجيب,"99 أ ش السباق, المريلاند, مصر الجديدة, القاهرة.",588521
دكتور تغذية وتخسيس,د. شيرين عزت حبيب,"427 ن, حدائق الاهرام, الهرم, الجيزة.",451706
دكتور تغذية وتخسيس,د. شيرين مختار,"60 ش الخليفة المأمون, الشقة 301, الدور 6, برج كوين سنتر, منشية البكرى, مصر الجديدة, القاهرة.",680496
دكتور تغذية وتخسيس,د. شيرين منير,"ش 288, المعادى, القاهرة.",589327
دكتور تغذية وتخسيس,د. شيماء عبد العزيز جاد,"129 عمارات تعاونيات سموحة - متفرع من ش جاردن سيتى, سموحة, الاسكندرية.",448723
دكتور تغذية وتخسيس,د. شيماء محمد مطاوع,"146 ش الجيش, قويسنا, المنوفية.",573013
دكتور تغذية وتخسيس,د. صفوت امين,"ش بورسعيد, المنصورة, الدقهلية.",185300
دكتور تغذية وتخسيس,د. صلاح الدين العشماوى,"13 ش الجزائر, المعادى, القاهرة.",443361
دكتور تغذية وتخسيس,د. صلاح سعد,"ش مصر تقاطع ش داوود حمدان, وسط البلد, الاسماعيلية.",289592
دكتور تغذية وتخسيس,د. صلاح عطية التونسى,"62 ش الحجاز, مصر الجديدة, القاهرة.",414423
دكتور تغذية وتخسيس,د. ضحى مجدى ابو زهرة,"ميدان فيكتور عمانويل - ابراج القطن - برج الياسمين B1 - الدور 1 شقة 113, سموحة, الاسكندرية.",594573
دكتور تغذية وتخسيس,د. ضياء العوضى,"القطعة 162 ش التسعين الشمالى, التجمع الخامس, القاهرة الجديدة, القاهرة.",669699
دكتور تغذية وتخسيس,د. طارق رضا,"8 ش الكنيسة الانجيلية متفرع من ش التأمين الصحى, ستانلى, الاسكندرية.",330022
دكتور تغذية وتخسيس,د. طارق عبد البر,"القطعة 18 - محور 26 يوليو, الشيخ زايد, السادس من اكتوبر, الجيزة.",591641
دكتور تغذية وتخسيس,د. طارق يوسف,"13 ش ضياء, الهرم, الجيزة.",603232
دكتور تغذية وتخسيس,د. عادل احمد عبد العليم,"7 عمارات الشركة السعودية ش النزهة, الدور 5, ارض الجولف, مصر الجديدة, القاهرة.",673648
دكتور تغذية وتخسيس,د. عادل عبد المنعم,"5 ش البطل احمد عبد العزيز, المهندسين, الجيزة.",382683
دكتور تغذية وتخسيس,د. عاصم فايد,"54 ش جمال عبد الناصر ميدان شرف - برج الكوثر - الدور 3, شبين الكوم, المنوفية.",530664
دكتور تغذية وتخسيس,د. عامر مرسى,"201 ش الترعة البولاقية, شبرا, القاهرة.",434126
دكتور تغذية وتخسيس,د. عبد الحكيم يوسف,"3 ش الجزائر, المعادى الجديدة, المعادى, القاهرة.",53088
دكتور تغذية وتخسيس,د. عبد الحى عبيد,"319 ش فيصل, حسن محمد, فيصل, الجيزة.",586950
دكتور تغذية وتخسيس,د. عبد الرحمن فصيح امام,"11 ش خوفو, الكوم الاخضر, الهرم, الجيزة.",586812
دكتور تغذية وتخسيس,د. عبد العال حسن,"155 ش الثلاثينى, العمرانية الغربية, الهرم, الجيزة.",586827
دكتور تغذية وتخسيس,د. عبد العزيز حجازى,"111 ش فيصل متفرع من ش المستشفى - الدور 2 شقة 7, الكوم الاخضر, فيصل, الجيزة.",372618
دكتور تغذية وتخسيس,د. عبير توفيق ربيع,"56 ش مكرم عبيد, مدينة نصر, القاهرة.",486768
دكتور تغذية وتخسيس,د. عبير قمر,"59 ش فيكتور عمانويل - الدور 3, سموحة, الاسكندرية.",193996
دكتور تغذية وتخسيس,د. عبير نبوى,"عمارات اول مايو - طريق النصر, مدينة نصر, القاهرة.",593615
دكتور تغذية وتخسيس,د. عزة الجوجرى,"4 ميدان بقطر, الالف مسكن, مصر الجديدة, القاهرة.",176734
دكتور تغذية وتخسيس,د. عصام عمران,"14 ش نادى امبابة الرياضى, امبابة, الجيزة.",263947
دكتور تغذية وتخسيس,د. عطيات السيد الامبابى,"ش السكة الجديدة ميدان المحطة, المنصورة, الدقهلية.",153799
دكتور تغذية وتخسيس,د. علا علاء موسى,"9 ميدان الحرية, المعادى, القاهرة.",587167
دكتور تغذية وتخسيس,د. علاء محمد شلبى,"ش ابراهيم العرومبى الشطر العاشر, زهراء المعادى, المعادى, القاهرة.",590203
دكتور تغذية وتخسيس,د. على الرشيدى,"267 ش الترعة - الدور 1, شبرا, القاهرة.",410352
دكتور تغذية وتخسيس,د. على زهران,"26 ش 9, المقطم, القاهرة.",530737
دكتور تغذية وتخسيس,د. على فاروق نوفل,"465 ش سكة الوايلى, حدائق القبة, القاهرة.",401400
دكتور تغذية وتخسيس,د. عماد صبحى,"5 ش مراد, الجيزة, الجيزة.",99748
دكتور تغذية وتخسيس,د. عمر سيد القاضى,"ش المستشفى المركزى, الخانكة, القليوبية.",422650
دكتور تغذية وتخسيس,د. عمرو احمد طاحون,"ش سعد زغلول, اشمون, المنوفية.",313122
دكتور تغذية وتخسيس,د. غادة ابو الفتوح,"96 ش مصطفى النحاس, مدينة نصر, القاهرة.",314938
دكتور تغذية وتخسيس,د. فادى ناجى,"منطقة خدمات الحى الاول, التجمع الخامس, القاهرة الجديدة, القاهرة.",544641
دكتور تغذية وتخسيس,د. فادى ناجى عبد الله,"40 ش احمد ماهر , فيصل, الجيزة.",241666
دكتور تغذية وتخسيس,د. فاطمة حجازى,"366 ش فيصل, الطالبية, فيصل, الجيزة.",602588
دكتور تغذية وتخسيس,د. فرح حسين,"13 ش المقدس القبارى, الحى السابع, مدينة نصر, القاهرة.",428947
دكتور تغذية وتخسيس,د. فردوس الافندى,"300 ش الهرم - عمارات منتصر - عمارة 6 - الدور 5 شقة 501, الطالبية, الهرم, الجيزة.",487955
دكتور تغذية وتخسيس,د. فيروز مجدى,"82 ش احمد الزمر, الحى الثامن, مدينة نصر, القاهرة.",597179
دكتور تغذية وتخسيس,د. كرستين اسامة,"107 ش الحجاز, ميدان سفير, مصر الجديدة, القاهرة.",671226
دكتور تغذية وتخسيس,د. كرم حبيب,"8 ش الاهرام - الدور 3 شقة 13, الكوربة, مصر الجديدة, القاهرة.",439907
دكتور تغذية وتخسيس,د. كريم فهمى,"5 ميدان النافورة, المقطم, القاهرة.",530852
دكتور تغذية وتخسيس,د. كريم نبيل,"القطعة 162 - ش التسعين الشمالى, التجمع الخامس, القاهرة الجديدة, القاهرة.",595785
دكتور تغذية وتخسيس,د. كمال لطفى,"2 ش عبد العزيز همام, حدائق المعادى, المعادى, القاهرة.",335332
دكتور تغذية وتخسيس,د. ليلى عجاج,"91 ش احمد شوقى متفرع من طريق الحرية, مصطفى كامل, الاسكندرية.",486720
دكتور تغذية وتخسيس,د. ماجد زكريا,"ابراج برعى بلازا - برج 2 - عيادة 6, ميدان الحصرى, السادس من اكتوبر, الجيزة.",606500
دكتور تغذية وتخسيس,د. ماجد زيتون,"7 ش صبحى فهمى, مدينة نصر, القاهرة.",120753
دكتور تغذية وتخسيس,د. ماجد محمود كامل,"225 ش عبد السلام عارف, السرايا, الاسكندرية.",22264
دكتور تغذية وتخسيس,د. ماجدة النويهى,"22 ش محمد كامل مرسى, المهندسين, الجيزة.",163932
دكتور تغذية وتخسيس,د. ماهر اسكندر,"1 ش ابراهيم باشا تقاطع ش بغداد, الكوربة, مصر الجديدة, القاهرة.",293421
دكتور تغذية وتخسيس,د. ماهر فوزى محمود,"10 ش ابو العتاهية, الحى الثامن, مدينة نصر, القاهرة.",53094
دكتور تغذية وتخسيس,د. مايسة عبد الحكيم,"23 ش الامام على, ميدان الاسماعيلية, مصر الجديدة, القاهرة.",527011
دكتور تغذية وتخسيس,د. مايفل اميل,"164 ش التسعين الشمالى, التجمع الخامس, القاهرة الجديدة, القاهرة.",596747
دكتور تغذية وتخسيس,د. مجدى على عامر,"الحى الرابع - مركز مبارك للخدمات, التجمع الخامس, القاهرة الجديدة, القاهرة.",449281
دكتور تغذية وتخسيس,د. محمد ابو الغيط,"3 ش الجزيرة الوسطى, الزمالك, القاهرة.",17203
دكتور تغذية وتخسيس,د. محمد الرومى,"حارة ابو النور, بلبيس, الشرقية.",328370
دكتور تغذية وتخسيس,د. محمد السيد دسوقى,"22 ش المحاريث والهندسة تقاطع ش المحافظة, الزقازيق, الشرقية.",154621
دكتور تغذية وتخسيس,د. محمد القرشى,"18 ش الثورة, بولاق الدكرور, الجيزة.",53092
دكتور تغذية وتخسيس,د. محمد النجار,"8 ش الاهرام, الدور 2, روكسى, مصر الجديدة, القاهرة.",458088
دكتور تغذية وتخسيس,د. محمد توفيق,"117 ش التحرير, الدقى, الجيزة.",450014
دكتور تغذية وتخسيس,د. محمد جمال الطويل,"6 ش محمود الوردانى, الخصوص, القليوبية.",497185
دكتور تغذية وتخسيس,د. محمد جمال عبد السميع,"ش الغشام - القومية, الزقازيق, الشرقية.",597374
دكتور تغذية وتخسيس,د. محمد حامد,"1 ش محمد حلمى, السيوف, الاسكندرية.",427434
دكتور تغذية وتخسيس,د. محمد حلمى,"55 ش شهاب, المهندسين, الجيزة.",598038
دكتور تغذية وتخسيس,د. محمد حمدى ابو رية,"ش الجيش, قطور, الغربية.",346396
دكتور تغذية وتخسيس,د. محمد رضوان,"10 ش ابو بكر الصديق, مصر الجديدة, القاهرة.",192903
دكتور تغذية وتخسيس,د. محمد رفيق,"106 ش عمر لطفى, الابراهيمية, الاسكندرية.",470627
دكتور تغذية وتخسيس,د. محمد زكرى,"83 ش الثلاثينى, العمرانية الغربية, الهرم, الجيزة.",488975
دكتور تغذية وتخسيس,د. محمد سامى يوسف,"1 ش على بن ابى طالب متفرع من ش الهرم, التعاون, الهرم, الجيزة.",507324
دكتور تغذية وتخسيس,د. محمد سعد,"ش احمد قمحة, الابراهيمية, الاسكندرية.",594241
دكتور تغذية وتخسيس,د. محمد سليمان,"ش السوق, ههيا, الشرقية.",362074
دكتور تغذية وتخسيس,د. محمد طه سعيد,"401 أ ش فيصل - الدور 5, الطالبية, فيصل, الجيزة.",382024
دكتور تغذية وتخسيس,د. محمد عباس حسن ابو العنين,"186 ش عبد السلام عارف - الدور 1, سان استيفانو, الاسكندرية.",470347
دكتور تغذية وتخسيس,د. محمد عبد البارى,"برج الهدايا - الدور 4, بولكلى, الاسكندرية.",58342
دكتور تغذية وتخسيس,د. محمد عبد الكريم,"5 ش الجلاء ميدان الساعة, فيكتوريا, الاسكندرية.",591256
دكتور تغذية وتخسيس,د. محمد عبد المنعم مرزوق,"60 ش الخليفة المأمون, روكسى, مصر الجديدة, القاهرة.",489588
دكتور تغذية وتخسيس,د. محمد عثمان,"القطعة 31 - , الشيخ زايد, السادس من اكتوبر, الجيزة.",586858
دكتور تغذية وتخسيس,د. محمد عطا الله للعلاج الطبيعى والتغذية العلاجية - بيرى كلينك,"265 أ عمارة مفكو حلوان ش الهرم, الدور 2, الهرم, الجيزة.",669934
دكتور تغذية وتخسيس,د. محمد عمر,"35 ش محمد فريد, مصر الجديدة, القاهرة.",596779
دكتور تغذية وتخسيس,د. محمد فؤاد رفاعى,"146 ش مصطفى كامل, باكوس, الاسكندرية.",592829
دكتور تغذية وتخسيس,د. محمد فتحى الفار,"2 ش الفواكه, المهندسين, الجيزة.",588976
دكتور تغذية وتخسيس,د. محمد فتحى سيد زكى,"273 ش شبرا, شبرا, القاهرة.",474222
دكتور تغذية وتخسيس,د. محمد محمود على,"14 ش عز الدين عمر, الهرم, الجيزة.",410434
دكتور تغذية وتخسيس,د. محمد مسعد,"60 ش محيى الدين عبد الحميد - الدور 1 شقة 1, الحى الثامن, مدينة نصر, القاهرة.",567834
دكتور تغذية وتخسيس,د. محمد هانى فتحى عاشور,"170 طريق الحرية, الابراهيمية, الاسكندرية.",612809
دكتور تغذية وتخسيس,د. محمود حجازى,"1 ش احمد ابو الفتوح متفرع من ش اللبينى - الدور 4, الهرم, الجيزة.",598749
دكتور تغذية وتخسيس,د. محمود حسن,"ش جمال عبد الناصر, سيدى بشر, الاسكندرية.",236185
دكتور تغذية وتخسيس,د. محمود حسين عباس,"26 ميدان السيدة زينب, السيدة زينب, القاهرة.",224208
دكتور تغذية وتخسيس,د. محمود حمدى حافظ,"2 ش الثلاثين تقاطع ش ابراهيم قاسم, قليوب, القليوبية.",572400
دكتور تغذية وتخسيس,د. محمود زكريا عبد العزيز,"8 ش بيروت, المريلاند, مصر الجديدة, القاهرة.",425568
دكتور تغذية وتخسيس,د. مروة عبد الحميد,"19 ش النصر, المعادى الجديدة, المعادى, القاهرة.",587131
دكتور تغذية وتخسيس,د. مروة نوح,"1 /4 ش انور المفتى, متفرع من ش عباس العقاد, المنطقة الاولى, مدينة نصر, القاهرة.",677362
دكتور تغذية وتخسيس,د. مصطفى جمال استشارى جراحات المناظير,"212 ش عبد السلام عارف, لوران, الاسكندرية.",394920
دكتور تغذية وتخسيس,د. مصطفى سارى,"43 ش نخلة المطيعى, تريومف, مصر الجديدة, القاهرة.",99924
دكتور تغذية وتخسيس,د. مصطفى شوقى خالد,"7 ش احمد ماهر, شبين الكوم, المنوفية.",532096
دكتور تغذية وتخسيس,د. مصطفى عطية سليمان,"5 ش 153 ميدان الحرية - برج الحرية, المعادى, القاهرة.",102413
دكتور تغذية وتخسيس,د. ممدوح ابوريان,"25 ش خالد بن الوليد, سيدى بشر, الاسكندرية.",234368
دكتور تغذية وتخسيس,د. منار نادى محمد,"21 ش ستوديو الاهرام, العمرانية الغربية, الهرم, الجيزة.",491975
دكتور تغذية وتخسيس,د. منال احمد ابو الفضل,"6 ش طمازين, فلمينج, الاسكندرية.",642769
دكتور تغذية وتخسيس,د. منال الجوهرى,"5 /1 ش اللاسلكى - الدور 2, المعادى الجديدة, المعادى, القاهرة.",482490
دكتور تغذية وتخسيس,د. منال محمد اسماعيل,"11 ش محمد حسنين هيكل، متفرع من ش عباس العقاد, المنطقة الاولى, مدينة نصر, القاهرة.",625057
دكتور تغذية وتخسيس,د. منة الحبشى,"ش د. عبد الحميد بدوى, الازاريطة, الاسكندرية.",589013
دكتور تغذية وتخسيس,د. منى ابراهيم,"عمارات الشركة السعودية ش النزهة, ارض الجولف, مصر الجديدة, القاهرة.",673621
دكتور تغذية وتخسيس,د. منى الجزيرى,"القطعة 82 - ش اخناتون - الحى الاول, التجمع الخامس, القاهرة الجديدة, القاهرة.",452648
دكتور تغذية وتخسيس,د. منى المكباتى,"6 ش السيد الميرغنى, الدور 3, روكسى, مصر الجديدة, القاهرة.",181756
دكتور تغذية وتخسيس,د. منى ثروت,"48 ش سليم الاول, الزيتون, القاهرة.",512067
دكتور تغذية وتخسيس,د. منى خليل,"25 ش عثمان محمد, طنطا, الغربية.",331854
دكتور تغذية وتخسيس,د. منى راداميس,"3 /4 ش انور المفتى, مدينة نصر, القاهرة.",400760
دكتور تغذية وتخسيس,د. منى زايد,"24 ج, حدائق الاهرام, الهرم, الجيزة.",450549
دكتور تغذية وتخسيس,د. منى سامى,"ش محمد سيد احمد تقاطع ش راغب, حلوان, القاهرة.",384664
دكتور تغذية وتخسيس,د. منى سلامة,"9 /2 ش النصر, المعادى الجديدة, المعادى, القاهرة.",594485
دكتور تغذية وتخسيس,د. منى عبود,"فيلا شومان - ش غاندى, حى الشرق, بور سعيد.",326112
دكتور تغذية وتخسيس,د. مها راداميس,"6 ش نبيل الوقاد, الدور 2, ارض الجولف, مصر الجديدة, القاهرة.",125074
دكتور تغذية وتخسيس,د. مها شاكر,"19 عمارات اسكان شباب المهندسين -, مدينة نصر, القاهرة.",462714
دكتور تغذية وتخسيس,د. مها عزيز,"60 ش الخليفة المأمون, روكسى, مصر الجديدة, القاهرة.",183039
دكتور تغذية وتخسيس,د. مى النشار,"18 عمارات المدفعية, مدينة نصر, القاهرة.",545343
دكتور تغذية وتخسيس,د. مى محمد الدياسطى,"73 /1 ش حسب الله الكفراوى المجاورة الثانية - الحى الثانى - الدور 4, دمياط الجديدة, دمياط.",528767
دكتور تغذية وتخسيس,د. مى ناصر,"21 ش البطل احمد عبد العزيز, المهندسين, الجيزة.",461944
دكتور تغذية وتخسيس,د. مينا ملاك,"402 ش الهرم, الهرم, الجيزة.",590411
دكتور تغذية وتخسيس,د. ناجى بطرس,"44 ش ميشيل باخوم, المهندسين, الجيزة.",61068
دكتور تغذية وتخسيس,د. نانسى عبد السيد,"83 ش عمر بن الخطاب, مصر الجديدة, القاهرة.",422073
دكتور تغذية وتخسيس,د. نانيس سراج الدين - الرشاقة والجمال,"7 أ عمارات الشركة السعودية - ش النزهة, مصر الجديدة, القاهرة.",420899
دكتور تغذية وتخسيس,د. نبيل فتحى حليم,"3 ش عبد العظيم عوض الله, ميدان الحجاز, مصر الجديدة, القاهرة.",596839
دكتور تغذية وتخسيس,د. نجوى عصام الدين,"361 طريق الحرية, سيدى جابر, الاسكندرية.",154044
دكتور تغذية وتخسيس,د. ندى بهاء الدين,"2 ش محمد المهدى, ارض الجولف, مصر الجديدة, القاهرة.",678099
دكتور تغذية وتخسيس,د. نرمين نبيل,"5 ش قصر العينى, قصر العينى, القاهرة.",597578
دكتور تغذية وتخسيس,د. نسمة فوزى,"5, ميدان النافورة, المقطم, القاهرة.",682249
دكتور تغذية وتخسيس,د. نها الهضيبى,"4 ش على الروبى, روكسى, مصر الجديدة, القاهرة.",426337
دكتور تغذية وتخسيس,د. نهلة صلاح,"30 ش ابن يزيد - ارض يعقوب, السيدة زينب, القاهرة.",528590
دكتور تغذية وتخسيس,د. هالة ابو غازى,"80 ش بورسعيد, شبين القناطر, القليوبية.",518387
دكتور تغذية وتخسيس,د. هالة احمد,"1 ش على بن ابى طالب متفرع من ش الهرم, سباتس, الهرم, الجيزة.",589890
دكتور تغذية وتخسيس,د. هالة سامى,"70 ش الميرغنى, مصر الجديدة, القاهرة.",425090
دكتور تغذية وتخسيس,د. هالة عرفات,"78 ش المنيل الدور 3, المنيل, القاهرة.",158048
دكتور تغذية وتخسيس,د. هانى جبران,"164 ش المطراوى, المطرية, القاهرة.",460225
دكتور تغذية وتخسيس,د. هانى عزت عبيه,"162 ش 26 يوليو, الشقة 15, الدور 2, ميدان سفنكس, المهندسين, الجيزة.",581944
دكتور تغذية وتخسيس,د. هانى عيسى,"., مدينة الرحاب, القاهرة.",598251
دكتور تغذية وتخسيس,د. هبة المغربى,"77 ش عبد الحميد بدوى - الدور 2, مصر الجديدة, القاهرة.",590889
دكتور تغذية وتخسيس,د. هبة حامد,"2 ش القبة, روكسى, مصر الجديدة, القاهرة.",602833
دكتور تغذية وتخسيس,د. هبة سامى,"119 ش التحرير, الشقة 809, الدور 8, الدقى, الجيزة.",441096
دكتور تغذية وتخسيس,د. هبة شبل,"48 ش الحرية متفرع من ش النزهة, الماظة, مصر الجديدة, القاهرة.",587203
دكتور تغذية وتخسيس,د. هبة عصام الدين,"القطعة 18 - محور 26 يوليو, الشيخ زايد, السادس من اكتوبر, الجيزة.",586959
دكتور تغذية وتخسيس,د. هبة عمر,"427 ن, حدائق الاهرام, الهرم, الجيزة.",452119
دكتور تغذية وتخسيس,د. هبة فارس,"ش الجمهورية المشاية السفلية, المنصورة, الدقهلية.",589484
دكتور تغذية وتخسيس,د. هدى خطاب خطاب,"17 ب ش الخليفة المأمون, الشقة 1, الدور 1, روكسى, مصر الجديدة, القاهرة.",353354
