Category,Name,Address,ID
دكتور عيون,د. حسين على حسين,"17 ميدان سعد زغلول, محطة الرمل, الاسكندرية.",34313
دكتور عيون,د. حسين محمد امام,"ش الثلاثينى وطارق بن زياد, الثلاثينى, الاسماعيلية.",160752
دكتور عيون,د. حسين مصطفى,"81 ش سليم الاول, حلمية الزيتون, القاهرة.",511312
دكتور عيون,د. حلمى الاسود,"94 ش عبد العزيز فهمى, الشقة 206, الدور 2, سانت فاتيما, مصر الجديدة, القاهرة.",626283
دكتور عيون,د. حلمى حسن,"ش جمال عبد الناصر, بركة السبع, المنوفية.",319606
دكتور عيون,د. حلمى سعيد لاشين,"32 ش سكة حديد الدلتا, شبين القناطر, القليوبية.",517088
دكتور عيون,د. حمادة غازى العوضى,"ش النبوى المهندس - الدور 2 شقة 3, دسوق, كفر الشيخ.",277285
دكتور عيون,د. حمدى احمد عبده,"ش الدهشان, بنها, القليوبية.",277322
دكتور عيون,د. حمدى الجزار,"9 مساكن المرور - ش العاشر من رمضان, قليوب, القليوبية.",525894
دكتور عيون,د. حمدى جيهان,"ش الزهور, الحضرة, الاسكندرية.",258519
دكتور عيون,د. حمدى سلامة,"ش محمود النقراشى, السنبلاوين, الدقهلية.",351056
دكتور عيون,د. حمدى محمد عبد الحميد,"78 ش المنيل - الدور 5, المنيل, القاهرة.",272433
دكتور عيون,د. حمدى مصطفى كامل,"71 ش البحر, طنطا, الغربية.",294391
دكتور عيون,د. حنان العفيفى,"50 ش العشرين, زهراء عين شمس, عين شمس, القاهرة.",647791
دكتور عيون,د. حنان زكى,"96 ش مصطفى النحاس, مدينة نصر, القاهرة.",430848
دكتور عيون,د. حنان محيى الغنيمى,"8 ش 153 ميدان الحرية, المعادى, القاهرة.",232832
دكتور عيون,د. خالد ابو سديرة,"4 ش 100, المعادى, القاهرة.",102333
دكتور عيون,د. خالد البلتاجى,"31 ش منشية البكرى, الدور 3, منشية البكرى, مصر الجديدة, القاهرة.",96354
دكتور عيون,د. خالد الشيمى,"96 طريق اسكندرية مطروح - الدرايسة, الهانوفيل, الاسكندرية.",226198
دكتور عيون,د. خالد الغنيمى,"61 ش الجيش, الباجور, المنوفية.",299046
دكتور عيون,د. خالد الغنيمى,"برج الفيروز - ميدان شرف, شبين الكوم, المنوفية.",322671
دكتور عيون,د. خالد النوسانى,"19 ش شاهين, منوف, المنوفية.",570610
دكتور عيون,د. خالد جمال ابو العينين,"282 ش السودان, المهندسين, الجيزة.",463414
دكتور عيون,د. خالد حجازى,"14 أ ش شريف - برج الحرية الطبى, الكوربة, مصر الجديدة, القاهرة.",289440
دكتور عيون,د. خالد حمدى,"102 ب ش الميرغنى, مصر الجديدة, القاهرة.",235074
دكتور عيون,د. خالد حمدى محمود,"14 عمارات رابعة الاستثمارى -, مدينة نصر, القاهرة.",212132
دكتور عيون,د. خالد شحاتة,"32 ش الوحدة المحلية, كرداسة, الجيزة.",557994
دكتور عيون,د. خالد صلاح مسعود,"35 ش الشباب ميدان اربيلا, التجمع الثالث, القاهرة الجديدة, القاهرة.",570495
دكتور عيون,د. خالد عامر,"ش النزهة, النزهة, مصر الجديدة, القاهرة.",591144
دكتور عيون,د. خالد عبد الحليم,"157 ش فيصل, الهرم, الجيزة.",53208
دكتور عيون,د. خالد عبد الخالق غيث,"15 ش الخليفة المأمون - الدور 8 شقة 803, روكسى, مصر الجديدة, القاهرة.",271432
دكتور عيون,د. خالد عبد الرحمن هاشم,"24 ش عدن, المهندسين, الجيزة.",575260
دكتور عيون,د. خالد عبد السلام,"ش سعد زغلول, حى الافرنج, الاسماعيلية.",290587
دكتور عيون,د. خالد عبد السلام,"158 ش سعد زغلول, حى الافرنج, الاسماعيلية.",111491
دكتور عيون,د. خالد عبد العظيم محمد,"ش السادات, امتداد ش يسرى راغب, برج معونة الشتاء, اسيوط, اسيوط.",564433
دكتور عيون,د. خالد عز الرجال,"ش بورسعيد - حى الصاغة, الابراهيمية, الشرقية.",363958
دكتور عيون,د. خالد عزت قطب,"5 ش النادى, روكسى, مصر الجديدة, القاهرة.",452995
دكتور عيون,د. خالد عصمت الرخاوى,"1 ميدان روكسى, روكسى, مصر الجديدة, القاهرة.",626273
دكتور عيون,د. خالد على حجازى,"14 أ ش شريف, روكسى, مصر الجديدة, القاهرة.",235077
دكتور عيون,د. خالد قطب,"321 ش فيصل, الدور 4, حسن محمد, فيصل, الجيزة.",511154
دكتور عيون,د. خالد لطفى,"20 ش مدرسة البنات, بركة السبع, المنوفية.",317201
دكتور عيون,د. خالد محمد حامد,"70 ش صفر باشا, رأس التين, الاسكندرية.",489562
دكتور عيون,د. خالد محمد رشاد,"14 ش كلية الطب, محطة الرمل, الاسكندرية.",115706
دكتور عيون,د. خالد محمد سليم,"61 ش الحجاز, ميدان المحكمة, مصر الجديدة, القاهرة.",126114
دكتور عيون,د. خالد محمد فوزى,"برج الاطباء - ميدان عرابى - الدور 2 شقة 9, الزقازيق, الشرقية.",185332
دكتور عيون,د. خالد منصور,"21 ش محمد كامل مرسى, المهندسين, الجيزة.",136792
دكتور عيون,د. خيرى السيد,"3 ش عدى, الدقى, الجيزة.",450035
دكتور عيون,د. دعاء رمضان قاسم,"54 ش ابن سندر, كوبرى القبة, القاهرة.",589370
دكتور عيون,د. دعاء طلبة,"18 ش خالد بن الوليد, حدائق حلوان, القاهرة.",644382
دكتور عيون,د. دلال شوقى,"9 ش ميدان المحطة, محطة الرمل, الاسكندرية.",32822
دكتور عيون,د. رؤوف رمسيس,"38 ش عبد العزيز ميدان العتبة, العتبة, القاهرة.",53255
دكتور عيون,د. رائف اميل,"ش زهير, الابراهيمية, الاسكندرية.",301842
دكتور عيون,د. راغب الجملى,"5 ش عمرو بن العاص, البدرشين, الجيزة.",609036
دكتور عيون,د. رأفت العريان,"1 ش الشريف متفرع من ش جسر السويس, روكسى, مصر الجديدة, القاهرة.",272434
دكتور عيون,د. رأفت حسين,"113 ش شبرا, شبرا, القاهرة.",467496
دكتور عيون,د. رأفت رياض,"48 ش سليم الاول, الزيتون, القاهرة.",53144
دكتور عيون,د. رأفت محمد الحناوى,"ش وادى النيل - ميت عقبة, الصحفيين, الجيزة.",235078
دكتور عيون,د. رامز شكرى,"130 ش النزهة, الدور 2, تريومف, مصر الجديدة, القاهرة.",596475
دكتور عيون,د. رامى حسين القاشر,"ش شبرا, شبرا, القاهرة.",672149
دكتور عيون,د. رامى رياض,"102 ب ش الميرغنى, كلية البنات, مصر الجديدة, القاهرة.",592877
دكتور عيون,د. رانيا فؤاد,"34 طريق الباجور - سنتريس, اشمون, المنوفية.",567320
دكتور عيون,د. رانيا محمد صبحى,"1, الشقة 702, الدور 7, ميدان الحجاز, برج الصفا الطبى, المهندسين, الجيزة.",381089
دكتور عيون,د. رشا اسماعيل,"73 /3 ش حسب الله الكفراوى المجاورة الثانية - الحى الثانى - الدور 2, دمياط الجديدة, دمياط.",528449
دكتور عيون,د. رشا عبد المنعم صديق,"511 ش الاهرام ميدان الجيزة - عمارة النصر - الدور 5, الجيزة, الجيزة.",592621
دكتور عيون,د. رشيد سامح اللقانى,"ش الثورة ميدان ام كلثوم - الدور 2, المنصورة, الدقهلية.",153649
دكتور عيون,د. رضا عبدالرحمن مهدى,"., الزقازيق, الشرقية.",156950
دكتور عيون,د. رفيق الغزاوى,"44 ش جسر السويس, جسر السويس, القاهرة.",235084
دكتور عيون,د. رفيق عبد الحليم بركات,"50 ش محمد فريد, وينجت, الاسكندرية.",450277
دكتور عيون,د. رفيق نبيه فهمى,"ش غيط العنب, المرج, القاهرة.",125694
دكتور عيون,د. رفيق يوسف,"86 ش 9, المقطم, القاهرة.",441492
دكتور عيون,د. رمضان عبد الحميد حجازى,"برج الصفا والمروة - ش البحر - سنتريس, اشمون, المنوفية.",323093
دكتور عيون,د. رنا حسين امين,"55 ش النادى الرياضى, متفرع من ش فيصل, برج الاطباء, فيصل, الجيزة.",651938
دكتور عيون,د. رندا زكى زعزع,"2 ش جواد حسنى, باب اللوق, القاهرة.",299077
دكتور عيون,د. رياض فكرى رياض,"102 ب ش الميرغنى, كلية البنات, مصر الجديدة, القاهرة.",9787
دكتور عيون,د. ريهام سامى علام,"44 أ ش الدقى, الشقة 44, الدور 4, الدقى, الجيزة.",449963
دكتور عيون,د. زينب ربيع,"29 ش عز الدين طه, مدينة نصر, القاهرة.",457196
دكتور عيون,د. زينب هانى,"21 ش المطبعة, المطبعة, الهرم, الجيزة.",599503
دكتور عيون,د. سارة صبرى,"15 ش فريد سميكة, الدور 2, ميدان بقطر, الالف مسكن, مصر الجديدة, القاهرة.",674904
دكتور عيون,د. سالم سلامة,"148 ش الترعة البولاقية, شبرا, القاهرة.",467241
دكتور عيون,د. سامح ابو الخير,"102 ش الميرغنى, كلية البنات, مصر الجديدة, القاهرة.",621579
دكتور عيون,د. سامح الاغا,"92 ش التحرير, الشقة 87, الدور 7, برج ساريدار الطبى, الدقى, الجيزة.",384900
دكتور عيون,د. سامح الجوهرى,"ش عبد المنعم حمزة, اشمون, المنوفية.",313198
دكتور عيون,د. سامح السيد سليمان,"427 طريق الكورنيش, لوران, الاسكندرية.",449975
دكتور عيون,د. سامح جلال,"ش مكة المكرمة المجاورة الاولى, الحى السابع, السادس من اكتوبر, الجيزة.",546073
دكتور عيون,د. سامح سامى البحراوى,"30 ش د. حسن ابراهيم متفرع من ش مكرم عبيد, المنطقة السادسة, مدينة نصر, القاهرة.",235113
دكتور عيون,د. سامح سعد مندور,"16 ش الامين - برج الحكمة - الدور 2, شبين الكوم, المنوفية.",531227
دكتور عيون,د. سامح عبد الرحمن,"6 ش 9, الدور 1, المقطم, القاهرة.",490353
دكتور عيون,د. سامح محمد شرف,"11 ش ترعة زنين, بولاق الدكرور, الجيزة.",442323
دكتور عيون,د. سامى ابو الخير,"ش الاستاد, دمياط, دمياط.",96405
دكتور عيون,د. سامى ابو الفتوح,"ش 23 يوليو, سيدى سالم, كفر الشيخ.",368144
دكتور عيون,د. سامى سعد حماد,"69 ش ربيع الجيزى, الجيزة, الجيزة.",235085
دكتور عيون,د. سامى عوض,"12 ش 23 يوليو, كفر شكر, القليوبية.",520030
دكتور عيون,د. سامية ابراهيم معوض,"2 ش الديب, الزقازيق, الشرقية.",274709
دكتور عيون,د. سامية ناشد عزيز,"103 ش شبرا, شبرا, القاهرة.",465835
دكتور عيون,د. سعد ابراهيم سعد,"عمارات جاردينيا ش امين حسونة, السيوف, الاسكندرية.",589577
دكتور عيون,د. سعد محمد رشاد,"117 ش التحرير ميدان الدقى, الدقى, الجيزة.",235110
دكتور عيون,د. سعيد عبد القادر التلوانى,"172 برج الخلفاء - ش عمر لطفى - الدور 2, سبورتنج, الاسكندرية.",449448
دكتور عيون,د. سماح احمد عثمان,"62 أ ش سليم الاول, حلمية الزيتون, القاهرة.",322341
دكتور عيون,د. سماح البحراوى,"30 ش حسن ابراهيم حسن, مدينة نصر, القاهرة.",436204
دكتور عيون,د. سمير البحة,"226 طريق الحرية, الابراهيمية, الاسكندرية.",41671
دكتور عيون,د. سمير قاسم,"7 ش الاهرام, روكسى, مصر الجديدة, القاهرة.",127980
دكتور عيون,د. سمير يحيى صالح,"امتداد ش يسرى راغب, اسيوط, اسيوط.",564437
دكتور عيون,د. سناء الغرباوى,"ش مسجد الروضة متفرع من ش سعد زغلول, منيا القمح, الشرقية.",324197
دكتور عيون,د. سهير السلماوى,"60 ش السودان, المهندسين, الجيزة.",272435
دكتور عيون,د. سهير محمد نصار,"297 ش سكة الوايلى, حدائق القبة, القاهرة.",272436
دكتور عيون,د. سوزان فوزى محمد السيد,"29 ش مصطفى كامل, الشقة 102, الدور 1, ميدان المحطة, المعادى, القاهرة.",235116
دكتور عيون,د. سيد الرفاعى,"70 ش السودان, المهندسين, الجيزة.",300469
دكتور عيون,د. سيد النواوى,"238 طريق الحرية, الابراهيمية, الاسكندرية.",41168
دكتور عيون,د. سيد سيف,"5 ش شريف, باب اللوق, القاهرة.",438697
دكتور عيون,د. سيد عبد المنعم,"1 ش فخرى زكى, حدائق المعادى, المعادى, القاهرة.",685923
دكتور عيون,د. سيف الله محمد انور,"ش ابو بكر الصديق, دكرنس, الدقهلية.",489168
دكتور عيون,د. شادى قنديل,"129 ش النزهة, تريومف, مصر الجديدة, القاهرة.",271450
دكتور عيون,د. شاكر خضر,"53 ش المقريزى, الشقة 104, الدور 1, برج الاطباء, منشية البكرى, مصر الجديدة, القاهرة.",666440
دكتور عيون,د. شحاتة حبيب,"228 ش الجيش, باب الشعرية, القاهرة.",472860
دكتور عيون,د. شريف احمد,"9 ش عثمان بن عفان, مصر الجديدة, القاهرة.",53235
دكتور عيون,د. شريف احمد ايوب,"ش عثمان بن عفان, ميدان الاسماعيلية, مصر الجديدة, القاهرة.",591736
دكتور عيون,د. شريف الفونس عدلى,"17 ش مصر المحروسة - قرية بشتيل, اوسيم, الجيزة.",545189
دكتور عيون,د. شريف الياس جرجس,"6 عمارة رمسيس - ميدان رمسيس, وسط البلد, القاهرة.",235123
دكتور عيون,د. شريف امبابى,"10 ش عبد الله العربى, امتداد ش الطيران, مدينة نصر, القاهرة.",575242
دكتور عيون,د. شريف جبر,"29 ش المدينة المنورة, الدقى, الجيزة.",662621
دكتور عيون,د. شريف جمال,"55 ش عبد المنعم رياض - برج القاهرة الطبى - الدور 6 شقة 1, المهندسين, الجيزة.",462015
دكتور عيون,د. شريف جمال الدين,"29 ش المروة, المهندسين, الجيزة.",300470
دكتور عيون,د. شريف حسن تراضى واصل,"ش سعد زغلول, وسط البلد, الفيوم.",278333
دكتور عيون,د. شريف حسن كامل,"79 ش شبرا - الدور 1 شقة 2, شبرا, القاهرة.",271416
دكتور عيون,د. شريف حلمى,"9 ش ثابت ميدان شيكوريل - الدور 1, حى غرب, اسيوط.",348101
دكتور عيون,د. شريف زعزوع,"20 ش البطل احمد عبد العزيز, الدور 4, تقاطع ش عبد المنعم رياض, برج الحكمة الطبى, المهندسين, الجيزة.",438689
دكتور عيون,د. شريف شتا,"55 برج القاهرة الطبى ش عبد المنعم رياض, الشقة 1006, الدور 11, متفرع من ش البطل احمد عبدالعزيز, برج القاهرة الطبى, المهندسين, الجيزة.",262114
دكتور عيون,د. شريف ضبع حبشى,"28 ش احمد عصمت, عين شمس الشرقية, القاهرة.",318362
دكتور عيون,د. شريف عزمى,"3 ش المعتمدية, ارض اللواء, الجيزة.",548688
دكتور عيون,د. شريف علوان,"20 ش ابن النفيس, متفرع من ش احمد فخرى, المنطقة السادسة, مدينة نصر, القاهرة.",235133
دكتور عيون,د. شريف عيسى,"5 ش الروضة, المنيل, القاهرة.",503720
دكتور عيون,د. شريف كراوية,"99 ش المنيل - الدور 2 شقة 6, المنيل, القاهرة.",157739
دكتور عيون,د. شريف محمد حجازى,"197 ش ملك حفنى, سيدى بشر قبلى, الاسكندرية.",223606
دكتور عيون,د. شريف محمد شرف الدين,"ش الجيش, ميت غمر, الدقهلية.",338141
دكتور عيون,د. شريف محمد طلعت,"22 ش منيل الروضة - الدور 1, منيل الروضة, القاهرة.",183230
دكتور عيون,د. شريف محمود احمد,"22 ش المنيل, المنيل, القاهرة.",300471
دكتور عيون,د. شريف ممتاز حجازى,"5 ش قصر النيل - الدور 3, وسط البلد, القاهرة.",552747
دكتور عيون,د. شريف ناشد,"24 ش عين شمس, عين شمس الشرقية, القاهرة.",322848
دكتور عيون,د. شكرى السيد,"9134 ش 9, المقطم, القاهرة.",444437
دكتور عيون,د. شهاب الدين امجد دويدار,"26 ش لاجيتية, الابراهيمية, الاسكندرية.",53924
دكتور عيون,د. شيرين غانم,"28 ش عثمان محمد, طنطا, الغربية.",332012
دكتور عيون,د. شيرين محمد,"المجاورة الثالثة - الحى 11, الشيخ زايد, السادس من اكتوبر, الجيزة.",589722
دكتور عيون,د. شيماء ابراهيم جعفر,"8 ش عز الدين عمر, متفرع من ش الهرم, الهرم, الجيزة.",618646
دكتور عيون,د. شيماء شريف,"35 ش بورسعيد, منوف, المنوفية.",570518
دكتور عيون,د. شيماء صديق,"2 ش شاهين, منوف, المنوفية.",570633
دكتور عيون,د. شيماء عارفين,"القطعة 8106 - ش 9, المقطم, القاهرة.",593026
دكتور عيون,د. شيماء محمد,"ش الثورة, بيلا, كفر الشيخ.",365384
دكتور عيون,د. شيماء ناصر على,"الشارع الجديد, شبرا الخيمة, القليوبية.",599490
دكتور عيون,د. صابر حامد السيد,"64 ش جمال عبد الناصر - الدور 1, شبين الكوم, المنوفية.",531143
دكتور عيون,د. صابر محمود حمود,"41 ش المدرسة, المنيب, الجيزة.",342552
دكتور عيون,د. صبرى شتا,"53 ش سعد زغلول, محطة الرمل, الاسكندرية.",34254
دكتور عيون,د. صفوت حكيم,"24 ش شبرا, شبرا, القاهرة.",13695
دكتور عيون,د. صفية عبد الغنى,"38 ش محمد سيد احمد, حلوان, القاهرة.",643568
دكتور عيون,د. صلاح على مخلوف,"12 ش الفتح, وسط البلد, الفيوم.",278334
دكتور عيون,د. صموئيل نجيب,"برج فرعاص - ش اسكندرية, وسط البلد, مرسى مطروح.",559420
دكتور عيون,د. ضياء عبد الحميد,"عمارة النصر - ميدان الجيزة, الجيزة, الجيزة.",177447
دكتور عيون,د. ضياء محمد كمال عبد المجيد,"ش المحمدية - الدور 2 شقة 3, وسط البلد, الفيوم.",263786
دكتور عيون,د. طارق ابو النصر,"5 ش السرايا, المنيل, القاهرة.",288451
دكتور عيون,د. طارق اسماعيل,"برج الهدى - ش عمرو بن العاص, البدرشين, الجيزة.",376123
دكتور عيون,د. طارق البلتاجى,"75 ش محيى الدين ابو العز, المهندسين, الجيزة.",53198
دكتور عيون,د. طارق العمرى,"71 ب عمارة الكوثر - ش جامعة الدول العربية, المهندسين, الجيزة.",235137
دكتور عيون,د. طارق النجار,"4 ش الاثرى محمد نافع, روكسى, مصر الجديدة, القاهرة.",591618
دكتور عيون,د. طارق بدر الدين,"62 ش فريد ندا, بنها الجديدة, القليوبية.",520269
دكتور عيون,د. طارق توفيق سليمان,"64 ش فريد ندا برج طيبة, بنها الجديدة, القليوبية.",305909
دكتور عيون,د. طارق حسين عثمان,"52 ش مسجد السلام القومية، الدور 1, الزقازيق, الشرقية.",185186
دكتور عيون,د. طارق حمد,"55 ش الرشاح - قرية طنان, قليوب, القليوبية.",519522
دكتور عيون,د. طارق رجائى,"ش عزيز فهمى, طنطا, الغربية.",276757
دكتور عيون,د. طارق رمضان كامل,"ش شريف, مصر الجديدة, القاهرة.",591601
دكتور عيون,د. طارق شرف,"20 ش توتنجى, حدائق حلوان, القاهرة.",175821
دكتور عيون,د. طارق طنطاوى,"98 ش التحرير, الشقة 306, الدور 3, برج الدقى الادارى, الدقى, الجيزة.",587398
دكتور عيون,د. طارق عبد الحارس,"5 ش الشباب, الحى الثالث, الشيخ زايد, السادس من اكتوبر, الجيزة.",665799
دكتور عيون,د. طارق عبد العزيز,"129 ش الميرغنى, الدور 6, ميدان السبع عمارات, مصر الجديدة, القاهرة.",469520
دكتور عيون,د. طارق عبد المقصود المنسى,"ش النصر, ديرب نجم, الشرقية.",330877
دكتور عيون,د. طارق عبد الوهاب,"33 ش جامعة الدول العربية, المهندسين, الجيزة.",458513
دكتور عيون,د. طارق قطامش,"20 ش البطل احمد عبد العزيز, برج الحكمة الطبى, المهندسين, الجيزة.",260509
دكتور عيون,د. طارق مأمون,"56 ش رمسيس تقاطع ش بطرس غالى, روكسى, مصر الجديدة, القاهرة.",271426
دكتور عيون,د. طارق محمد رضوان,"21 ش اسماعيل الزمرى, مصر الجديدة, القاهرة.",235147
دكتور عيون,د. طارق محمد زغلول سلام,"8 ش بلال بن رباح, النزهة, مصر الجديدة, القاهرة.",126101
دكتور عيون,د. طارق محمد عبد الله,"104 ش الشيخ محمد غراب, حدائق القبة, القاهرة.",235143
دكتور عيون,د. طارق محمد محمود عمارة,"عمارة الشرق للتأمين - ش صلاح سالم, وسط البلد, كفر الشيخ.",360263
دكتور عيون,د. طارق يونس,"30 ش محمد عوف, العجوزة, الجيزة.",390486
دكتور عيون,د. طلال عاطف الفار,"1 ش 26 يوليو ميدان لبنان, المهندسين, الجيزة.",235149
دكتور عيون,د. طلعت باخوم,"34 ش فريد شوقى, العجوزة, الجيزة.",53185
دكتور عيون,د. طلعت ساويرس,"20 ش حسن صبرى, عزبة النخل, القاهرة.",207019
دكتور عيون,د. طلعت ساويرس,"147 ش النزهة, الدور 4, مصر الجديدة, القاهرة.",678893
دكتور عيون,د. طه الحج,"459 ش فيصل, فيصل, الجيزة.",240837
دكتور عيون,د. طه الشيوى,"عمارة ستراند -, باب اللوق, القاهرة.",235154
دكتور عيون,د. طه مبروك عطية,"119 ش العشرين, عين شمس, القاهرة.",420732
دكتور عيون,د. طه محمد عبد المنعم,"56 ش عبد الخالق ثروت, وسط البلد, القاهرة.",174277
دكتور عيون,د. ظافر محمد فهيم,"49 ش محمد فريد, مصر الجديدة, القاهرة.",271431
دكتور عيون,د. عادل السيد محمود,"25 ش حيدر - الدور 1, حلوان, القاهرة.",271434
دكتور عيون,د. عادل جرجس,"22 ش شبرا, شبرا, القاهرة.",200310
دكتور عيون,د. عادل جلال زكى,"ش الحرية, تلا, المنوفية.",319150
دكتور عيون,د. عادل سامى,"2 ش شعبان موسى, عزبة النخل, القاهرة.",376598
