Category,Name,Address,ID
دكتور تغذية وتخسيس,عيادات نيوترى فتنس,"26 ش محمد المقريفى, الحى الثامن, مدينة نصر, القاهرة.",671922
دكتور تغذية وتخسيس,عيادات حور,"20 شارع على امين, امتداد مصطفى النحاس, مدينة نصر, القاهرة.",519389
دكتور تغذية وتخسيس,مركز د. ماضى للعلاج الطبيعى و السمنة,"ش المنيل, الدور 3, ميدان الباشا, المنيل, القاهرة.",437058
دكتور تغذية وتخسيس,عيادة دكتور محمد مسعد قنديل للجراحة العامة والمناظير,"154 ش عبد السلام عارف, الشقة 4, الدور 1, سان استيفانو, الاسكندرية.",511365
دكتور تغذية وتخسيس,عيادة د. اسلام الكومى ماجستير سمنة ونحافة,"662 ج طريق الحرية, جناكليس, الاسكندرية.",520907
دكتور تغذية وتخسيس,د. احمد محمد ناصر استشارى جراحة المناظير والسمنة,"5 عمارة الدار البيضاء - ش عباس العقاد, مدينة نصر, القاهرة.",611614
دكتور تغذية وتخسيس,د. حازم ناصف استشارى الجراحة العامة والجهاز الهضمى والمناظير والسمنة الفرطة,"303 أ ش الثروة المعدنية, حدائق الاهرام, الهرم, الجيزة.",531417
دكتور تغذية وتخسيس,د. محمد ضياء سرحان,"15 ش عمرو, متفرع من ش سوريا,, المهندسين, الجيزة.",183497
دكتور تغذية وتخسيس,دايت هوس - د. هاجر سرى,"64 ش الاسماعيلية, الشقة 2, الدور 1, متفرع من ش ابو قير, رشدى, الاسكندرية.",433334
دكتور تغذية وتخسيس,عيادة توازن التخصصية - تغذية علاجية وامراض جلدية - د. هالة لطفى,"19 عمارة المدينة المنورة ش الصفا متفرع من شارع ادموند فيرمونت, الدور 1, سموحة, الاسكندرية.",342058
دكتور تغذية وتخسيس,مركز الامل للعلاج الطبيعى وتنسيق القوام - الترا كير,"22 ش سوريا, الدور 1, رشدى, الاسكندرية.",506453
دكتور تغذية وتخسيس,مركز النخبة للعلاج الطبيعى والسمنة وتنسيق القوام - د. احمد عبد الغنى,"42 ش المشير - برج سرايا المشير - الدور 2, سيدى جابر, الاسكندرية.",609216
دكتور تغذية وتخسيس,مركز د. احمد اسماعيل,"5 ش القصر العيني - الدور 2, وسط البلد, القاهرة.",486055
دكتور تغذية وتخسيس,مركز د. اميرة مدحت للجلدية والتجميل والليزر والتغذية العلاجية,"71 ش النصر, المعادى الجديدة, المعادى, القاهرة.",223018
دكتور تغذية وتخسيس,أ. د. احمد سعيد الخولى استشارى علاج السمنة والنحافة وعلاج الام المفاصل,"10 ش ابو المجد عامر, متفرع من ش شمس الدين الذهبى, ارض الجولف, مصر الجديدة, القاهرة.",552935
دكتور تغذية وتخسيس,اب ليفت 16 للتغذية,"ش التسعين, قطاع 3, التجمع الخامس, القاهرة الجديدة, القاهرة.",665618
دكتور تغذية وتخسيس,احمد عبد الله سعده,"1 ش المحكمة, كفر سعد, دمياط.",624837
دكتور تغذية وتخسيس,اس ويلنس كلينكس,"2 /2 عمارات نيركو ش الزهراء, الشطر الخامس, زهراء المعادى, المعادى, القاهرة.",667219
دكتور تغذية وتخسيس,اكتوبر كير للعلاج الطبيعى والسمنة والنحافة والتخسيس الموضعى,"383 المحور المركزى, الحى الثانى, السادس من اكتوبر, الجيزة.",349657
دكتور تغذية وتخسيس,الجمعية المصرية للتغذية والارشاد الصحى,"52 ش توت عنخ امون, سموحة, الاسكندرية.",547803
دكتور تغذية وتخسيس,الشفاء للعلاج الطبيعى والتخسيس,"4 ش طراد النيل, منيل شيحة, الجيزة.",648342
دكتور تغذية وتخسيس,الشهاب كلينيك,"334 ش فيصل - الدور 2, حسن محمد, فيصل, الجيزة.",598398
دكتور تغذية وتخسيس,المركز الالمانى للعلاج الطبيعى والسمنة,"132 ش مصطفى كامل, باكوس, الاسكندرية.",597016
دكتور تغذية وتخسيس,المركز التخصصى لعلاج السمنة والنحافة - د. اشرف يسرى,"7 ش عبد الحميد ابو هيف, ميدان المحكمة, مصر الجديدة, القاهرة.",387221
دكتور تغذية وتخسيس,المركز التخصصى للعلاج الطبيعى والتخسيس,"المحور المركزى - ميدان ليلة القدر, الحى السادس, السادس من اكتوبر, الجيزة.",346029
دكتور تغذية وتخسيس,المركز الدولى للعلاج الطبيعى - دايت اند سليم,"13 ش البحر - الدور 5, طنطا, الغربية.",371184
دكتور تغذية وتخسيس,المركز الفاطمى للعلاج الطبيعى والتخسيس,"47 ش عبد السلام عارف, المنصورة, الدقهلية.",295612
دكتور تغذية وتخسيس,الياسمين كلينيك,"28 ش خسرو باشا تقاطع ش محمد سيد احمد - ابراج نقابة المهندسين - برج ب, حلوان, القاهرة.",246136
دكتور تغذية وتخسيس,امازون دايت كلينك,"39, الدور 3, المحور المركزى, الحى الاول, السادس من اكتوبر, الجيزة.",445814
دكتور تغذية وتخسيس,اوريندا للسمنة والنحافة,"ش التسعين الشمالى, التجمع الخامس, القاهرة الجديدة, القاهرة.",665585
دكتور تغذية وتخسيس,اى كير كلينيك للعلاج الطبيعى,"عمارة 2078, زهراء مدينة نصر, مدينة نصر, القاهرة.",570998
دكتور تغذية وتخسيس,اى لايف - د. دينا محمود,"9 ش النادى, المعادى, القاهرة.",577235
دكتور تغذية وتخسيس,ايت رايت كلينك,"مركز القاهرة الطبى, التجمع الخامس, القاهرة الجديدة, القاهرة.",657328
دكتور تغذية وتخسيس,ايمى سنتر للتغذية,"26 بلوك 86, الشطر 13, زهراء المعادى, المعادى, القاهرة.",679282
دكتور تغذية وتخسيس,برايم كلينك,"4 ش عبد الحى فتحى, ميدان الحجاز, مصر الجديدة, القاهرة.",564472
دكتور تغذية وتخسيس,برفكت بادى كلينيك,"86 ش احمد الزمر, الحى الثامن, مدينة نصر, القاهرة.",609064
دكتور تغذية وتخسيس,برميم للعلاج الطبيعى والتأهيل الشامل للاطفال - د. محمد محمود,"فيلا 422 - ش 16 - منطقة أ - هضبة الاهرام, حدائق الاهرام, الهرم, الجيزة.",532483
دكتور تغذية وتخسيس,بودى اند سول كلينيك,"14 ش 9, ثكنات المعادى, المعادى, القاهرة.",388875
دكتور تغذية وتخسيس,بى - هيلثى سنتر,"65 ش عبد السلام عارف - الدور 2, جليم, الاسكندرية.",556833
دكتور تغذية وتخسيس,بى اليجانت كلينك,", امتداد ش ابو داوود الظاهرى, الحى الثامن, مدينة نصر, القاهرة.",688373
دكتور تغذية وتخسيس,بيان اتر,"16 شارع صلاح الدين متفرع من ش شجرة الدر - الدور 4, الزمالك, القاهرة.",582283
دكتور تغذية وتخسيس,بيراميدز هيلثى كلينيك,"10 ش الشوربجى مدكور, الهرم, الجيزة.",14398
دكتور تغذية وتخسيس,بيلافيتيا للسمنة والنحافة د. وليد ابو بكر,"اول ش قناة السويس, المنصورة, الدقهلية.",245537
دكتور تغذية وتخسيس,تشينج كلينيك,"9 ش الجزائر, متفرع من ش جامعة الدول العربية, المهندسين, الجيزة.",394989
دكتور تغذية وتخسيس,جولدن شيب,"الدور 2, التجمع الخامس, القاهرة الجديدة, القاهرة.",431305
دكتور تغذية وتخسيس,د. احمد ابرهيم,"عيادة ٢١٠ مركز القاهرة الطبى, الدور 2, التجمع الخامس, القاهرة الجديدة, القاهرة.",686752
دكتور تغذية وتخسيس,د. احمد الشافعى,"39 ش زهير صبرى, متفرع من ش الطيران, مدينة نصر, القاهرة.",667435
دكتور تغذية وتخسيس,د. احمد النبيل,"28 عمارات رابعة الاستثمارى - ش النزهة, مدينة نصر, القاهرة.",469681
دكتور تغذية وتخسيس,د. احمد بهاء الدين بلال,"49 ش البطل احمد عبد العزيز, الدور 7, تقاطع ش جامعة الدول العربية, المهندسين, الجيزة.",586853
دكتور تغذية وتخسيس,د. احمد جابر بيبرس,"ش بحرى الاستاد الرياضى تقسيم الشرطة - عمارة مبارك, شبين الكوم, المنوفية.",473277
دكتور تغذية وتخسيس,د. احمد دياب,"7 ش الاهرام, الكوربة, مصر الجديدة, القاهرة.",154919
دكتور تغذية وتخسيس,د. احمد رامى,"45 ش عثمان بن عفان, ميدان الاسماعيلية, مصر الجديدة, القاهرة.",276993
دكتور تغذية وتخسيس,د. احمد عبد الحميد,"81 ش شبين الكوم, حى السلام, الاسماعيلية.",623737
دكتور تغذية وتخسيس,د. احمد عبد الله - عيادات نيولايف التخصصية للتجميل والسمنة,"2 ش الفواكه, متفرع من ش جامعة الدول العربية, المهندسين, الجيزة.",503562
دكتور تغذية وتخسيس,د. احمد عبد المنعم,"87 ش المنيل - الغمراوى - الدور 4, المنيل, القاهرة.",465477
دكتور تغذية وتخسيس,د. احمد عبد المنعم السلامونى,"55 ش انور السادات - ش ترسا سابقا, سباتس, الهرم, الجيزة.",585471
دكتور تغذية وتخسيس,د. احمد على,"10 ش ثابت - الدور 1, اسيوط, اسيوط.",587125
دكتور تغذية وتخسيس,د. احمد عمارة,"23 ش خالد امين متفرع من ش العريش - برج الجوهرة - الدور 2, الهرم, الجيزة.",533099
دكتور تغذية وتخسيس,د. احمد محمد السعيد,"63 ش فيصل, فيصل, الجيزة.",592852
دكتور تغذية وتخسيس,د. احمد محمد رائف,"9 ش عبد الله دراز, ارض الجولف, مصر الجديدة, القاهرة.",587707
دكتور تغذية وتخسيس,د. احمد منصور,"1 ش احمد حشمت - الدور 1 شقة 1, الزمالك, القاهرة.",439192
دكتور تغذية وتخسيس,د. احمد ناصر,"52 ش مصطفى النحاس, الدور 9, تقاطع ش مكرم عبيد, مدينة نصر, القاهرة.",422848
دكتور تغذية وتخسيس,د. اذار سمير الورد,"97 ش التحرير, الدور 4, الدقى, الجيزة.",595648
دكتور تغذية وتخسيس,د. اسامة حجازى,"401 ب ش فيصل, الطالبية, فيصل, الجيزة.",393638
دكتور تغذية وتخسيس,د. اسامة رفيق,"71 ش جامعة الدول العربية, المهندسين, الجيزة.",53089
دكتور تغذية وتخسيس,د. اسامة شلبى,"ش المديرية - عمارة الست مباركة - مدخل أ, طنطا, الغربية.",338198
دكتور تغذية وتخسيس,د. اسامة فؤاد محمد,"6 ش محمود حافظ, ميدان سفير, مصر الجديدة, القاهرة.",533664
دكتور تغذية وتخسيس,د. اسلام السايس,"8 ش كلية الطب - برج الاطباء, محطة الرمل, الاسكندرية.",597768
دكتور تغذية وتخسيس,د. اسلام خالد,"المحور المركزى - عمارة 73, الحى الثانى, السادس من اكتوبر, الجيزة.",581265
دكتور تغذية وتخسيس,د. اسلام على,"4 ش طومانباى - برج السماح - الدور 1, حدائق الزيتون, القاهرة.",611424
دكتور تغذية وتخسيس,د. اسلام محمد ياقوت,"63 عمارات ضباط مصطفى كامل -, مصطفى كامل, الاسكندرية.",211569
دكتور تغذية وتخسيس,د. اسماء الخطيب,"., التجمع الخامس, القاهرة الجديدة, القاهرة.",452250
دكتور تغذية وتخسيس,د. اسماء زيدان,"50 ش ترعة السواحل - عزبة الصعايدة, امبابة, الجيزة.",590894
دكتور تغذية وتخسيس,د. اسماء سيد الجندى,"11 ش مصطفى جسرها - زهراء مصر القديمة, مصر القديمة, القاهرة.",518999
دكتور تغذية وتخسيس,د. اسماء محمد عبد الحميد,"57 ش فيصل, المريوطية, فيصل, الجيزة.",509112
دكتور تغذية وتخسيس,د. اسماعيل راشد,"48 ابراج البارون - ش عقل باشا, سيدى بشر قبلى, الاسكندرية.",455204
دكتور تغذية وتخسيس,د. اشرف فاروق,"37 ش ابن عقيل, فيكتوريا, الاسكندرية.",468501
دكتور تغذية وتخسيس,د. اشرف قورة,"164 ش التسعين الشمالى, التجمع الخامس, القاهرة الجديدة, القاهرة.",686361
دكتور تغذية وتخسيس,د. اشرف محمد منصور,"ش ترعة عبد العال, فيصل, الجيزة.",344779
دكتور تغذية وتخسيس,د. اشرف هلال,"17 ش الثلاثينى الجديد, المريوطية, الهرم, الجيزة.",436366
دكتور تغذية وتخسيس,د. السيد كمال,"ش البيطاش, البيطاش, الاسكندرية.",227987
دكتور تغذية وتخسيس,د. السيد يسرى عبد المطلب,"ش الجمهورية, طلخا, الدقهلية.",354982
دكتور تغذية وتخسيس,د. امال فتحى عبد العزيز,"86 ش العشرين, زهراء عين شمس, عين شمس الشرقية, القاهرة.",318459
دكتور تغذية وتخسيس,د. امانى رجب داوود,"22 أ ش مراد, الجيزة, الجيزة.",444189
دكتور تغذية وتخسيس,د. امجد الزغبى,"59 أ ش عبد المنعم رياض, المهندسين, الجيزة.",123609
دكتور تغذية وتخسيس,د. امجد الناصح,"129 ش فيصل, الكوم الاخضر, فيصل, الجيزة.",510858
دكتور تغذية وتخسيس,د. اميرة محجوب,"2 ش فيضى تقاطع ش محمد سيد احمد, حلوان, القاهرة.",589035
دكتور تغذية وتخسيس,د. انجى جابر,"75 ش فوزى معاذ, سموحة, الاسكندرية.",505825
دكتور تغذية وتخسيس,د. انور حامد,"1 برج الاطباء - ش احمد عرابى, شبرا الخيمة, القليوبية.",437811
دكتور تغذية وتخسيس,د. ايمان ابراهيم,"ش الهانوفيل, الهانوفيل, الاسكندرية.",603251
دكتور تغذية وتخسيس,د. ايمان عباس,"3 ش اللوكاندة, روكسى, مصر الجديدة, القاهرة.",587638
دكتور تغذية وتخسيس,د. ايمان فكرى مصطفى,"القطعة 165 ش التسعين الشمالى, قطاع 1, التجمع الخامس, القاهرة الجديدة, القاهرة.",597590
دكتور تغذية وتخسيس,د. ايمان كامل,"10 ش 77 ج, المعادى, القاهرة.",225854
دكتور تغذية وتخسيس,د. ايمان محفوظ,"60 ش الخليفة المأمون, الشقة 301, الدور 6, برج كوين سنتر, منشية البكرى, مصر الجديدة, القاهرة.",588162
دكتور تغذية وتخسيس,د. ايمان محمد عصر,"25 ش الرصافة - الدور 3 شقة 3, محرم بك, الاسكندرية.",25613
دكتور تغذية وتخسيس,د. ايمان منصور,"8 ش الثورة - الدور 2 شقة 11, الكوربة, مصر الجديدة, القاهرة.",99773
دكتور تغذية وتخسيس,د. ايمن البدراوى,"54 ش رمسيس, روكسى, مصر الجديدة, القاهرة.",289547
دكتور تغذية وتخسيس,د. ايمن البربرى,"2 برج الاطباء ش الفيوم, الدور 2, متفرع من ش كليوباترا, الكوربة, مصر الجديدة, القاهرة.",184388
دكتور تغذية وتخسيس,د. ايمن الشرقاوى,"17 ش طلبة عويضة - القومية, الزقازيق, الشرقية.",587095
دكتور تغذية وتخسيس,د. ايناس كامل خاطر,"186 ش عبد السلام عارف, لوران, الاسكندرية.",470345
دكتور تغذية وتخسيس,د. باسم الشايب,"5 ش ابو الفدا - برج ام كلثوم - الدور 3, الزمالك, القاهرة.",445322
دكتور تغذية وتخسيس,د. باهى هانى,"55 ش شهاب متفرع من ش جامعة الدول العربية - فيلا 1 - الدور 2, المهندسين, الجيزة.",575044
دكتور تغذية وتخسيس,د. بهاء الدين ناجى,"توين تاور - المحور المركزى, الشيخ زايد, السادس من اكتوبر, الجيزة.",166845
دكتور تغذية وتخسيس,د. بهاء جمال غوردون,"17 ش ابراهيم اللقانى, الدور 5, روكسى, مصر الجديدة, القاهرة.",293653
دكتور تغذية وتخسيس,د. تامر بدران,"230 ش الهرم, الهرم, الجيزة.",486434
دكتور تغذية وتخسيس,د. تامر محمد امين,"129 ش التحريربرج الزهراء, الدقى, الجيزة.",621860
دكتور تغذية وتخسيس,د. تيسير عزب,"43 ش اسنا، متفرع من ش عبد المنعم سند, كامب شيزار, الاسكندرية.",622015
دكتور تغذية وتخسيس,د. جاسر البربرى,"المنطقة الادارية, مدينة الرحاب, القاهرة.",394207
دكتور تغذية وتخسيس,د. جرجس فكرى,"2 ش صادق عجرمة, الزاوية الحمراء, القاهرة.",402499
دكتور تغذية وتخسيس,د. جيلان عثمان,"59 ش الحجاز, ميدان الحجاز, مصر الجديدة, القاهرة.",289312
دكتور تغذية وتخسيس,د. جيهان ابراهيم عبد الجواد,"16 عمارات رابعة الاستثمارى - ش النزهة - الدور 4 شقة 41, مدينة نصر, القاهرة.",452647
دكتور تغذية وتخسيس,د. جيهان السيد,"26 ش عطية الصوالحى, الدور 3, الحى الثامن, مدينة نصر, القاهرة.",675418
دكتور تغذية وتخسيس,د. حاتم نعمان,"فيلا 79 - ش سامح جادو - القرية السياحية السادسة, السادس من اكتوبر, الجيزة.",406593
دكتور تغذية وتخسيس,د. حازم محمود,"ش على مبارك تقاطع ش النادى, طنطا, الغربية.",592074
دكتور تغذية وتخسيس,د. حسام عبد الغفار,"96 ش مصطفى النحاس - الدور 5 شقة 502, مدينة نصر, القاهرة.",596663
دكتور تغذية وتخسيس,د. حسن فكرى منصور,"ش احمد عرابى, دمنهور, البحيرة.",382419
دكتور تغذية وتخسيس,د. حنان حلمى عبد الحكيم,"2 ش محمد سيد حمادة, الخصوص, القليوبية.",493842
دكتور تغذية وتخسيس,د. حنان فاروق,"53 ش الفتح, فلمينج, الاسكندرية.",638793
دكتور تغذية وتخسيس,د. خالد جودت,"73 ش الميرغنى, كلية البنات, مصر الجديدة, القاهرة.",136766
دكتور تغذية وتخسيس,د. خالد صلاح,"103 عمارات التوفيق ش الطيران, الدور 2, مدينة نصر, القاهرة.",347456
دكتور تغذية وتخسيس,د. خالد عبد المنعم التلاوى,"13 ش السلام، متفرع من ش طه حسين, ارض سلطان, المنيا.",470238
دكتور تغذية وتخسيس,د. داليا البنهاوى,"59 ش الحجاز, ميدان المحكمة, مصر الجديدة, القاهرة.",623226
دكتور تغذية وتخسيس,د. داليا بهجت,"15 ش عبد الله العربى, مدينة نصر, القاهرة.",454503
دكتور تغذية وتخسيس,د. داليا يوسف,"طريق الواحات - مدينة الفردوس - عمارة 61 - الدور 2 شقة 204, السادس من اكتوبر, الجيزة.",590731
دكتور تغذية وتخسيس,د. دعاء البدراوى,"القطعة 79 ش 17, متفرع من ش اخناتون, منطقة خدمات الحى الاول, التجمع الخامس, القاهرة الجديدة, القاهرة.",668691
دكتور تغذية وتخسيس,د. دعاء جنينة - دكتوراة التغذية العلاجية والصحة العامة,"59 عمارة قبنورى - ش عمر لطفى - الدور 3, الابراهيمية, الاسكندرية.",347327
دكتور تغذية وتخسيس,د. دينا الهلالى,"160 ش احمد شوقى, رشدى, الاسكندرية.",430229
دكتور تغذية وتخسيس,د. دينا خليفة,"6 ش 100 ميدان الحرية, المعادى, القاهرة.",487447
دكتور تغذية وتخسيس,د. رامى ابو هيف,"8 ش الكوثر, المهندسين, الجيزة.",439065
دكتور تغذية وتخسيس,د. رامى احمد رمزى,"107 ش فيصل, المريوطية, فيصل, الجيزة.",599488
دكتور تغذية وتخسيس,د. رامى سعيد عامر,"88 عمارة جاد ش الميرغنى, الدور 2, مصر الجديدة, القاهرة.",461383
دكتور تغذية وتخسيس,د. راندا السيد الدمناوى,"139 ش على مشرفة, دمياط, دمياط.",503904
دكتور تغذية وتخسيس,د. رانيا السيد عبد العليم,"203 ش السودان, المهندسين, الجيزة.",463330
دكتور تغذية وتخسيس,د. رانيا عادل محمود,"92 ش مؤسسة الزكاة, المرج, القاهرة.",480912
دكتور تغذية وتخسيس,د. رحاب عبد المجيد,"5 ش الشباب - الحى الثالث, الشيخ زايد, السادس من اكتوبر, الجيزة.",597766
دكتور تغذية وتخسيس,د. رشا الشناوى,"., التجمع الخامس, القاهرة الجديدة, القاهرة.",452281
دكتور تغذية وتخسيس,د. روبير جورج فوزى,"ش بركات, طره, القاهرة.",402565
دكتور تغذية وتخسيس,د. ريم سمير,"القطعة 162 ش التسعين الشمالى, التجمع الخامس, القاهرة الجديدة, القاهرة.",635500
دكتور تغذية وتخسيس,د. ريم محمد عيد,"11 بلوك 42 ش محمد متولى الشعراوى, مدينة نصر, القاهرة.",678603
دكتور تغذية وتخسيس,د. ريهام صفوت - نيوترى لايف كلينك,"119 ش الثورة, مصر الجديدة, القاهرة.",373919
دكتور تغذية وتخسيس,د. ريهام عبد الغفور الموافى,"11 ب ش الثروة المعدنية, حدائق الاهرام, الهرم, الجيزة.",587805
دكتور تغذية وتخسيس,د. ريهام مصطفى ابو عميرة,"59 ش عمر لطفى, الابراهيمية, الاسكندرية.",598053
دكتور تغذية وتخسيس,د. زينب عيد,"31 ش عبد المقصود عبد العظيم, البساتين, القاهرة.",677435
دكتور تغذية وتخسيس,د. سارة الحسينى,"1 ش احمد عرابى, المهندسين, الجيزة.",590092
دكتور تغذية وتخسيس,د. سارة سمير الاشقر,"26 ش حسب الله الكفراوى - مركز الحى الثانى, دمياط الجديدة, دمياط.",528910
دكتور تغذية وتخسيس,د. سارة عادل احمد,"105 عمارات التوفيق ش الطيران, مدينة نصر, القاهرة.",671143
دكتور تغذية وتخسيس,د. سارة عفيفى,"المحور المركزى - ميدان ماجدة, الحى السابع, السادس من اكتوبر, الجيزة.",595458
دكتور تغذية وتخسيس,د. سارة محمد,"المنطقة الادارية, مدينة الرحاب, القاهرة.",570248
دكتور تغذية وتخسيس,د. سامح زيتون,"22 ش سوريا , رشدى, الاسكندرية.",211879
دكتور تغذية وتخسيس,د. سامح محسن,"39 ش زهير صبرى, مدينة نصر, القاهرة.",313485
