Category,Name,Address,ID
دكتور جلدية,د. ايمان احمد ابو ستة,"25 ش اسماعيل رمزى, ميدان الجامع, مصر الجديدة, القاهرة.",183091
دكتور جلدية,د. ايمان البابلى,"432 ن ش 16أ, حدائق الاهرام, الهرم, الجيزة.",531382
دكتور جلدية,د. ايمان الشافعى,"1 عمارات المهندسين -, مدينة نصر, القاهرة.",457111
دكتور جلدية,د. ايمان الفقى,"1 ابراج برعى بلازا - المحور المركزى - ميدان الحصرى, الحى السابع, السادس من اكتوبر, الجيزة.",213534
دكتور جلدية,د. ايمان المرسى,"20 ش مسجد الهداية, الهداية, الاسكندرية.",140594
دكتور جلدية,د. ايمان جرجس دانيال,"ش سعد زغلول, الفشن, بنى سويف.",318513
دكتور جلدية,د. ايمان حامد المرسى,"عمارة الخليج - ش مسجد الهدايا, بولكلى, الاسكندرية.",21769
دكتور جلدية,د. ايمان سعد,"ش سعد زغلول , النمسا, السويس.",111484
دكتور جلدية,د. ايمان سعد رزق,"ش الشهيد احمد عبد العزيز, السنبلاوين, الدقهلية.",351146
دكتور جلدية,د. ايمان سعد رزق,"ش عبد المنعم, السنبلاوين, الدقهلية.",353027
دكتور جلدية,د. ايمان صلاح,"35 ش محمد النادى, مدينة نصر, القاهرة.",462353
دكتور جلدية,د. ايمان عبد الغفار,"14 أ ش شريف باشا, الكوربة, مصر الجديدة, القاهرة.",667644
دكتور جلدية,د. ايمان مكاوى,"القطعة 9091 ش 9, المقطم, القاهرة.",396354
دكتور جلدية,د. ايمان ياسين,"30 ش اسماء فهمى, تقاطع ش نبيل الوقاد, ارض الجولف, مصر الجديدة, القاهرة.",691308
دكتور جلدية,د. ايمن الدبس,"6 ش عابدين, العياط, الجيزة.",613315
دكتور جلدية,د. ايمن الديب,"ش صيدلية فاطمة متفرع من ش احمد عرابى, اسنا, الاقصر.",597193
دكتور جلدية,د. ايمن الرفاعى,"32 ش البطل احمد عبد العزيز, المهندسين, الجيزة.",592952
دكتور جلدية,د. ايمن الزغبى السعيد,"9 ش طه الحكيم, طنطا, الغربية.",275007
دكتور جلدية,د. ايمن السيسى,", الشقة 318, الدور 5, ميدان بن الحكم, عمارات بيت العز - عمارة أ, الزيتون, القاهرة.",183096
دكتور جلدية,د. ايمن الوسيمى,"261 ش الترعة البولاقية, شبرا, القاهرة.",478847
دكتور جلدية,د. ايمن خليل منصور,"52 ش الطيران, مدينة نصر, القاهرة.",675754
دكتور جلدية,د. ايمن سليمان الشناوى,"ش بورسعيد, ايتاى البارود, البحيرة.",370305
دكتور جلدية,د. ايمن منير,"ش جيهان, المنصورة, الدقهلية.",278553
دكتور جلدية,د. ايناس ابو الفتح,"54 ش جمال عبد الناصر ميدان شرف - برج الكوثر - الدور 4, شبين الكوم, المنوفية.",530641
دكتور جلدية,د. ايناس خورشيد,"5 ش الشباب - الحى الثالث, الشيخ زايد, السادس من اكتوبر, الجيزة.",602949
دكتور جلدية,د. ايناس شاكر طه,"11 ش عيد مصطفى, برج بلازا الطبى, فيصل, الجيزة.",509511
دكتور جلدية,د. ايناس عبد المنعم,"المحور المركزى - ابراج المدينة سنتر - برج أ, السادس من اكتوبر, الجيزة.",345826
دكتور جلدية,د. اية مجدى العربانى,"55 ش النادى الرياضى - برج الاطباء - الدور 5, فيصل, الجيزة.",602430
دكتور جلدية,د. ايهاب نجيب,"197 ش الترعة البولاقية - الدور 1, شبرا, القاهرة.",183097
دكتور جلدية,د. ايهاب يونس,"340 عمارات العرائس - ش السودان, المهندسين, الجيزة.",183190
دكتور جلدية,د. باسم حبشى بشاى,"ش 23 يوليو, وسط البلد, قنا.",567706
دكتور جلدية,د. باسم حبيب جرجس,"ميدان الساعة - عمارة حماد ماركت - الدور 3, طنطا, الغربية.",524472
دكتور جلدية,د. بثينة طارق,"23 ش ترعة الغزالية, الشهداء, المنوفية.",548037
دكتور جلدية,د. بدور احمد موسى,"30 ش الكوثر, مدينة نصر, القاهرة.",435675
دكتور جلدية,د. بدور السيد احمد موسى,"23 ش عرابى - الدور 2, وسط البلد, القاهرة.",185477
دكتور جلدية,د. بسمة السيد,"23 ش عمر بن الخطاب - ارض الجمعية, امبابة, الجيزة.",571970
دكتور جلدية,د. بسمة شهاب,"1 ش فيصل, فيصل, الجيزة.",682387
دكتور جلدية,د. بسنت سامح,"145 ش شبرا, شبرا, القاهرة.",595669
دكتور جلدية,د. بكر الظواهرى,"6 ش جواد حسنى, باب اللوق, القاهرة.",305310
دكتور جلدية,د. بكر ثروت,"143 ش مصر والسودان, حدائق القبة, القاهرة.",254518
دكتور جلدية,د. بهاء صبحى,"1 ش 45, المعصرة, القاهرة.",456946
دكتور جلدية,د. بهجت مطاوع,"90 أ ش احمد عرابى ميدان سفنكس, العجوزة, الجيزة.",183193
دكتور جلدية,د. بهية جويلى,"ش احمد عرابى, دمنهور, البحيرة.",356890
دكتور جلدية,د. بيومى ابراهيم عيسى,"ش سعد زغلول, زفتى, الغربية.",336155
دكتور جلدية,د. تاج الدين عنبر,"9 ش همدان متفرع من ش مراد - ميدان الجيزة, الجيزة, الجيزة.",153410
دكتور جلدية,د. تامر نعمانى,"ش الشموت, منشية النور, بنها, القليوبية.",665454
دكتور جلدية,د. توحة محمد الحريرى,"ش كلية التجارة, بنها, القليوبية.",305184
دكتور جلدية,د. تيمور محمد خليفة,"2 ش مظلوم, باب اللوق, القاهرة.",273063
دكتور جلدية,د. تيمور مصطفى ابو هنيدى,"54 ش عثمان بن عفان, ميدان سفير, مصر الجديدة, القاهرة.",273062
دكتور جلدية,د. ثريا حسنى,"13 عمارات رابعة الاستثمارى - ش النزهة, مدينة نصر, القاهرة.",588733
دكتور جلدية,د. ثناء صبرى,"ش عبد السلام الشاذلى - برج تبارك, دمنهور, البحيرة.",587107
دكتور جلدية,د. جلال عبد المقصود,"141 ش محمد فريد, عابدين, القاهرة.",168087
دكتور جلدية,د. جلال محمد الجيار,"ش مكة المكرمة المجاورة الاولى, الحى السابع, السادس من اكتوبر, الجيزة.",156926
دكتور جلدية,د. جمال ابو الفتوح,"ش صبرى ابو علم, المنصورة, الدقهلية.",279537
دكتور جلدية,د. جمال سامى حداد,"24 ش المحاسبة, بولكلى, الاسكندرية.",96387
دكتور جلدية,د. جميل مصطفى درويش,"8 ش عبد العزيز الطحان, الزاوية الحمراء, القاهرة.",273060
دكتور جلدية,د. جميل مصطفى درويش,"5 ش يوسف خليل, شبرا الخيمة, القليوبية.",416497
دكتور جلدية,د. جورج فؤاد نصر,"25 عمارة سينما ماجدة - ش المراغى, حلوان, القاهرة.",384589
دكتور جلدية,د. جورج منير سابا,"22 ش الغرفة التجارية - الدور 1, محطة الرمل, الاسكندرية.",195597
دكتور جلدية,د. جون جميل الحلبى,"48 ش سليم الاول, الشقة 7, الدور 2, الزيتون, القاهرة.",687577
دكتور جلدية,د. جين الحناوى,"45 ش عثمان بن عفان, ميدان الاسماعيلية, مصر الجديدة, القاهرة.",593042
دكتور جلدية,د. حاتم زهدى,"106 ش مصدق, الدقى, الجيزة.",163867
دكتور جلدية,د. حاتم زيدان محمد,"امتداد ش يسرى راغب, اسيوط, اسيوط.",277515
دكتور جلدية,د. حاتم غريب,"122 ش التوفيق, مدينة نصر, القاهرة.",439917
دكتور جلدية,د. حازم المهندس,"104 ش فيصل, الدور 5, برج الفاروق, فيصل, الجيزة.",670949
دكتور جلدية,د. حازم سيف النصر,"1 ميدان الحجاز - برج الصفا الطبى - الدور 6, المهندسين, الجيزة.",381094
دكتور جلدية,د. حازم يونس استشارى طب وجراحات التجميل والتغذية العلاجية,"13 ش د. محمد رافت ناصية سنيما فريال, محطة الرمل, الاسكندرية.",203969
دكتور جلدية,د. حامد عبد الله حامد,"28 ش مراد - الدور 6, الجيزة, الجيزة.",12361
دكتور جلدية,د. حامد كامل,"6 أ ش عيسى حمدى, العجوزة, الجيزة.",393550
دكتور جلدية,د. حسن امين عفية,"72 ش محرم بك, محرم بك, الاسكندرية.",23982
دكتور جلدية,د. حسن سمير,"5 ابراج الامريكية - المحور المركزى - ميدان الحصرى, الحى السابع, السادس من اكتوبر, الجيزة.",599224
دكتور جلدية,د. حسن عطية,"21 ش البطل احمد عبد العزيز, المهندسين, الجيزة.",586921
دكتور جلدية,د. حسن محمد حسن,"280 ب ش ترعة الجبل, الدور 2, حدائق الزيتون, القاهرة.",185478
دكتور جلدية,د. حسنى عوض,"132 ش التحرير, الدور 3, الدقى, الجيزة.",185480
دكتور جلدية,د. حسين السيد محمد,"ش عباس الاعصر, الزقازيق, الشرقية.",286192
دكتور جلدية,د. حسين حسب النبى,"27 أ ش بغداد, برج الاطباء, الكوربة, مصر الجديدة, القاهرة.",273057
دكتور جلدية,د. حسين فهمى,"28 ش مصدق - الدور 1, الدقى, الجيزة.",587275
دكتور جلدية,د. حسين قطب الجلادى,"ش صلاح سالم - برج مكة - الدور 3, طلخا, الدقهلية.",600459
دكتور جلدية,د. حسين محمد عبد الحميد,"33 ش الجيش, الاميرية, القاهرة.",273058
دكتور جلدية,د. حلمى نجيب,"42 ش حمدى, وسط البلد, القاهرة.",53061
دكتور جلدية,د. حمزة محمد,"1 ش يثرب, تقاطع ش السودان, المهندسين, الجيزة.",183195
دكتور جلدية,د. حنان اسماعيل راشد,"65 ش الجلاء البحرى, شبين الكوم, المنوفية.",544256
دكتور جلدية,د. حنان على,"6 أ ش بطرس غالى, روكسى, مصر الجديدة, القاهرة.",290484
دكتور جلدية,د. حنان محمد صالح,"50 ش ترعة الجندى - الوايلى الكبير, حدائق القبة, القاهرة.",592317
دكتور جلدية,د. حنفى عبد العظيم حنفى,"ش التحرير, كفر صقر, الشرقية.",352081
دكتور جلدية,د. خالد ابو الفتوح شاهين,"الشارع القديم, الباجور, المنوفية.",299510
دكتور جلدية,د. خالد الحوشى,"5 ش رمسيس, الكوربة, مصر الجديدة, القاهرة.",545531
دكتور جلدية,د. خالد النحاس,"5 ب عمارات الهيئة العربية للتصنيع ش مكرم عبيد, الدور 2, مدينة نصر, القاهرة.",679053
دكتور جلدية,د. خالد شاهين,"ش الجلاء, شبين الكوم, المنوفية.",287653
دكتور جلدية,د. خالد عبد المنعم بهجت,"2 ش هشام لبيب, الدور 1, الحى الثامن, مدينة نصر, القاهرة.",50387
دكتور جلدية,د. خالد محمد غريب,"ش الجيش, كفر صقر, الشرقية.",351437
دكتور جلدية,د. خالد محمود يونس هيبه,"34 ش النقراشى - المزلقان الوسطانى - الدور 2, وسط البلد, كفر الشيخ.",605751
دكتور جلدية,د. خالد محى الدين منيب,"16 ش الكرامة, الدور 1, متفرع من ش ترعة الزمر, عمرانية, العمرانية الغربية, الهرم, الجيزة.",185481
دكتور جلدية,د. خديجة سيد,"القطعة 79 ش 17, متفرع من ش اخناتون, منطقة خدمات الحى الاول, التجمع الخامس, القاهرة الجديدة, القاهرة.",668695
دكتور جلدية,د. داليا بركة,"108 ش التحرير, الدقى, الجيزة.",449902
دكتور جلدية,د. داليا بسيونى,"106 ش جامعة الدول العربية, المهندسين, الجيزة.",458578
دكتور جلدية,د. داليا حسنين,"314 طريق الحرية, كليوباترا, الاسكندرية.",606550
دكتور جلدية,د. داليا عبد الحليم,"401 ش فيصل, الطالبية, فيصل, الجيزة.",589347
دكتور جلدية,د. داليا عبد القادر العبودى,"., سانت فاتيما, مصر الجديدة, القاهرة.",468759
دكتور جلدية,د. درويش الدسوقى,"47 ش صفية زغلول, متفرع من ش عبد الهادى غزالى, العاشر من رمضان, بور سعيد.",568296
دكتور جلدية,د. دعاء احمد عبد الرحيم,"45 المجاورة الثامنة, السادس من اكتوبر, الجيزة.",437571
دكتور جلدية,د. دعاء شعبان,"27 ش النصر, ارض الجمعية, امبابة, الجيزة.",651981
دكتور جلدية,د. دلال احمد مسعد,"53 ش المقريزى, الشقة 110, الدور 1, برج الاطباء, منشية البكرى, مصر الجديدة, القاهرة.",557473
دكتور جلدية,د. دنيا علاء فرج,"9 ش محمد كريم, مدينة نصر, القاهرة.",680056
دكتور جلدية,د. دينا الرفاعى,"18 ش مصطفى رفعت, مساكن شيراتون, مصر الجديدة, القاهرة.",586862
دكتور جلدية,د. دينا جمال,"ش الكوبرى, بنها, القليوبية.",683865
دكتور جلدية,د. دينا درغام,"14 ش سمير سيد احمد, الدور 1, المنيل, القاهرة.",682109
دكتور جلدية,د. دينا راضى ديرما كلينيك,"ش ابراهيم الشريف امتداد ش فيكتور عمانويل - ابراج مينا شهرزاد - برج ج - الدور 1, سموحة, الاسكندرية.",612243
دكتور جلدية,د. دينا عبد الله,"10 ش ابو بكر الصديق, ميدان المحكمة, مصر الجديدة, القاهرة.",673140
دكتور جلدية,د. دينا متولى سلام,"158 أ ش السودان, المهندسين, الجيزة.",463002
دكتور جلدية,د. راجية محمود ابو المكارم,"18 ش مصطفى رفعت, مساكن شيراتون, مصر الجديدة, القاهرة.",587172
دكتور جلدية,د. راجية هانى وشاحى,"25 ش مكة - الدور 3, المهندسين, الجيزة.",587403
دكتور جلدية,د. رامى قطب,"طريق مليج, شبين الكوم, المنوفية.",668278
دكتور جلدية,د. راندا موسى استشارى الامراض الجلدية والتجميل والليزر,"129 ش الميرغنى ميدان السبع عمارت, مصر الجديدة, القاهرة.",588647
دكتور جلدية,د. رانيا ابو بكر السيد,"36 ش منية مطر, المطرية, القاهرة.",477008
دكتور جلدية,د. رانيا الحسينى,"22 عمارات الشركة السعودية - ش النزهة, مصر الجديدة, القاهرة.",224399
دكتور جلدية,د. رانيا عبد العزيز رجب,"53 ش 23 يوليو, الباجور, المنوفية.",556355
دكتور جلدية,د. رانيا محمد منير,"2 ش 100 متفرع من ش 105, المعادى, القاهرة.",245907
دكتور جلدية,د. رانيا محمود الحسينى,"22 عمارات الشركة السعودية ش النزهة, الدور 4, ارض الجولف, مصر الجديدة, القاهرة.",674252
دكتور جلدية,د. رانيا مسعد سعدون,"ميدان الشهابية, دمياط, دمياط.",591828
دكتور جلدية,د. رانيا والى,"ش المركز, دسوق, كفر الشيخ.",586704
دكتور جلدية,د. رحاب العشرى,"24 ش سعد زغلول, اشمون, المنوفية.",313054
دكتور جلدية,د. رحاب حجازى,"92 ش التحرير, الدقى, الجيزة.",449991
دكتور جلدية,د. رحاب حلمى محمد,"طحانوب, شبين القناطر, القليوبية.",488427
دكتور جلدية,د. رحاب لطفى عجور,"21 ش العزب متفرع من ش المحطة, الباجور, المنوفية.",559322
دكتور جلدية,د. رحاب محمد صبحى,"1, الشقة 702, الدور 7, ميدان الحجاز, برج الصفا الطبى, المهندسين, الجيزة.",381092
دكتور جلدية,د. رحاب محمد فهمى,"16 ش الامين - برج الحكمة - الدور 4, شبين الكوم, المنوفية.",531216
دكتور جلدية,د. رحمة فايز,"5 ش البطل احمد عبد العزيز, المهندسين, الجيزة.",597777
دكتور جلدية,د. رشا ابو الوفا,"114 ش التحرير, الدقى, الجيزة.",449906
دكتور جلدية,د. رشا احمد,"55 ش الطائف, المهندسين, الجيزة.",323548
دكتور جلدية,د. رشا رشدى,"50 ش لمعى المطيعى, مدينة الهدى, حدائق حلوان, القاهرة.",642899
دكتور جلدية,د. رشا عادل البدوى,"ش الشهداء - شبرامنت, الهرم, الجيزة.",347511
دكتور جلدية,د. رشا عبد الجواد الشواف,"برج الفراج - ش جمال الدين الافغانى, المنصورة, الدقهلية.",395797
دكتور جلدية,د. رشا قاسم,"62 ش فيصل الوفاء والامل, فيصل, الجيزة.",401330
دكتور جلدية,د. رشدى محارب,"6 أ ميدان رمسيس, وسط البلد, القاهرة.",99913
دكتور جلدية,د. رفعت ابراهيم فهيم,"5 ش كامل صدقى - الدور 1 شقة 10, الفجالة, القاهرة.",185482
دكتور جلدية,د. رفعت سيفين غطاس,"تقسيم يوسف حسن, الاقصر, الاقصر.",96334
دكتور جلدية,د. رفعت هنرى امين عوض,"957 كورنيش النيل, مصر القديمة, القاهرة.",99806
دكتور جلدية,د. رمسيس حليم قلينى,"ش مصطفى كامل, نجع حمادى, قنا.",351656
دكتور جلدية,د. رمضان صالح على,"ش المحطة, سوهاج, سوهاج.",406592
دكتور جلدية,د. ريم الطنطاوى,"66 ش حسنين دسوقى, حدائق المعادى, المعادى, القاهرة.",674560
دكتور جلدية,د. ريم اهاب الدين,"14 طريق النصر, الدور 5, ميدان رابعة, مدينة نصر, القاهرة.",667999
دكتور جلدية,د. ريم على الطنطاوى,"2 ش السد العالى, حدائق المعادى, المعادى, القاهرة.",408390
دكتور جلدية,د. ريم نبيل مرزبان,"القطعة 43, منطقة خدمات الحى الاول, التجمع الخامس, القاهرة الجديدة, القاهرة.",668121
دكتور جلدية,د. ريهام حمدى,"3 ش خيرت - الدور 2 شقة 12, السيدة زينب, القاهرة.",591244
دكتور جلدية,د. ريهام عاطف عثمان,"75 ش جمال عبد الناصر ميدان شرف - برج الفيروز, شبين الكوم, المنوفية.",530602
دكتور جلدية,د. ريهام عطية,"19 بلوك 6 ش احمد الزمر, الدور 2, الحى العاشر, مدينة نصر, القاهرة.",678757
دكتور جلدية,د. زمزم هاشم,"129 ش الميرغنى ميدان السبع عمارات - الدور 6, مصر الجديدة, القاهرة.",592189
دكتور جلدية,د. زينب شاهين,"29 ميدان السيدة زينب, السيدة زينب, القاهرة.",223306
دكتور جلدية,د. زينب طوسون على,"10 ش البوسطة, الزقازيق, الشرقية.",285975
دكتور جلدية,د. زينب ماهر عبد الرحيم,"1 ش الشهيد امين بيومى, ابو النمرس, الجيزة.",602462
دكتور جلدية,د. زينب مصطفى شكرى,"13 عمارات رابعة الاستثمارى ش النزهة, مدينة نصر, القاهرة.",599519
دكتور جلدية,د. سارة القاضى,"ش العشرين - برج الشروق - الدور 2, الخامسة, الاسماعيلية.",616672
دكتور جلدية,د. سارة الهوارى,"3 ش سمير الصاوى, سراى القبة, القاهرة.",590884
دكتور جلدية,د. سارة حسن,"المنطقة الادارية, مدينة الرحاب, القاهرة.",570213
دكتور جلدية,د. سارة فيليبس حلمى,"102 ش جسر السويس, روكسى, مصر الجديدة, القاهرة.",458888
دكتور جلدية,د. سارة قطب,"55 ش النادى الرياضى - برج الاطباء, فيصل, الجيزة.",590389
دكتور جلدية,د. ساطع محمد,"8 ش الجلاء, فيكتوريا, الاسكندرية.",468787
دكتور جلدية,د. سالم سالم,"26 ش هشام لبيب, الحى الثامن, مدينة نصر, القاهرة.",273056
دكتور جلدية,د. سالى صفوت,"ش الخشاب, الزقازيق, الشرقية.",669181
دكتور جلدية,د. سامح سعيد,"برج الانوار - - الصاغة - الدور 5, الزقازيق, الشرقية.",429127
دكتور جلدية,د. سامح كرم فتح الله,"12 ش جزيرة ناصر, الاميرية, القاهرة.",128902
دكتور جلدية,د. سامح يوسف,"3 ش ابو عميرة متفرع من ش عثمان محرم, الطالبية, الهرم, الجيزة.",319686
دكتور جلدية,د. سامى حنا ميخائيل,"15 ش زنانيرى, شبرا, القاهرة.",434537
دكتور جلدية,د. سامى حنفى محمد,"53 ش مصطفى النحاس, الحى الثامن, مدينة نصر, القاهرة.",53043
دكتور جلدية,د. سامى عبد الحميد ابو زيد,"59 ش سعد زغلول, محطة الرمل, الاسكندرية.",33045
دكتور جلدية,د. سامية الكيلانى,"ميدان النحاس, سمنود, الغربية.",603104
دكتور جلدية,د. سامية عثمان نصار,"ميدان سعد زغلول, طنطا, الغربية.",275008
دكتور جلدية,د. سامية عدلى,"3 ش احمد العوامرى, شبرا, القاهرة.",431899
دكتور جلدية,د. سامية محمد عصمت,"209 ش 26 يوليو ميدان سفنكس - الدور 7, المهندسين, الجيزة.",183200
دكتور جلدية,د. سحر الحديدى,"226 ش بورسعيد متفرع من ش مجلس الشعب - الدور 1, السيدة زينب, القاهرة.",183090
دكتور جلدية,د. سحر السيد,"91 ش العباسية - برج الاطباء شقة 8, عباسية, القاهرة.",183202
دكتور جلدية,د. سحر المقدم,"82 ش اللواء عبد العزيز على, الزقازيق, الشرقية.",347884
دكتور جلدية,د. سحر محمد,"10 ابراج المدينة المنورة - ش 15 مايو, شبرا الخيمة, القليوبية.",476220
دكتور جلدية,د. سحر محمد ابراهيم,"8 ش فتحى عوض, شبرا الخيمة, القليوبية.",479563
دكتور جلدية,د. سحر محمد احمد ابو العز,"24 ش التحرير, دسوق, كفر الشيخ.",278229
دكتور جلدية,د. سلوى فهمى,"128 ش فيصل - الدور 4, الكوم الاخضر, فيصل, الجيزة.",406277
دكتور جلدية,د. سماء عيسى,"7 عمارات الشركة السعودية ش النزهة, الدور 5, ارض الجولف, مصر الجديدة, القاهرة.",673641
دكتور جلدية,د. سمر محمد رجائى,"8 ش 78 - الدور 2, المعادى, القاهرة.",185484
دكتور جلدية,د. سميحة حسن,"96 ش مصطفى النحاس, الشقة 406, الدور 4, برج الاطباء, مدينة نصر, القاهرة.",430837
دكتور جلدية,د. سمير ابو النصر,"347 ش السودان تقاطع ش عرابى, المهندسين, الجيزة.",183206
دكتور جلدية,د. سمير صبرى,"47 ش حموده, حدائق حلوان, القاهرة.",380351
دكتور جلدية,د. سمير محمود الجمل,"1 ش تيسير, شبين الكوم, المنوفية.",541596
دكتور جلدية,د. سمير مشعل,"17 ش بورسعيد, قها, القليوبية.",516740
دكتور جلدية,د. سمية عزت حماد,"4 ش الميرغنى, روكسى, مصر الجديدة, القاهرة.",426321
