Category,Name,Address,ID
دكتور عيون,د. محمد احمد نجم,"ش الجمهورية, وسط البلد, كفر الشيخ.",345567
دكتور عيون,د. محمد احمد يحيى,"26 ش عدن، متفرع من ش شهاب, المهندسين, الجيزة.",625650
دكتور عيون,د. محمد اشرف ابراهيم,"ش عمر زعفان, طنطا, الغربية.",337862
دكتور عيون,د. محمد الجماجمونى,"ش الشهيد محمد المغربى متفرع من ش سعد زغلول - عمارة جمال الحمضى, دسوق, كفر الشيخ.",475130
دكتور عيون,د. محمد السباعى ابراهيم,"ش شبين الكوم, حى السلام, الاسماعيلية.",111654
دكتور عيون,د. محمد السجينى,"130 ط ش العشرين, حدائق الاهرام, الهرم, الجيزة.",575253
دكتور عيون,د. محمد السعداوى,"ش الجيش - برج العلا, قطور, الغربية.",346068
دكتور عيون,د. محمد السعيد,"1 ش القيسارية, قها, القليوبية.",516466
دكتور عيون,د. محمد السيد,"47 ش عثمان بن عفان, ميدان الاسماعيلية, مصر الجديدة, القاهرة.",53241
دكتور عيون,د. محمد الصاوى,"64 ش بورسعيد, منوف, المنوفية.",570852
دكتور عيون,د. محمد الطاهر عبد الوهاب,"1 ش المستشفى المركزى, الخانكة, القليوبية.",272033
دكتور عيون,د. محمد العسقلانى,"73 ش الجمهورية, الحوامدية, الجيزة.",603787
دكتور عيون,د. محمد المرزوقى,"26 ش فيصل, المريوطية, فيصل, الجيزة.",596041
دكتور عيون,د. محمد المصرى,"31 ش سعد زغلول ومختار سعيد, حى الشرق, بور سعيد.",96379
دكتور عيون,د. محمد المعصراوى,"83 ش ترعة الزمر, العمرانية الشرقية, الهرم, الجيزة.",490424
دكتور عيون,د. محمد الملاح,"ش الخصوص العمومى, الخصوص, القليوبية.",290522
دكتور عيون,د. محمد الملط,"19 ش المساحة تقاطع ش عامر, الدقى, الجيزة.",387225
دكتور عيون,د. محمد النجار,"45 ش البطل احمد عبد العزيز, المهندسين, الجيزة.",528937
دكتور عيون,د. محمد الهادى على,"1 ش جميل, بنها, القليوبية.",305110
دكتور عيون,د. محمد امين انور المصرى,"3 ش هشام لبيب, الحى الثامن, مدينة نصر, القاهرة.",235260
دكتور عيون,د. محمد انور خلف,"9 ش جامعة الدول العربية, المهندسين, الجيزة.",458541
دكتور عيون,د. محمد انيس,"50 ش جزيرة العرب, المهندسين, الجيزة.",273107
دكتور عيون,د. محمد انيس,"ش عمرو بن العاص, البدرشين, الجيزة.",375860
دكتور عيون,د. محمد ايوب,"35 ش عرابى, وسط البلد, القاهرة.",280038
دكتور عيون,د. محمد بدوى,"56 طريق مصر حلوان الزراعى - برج بدر - الدور 2 شقة 2, المعادى, القاهرة.",435975
دكتور عيون,د. محمد برافو بديع,"12 ش التحرير, الدقى, الجيزة.",450071
دكتور عيون,د. محمد بهاء طاهر,"ش سعد زغلول, السنبلاوين, الدقهلية.",352572
دكتور عيون,د. محمد ثروت صيام,"49 ش اسوان الدور 1, العرب, بور سعيد.",96534
دكتور عيون,د. محمد جابر,"1 ش على عبد المجيد, عزبة النخل, القاهرة.",532886
دكتور عيون,د. محمد جمال,"ش مصر والسودان, حدائق القبة, القاهرة.",590948
دكتور عيون,د. محمد جمال صالح,"امتداد ش يسرى راغب, اسيوط, اسيوط.",587722
دكتور عيون,د. محمد جميعى احمد,"ميدان التوبة - الدور 1, دمنهور, البحيرة.",277697
دكتور عيون,د. محمد جميل,"18 ش الخليفة المأمون, مصر الجديدة, القاهرة.",693464
دكتور عيون,د. محمد جودة,"16 ش كورنيش النيل, الشقة 8, الدور 3, حى الفلل, بنها, القليوبية.",637207
دكتور عيون,د. محمد حامد,"14 ش الحجاز, ميدان المحكمة, مصر الجديدة, القاهرة.",418782
دكتور عيون,د. محمد حسام الدين زكى ندا,"ش احمد شوقى تقاطع ش ايبرس, مصطفى كامل, الاسكندرية.",53988
دكتور عيون,د. محمد حسن,"ش كفر طهرمس, فيصل, الجيزة.",393353
دكتور عيون,د. محمد حسن جهيم,"ش السوق القديم, كرداسة, الجيزة.",362362
دكتور عيون,د. محمد حسن سعيد,"ش 4 شمال متفرع من ش 45, العصافرة قبلى, الاسكندرية.",602374
دكتور عيون,د. محمد حسن عبد الله,"398 طريق الحرية, رشدى, الاسكندرية.",212130
دكتور عيون,د. محمد حسين سلام,"ش 23 يوليو, العريش, شمال سيناء.",277493
دكتور عيون,د. محمد حسين عيسى,"ش الجمهورية, ههيا, الشرقية.",362102
دكتور عيون,د. محمد حمدى,"203 ش السودان, المهندسين, الجيزة.",463332
دكتور عيون,د. محمد حنفى,"7 ب عمارات الهيئة العربية للتصنيع - ش مكرم عبيد - الدور 1, مدينة نصر, القاهرة.",371327
دكتور عيون,د. محمد خالد ابراهيم,"20 ش عبد العزيز جاويش, باب اللوق, القاهرة.",272688
دكتور عيون,د. محمد خليفة كمالى,"عمارة رمسيس - ميدان رمسيس - الدور 6, وسط البلد, القاهرة.",152095
دكتور عيون,د. محمد درويش,"1 ش زكى نبوى تقاطع ش عثمان محرم - برج الكوثر - الدور 2, العمرانية الغربية, الهرم, الجيزة.",489159
دكتور عيون,د. محمد ذكرى,"برج الاميرة ش شبين الكوم - برج الاميرة, حى السلام, الاسماعيلية.",385672
دكتور عيون,د. محمد ربيع,"21 ش المراغى, حلوان, القاهرة.",640233
دكتور عيون,د. محمد رجب,"5 ش اسماعيل الفنجرى, كامب شيزار, الاسكندرية.",41683
دكتور عيون,د. محمد رسلان,"1 ش المنشية, الطوابق, فيصل, الجيزة.",330842
دكتور عيون,د. محمد رمضان,"القطعة 162 ش التسعين الشمالى, التجمع الخامس, القاهرة الجديدة, القاهرة.",598341
دكتور عيون,د. محمد رمضان,"146 ش الجيش, قويسنا, المنوفية.",299981
دكتور عيون,د. محمد رمضان راجح,"7 ش الجمهورية, الخصوص, القليوبية.",493962
دكتور عيون,د. محمد سادات,"ش النقراشى, دمياط, دمياط.",277764
دكتور عيون,د. محمد سامح عبد الحميد,"ش حامد صلاح, طنطا, الغربية.",276748
دكتور عيون,د. محمد سامى محمود,"289 ش فيصل, فيصل, الجيزة.",235265
دكتور عيون,د. محمد سعد,"8 ش الاشراف, متفرع من ش 9, حدائق المعادى, المعادى, القاهرة.",603312
دكتور عيون,د. محمد سعد,"38 ش ربيع الجيزى, الجيزة, الجيزة.",53137
دكتور عيون,د. محمد سعد ابراهيم,"القطعة 352 ش المقطم, المقطم, القاهرة.",682233
دكتور عيون,د. محمد سعد عبد الوهاب,"ش بورسعيد, بلبيس, الشرقية.",324455
دكتور عيون,د. محمد سعيد جمعة,"10 ش الجلاء, فيكتوريا, الاسكندرية.",45748
دكتور عيون,د. محمد سعيد جمعة,"29 ش فوزى معاذ ميدان فيكتور عمانويل, سموحة, الاسكندرية.",593313
دكتور عيون,د. محمد سعيد محمود يوسف,"295 ش بورسعيد, السيدة زينب, القاهرة.",272690
دكتور عيون,د. محمد سليم القاضى,"ش مسجد الدعاة, حدائق المعادى, المعادى, القاهرة.",337744
دكتور عيون,د. محمد سمير,"ش فوزى معاذ, سموحة, الاسكندرية.",460377
دكتور عيون,د. محمد شاكر,"96 ش بورسعيد, شبين القناطر, القليوبية.",518378
دكتور عيون,د. محمد شرف الدين عبد الرحيم,"9 ش عبد الخالق ثروت متفرع من ش 26 يوليو, اسيوط, اسيوط.",587177
دكتور عيون,د. محمد شريف حسنين,"53 ش المقريزى, الشقة 504, الدور 5, برج الاطباء, منشية البكرى, مصر الجديدة, القاهرة.",557455
دكتور عيون,د. محمد شفيق,"21 ش الانصار, الدقى, الجيزة.",53141
دكتور عيون,د. محمد شوقى راشد,"7 ش البيطاش, البيطاش, الاسكندرية.",434585
دكتور عيون,د. محمد شوقى محرم,"ميدان النحاس, سمنود, الغربية.",345503
دكتور عيون,د. محمد صادق المشنب,"38 ش د. المحروقى, العجوزة, الجيزة.",45658
دكتور عيون,د. محمد صالح,"124 عمارات البحر الاحمر -, مدينة الشروق, القاهرة.",390726
دكتور عيون,د. محمد صبرى,"22 ش الدوران, شبرا, القاهرة.",434037
دكتور عيون,د. محمد صبرى,"11 ش عيد مصطفى, الدور 2, برج بلازا الطبى, فيصل, الجيزة.",509538
دكتور عيون,د. محمد صديق,"226 ش الجيش, باب الشعرية, القاهرة.",472872
دكتور عيون,د. محمد صلاح,"30 ش عبد الحميد عثمان, جسر السويس, القاهرة.",57872
دكتور عيون,د. محمد صلاح الدين,"30 درب الاثر, طنطا, الغربية.",276743
دكتور عيون,د. محمد صلاح الدين بدر,"22 ش مصدق, الدقى, الجيزة.",235269
دكتور عيون,د. محمد صلاح الدين حكيم,"5 ش مراد - الدور 1, الجيزة, الجيزة.",240639
دكتور عيون,د. محمد صلاح الدين زعتر,"35 ش الدقى, الدقى, الجيزة.",450149
دكتور عيون,د. محمد صلاح سلام,"6 ش دار المناسبات, شبين القناطر, القليوبية.",517602
دكتور عيون,د. محمد صلاح شاهين,"ش الجلاء, الدور 2, برج النحاس, طنطا, الغربية.",343173
دكتور عيون,د. محمد طاهر حجازى,"86 ش سليم الاول, حلمية الزيتون, القاهرة.",53145
دكتور عيون,د. محمد طلال,"256 ش فيصل, فيصل, الجيزة.",53211
دكتور عيون,د. محمد عادل,"31 ش عبد المنعم رياض - وراق الحضر, الوراق, الجيزة.",597716
دكتور عيون,د. محمد عاطف,"5 ش ابو الفتوح عبد الله - زهراء عين شمس, عين شمس الشرقية, القاهرة.",327417
دكتور عيون,د. محمد عباس الشلح,"ش يسرى راغب - الدور 2, اسيوط, اسيوط.",351825
دكتور عيون,د. محمد عبد البديع راشد,"84 ش حسنين دسوقى, الدور 2, حدائق المعادى, المعادى, القاهرة.",506256
دكتور عيون,د. محمد عبد البديع راشد,"18 ش الطيران, الدور 4, مدينة نصر, القاهرة.",671560
دكتور عيون,د. محمد عبد الجواد,"., الدلنجات, البحيرة.",374668
دكتور عيون,د. محمد عبد الحافظ,"20 ش البطل احمد عبد العزيز, برج الحكمة الطبى, المهندسين, الجيزة.",260503
دكتور عيون,د. محمد عبد الحكيم زكى,"70 ش الميرغنى, مصر الجديدة, القاهرة.",235271
دكتور عيون,د. محمد عبد الحليم,"برج رانيا - ش الكوبرى, بنها, القليوبية.",303587
دكتور عيون,د. محمد عبد الحميد محمد,"97 ش التحرير ميدان الدقى, الدقى, الجيزة.",271517
دكتور عيون,د. محمد عبد الرحمن,"المنطقة السادسة - الحى الرابع, التجمع الخامس, القاهرة الجديدة, القاهرة.",446074
دكتور عيون,د. محمد عبد الظاهر عواد,"12 ش هانى كامل, بنها الجديدة, القليوبية.",520197
دكتور عيون,د. محمد عبد العزيز صالح,"35 ش حسين رشدى, شبين القناطر, القليوبية.",517197
دكتور عيون,د. محمد عبد العزيز صلاح,"القطعة 7963 ش 9, الشقة 2, الدور 1, المقطم, القاهرة.",613261
دكتور عيون,د. محمد عبد الغفار,"3 ش جمال عبد الناصر - قرية المعتمدية, كرداسة, الجيزة.",553682
دكتور عيون,د. محمد عبد الفتاح زايد,"19 ميدان السيدة زينب, السيدة زينب, القاهرة.",366870
دكتور عيون,د. محمد عبد الفتاح ناصر,"121 ش النزهة, تريومف, مصر الجديدة, القاهرة.",235278
دكتور عيون,د. محمد عبد اللطيف بلطية,"3 ش على الشريف, المنيل, القاهرة.",156574
دكتور عيون,د. محمد عبد الله مصطفى,"ش مؤسسة الزكاة, المرج, القاهرة.",433093
دكتور عيون,د. محمد عبد المنعم صديق,"511 ش الاهرام ميدان الجيزة - عمارة النصر - الدور 5, الجيزة, الجيزة.",240092
دكتور عيون,د. محمد عبد المنعم على,"34 ش عدلى, وسط البلد, القاهرة.",272691
دكتور عيون,د. محمد عبد المنعم مهدى,"47 ب ش عباس العقاد, الدور 2, المنطقة الاولى, مدينة نصر, القاهرة.",677995
دكتور عيون,د. محمد عبد المنعم مهدى,"ش الحرية, تلا, المنوفية.",318966
دكتور عيون,د. محمد عثمان,"ش الهرم, الهرم, الجيزة.",589211
دكتور عيون,د. محمد عز الدين,"205 ش المسلة, المطرية, القاهرة.",447752
دكتور عيون,د. محمد عزت الشريف,"ميدان القومية - الدور 1, الزقازيق, الشرقية.",590577
دكتور عيون,د. محمد عسقلانى,"23 ش عمرو بن العاص, البدرشين, الجيزة.",610271
دكتور عيون,د. محمد عطية,"48 ش الجمهورية, الحوامدية, الجيزة.",375678
دكتور عيون,د. محمد عطية سليمان,"5 ميدان المساحة, الدقى, الجيزة.",235279
دكتور عيون,د. محمد علاء الشريف,"امتداد محور 26 يوليو, الشيخ زايد, السادس من اكتوبر, الجيزة.",560796
دكتور عيون,د. محمد علام,"53 ش المقريزى, منشية البكرى, مصر الجديدة, القاهرة.",376077
دكتور عيون,د. محمد على بكرى,"28 ش التحرير - الشوربجى, بولاق الدكرور, الجيزة.",591376
دكتور عيون,د. محمد على عبد ربه,"35 ش الجمعية, بنها الجديدة, القليوبية.",520229
دكتور عيون,د. محمد على قنديل مصطفى,"25 ش محمد عثمان, امبابة, الجيزة.",272693
دكتور عيون,د. محمد على محمد,"43 ش انس بن مالك, المهندسين, الجيزة.",53206
دكتور عيون,د. محمد على ناجى,"55 ش النادى الرياضى - برج الاطباء, فيصل, الجيزة.",509485
دكتور عيون,د. محمد عمار,"251 ش بورسعيد, السيدة زينب, القاهرة.",521942
دكتور عيون,د. محمد عمارة,"6 ميدان الفلكى, باب اللوق, القاهرة.",99609
دكتور عيون,د. محمد عمر,"6 ش اسماعيل القبانى, متفرع من ش الطيران, المنطقة الاولى, مدينة نصر, القاهرة.",589403
دكتور عيون,د. محمد عمرو صلاح الدين,"30 ش مراد, الجيزة, الجيزة.",445060
دكتور عيون,د. محمد عنانى,"ش سيف النصر, بنها, القليوبية.",304545
دكتور عيون,د. محمد عيد,"73 ش 9, المقطم, القاهرة.",272755
دكتور عيون,د. محمد عيسى,"الاردنية, العاشر من رمضان, الشرقية.",619859
دكتور عيون,د. محمد غنيم,"المنطقة الثالثة, مدينة السادات, المنوفية.",601761
دكتور عيون,د. محمد فتحى المكاوى,"1 ش المنتزة, مصر الجديدة, القاهرة.",426165
دكتور عيون,د. محمد فتحى عمر,"2 ش الامير عمر متفرع من ش قناة السويس, محرم بك, الاسكندرية.",587110
دكتور عيون,د. محمد فخرى خطاب,"92 ش التحرير, الشقة 74, الدور 6, ميدان الدقى, برج ساريدار الطبى, الدقى, الجيزة.",235282
دكتور عيون,د. محمد فرج ابو ذكرى,"4 أ عمارات الهيئة العربية للتصنيع - ش مكرم عبيد, المنطقة السادسة, مدينة نصر, القاهرة.",235284
دكتور عيون,د. محمد فريد,"172 ش النزهة, سانت فاتيما, مصر الجديدة, القاهرة.",183467
دكتور عيون,د. محمد قطب,"21 ش مصطفى كامل - برج سيتى سنتر - الدور 2, شبين الكوم, المنوفية.",535503
دكتور عيون,د. محمد كرم الباسطى,"12 ش الدقى, الدقى, الجيزة.",235288
دكتور عيون,د. محمد كريم صدقى,"5 ش البطل احمد عبد العزيز, المهندسين, الجيزة.",262571
دكتور عيون,د. محمد لطفى,"ش سعد زغلول - عمارة مصطفى الطاروطى, منيا القمح, الشرقية.",576056
دكتور عيون,د. محمد مجدى مرشد,"20 أ ش احمد فخرى, المنطقة السادسة, مدينة نصر, القاهرة.",235290
دكتور عيون,د. محمد محمود,"ش المطافى, ايتاى البارود, البحيرة.",372016
دكتور عيون,د. محمد محمود الجوهرى,"ش المديرية, طنطا, الغربية.",276741
دكتور عيون,د. محمد محمود الطويل,"ش الجمهورية, اوسيم, الجيزة.",349845
دكتور عيون,د. محمد محمود سمسم,"ش السماليهى 2, البيطاش, الاسكندرية.",587787
دكتور عيون,د. محمد محمود عبد القادر,"12 ش الجيش ميدان التحرير - الدور 3, الزقازيق, الشرقية.",185330
دكتور عيون,د. محمد محمود لاشين,"عمارة الكاشف - ش عبد المنعم رياض, بركة السبع, المنوفية.",317449
دكتور عيون,د. محمد مصطفى المهندس,"ش مصطفى كامل, منية النصر, الدقهلية.",354753
دكتور عيون,د. محمد مصطفى ضيف,"197 ش ملك حفنى, سيدى بشر قبلى, الاسكندرية.",594906
دكتور عيون,د. محمد مصطفى كمال,"26 ش عثمان محمد, طنطا, الغربية.",276739
دكتور عيون,د. محمد ممدوح علوان,"ش البوسطة, اجا, الدقهلية.",350314
دكتور عيون,د. محمد منصور,"6 ش 155, المعادى, القاهرة.",53195
دكتور عيون,د. محمد مهدى,"ش الحرية, تلا, المنوفية.",318948
دكتور عيون,د. محمد ناجح السكرى,"ش احمد عرابى, الوسطى, بنى سويف.",621466
دكتور عيون,د. محمد ناجى,"24 ش هانى كامل, بنها الجديدة, القليوبية.",520258
دكتور عيون,د. محمد نبيل النحاس,"3 ش الرملة, ميدان الجامع, مصر الجديدة, القاهرة.",235293
دكتور عيون,د. محمد نبيل على,"178 ش الجيش, باب الشعرية, القاهرة.",471810
دكتور عيون,د. محمد نبيل على عفيفى,"60 مساكن بديل العشوائيات -, الحى السادس, السادس من اكتوبر, الجيزة.",439138
دكتور عيون,د. محمد نصر,"1 ش الجزائر, المعادى الجديدة, المعادى, القاهرة.",225489
دكتور عيون,د. محمد نصر الدين,"المحور المركزى, ميدان ماجدة, السادس من اكتوبر, الجيزة.",587731
دكتور عيون,د. محمد نوارة,"115 ش سليم الاول, الزيتون, القاهرة.",53146
دكتور عيون,د. محمد نوح,"511 ش الاهرام ميدان الجيزة - عمارة النصر, الجيزة, الجيزة.",241154
دكتور عيون,د. محمد هيكل,"5 ش مسجد العوام, قليوب, القليوبية.",525812
دكتور عيون,د. محمد ياسر محمود فرج,"24 أ ش المطار, امبابة, الجيزة.",235295
دكتور عيون,د. محمد ياسين,"62 ش ابو بكر الصديق, ميدان سفير, مصر الجديدة, القاهرة.",596066
دكتور عيون,د. محمد يسرى,"181 ش جمال عبد الناصر, سيدى بشر, الاسكندرية.",597431
دكتور عيون,د. محمد يسرى المنياوى,"11 ش الحكيم متفرع من ش سعد زغلول, الجيزة, الجيزة.",455971
دكتور عيون,د. محمد يوسف,"محلية 5 - محور السادات - الحى الاول, مدينة العبور, القليوبية.",522296
دكتور عيون,د. محمد يوسف احمد,"64 ش جمال عبد الناصر - الدور 2, شبين الكوم, المنوفية.",531146
دكتور عيون,د. محمود احمد الروبى,"77 ش شبرا, شبرا, القاهرة.",235030
دكتور عيون,د. محمود احمد السمكرى,"15 ش عمر الكبير, مصر الجديدة, القاهرة.",422585
دكتور عيون,د. محمود احمد السمكرى,"19 ش المعاهدة, ابو زعبل, القليوبية.",415663
دكتور عيون,د. محمود احمد كمال,"14 ش مصدق, الدقى, الجيزة.",235034
دكتور عيون,د. محمود اسامة,"103 ش الهرم - برج الرياض, المريوطية, الهرم, الجيزة.",591137
دكتور عيون,د. محمود اسماعيل,"1 ميدان الحسين, الازهر, القاهرة.",235037
دكتور عيون,د. محمود الحديدى,"269 ش بورسعيد, السيدة زينب, القاهرة.",235039
دكتور عيون,د. محمود السعدنى,"عمارات الاوقاف - ش الجيش, وسط البلد, كفر الشيخ.",360425
دكتور عيون,د. محمود السنباوى,"488 طريق الحرية, بولكلى, الاسكندرية.",599244
دكتور عيون,د. محمود العزيزى,"82 ش عشرة - الوايلى الكبير, حدائق القبة, القاهرة.",617918
دكتور عيون,د. محمود جمال الدين ابراهيم,"11 ش نوبار ميدان لاظوغلى, السيدة زينب, القاهرة.",235040
دكتور عيون,د. محمود حسن مرسى,"197 ش عبد السلام عارف, لوران, الاسكندرية.",221107
دكتور عيون,د. محمود حسين محمد,"37 ش احمد بدوى متفرع من ش رايل, حلوان, القاهرة.",235043
دكتور عيون,د. محمود حواس,"ش مؤسسة الزكاة, المرج, القاهرة.",688689
دكتور عيون,د. محمود خطاب,"12 ش سعد زغلول, اشمون, المنوفية.",560044
دكتور عيون,د. محمود راتب,"ش يسرى راغب, اسيوط, اسيوط.",601929
دكتور عيون,د. محمود ربيع,"17 ش النمرسى, متفرع من ش عبد المنعم اسماعيل, المنيرة الشرقية, امبابة, الجيزة.",569699
دكتور عيون,د. محمود سعودى,"11 طريق البراجيل, البراجيل, الجيزة.",545618
دكتور عيون,د. محمود سعيد زيد,"24 ش حسين رشدى, شبين القناطر, القليوبية.",517207
دكتور عيون,د. محمود سيد,"الشارع العمومى, قليوب, القليوبية.",363486
دكتور عيون,د. محمود شفيق,"44 ش عبد المجيد اللبان, ميدان السيدة زينب, السيدة زينب, القاهرة.",675460
دكتور عيون,د. محمود صالح,"72 ش 9, المقطم, القاهرة.",441505
دكتور عيون,د. محمود صدقى عمر,"3 ش حسن رمضان, الدقى, الجيزة.",449890
دكتور عيون,د. محمود عبد الباسط,"76 ش الجمهورية, اوسيم, الجيزة.",559024
دكتور عيون,د. محمود عبد البديع محمد,"ش المحطة, حى غرب, سوهاج.",351728
دكتور عيون,د. محمود عبد الحميد,"50 ش الحجاز, مصر الجديدة, القاهرة.",241860
دكتور عيون,د. محمود عبد الله مصطفى,"ش مؤسسة الزكاة - برج الفاروق, عين شمس, القاهرة.",595698
دكتور عيون,د. محمود فهمى,"ش التحرير, ابو حماد, الشرقية.",364608
