Category,Name,Address,ID
دكتور جلدية,د. سناء الزغبى,"ش فلسطين, زفتى, الغربية.",333990
دكتور جلدية,د. سهام الطبشى,"98 ش التحرير, الشقة 303, الدور 3, ميدان الدقى, برج الدقى الادارى, الدقى, الجيزة.",594541
دكتور جلدية,د. سهام عزت,"93 ش الهرم - برج بيراميدز مول, المريوطية, الهرم, الجيزة.",510703
دكتور جلدية,د. سهير طه,"فيلا 13 - بلوك 9 - ش 9 - التجاريين, المقطم, القاهرة.",530420
دكتور جلدية,د. سوزان سعيد جودة,"13 /13 عمارات الشركة السعودية -, المعادى الجديدة, المعادى, القاهرة.",373390
دكتور جلدية,د. سوزان كمال,"56 ش محمد رمزى, تريومف, مصر الجديدة, القاهرة.",127577
دكتور جلدية,د. سوسن الشيخ,"ميدان التحرير, كوم حمادة, البحيرة.",371585
دكتور جلدية,د. سيد فرغلى محمد,"72 ب ش المنيل, المنيل, القاهرة.",50389
دكتور جلدية,د. سيف الله الفقى,"القطعة 18, محور 26 يوليو, داخل مول توين تاورز - مبنى C - الدور السادس - عيادة L, الشيخ زايد, السادس من اكتوبر, الجيزة.",628881
دكتور جلدية,د. شادى نبيل توما,"2 ش على نصر, عزبة النخل, القاهرة.",527810
دكتور جلدية,د. شريف رفعت اسماعيل,"ش جيهان, المنصورة, الدقهلية.",592078
دكتور جلدية,د. شريف على زكى,"ميدان المحطة, طنطا, الغربية.",576017
دكتور جلدية,د. شريف وهبى,"41 ش جزيرة العرب تقاطع ش وادى النيل, المهندسين, الجيزة.",439968
دكتور جلدية,د. شمس الدين عبد الحافظ,"ش ترعة الجندى, حدائق القبة, القاهرة.",401605
دكتور جلدية,د. شوقى الحجار,"6 ش 154, المعادى, القاهرة.",425663
دكتور جلدية,د. شوقى محمود الفرارجى,"ميدان شرف - الدور 1, شبين الكوم, المنوفية.",275449
دكتور جلدية,د. شيرين اسامة,"511 ش الاهرام ميدان الجيزة - عمارة النصر, الجيزة, الجيزة.",241159
دكتور جلدية,د. شيرين سيد احمد عبد العظيم,"القطعة 10072 طريق كارفور, الدور 6, المجاورة العاشرة, المعراج السفلى, زهراء المعادى, المعادى, القاهرة.",639533
دكتور جلدية,د. شيرين صبيح,"58 ش سوريا, المهندسين, الجيزة.",571831
دكتور جلدية,د. شيرين عادل,"ش خالد باشا, وسط البلد, الفيوم.",282711
دكتور جلدية,د. شيرين عبد المنعم محمود,"22 عمارات الشركة السعودية ش النزهة, الدور 4, ارض الجولف, مصر الجديدة, القاهرة.",591745
دكتور جلدية,د. شيرين عز الرجال العشرى,"ش الجلاء, اجا, الدقهلية.",350306
دكتور جلدية,د. شيرين فاروق جمعة,"ش الشباب, الشيخ زايد, السادس من اكتوبر, الجيزة.",594381
دكتور جلدية,د. شيرين فكرى محمد,"ش شبين الكوم, حى السلام, الاسماعيلية.",277997
دكتور جلدية,د. شيرين نادى جرجس,"64 ش مسجد سيدى بشر, سيدى بشر, الاسكندرية.",471469
دكتور جلدية,د. شيرين وفيق,"30 ش محمد كريم, مدينة نصر, القاهرة.",587199
دكتور جلدية,د. شيماء ابو المعاطى,"ش ابو زر الغفارى, متفرع من ش مصطفى النحاس, مدينة نصر, القاهرة.",677082
دكتور جلدية,د. شيماء احمد حميدة,"ش شرق السكة الحديد, ابشواى, الفيوم.",352378
دكتور جلدية,د. شيماء الشبراوى حسين,"ش مسجد ابو بكر الصديق - العدوة, ههيا, الشرقية.",468680
دكتور جلدية,د. شيماء ثابت,"301 ش ترعة الجبل, الزيتون, القاهرة.",511419
دكتور جلدية,د. شيماء فوزى,"منطقة خدمات الحى الاول, التجمع الخامس, القاهرة الجديدة, القاهرة.",590742
دكتور جلدية,د. شيماء محمود,"12 ش البطراوى, الدور 2, المنطقة الاولى, مدينة نصر, القاهرة.",595397
دكتور جلدية,د. شيماء مختار,"83 ش الثلاثينى, العمرانية الغربية, الهرم, الجيزة.",488984
دكتور جلدية,د. صالح الشيمى,"ش الجمهورية, الخانكة, القليوبية.",271976
دكتور جلدية,د. صباح انور سيد,"19 ش منية السرج, شبرا, القاهرة.",231094
دكتور جلدية,د. صباح انور سيد,"54 ش رمسيس, الدور 2, متفرع من ش بطرس غالى, روكسى, مصر الجديدة, القاهرة.",617759
دكتور جلدية,د. صباح حسين الشعشاعى,"79 ش مصر والسودان, حدائق القبة, القاهرة.",398581
دكتور جلدية,د. صبحى الحفناوى,"ش الجلاء - الدور 2, المنصورة, الدقهلية.",403147
دكتور جلدية,د. صبحى كمال حناوى,"54 ش 15 مايو - الدور 3, شبرا الخيمة, القليوبية.",185488
دكتور جلدية,د. صبرى خضر,"ش التحرير, كفر صقر, الشرقية.",351409
دكتور جلدية,د. صفاء عيسى,"ش الجيش, قنطرة غرب, الاسماعيلية.",613058
دكتور جلدية,د. صلاح ابراهيم,"25 ش الحوض المرصود, السيدة زينب, القاهرة.",183215
دكتور جلدية,د. صلاح احمد خليل,"28 ش عمرو بن العاص متفرع من ش جمال عبد الناصر, الحرفيين, القاهرة.",216613
دكتور جلدية,د. صلاح الدين بدوى,"91 ش مصر والسودان, حدائق القبة, القاهرة.",183216
دكتور جلدية,د. صلاح عبد النبى,"ش كوبرى البحر, شبين القناطر, القليوبية.",421392
دكتور جلدية,د. صلاح عبد النبى,"ش كوبرى البحر, ابو زعبل, القليوبية.",422345
دكتور جلدية,د. صلاح عمارة,"القطعة 165 ش التسعين الشمالى, قطاع 1, التجمع الخامس, القاهرة الجديدة, القاهرة.",686459
دكتور جلدية,د. ضحى احمد طه,"16 ش محمود فهمى النقراشى, قويسنا, المنوفية.",572902
دكتور جلدية,د. ضياء الدين جميل,"329 ش بورسعيد, السيدة زينب, القاهرة.",273101
دكتور جلدية,د. طارق احمد عمارة,"93 ش المنيل, المنيل, القاهرة.",427090
دكتور جلدية,د. طارق العماوى,"2 بلوك 6 ش احمد الزمر, الدور 4, الحى العاشر, مدينة نصر, القاهرة.",445285
دكتور جلدية,د. طارق الغندور,"19 ش ابن الحكم ميدان حلمية الزيتون, حلمية الزيتون, القاهرة.",183486
دكتور جلدية,د. طارق بشر,"90 ش المنيل, الدور 2, المنيل, القاهرة.",246393
دكتور جلدية,د. طارق بشر,"ش اثار سقارة, البدرشين, الجيزة.",375316
دكتور جلدية,د. طارق عبد الحميد النجار,"87 ش الوحدة, امبابة, الجيزة.",569929
دكتور جلدية,د. طارق منير ذكى,"19 ش عبد الجليل ميدان ابن سندر, منشية البكرى, مصر الجديدة, القاهرة.",169207
دكتور جلدية,د. طارق نور,"4 عمارة النصر - ميدان الجيزة - الدور 4, الجيزة, الجيزة.",183218
دكتور جلدية,د. طاهر محمد ابو الغيط,"511 ش الاهرام ميدان الجيزة - عمارة النصر, الجيزة, الجيزة.",240612
دكتور جلدية,د. عائشة عبد المنعم,"17 ش البوسطة, المنشية, الاسكندرية.",273293
دكتور جلدية,د. عائشة محمد ربيع,"6 ش الاسماعيلية - كفر عبده, رشدى, الاسكندرية.",419173
دكتور جلدية,د. عادل ابراهيم,"17 عمارات رابعة الاستثمارى - ش النزهة, مدينة نصر, القاهرة.",183221
دكتور جلدية,د. عادل ابراهيم,"ش بنك مصر, المنصورة, الدقهلية.",185425
دكتور جلدية,د. عادل احمد حليم امام,"60 ش الخليفة المأمون, الدور 3, برج كوين سنتر, منشية البكرى, مصر الجديدة, القاهرة.",185487
دكتور جلدية,د. عادل الشافعى,"13 ش الفلكى, محطة الرمل, الاسكندرية.",33532
دكتور جلدية,د. عادل الشافعى,"3 ش جسر المشروع, الشهداء, المنوفية.",314053
دكتور جلدية,د. عادل بطرس زغلول,"243 ش جسر السويس, جسر السويس, القاهرة.",246400
دكتور جلدية,د. عادل سلطان,"45 ش الدقى, الدقى, الجيزة.",450133
دكتور جلدية,د. عادل مسعود,"17 عمارات رابعة الاستثمارى - , مدينة نصر, القاهرة.",597690
دكتور جلدية,د. عادل نعمان محمد,"15 ش جمال عبد الناصر, الحوامدية, الجيزة.",603880
دكتور جلدية,د. عاصم محمد فرج,"46 أ ش رمسيس متفرع من ش الاهرام, روكسى, مصر الجديدة, القاهرة.",53046
دكتور جلدية,د. عاطف فودة,"1 طريق كعبيش, الطوابق, فيصل, الجيزة.",509353
دكتور جلدية,د. عبد الحليم ابو النور,"60 ش نخلة المطيعى, الشقة 5, الدور 1, تريومف, مصر الجديدة, القاهرة.",315924
دكتور جلدية,د. عبد الحميد الشربينى,"5 ش الجيش, قويسنا, المنوفية.",299768
دكتور جلدية,د. عبد الخالق حسن يونس,"25 ش العشرين, جسر السويس, القاهرة.",50392
دكتور جلدية,د. عبد الرؤوف محمد,"المحور المركزى - ميدان ليلة القدر, الحى 12, السادس من اكتوبر, الجيزة.",150657
دكتور جلدية,د. عبد الرحمن الشيمى,"ش شرق السكة الحديد, ابو زعبل, القليوبية.",345159
دكتور جلدية,د. عبد الرحمن محمود النشار,"13 ش النيل الابيض, المهندسين, الجيزة.",52998
دكتور جلدية,د. عبد الرحيم عبد الله,"2 ميدان الجامع, مصر الجديدة, القاهرة.",211317
دكتور جلدية,د. عبد السلام الشاذلى,"2 ش محمد صدقى, باب اللوق, القاهرة.",53064
دكتور جلدية,د. عبد السلام الظواهرى,"15 ش الطيران, الشقة 502, الدور 5, ميدان رابعة العدوية, مدينة نصر, القاهرة.",212532
دكتور جلدية,د. عبد السلام الظواهرى,"8 ش التدريب المهنى, اشمون, المنوفية.",561034
دكتور جلدية,د. عبد العزيز الرفاعى,"1 /1 ش اللاسلكى, المعادى الجديدة, المعادى, القاهرة.",226028
دكتور جلدية,د. عبد العزيز الطويل,"ميدان المنتزة - عمارة العقادين الكبرى, الزقازيق, الشرقية.",401770
دكتور جلدية,د. عبد العزيز عبد السلام,"40 ش الفيوم, دار السلام, القاهرة.",460817
دكتور جلدية,د. عبد العليم الزقطة,"سوق السمك, ابو كبير, الشرقية.",329893
دكتور جلدية,د. عبد الفتاح مرسى والى,"8 ش الجلاء, دمياط, دمياط.",276559
دكتور جلدية,د. عبد القادر عواد,"1 طريق كعبيش, الطوابق, فيصل, الجيزة.",509443
دكتور جلدية,د. عبد الله عيسوى,"ش 23 يوليو, برج شاكر سند, ديرب نجم, الشرقية.",330350
دكتور جلدية,د. عبد الله محمد,"25 ش منصور متفرع من ش احمد عصمت, عين شمس الشرقية, القاهرة.",183226
دكتور جلدية,د. عبد الله مصطفى,"52 ش مكرم عبيد, المنطقة السادسة, مدينة نصر, القاهرة.",53044
دكتور جلدية,د. عبد الله مصطفى,"49 ش السيدة عائشة, السيدة عائشة, القاهرة.",327685
دكتور جلدية,د. عبد المقصود عزب,"بلوك 180 - ش منشية الجمل, الزاوية الحمراء, القاهرة.",273105
دكتور جلدية,د. عبد المنعم شعبان,"ش احمد عرابى, دمنهور, البحيرة.",382362
دكتور جلدية,د. عبد الناصر شرف,"4 ش احمد الشريف, الوايلى الكبير, حدائق القبة, القاهرة.",617965
دكتور جلدية,د. عبد الهادى محمد احمد,"41 ش المهدى بن بركة, الحى السابع, مدينة نصر, القاهرة.",246404
دكتور جلدية,د. عبد ربه محمد عبد الرحمن,"16 مساكن النيل k -, مدينة السلام, القاهرة.",390673
دكتور جلدية,د. عبدالرحيم عبد الله,"2 ميدان الجامع, مصر الجديدة, القاهرة.",99763
دكتور جلدية,د. عبير احمد فرحات,"ش مدينة قونيا, دمنهور, البحيرة.",361553
دكتور جلدية,د. عبير المغربى,"56 ش الجمهورية, منوف, المنوفية.",572503
دكتور جلدية,د. عبير سليم العطار,"430 ش فيصل, فيصل, الجيزة.",597300
دكتور جلدية,د. عبير عطية توفيق,"6 ميدان النبوى المهندس - الدور 1, العجوزة, الجيزة.",175749
دكتور جلدية,د. عبير فوده,"37 ش البطل احمد عبد العزيز, المهندسين, الجيزة.",619489
دكتور جلدية,د. عزت عبد الحميد,"106 ش التحرير, الدقى, الجيزة.",52988
دكتور جلدية,د. عزمى عبد اللطيف,"50 ش محيى الدين ابو العز - الدور 1 شقة 2, الدقى, الجيزة.",163250
دكتور جلدية,د. عزة جابر عنتر,"8 ش عبد الفتاح فرج, شبين الكوم, المنوفية.",530524
دكتور جلدية,د. عزة حرفوش,"48 ش سعد زغلول, اشمون, المنوفية.",561174
دكتور جلدية,د. عزة عصمت مصطفى,"9 ش ابن الوردى متفرع من ش عمار بن ياسر, مصر الجديدة, القاهرة.",595773
دكتور جلدية,د. عزة عطوة,"برج الملكة - ش السكة الجديدة, المنصورة, الدقهلية.",352576
دكتور جلدية,د. عزة محفوظ عبد المجيد,"ش الهلالى, حى شرق, اسيوط.",277523
دكتور جلدية,د. عزة محمد جبل,"2 أ عمارات طيبة - ش الزهراء, زهراء المعادى, المعادى, القاهرة.",527558
دكتور جلدية,د. عزة محمد حسن,"12 ش احمد عرابى - برج عرابى, حى الاربعين, السويس.",295384
دكتور جلدية,د. عصام الاشمونى,"6 ش 153, الدور 2, ميدان الحرية, المعادى, القاهرة.",636984
دكتور جلدية,د. عصام العطار,"بلوك 11 - ش نادى امبابة الرياضى, امبابة, الجيزة.",262763
دكتور جلدية,د. عصام بكر عبد العال,"22 ش الجمهورية, حى الافرنج, الاسماعيلية.",278000
دكتور جلدية,د. عصام محمد شعبان,"13 ش بغداد, الدور 4, برج الاطباء, الكوربة, مصر الجديدة, القاهرة.",692195
دكتور جلدية,د. عصام يحيى خليل,"8 ش الجمهورية, الحوامدية, الجيزة.",199934
دكتور جلدية,د. عطية عبد الله عطية,"92 أ ش محمد فريد, عابدين, القاهرة.",168796
دكتور جلدية,د. عفاف المصرى,", موقف طلعت حرب - برج الدلتا, المحلة الكبرى, الغربية.",690131
دكتور جلدية,د. علا حسام,"68 ش جامعة الدول العربية, الدور 4, المهندسين, الجيزة.",355240
دكتور جلدية,د. علا رأفت,"17 ش لبنان, الشقة 8, الدور 4, المهندسين, الجيزة.",168809
دكتور جلدية,د. علا عبد العال الكمشوشى,"398 طريق الحرية , مصطفى كامل, الاسكندرية.",211488
دكتور جلدية,د. علاء الدين سرحان,"بلوك 2 - مساكن اطلس -, المقطم, القاهرة.",273018
دكتور جلدية,د. علاء حجاج,"6 ش ابن الوردى متفرع من ش عمار بن ياسر, مصر الجديدة, القاهرة.",588527
دكتور جلدية,د. علاء حسن مرعى,"64 ش جمال عبد الناصر, شبين الكوم, المنوفية.",531154
دكتور جلدية,د. علاء سمرة,"28 ب ش انور المفتى, مدينة نصر, القاهرة.",462434
دكتور جلدية,د. علاء سمرة,"911 ش بورسعيد - الوايلى الكبير, حدائق القبة, القاهرة.",617805
دكتور جلدية,د. علاء عبد العال مباشر,"5 عمارة الاوقاف - شقة 21, حى غرب, اسيوط.",277529
دكتور جلدية,د. علاء عبد المجيد,"53 ش روض الفرج, شبرا, القاهرة.",50402
دكتور جلدية,د. على ابراهيم السيد,"7 ميدان سعد زغلول - الدور 3, محطة الرمل, الاسكندرية.",273290
دكتور جلدية,د. على العرينى,"17 ميدان سعد زغلول, محطة الرمل, الاسكندرية.",32428
دكتور جلدية,د. على حسن توفيق,"53 ش عبد الله ابو السعود, ميدان هليوبوليس, مصر الجديدة, القاهرة.",50403
دكتور جلدية,د. على حسن توفيق,"18 برج هارون - ش المنصورة, ميدان الجامع, مصر الجديدة, القاهرة.",246406
دكتور جلدية,د. على رمضان,"27 ش زهنى, الظاهر, القاهرة.",273104
دكتور جلدية,د. على شعبان,"53 ش المقريزى, الدور 5, برج الاطباء, روكسى, مصر الجديدة, القاهرة.",592439
دكتور جلدية,د. على عبد السلام,"44 ش سوريا, المهندسين, الجيزة.",571801
دكتور جلدية,د. على ميرغنى,"511 ش الاهرام ميدان الجيزة, الجيزة, الجيزة.",241163
دكتور جلدية,د. علياء شعبان,"68 ش بورسعيد, الشهداء, المنوفية.",551597
دكتور جلدية,د. عماد الدين طريح,"411 أ, حدائق الاهرام, الهرم, الجيزة.",450628
دكتور جلدية,د. عماد الدين طريح,"272 د ش الضغط العالى, حدائق الاهرام, الهرم, الجيزة.",531706
دكتور جلدية,د. عماد بيومى,"2 ش عبد العظيم امين, العياط, الجيزة.",611868
دكتور جلدية,د. عماد فرج محمود استشارى الجلدية والتجميل والعلاج بالليزر,"3 برج المغربى، ش المعهد الاشتراكى, روكسى, مصر الجديدة, القاهرة.",634540
دكتور جلدية,د. عماد محمود سامى,"42 ش الجسر البرانى, دار السلام, القاهرة.",329195
دكتور جلدية,د. عمر احمد عزام,"53 ش محيى الدين ابو العز, المهندسين, الجيزة.",458509
دكتور جلدية,د. عمر الصافورى,"1 ش ابن قتيبة, الحى السابع, مدينة نصر, القاهرة.",183233
دكتور جلدية,د. عمر محمد الغنام,"2 ابراج البرعى بلازا, الدور 2, ميدان الحصرى, السادس من اكتوبر, الجيزة.",649908
دكتور جلدية,د. عمرو جعفر,"ابراج المحاربين القدامى -, وسط البلد, كفر الشيخ.",340204
دكتور جلدية,د. عمرو عبد الحكيم راتب,"93 ش 9, الدور 4, المعادى, القاهرة.",7235
دكتور جلدية,د. عمرو عز الدين شرف,"146 ش النصر - الدور 1, المعادى الجديدة, المعادى, القاهرة.",240874
دكتور جلدية,د. عمرو غريب,"51 ش فيصل, فيصل, الجيزة.",502971
دكتور جلدية,د. عمرو قطب,"30 فيلا ش الشهيد محمد قناية, الماظة, مصر الجديدة, القاهرة.",457831
دكتور جلدية,د. عمرو كامل,"60 ش الطيران, الدور 2, المنطقة الاولى, مدينة نصر, القاهرة.",671275
دكتور جلدية,د. عمرو محمد زكى,"8 عمارات اول مايو, مدينة نصر, القاهرة.",183238
دكتور جلدية,د. عمرو مصطفى عبد الوهاب,"2 ش السلام, فيصل, الجيزة.",243336
دكتور جلدية,د. عمرو ندا,"50 ش الخليفة المأمون, الشقة 506, الدور 5, منشية البكرى, مصر الجديدة, القاهرة.",241924
دكتور جلدية,د. عنايات حسن المكاوى,"1 ش حسين رشدى, شبين القناطر, القليوبية.",517288
دكتور جلدية,د. عنايات عطوة,"برج الصفا - ميدان القومية - الدور 1, الزقازيق, الشرقية.",158324
دكتور جلدية,د. غادة سعد الدين,"ش الصناعة, بلقاس, الدقهلية.",357507
دكتور جلدية,د. غادة شريف,"96 ش مصطفى النحاس, الشقة 303, الدور 3, برج الاطباء, مدينة نصر, القاهرة.",430828
دكتور جلدية,د. غادة عبد الهادى,"4 ش فريد ندا, بنها, القليوبية.",524175
دكتور جلدية,د. غادة فتحى,"4 عمارات الشركة السعودية - ش النزهة - الدور 2, مصر الجديدة, القاهرة.",589503
دكتور جلدية,د. غادة فرج استشارية الامراض الجلدية والتجميل والليزر,"2 /3 ش اللاسلكى, المعادى, القاهرة.",273968
دكتور جلدية,د. غادة محمد البطريق,"ش الطيران, مدينة نصر, القاهرة.",589641
دكتور جلدية,د. غادة مصطفى,"9 ش سعيد ذو الفقار, الشقة 501, الدور 5, ميدان الباشا, المنيل, القاهرة.",287847
دكتور جلدية,د. فادى وحيد,"145 ش منشية التحرير, عين شمس الشرقية, القاهرة.",658702
دكتور جلدية,د. فادية عبد الجواد,"18 ش الخليفة المأمون, منشية البكرى, مصر الجديدة, القاهرة.",558757
دكتور جلدية,د. فاطمة الوكيل,"17 ش حسين رشدى, شبين القناطر, القليوبية.",517187
دكتور جلدية,د. فاطمة بدر الكومى,"82 ش السودان, الدقى, الجيزة.",590008
دكتور جلدية,د. فاطمة شيش,"10 ش عبد العزيز عيسى متفرع من ش مصطفى النحاس, الحى التاسع, مدينة نصر, القاهرة.",603205
دكتور جلدية,د. فاطمة محمد,"99 ش الميرغنى, مصر الجديدة, القاهرة.",686430
دكتور جلدية,د. فانيسا حافظ,"41 ش الدقى, الدقى, الجيزة.",270345
دكتور جلدية,د. فايق موريس,"19 ش الخليفة المأمون شقة 711, روكسى, مصر الجديدة, القاهرة.",255472
دكتور جلدية,د. فتحى الصيرفى,"1 ش 15 مايو, شبرا الخيمة, القليوبية.",473332
دكتور جلدية,د. فتحى بدوى,"32 ش شبرا, شبرا, القاهرة.",246386
دكتور جلدية,د. فتحى خليف,"11 ش المحطة, شبين القناطر, القليوبية.",517799
دكتور جلدية,د. فتحى شفيق سعيد,"6 ش المديرية, طنطا, الغربية.",275029
دكتور جلدية,د. فريد احمد مصطفى,"56 ش احمد عصمت, عين شمس الشرقية, القاهرة.",273102
دكتور جلدية,د. فكرى توفيق شهاب الدين,"4 أ ش يحيى توفيق, جسر السويس, القاهرة.",52990
دكتور جلدية,د. فكرى شهاب الدين,"29 ش مكرم عبيد, المنطقة السادسة, مدينة نصر, القاهرة.",462265
دكتور جلدية,د. فكرى محمود,"117 ش جسر البحر , شبرا, القاهرة.",202631
دكتور جلدية,د. فوزية امين,"برج الكوثر - ميدان المحطة - الدور 2, المنصورة, الدقهلية.",185418
دكتور جلدية,د. فوزية عازر,"119 طريق مصر حلوان الزراعى - برج الكرنك - الدور 13, حدائق المعادى, المعادى, القاهرة.",50406
دكتور جلدية,د. فيروز خليل بدران,"59 ش عمر لطفى, الابراهيمية, الاسكندرية.",194747
