Category,Name,Address,ID
شركات امن وحراسة,ايجلز انترناشيونال للانظمة الدفاعية,"القطعة السادسة - بلوك ب, المنطقة الحرة, ميناء ادبية, السويس.",450877
شركات امن وحراسة,الفارس لتوريدات الامن الصناعى,", عمارة أ - الاردنية - سنتر المروة, العاشر من رمضان, الشرقية.",474142
شركات امن وحراسة,شركة فور هورس لخدمات رجال الاعمال,"30, المحور المركزى, الحى الرابع, السادس من اكتوبر, الجيزة.",689321
شركات امن وحراسة,سيفتى جيت للامن والخدمات,"1 ش 270, متفرع من ش النصر, المعادى الجديدة, المعادى, القاهرة.",553106
شركات امن وحراسة,سما المعادى للامن وشئون البيئة,"16 عمارات العرائس, المعادى الجديدة, المعادى, القاهرة.",606481
شركات امن وحراسة,اسلام سيرفيس للامن والحراسة,", الاردنية - سنتر المباركية, العاشر من رمضان, الشرقية.",689159
شركات امن وحراسة,بريفينشن لخدمات الامن والحراسة ونقل الاموال,"55 ش رمسيس, متفرع من ش دمشق, روكسى, مصر الجديدة, القاهرة.",625137
شركات امن وحراسة,جى اس اس للخدمات الامنية,"43 شارع اسماعيل سرى, سموحة, الاسكندرية.",540943
شركات امن وحراسة,ايلاند للتوكيلات التجارية والخدمات ش.م.م,"42 ش على باشا ذو الفقار, كفر عبده, الاسكندرية.",271134
شركات امن وحراسة,اليكس سيرفيس للأمن وخدمات الحراسة,"17 برج الشيماء ش دنشواى, سيدى جابر, الاسكندرية.",260069
شركات امن وحراسة,نسور الشرق للامن والحراسة,"8 ش احمد الزمر, مدينة نصر, القاهرة.",689186
شركات امن وحراسة,ايجيبت ليميتد انترناشونال سيرفيس,"المحور المركزى, السادس من اكتوبر, الجيزة.",438324
شركات امن وحراسة,شركة فايف ستارز سيرفيس للامن والحراسة ش . م . م,"242 ش الفتح, جناكليس, الاسكندرية.",113227
شركات امن وحراسة,ادريسو جروب - اى اس ال للامن والحراسه ونقل الاموال,"4 ش ابو المعاطى - الدور 1 شقة 3, العجوزة, الجيزة.",50318
شركات امن وحراسة,ارمى سيفتى جروب,"3 ش فاطمة رشدى, الشقة 8, الدور 2, برج الفردوس, الهرم, الجيزة.",648877
شركات امن وحراسة,اس اس جى - سمارت ايجيبت جروب,"ش المطرية, عمارات السعودية أ - برج الصفا, كوبرى القبة, القاهرة.",608799
شركات امن وحراسة,استرايك فورث للامن والخدمات,"5 ب ش غرناطة, روكسى, مصر الجديدة, القاهرة.",349952
شركات امن وحراسة,استرونجر للامن والحراسة,"6 ش فتح الله علام, الحى الثامن, مدينة نصر, القاهرة.",657831
شركات امن وحراسة,الاسكندرية الدولية للامن والحراسة,"92 ش جمال عبد الناصر, سيدى بشر بحرى, الاسكندرية.",626037
شركات امن وحراسة,الاسكندرية للخدمات الامنية,"13 ش الغرفة التجارية, الدور 10, برج الكونكورد, محطة الرمل, الاسكندرية.",345164
شركات امن وحراسة,الامل المتحدة,"ميدان الحصرى, الحى السابع, السادس من اكتوبر, الجيزة.",473590
شركات امن وحراسة,الاميرة سيرفيس,"الاردنية, العاشر من رمضان, الشرقية.",618708
شركات امن وحراسة,الاهرامات الثلاثة للامن والحراسة,"ش اولاد رجب, اللبينى, الهرم, الجيزة.",651540
شركات امن وحراسة,البلدوزر للحراسات الخاصة,"ش السينما, دسوق, كفر الشيخ.",679740
شركات امن وحراسة,الثائر للامن والحراسة,"الاردنية - عمارات المشروع الاستثمارى 2 - عمارة 11 - محل 5, العاشر من رمضان, الشرقية.",620015
شركات امن وحراسة,الثريا للخدمات الامنية,"القطعة الثالثة, البنفسج 3 - المنطقة التجارية الاولى, التجمع الاول, القاهرة الجديدة, القاهرة.",553170
شركات امن وحراسة,الحماية المتكاملة,"59 ش 104, حدائق المعادى, المعادى, القاهرة.",567938
شركات امن وحراسة,الرواد للخدمات المتكاملة,"ش رايل, حلوان, القاهرة.",587276
شركات امن وحراسة,الرواد هاى سيرفيس,"9 ش السد العالى, متفرع من ش احمد الزمر, الحى العاشر, مدينة نصر, القاهرة.",63039
شركات امن وحراسة,السيف مصر الوطنية للامن,"354 ش فيصل, برج الخواجة, الطالبية, فيصل, الجيزة.",545359
شركات امن وحراسة,الشركة المصرية العربية للأمن,"7 ش صالح محمد, متفرع من ش سهل حمزة, العمرانية الشرقية, الهرم, الجيزة.",631958
شركات امن وحراسة,الشروق لخدمات النظافة والصيانة,"برج الاء كورنيش النيل, الشقة 4, حدائق حلوان, القاهرة.",689328
شركات امن وحراسة,الشروق للامن والحراسة,"330 ش السودان, المهندسين, الجيزة.",577976
شركات امن وحراسة,الشروق للخدمات الامنية,"81 ش نبيل الوقاد, ارض الجولف, مصر الجديدة, القاهرة.",582898
شركات امن وحراسة,الصقر الذهبى للامن والحراسة,"28 ش المحكمة, طوخ, القليوبية.",665273
شركات امن وحراسة,الصقر للامن والحراسة,"5 مربع 115 ش جمال سالم, الحى السابع, مدينة نصر, القاهرة.",254035
شركات امن وحراسة,العاصمة للامن والحراسة,"67 عمارات صقر قريش, مساكن شيراتون, مصر الجديدة, القاهرة.",671364
شركات امن وحراسة,العالمية للخدمات والحراسة,"20 عمارات المروة ش احمد تيسير, الدور 2, كلية البنات, مصر الجديدة, القاهرة.",64563
شركات امن وحراسة,العروبة جروب للامن والحراسة,"29 ش المشير احمد اسماعيل, سيدى جابر, الاسكندرية.",624165
شركات امن وحراسة,العروبة للامن والحراسة,"46 ش يوسف عباس, مدينة نصر, القاهرة.",557937
شركات امن وحراسة,العقرب للامن والحراسة,"2 ابراج المهندسين، كورنيش النيل الدور 14, كورنيش المعادى, المعادى, القاهرة.",580107
شركات امن وحراسة,الكرامة,"303 ش ترعة الجبل, الزيتون, القاهرة.",404601
شركات امن وحراسة,اللواء للامن,"9 ش شاهين, منوف, المنوفية.",570667
شركات امن وحراسة,المجموعة العربية المتحدة للأمن والحراسات والنظافة,"21 ش محمد جمعه متفرع من ش عبد الغفار سليم, النزهة, مصر الجديدة, القاهرة.",606314
شركات امن وحراسة,المحبة للامن,"66 ش حسنين دسوقى, حدائق المعادى, المعادى, القاهرة.",674140
شركات امن وحراسة,المروة للامن والحراسة,"10 عمارات اول مايو طريق النصر, مدينة نصر, القاهرة.",593377
شركات امن وحراسة,المستقبل للامن والحراسة,"30 عمارات العبور طريق صلاح سالم, مصر الجديدة, القاهرة.",637599
شركات امن وحراسة,المصرية البريطانية للخدمات الامنية,"13 عمارات مصر للتعمير , المنطقة التاسعة, مساكن شيراتون, مصر الجديدة, القاهرة.",59669
شركات امن وحراسة,المعالم الدولية للتوريدات العمومية وانظمة التحكم - ايه اى سى,"فيلا 33 - - الحى الاول, التجمع الخامس, القاهرة الجديدة, القاهرة.",528642
شركات امن وحراسة,النسور للامن والحراسة,"المحور المركزى - ميدان ليلة القدر, الحى 12, السادس من اكتوبر, الجيزة.",625673
شركات امن وحراسة,النصر للامن والحراسة,"ش رايل, الدور 1, تقاطع ش لطيف, حلوان, القاهرة.",648672
شركات امن وحراسة,الهداية للامن والحراسة,"16 ب ش حسن القاضى, متفرع من ش فاطمة رشدى, الهرم, الجيزة.",664276
شركات امن وحراسة,ام اس ار للامن والحراسة,"73 عمارات صقر قريش ش عبد الحميد بدوى, مساكن شيراتون, مصر الجديدة, القاهرة.",625432
شركات امن وحراسة,ام اس ايه لخدمات الامنية,"173 ش الهرم, الكوم الاخضر, فيصل, الجيزة.",434322
شركات امن وحراسة,امان مصر,"8 ابراج سيتى ستارزالمحور المركزى الدور 5, السادس من اكتوبر, الجيزة.",624133
شركات امن وحراسة,امجاد للامن والحراسة,"23 ش ذاكر حسين, الحى السابع, مدينة نصر, القاهرة.",518051
شركات امن وحراسة,ان اس سى لخدمات الامن,"14 ش عبد الحميد لطفى, المهندسين, الجيزة.",18832
شركات امن وحراسة,انفيل لخدمات الامن والحراسة,"فيلا 8 ش بنى امية, الحى السابع, مدينة نصر, القاهرة.",670088
شركات امن وحراسة,انوبيس لخدمات الامن والحراسة,"2 عمارات النصر - طريق النصر - رابعة العدوية, مدينة نصر, القاهرة.",524494
شركات امن وحراسة,اوديت للحراسات,"10 ش ابو بكر الصديق, مدينة نصر, القاهرة.",687485
شركات امن وحراسة,اى سى للامن والحراسة,"5 ش السلطان حسين, العطارين, الاسكندرية.",671450
شركات امن وحراسة,ايجيبت تريد للامن صناعى,"10 عمارات المشروع الاستثمارى 2 الاردنية, العاشر من رمضان, الشرقية.",620109
شركات امن وحراسة,ايه اس جروب,"47 ش رمسيس, وسط البلد, القاهرة.",641174
شركات امن وحراسة,ايه اى اكتيف تكنولوجيز,"فيلا 90 - - مبارك 2, الكوثر, الغردقة.",531070
شركات امن وحراسة,بلو مارك للامن والحراسة,"29 ش الجاحظ, الحى السابع, مدينة نصر, القاهرة.",687443
شركات امن وحراسة,بلو ووتر للامن,"20 بلوك 14 - ش الخمسين - حى الواحة, مدينة نصر, القاهرة.",578713
شركات امن وحراسة,بودى جارد للحراسات الخاصة,"أ ش شهاب, المهندسين, الجيزة.",639311
شركات امن وحراسة,بيراميدز,"58 الشطر السادس, زهراء المعادى, المعادى, القاهرة.",621722
شركات امن وحراسة,بيلارز لخدمات الحراسة,"112 ش كريم جوهر, الهضبة الوسطى, المقطم, القاهرة.",693285
شركات امن وحراسة,تاتش جروب لخدمات الامن والحراسة,"39 برج سان مينا, ش خالد بن الوليد, سيدى بشر, الاسكندرية.",394033
شركات امن وحراسة,تايفون لخدمات الامن والحراسة,", الحى العاشر - عمارة 2200, زهراء مدينة نصر, مدينة نصر, القاهرة.",648679
شركات امن وحراسة,تريبل اس,"16 بلوك 35 ش عبد العزيز عيسى, متفرع من ش مصطفى النحاس, الحى التاسع, مدينة نصر, القاهرة.",663689
شركات امن وحراسة,تشاك للامن والحراسة,"177 ش ترعة الجبل, حدائق القبة, القاهرة.",156612
شركات امن وحراسة,توب سيرفيس للامن والحراسة,"4 ش حسين المعمارى, متفرع من ش محمود بسيونى, وسط البلد, القاهرة.",651161
شركات امن وحراسة,تيما للخدمات الامنية,"328, المجاورة السابعة - ميدان الحصرى, السادس من اكتوبر, الجيزة.",639314
شركات امن وحراسة,ثرى ام للامن والحراسة,"ش الجيش, قويسنا, المنوفية.",666723
شركات امن وحراسة,ثرى برازرز سيكيورتى للخدمات,"32 ش الفلكى - عمارة الاوقاف - الدور 3, باب اللوق, القاهرة.",603748
شركات امن وحراسة,جـاردز لخدمات الامن,"36 امتداد ش ولى العهد - برج عباد الرحمن - الدور 7, حدائق القبة, القاهرة.",613596
شركات امن وحراسة,جـاردز لخدمات الامن والحراسة,"91 ش جسر السويس, جسر السويس, القاهرة.",631026
شركات امن وحراسة,جاردز للامن والحراسة,"12 ش البطراوى, الدور 2, مدينة نصر, القاهرة.",677265
شركات امن وحراسة,جراند سيرفيس,"21 ش 23 يوليو, الباجور, المنوفية.",556167
شركات امن وحراسة,جراند سيرفيس للامن والحراسة,"26 ش سمير عبد الروؤف, الدور 2, امتداد ش مكرم عبيد, الحى الثامن, مدينة نصر, القاهرة.",93695
شركات امن وحراسة,جلوبال سيكيورتى لوجيستك,"ش 17, متفرع من ش اخناتون, منطقة خدمات الحى الاول, التجمع الخامس, القاهرة الجديدة, القاهرة.",668694
شركات امن وحراسة,جولدن ليون,"258 ش ترعة الجبل - الدور 2, الزيتون, القاهرة.",573017
شركات امن وحراسة,جى اوفر سيز,"338 ش الهرم - الدور 5 شقة 21, حسن محمد, الهرم, الجيزة.",572266
شركات امن وحراسة,جى فور اس للامن,"ش ابو بكر الصديق الاردنية, العاشر من رمضان, الشرقية.",618748
شركات امن وحراسة,جى فور اس للامن والحراسة,"7 ش حسن ابراهيم, تقاطع ش تاج الدين السبكى, مدينة نصر, القاهرة.",611926
شركات امن وحراسة,حراس مصر,"128 ش الهرم, الكوم الاخضر, الهرم, الجيزة.",444035
شركات امن وحراسة,حراس مصر للتوريدات العمومية,"128 ش الهرم, الكوم الاخضر, الهرم, الجيزة.",655996
شركات امن وحراسة,دايموند سيكيوريتى,"34 ش الصواف, متفرع من ش ذاكر حسين, مدينة نصر, القاهرة.",461420
شركات امن وحراسة,دلالات العالمية للخدمات الامنية,"1 ب/1 ش عاطف خطاب, تقسيم اللاسلكى, المعادى الجديدة, المعادى, القاهرة.",661785
شركات امن وحراسة,دولار للامن والحراسة,"90 ش وادى النيل - ميت عقبة, المهندسين, الجيزة.",575640
شركات امن وحراسة,دولار للحراسات الخاصة,"90 ش وادى النيل, ميت عقبة, المهندسين, الجيزة.",664143
شركات امن وحراسة,رادار للحراسات,"25 عمارات العبور طريق صلاح سالم, مدينة نصر, القاهرة.",693088
شركات امن وحراسة,رادار للحراسات والامن,"24 عمارات العبور, الدور 5, مدينة نصر, القاهرة.",689589
شركات امن وحراسة,رادار للحراسة ونقل الامول,"عمارات العبور طريق صلاح سالم, مدينة نصر, القاهرة.",457233
شركات امن وحراسة,رامر للخدمات الامنية,"6 عمارات العبور طريق صلاح سالم, الشقة 8, الدور 4, مدينة نصر, القاهرة.",94952
شركات امن وحراسة,زادا - مؤسسة اشرف فرغلى للاستيراد والتصدير,"6 ش الاسيوطى, متفرع من ش الخليفة المامون, مصر الجديدة, القاهرة.",517133
شركات امن وحراسة,سبيد سيرفيس للأمن و نقل الاموال,"كم 7 طريق القاهرة السويس الصحراوى, محور مصطفى كامل, التجمع الاول, القاهرة الجديدة, القاهرة.",61976
شركات امن وحراسة,سبيشيال تايجر للامن والحراسة,"19 أ عمارات العبور طريق صلاح سالم, الدور 2, مصر الجديدة, القاهرة.",639312
شركات امن وحراسة,سبيشيال فورسيس لخدمات الامن والحراسة,"10 ش ابراهيم راجى, بولكلى, الاسكندرية.",665058
شركات امن وحراسة,سلامكو للامن,"20 ش عبد الحكيم رفاعى, مدينة نصر, القاهرة.",682970
شركات امن وحراسة,سمارت لخدمات الامن والحراسة,"19 ش خاتم المرسلين, العمرانية الشرقية, الهرم, الجيزة.",395881
شركات امن وحراسة,سوات تيم ايجيبت لخدمات الامن,"7 ش مسجد الهدايا, بولكلى, الاسكندرية.",672534
شركات امن وحراسة,سوات لاعمال الامن والحراسة,"فيلا 98 ش عبد المنعم رياض, الحى المتميز, السادس من اكتوبر, الجيزة.",534483
شركات امن وحراسة,سواعد للامن والحراسة,"3 ش الحلو, تقاطع ش الجمهورية, طنطا, الغربية.",633960
شركات امن وحراسة,سيزر لانظمة الخدمات الامنية,"30 ش الامام ابو حنيفة, متفرع من ش الطيران, الحى السابع, مدينة نصر, القاهرة.",55007
شركات امن وحراسة,سيفتى سيرفيس اند كير,"5 ش قره ابن شريك, الدور 3, متفرع من ش مراد, الجيزة, الجيزة.",690089
شركات امن وحراسة,سيكيورتى جارد للحراسة,"6 ش نخلة المطيعى, ميدان سفير, مصر الجديدة, القاهرة.",622286
شركات امن وحراسة,سيل سيكيورتى للامن والحراسة والنظافة والخدمات,"44 ش الشهيد سيد عفيفى, متفرع من ش نبيل الوقاد, ارض الجولف, مصر الجديدة, القاهرة.",650561
شركات امن وحراسة,سيناء للامن والحراسة,"94 عمارات صقر قريش ش الشهيد سيد زكريا, مساكن شيراتون, مصر الجديدة, القاهرة.",627766
شركات امن وحراسة,شركة الاصدقاء لخدمات الامن والنظافة - بلاك وولف,"8 برج الرحمن تقاطع ش أمين حسونه مع ش محمد عارف, دوران السيوف, السيوف شماعة, الاسكندرية.",612731
شركات امن وحراسة,شركة القاهرة 2020 للخدمات المتكاملة,"4 ش احمد خيرى, مصر القديمة, القاهرة.",544899
شركات امن وحراسة,شركة ايه ام,"93 أ ش احمد عرابى, المهندسين, الجيزة.",671026
شركات امن وحراسة,شركة خدمات وحراسة المنشأت - امان,"برج الشرطة - ش نوال - الدور 7 شقة 2, العجوزة, الجيزة.",157354
شركات امن وحراسة,شركة فرست باور سكيوريتى سيرفيس جروب ش.م.م,"71 ش عثمان بن عفان, ميدان سفير, مصر الجديدة, القاهرة.",393159
شركات امن وحراسة,صن سيرفيس للخدمات والحراسة,"24 ش محمد رضوان, الحى العاشر, مدينة نصر, القاهرة.",52748
شركات امن وحراسة,عيون الصقر الذهبى 2000,"4 ش جمال حمدان, متفرع من ش الشعراوى, الحى العاشر, مدينة نصر, القاهرة.",655631
شركات امن وحراسة,فالكون جروب الدولية,"417 ش التسعين, التجمع الخامس, القاهرة الجديدة, القاهرة.",441632
شركات امن وحراسة,فايتر للامن والحراسة,"9 ش احمد النحاس, متفرع من ش اللبينى, المريوطية, فيصل, الجيزة.",667583
شركات امن وحراسة,فور سيزونز للامن والحراسة واعمال النظافة,"39 ش جسر السويس - الدور 3, جسر السويس, القاهرة.",310171
شركات امن وحراسة,فورسيز بلس للامن والحراسة,", التجمع الاول, القاهرة الجديدة, القاهرة.",685519
شركات امن وحراسة,فورسيز للامن والحراسة,"فيلا 10 - ش العروبة متفرع من صلاح سالم, مصر الجديدة, القاهرة.",343606
شركات امن وحراسة,فونيكس للخدمات الامنية,"17 أ عمارات العبور ش صلاح سالم, مصر الجديدة, القاهرة.",665716
شركات امن وحراسة,فى اى بى للخدمات الامنية,"127 ج ش مصر والسودان, الدور 5, حدائق القبة, القاهرة.",662310
شركات امن وحراسة,فيجن للخدمات الامنية,"ش زهراء المعادى, زهراء المعادى, المعادى, القاهرة.",663316
شركات امن وحراسة,كان ستارز لخدمات الامن مصر,"ش احمد فهيم متفرع من ش الطيران, الحى السابع, مدينة نصر, القاهرة.",574653
شركات امن وحراسة,كانستارز ايجيبت للخدمات الامنية,"12 ش احمد فهيم, الحى السابع, مدينة نصر, القاهرة.",664932
شركات امن وحراسة,كايرو انترناشيونال,"6 ش غرب السكة الحديد, عين شمس الغربية, القاهرة.",206133
شركات امن وحراسة,كايرو باور,"98 عمارات الامل طريق الاتوستراد, الشقة 21, الدور 2, المعادى, القاهرة.",624904
شركات امن وحراسة,كوبرا للحراسات الخاصة,", حى الجامعة, المنصورة, الدقهلية.",638177
شركات امن وحراسة,لاين سرفيس لخدمات الامن,"108 ش كريم جوهر, ارض المباحث, المقطم, القاهرة.",640472
شركات امن وحراسة,ليوبارد لخدمات الامن,"100 ش عثمان بن عفان, النزهة, مصر الجديدة, القاهرة.",593117
شركات امن وحراسة,مؤسسة الكريم للامن الصناعى,"ش السنترال الاردنية, العاشر من رمضان, الشرقية.",635154
شركات امن وحراسة,ماجنوم لخدمات الامن,"8 عمارات العبور طريق صلاح سالم, الشقة 7, الدور 6, مدينة نصر, القاهرة.",624296
شركات امن وحراسة,مارشال سيرفيس للامن والحراسة,"90 برج السوسن ش الجمهورية, المنصورة, الدقهلية.",108996
شركات امن وحراسة,محمد عرفة الحجار للامن والحراسة,"4 ش بورسعيد, الباجور, المنوفية.",558911
شركات امن وحراسة,مصر السلام للامن والحراسة ش . م . م,"40 برج الزهور ش عين شمس, حلمية الزيتون, القاهرة.",366953
شركات امن وحراسة,مك لانظمة الحماية والمراقبة,"142 برج الراوى ش مسجد الوطنية, متفرع من ش جسر السويس, جسر السويس, القاهرة.",520896
شركات امن وحراسة,مكتب الحسن للخدمات العامة والامنية,"ش بدر متفرع من ش اديب معقد, السيوف, الاسكندرية.",531823
شركات امن وحراسة,ميدل ايست للامن,"ش 9, برج الياسمين, المقطم, القاهرة.",621975
شركات امن وحراسة,ميدل ايست للخدمات الامنية,"القطعة 2046 الطريق الدائرى, المجاورة الثانية, مدينة المعراج, زهراء المعادى, المعادى, القاهرة.",639060
شركات امن وحراسة,نسور الدلتا للامن والحراسة,"ش 23 يوليو, سيدى سالم, كفر الشيخ.",576913
شركات امن وحراسة,نسور جروب لخدمات الامن,"203 ش فوزى معاذ, برج قصر السلام, سموحة, الاسكندرية.",613714
