Category,Name,Address,ID
شركات امن وحراسة,نيو جلوبال تراست,"39 ش الاندلس, الشقة 2, الدور 1, المريلاند, مصر الجديدة, القاهرة.",507835
شركات امن وحراسة,هاى بوينت للانظمة الامنية,"ش رايل, حلوان, القاهرة.",592029
شركات امن وحراسة,هاى كير,"138 ش الجمهورية - برج المروة - الدور 1, اسيوط, اسيوط.",577280
شركات امن وحراسة,وادى النيل للحراسات الخاصة,"ش سعد زغلول - برج الايمان - الدور 8, حى الشرق, بور سعيد.",572553
شركات امن وحراسة,ون جارد للامن والحراسة,"344 طريق الجيش, جليم, الاسكندرية.",693614
شركات امن وحراسة,يونيفرسال لانظمة الامن والحراسة,"29 ش الملك فيصل, الدور 4, فيصل, الجيزة.",541809
شركات امن وحراسة,يونيفرسال لخدمات الامن والحراسه ونقل الاموال,"22 ش نادي الصيد, الدقى, الجيزة.",589545
