Category,Name,Address,ID
كهرباء ميكانيكية,شركة الندى للتكييف والمقاولات,"24 ش عبد العزيز السيد, النزهة الجديدة, القاهرة.",630322
كهرباء ميكانيكية,اكسبرتك ادارة و تشغيل المنشآت و خدمات الصيانة,"15 / 5, محور 26 يوليو, السادس من اكتوبر, الجيزة.",584430
كهرباء ميكانيكية,يونيتك مصر لمواد البناء,"القطعة 235 أ, المحور الخدمى الثانى, المنطقة الصناعية الثالثة, السادس من اكتوبر, الجيزة.",44916
كهرباء ميكانيكية,شركة اتوميشن تكنولوجى,"مكتب 215 - 216 مبنى ج, نهاية المحور المركزى, مجمع على الدين, السادس من اكتوبر, الجيزة.",579552
كهرباء ميكانيكية,داتا لأنظمة الكهرباء والقوى,"21 ش حسين رمضان, الابراهيمية, الاسكندرية.",688112
كهرباء ميكانيكية,اس بى سى لصيانة وادارة المشروعات,"32 أ, الشيخ زايد, السادس من اكتوبر, الجيزة.",689095
كهرباء ميكانيكية,دلتا للخدمات الهندسية,"3 ش السلخانة, بيجام, شبرا الخيمة, القليوبية.",689661
كهرباء ميكانيكية,شركة ميكاسول - الحلول الميكاترونية للتحكم الالى ش. م. م.,"55 ش مصدق, الدور 8, الدقى, الجيزة.",328027
كهرباء ميكانيكية,زين اليكتريك للمقاولات الكهروميكانيكية والطاقة الشمسية,", دمنهور, البحيرة.",685381
كهرباء ميكانيكية,كايرو تكنيكال سنتر - سى تى سى,"قطعة 518, طريق الكلية الجوية الخلفى, المنطقة الصناعية, بلبيس, الشرقية.",619983
كهرباء ميكانيكية,الشركة الهندسية للطاقة الكهربائية,"3 ش عبد العزيز احمد, متفرع من ش محمد رفعت, النزهة الجديدة, القاهرة.",298209
كهرباء ميكانيكية,وورلد لايت للتوريدات الكهربائية ومستلزمات المصانع,"وحدة 56, الاردنية, العاشر من رمضان, الشرقية.",693607
كهرباء ميكانيكية,ال اس ايجيبت,"12 ش الربيع, المنطقة الاولى, مدينة نصر, القاهرة.",347888
كهرباء ميكانيكية,باور سينا للتوريدات الكهربائية,", الاردنية - المشروع الاستثمارى 2 - عمارة 2 - محل 12, العاشر من رمضان, الشرقية.",619748
كهرباء ميكانيكية,الرواد للانشاءات الصناعية ش.م.م,"146 برج اللؤلؤة ش المريوطية, المريوطية, الهرم, الجيزة.",46642
كهرباء ميكانيكية,هنديكو للاعمال الكهربائية,"54 ش اسماعيل سرى, سموحة, الاسكندرية.",20629
كهرباء ميكانيكية,شركة مينار الهندسية,"9 ش عبد العزيز خليل, متفرع من ش جسر السويس, الحى الثانى - النزهة, جسر السويس, القاهرة.",1603
كهرباء ميكانيكية,الباسم للمقاولات العمومية والتوريدات,"17 ش الهدى والنور, الشقة 3, الدور 1, تقسيم فريد زكى, حدائق حلوان, القاهرة.",605123
كهرباء ميكانيكية,الشركة الدولية للانشاءات والصيانة المتخصصة - انترمنت جروب,"28 ش توت عنخ امون, سموحة, الاسكندرية.",64345
كهرباء ميكانيكية,الفتح للمقاولات والاعمال الهندسية,"215 ش بورسعيد, سبورتنج, الاسكندرية.",604962
كهرباء ميكانيكية,الكتروميتال لمقاولات الكهرباء,"قطعة 28 - المنطقة الصناعية الثانية - الحرفيين, المنشية الجديدة, الاسكندرية.",145376
كهرباء ميكانيكية,المصنع الفنى للمعدات الهندسية,"5 ش عثمان بن عفان قطاع د - المنطقة الصناعية الاولى, الصالحية الجديدة, الشرقية.",44496
كهرباء ميكانيكية,الهندسية للتوريدات الكهربائية والحلول المتقدمة - اسيك,"10 ش جمال الدين عفيفى, المنطقة السادسة, مدينة نصر, القاهرة.",507652
كهرباء ميكانيكية,شركة الكتروميكانيك للتوريدات والتوكيلات الهندسية وتجهيزات مصانع الاعلاف,", تقاطع ش توت عنخ امون مع ش محمد فريد, طنطا, الغربية.",615326
كهرباء ميكانيكية,3 ايه كومشيننج للخدمات الهندسية,"10 ش الشرقاوى - المنطقة الصناعية, قليوب, القليوبية.",542120
كهرباء ميكانيكية,اباكون - ايه بى بى المقاولون العرب للانشاءات,"7 ش د. محمد كامل حسين, النزهة الجديدة, القاهرة.",136252
كهرباء ميكانيكية,ابكوم,"47 ش التسعين الشمالى, التجمع الخامس, القاهرة الجديدة, القاهرة.",467595
كهرباء ميكانيكية,اتش او ام ايجيبت,"1 ش رمضان بيومى متفرع من ش فيصل, المريوطية, فيصل, الجيزة.",577456
كهرباء ميكانيكية,ازورا جروب,"13 ش احمد حمدى, ميامى, الاسكندرية.",634533
كهرباء ميكانيكية,اس اتش جروب,"الاردنية - مركز المدينة, العاشر من رمضان, الشرقية.",619719
كهرباء ميكانيكية,اسامة الغريب للمقاولات,"كفر حجازى, المحلة الكبرى, الغربية.",557441
كهرباء ميكانيكية,استريم لاين - الشركة الفنية للتوريدات الكهروميكانيكية,"25 ش الحرمين, الحوامدية, الجيزة.",267913
كهرباء ميكانيكية,اسكندرية للمقاولات الكهربائية والميكانيكية,"40 ش السلام, السيوف, الاسكندرية.",540691
كهرباء ميكانيكية,اسما للاعمال الهندسية,"42 ش 108, حدائق المعادى, المعادى, القاهرة.",55887
كهرباء ميكانيكية,اشيدا للتوريدات,"1 عمارات توب هاوس - ش النصر متفرع من طريق 14 مايو, سموحة, الاسكندرية.",583205
كهرباء ميكانيكية,اعمار للحلول المتكاملة,"103 - الحى الثالث - المنطقة الرابعة, التجمع الخامس, القاهرة الجديدة, القاهرة.",451545
كهرباء ميكانيكية,افاق,"11 و/5 ش منشاوى متفرع من ش النصر, المعادى الجديدة, المعادى, القاهرة.",457883
كهرباء ميكانيكية,افراكون,"25 ش كمال حجاب, مصر الجديدة, القاهرة.",673242
كهرباء ميكانيكية,افيكو,"5 ابراج الحلوانى - ش الحدائق - الدور 1, كفر الدوار, البحيرة.",607196
كهرباء ميكانيكية,افيكو للاعمال الكهروميكانيكية,"ش الترعة, حى الفلل - برج فارس - الزهور الجديدة, بنها الجديدة, القليوبية.",680302
كهرباء ميكانيكية,اكتيف للمقاولات والتوريدات العمومية,"1 ش عمار متفرع من ش معمل الالبان, شبرا, القاهرة.",387987
كهرباء ميكانيكية,اكسبريس,"37 ش احمد الصاوى متفرع من ش مكرم عبيد, المنطقة السادسة, مدينة نصر, القاهرة.",192513
كهرباء ميكانيكية,اكوا باور للتوريدات الكهروميكانيكية,"المحور المركزى - ميدان ليلة القدر, الحى 12, السادس من اكتوبر, الجيزة.",634281
كهرباء ميكانيكية,الاندلس تكنولوجى للمقاولات الكهروميكانيكية,"6 ش توت عنخ امون , متفرع من ش البحر, طنطا, الغربية.",157094
كهرباء ميكانيكية,البتول لتصنيع الضفائر الكهربائية وسحب الاسلاك,"وحدة 92/12, العاشر من رمضان - المنطقة الصناعية الثالثة 3A, العاشر من رمضان, الشرقية.",630555
كهرباء ميكانيكية,البسملة للمشروعات الميكانيكية والكهربائية,"برج موافى - تقاطع ش 23 يوليو والجمهورية - الدور 4, حى الشرق, بور سعيد.",447532
كهرباء ميكانيكية,التجارية للتوريدات الكهربائية والميكانيكية,"51 ش السبع بنات, المنشية, الاسكندرية.",190498
كهرباء ميكانيكية,التعاونية للاعمال الهندسية والتركيبات,"فيلا 109, حى البنفسج 7, التجمع الاول, القاهرة الجديدة, القاهرة.",634539
كهرباء ميكانيكية,التقنية للمقاولات,"ش الاقصر, امبابة, الجيزة.",693924
كهرباء ميكانيكية,الجمعية التعاونية الانتاجية للانشاءات والتخطيط العمرانى - منارة,"4 ش السلطان حسين، تقاطع ش صفية زغلول الدور 2, محطة الرمل, الاسكندرية.",475154
كهرباء ميكانيكية,الجيزة للمقاولات والتجارة,"73 ش ترعة الزمر, نصر الدين, الهرم, الجيزة.",371804
كهرباء ميكانيكية,الحباك للمحركات الكهربائية,"القطعة 231 - - المنطقة الصناعية الثالثة, السادس من اكتوبر, الجيزة.",144028
كهرباء ميكانيكية,الحرية لصيانة الاجهزة الكهروميكانيكية,"45 ش عثمان نعمان, متفرع من ش الثلاثينى, الطالبية, الهرم, الجيزة.",656315
كهرباء ميكانيكية,الحلول الذكية,"القطعة 34 - - المنطقة الصناعية الخامسة, المنطقة الصناعية, السادس من اكتوبر, الجيزة.",386370
كهرباء ميكانيكية,الحمد للتوريدات الكهروميكانيكية,", الاردنية - مركز المدينة, العاشر من رمضان, الشرقية.",619766
كهرباء ميكانيكية,الخبراء للمشروعات الهندسية,"10 ش احمد فخرى - الدور 4, مدينة نصر, القاهرة.",343615
كهرباء ميكانيكية,الرماح للميكانيكا,"49 ش الفخرانى, السيوف, الاسكندرية.",427457
كهرباء ميكانيكية,السما للاعمال الهندسية,"44 ب برج الكوثر - ش ترسا - الدور 5 شقة 55, الهرم, الجيزة.",263561
كهرباء ميكانيكية,السويس للتجارة الميكانيكية,"353 ش 23 يوليو, حى السويس, السويس.",390420
كهرباء ميكانيكية,السيف للهندسة والمقاولات المتكاملة,"26 ش موريتانيا متفرع من ش جمال عبد الناصر - الدور 3, المندرة البحرية, الاسكندرية.",578810
كهرباء ميكانيكية,الشركة الدولية للحماية الكهربائية - ابكو,"26 ش الشهيد زكريا عبد القوى من ش ترسة - الدور 7 شقة 13, الهرم, الجيزة.",224827
كهرباء ميكانيكية,الشركة العامة للتوريدات الكهربائية والميكانيكية,"13 أ ش بستان الدكة - برج الفاروق 1 - الدور 4, وسط البلد, القاهرة.",153180
كهرباء ميكانيكية,الشركة العربية للمشروعات الكهروميكانيكية - امبيك,"40 ش حمودة محمود, اخر امتداد مكرم عبيد, المنطقة الثامنة, مدينة نصر, القاهرة.",685426
كهرباء ميكانيكية,الشركة المصرية الاوروبية لتكنولوجيا الطاقة - اتوس,"المنطقة الصناعية الثانية, المنطقة الصناعية, الاسماعيلية.",118601
كهرباء ميكانيكية,الشركة المصرية السودانية,"15 ش سليمان الحلبى, وسط البلد, القاهرة.",376194
كهرباء ميكانيكية,الشركة المصرية لتصنيع الكربون - ايجيكاربون,"3 ش شاكر الجندى - منطقة غمرة الصناعية, غمره, القاهرة.",157517
كهرباء ميكانيكية,الشركة المصرية للخدمات الهندسية,"16 ميدان المساحة, الدقى, الجيزة.",5299
كهرباء ميكانيكية,الشركة المصرية للمشروعات والتجارة,"4 ش محمود شاكر - الدور 3 شقة 301, سموحة, الاسكندرية.",520729
كهرباء ميكانيكية,الشركة الهندسية المصرية,"9 ش اسماعيل رأفت, ميدان سفير, مصر الجديدة, القاهرة.",110803
كهرباء ميكانيكية,الشركة الهندسية للمواسير الصلب والتوريدات الكهربية,"13 ش بستان الدكة - برج الفاروق - الدور 1, العتبة, القاهرة.",160843
كهرباء ميكانيكية,الطاقة وحلول التعاقد - اى سى اس,"25 ش 10، ميدان المحطة, المعادى, القاهرة.",631231
كهرباء ميكانيكية,الطبرى,"119 ش اسماعيل مهنى, العطارين, الاسكندرية.",23497
كهرباء ميكانيكية,العالمية للانظمة الهندسية,"633 طريق الحرية, جناكليس, الاسكندرية.",568884
كهرباء ميكانيكية,العالمية لنظم القوة,"9 عمارات العبور - طريق صلاح سالم - الدور 6 شقة 8, مدينة نصر, القاهرة.",431404
كهرباء ميكانيكية,العدل اليكتريك,"30 ش المصانع, المنطقة الصناعية, البساتين, القاهرة.",621158
كهرباء ميكانيكية,الفتح للتوريدات الهندسية,"5 ش بكير, ميت غمر, الدقهلية.",553079
كهرباء ميكانيكية,القدس للهندسة والمقاولات,"5 ب ش حافظ رمضان متفرع من ش مكرم عبيد - الدور 8 شقة 81, المنطقة السادسة, مدينة نصر, القاهرة.",564447
كهرباء ميكانيكية,الكترو اجيبت,"بلوك 10052, المجاورة العاشرة, المعراج العلوى, زهراء المعادى, المعادى, القاهرة.",643047
كهرباء ميكانيكية,الكترو باور كنترول,"4 عمارة الحاج نبيل اسماعيل - ش مدرسة الصنايع - الدور 2, التل الكبير, الاسماعيلية.",247710
كهرباء ميكانيكية,الكترو ماستر للاستيراد والتوريدات,"33 برج الاندلس - ش محمد الصيرفى, ميامى, الاسكندرية.",405095
كهرباء ميكانيكية,الكترو ميكانيكال هاوس,"5 ش الانصارى, روكسى, مصر الجديدة, القاهرة.",154385
كهرباء ميكانيكية,الكتروماك للمقاولات والاستشارات الهندسية,"5 ش كابول, روكسى, مصر الجديدة, القاهرة.",227615
كهرباء ميكانيكية,الكتروميكانيكل ديزاين جروب,"6 ش كلية الزراعة, الجيزة, الجيزة.",193349
كهرباء ميكانيكية,الكفراوى للمقاولات الكهروميكانيكية,"5 عمارات المشروع الاستثمارى 2 الاردنية, العاشر من رمضان, الشرقية.",620120
كهرباء ميكانيكية,الكندية للكهروميكانيكا - سيمكو,"القطعة 517, المنطقة الصناعية الثالثة - جنوب غرب أ6, العاشر من رمضان, الشرقية.",634745
كهرباء ميكانيكية,المؤسسة المصرية للتوريدات الكهروميكانيكية,", الحى الثانى - القطعة 3155, المقطم, القاهرة.",50976
كهرباء ميكانيكية,المؤسسة المصرية للتوريدات كهروميكانيكية,"3155 ش هادى جوهر, الحى الثانى, المقطم, القاهرة.",641061
كهرباء ميكانيكية,المتحدة للقوى الكهروميكانيكية,"المحور المركزى - ميدان ليلة القدر, الحى 12, السادس من اكتوبر, الجيزة.",153817
كهرباء ميكانيكية,المتخصصة للمشروعات الالكتروميكانيكال,"197 ش 26 يوليو, المهندسين, الجيزة.",590256
كهرباء ميكانيكية,المتولى للتوريدات الكهربائية,"5 ش النصر - دوران محب, المحلة الكبرى, الغربية.",113926
كهرباء ميكانيكية,المجد للمقاولات العمومية,"12 مساكن الشباب الجنوبى, الشقة 1, التجمع الاول, القاهرة الجديدة, القاهرة.",664753
كهرباء ميكانيكية,المجموعة الاستشارية للاعمال الكهروميكانيكية,"26 عمارات القضاة - , الحى الثامن, مدينة نصر, القاهرة.",564022
كهرباء ميكانيكية,المجموعة المتحدة للمقاولات الكهروميكانيكية,"3 ش حسنى متولى - الاريزونا, الهرم, الجيزة.",214294
كهرباء ميكانيكية,المجموعة المتحدة للهندسة والمقاولات,"البرج الاول - ابراج امن الدولة - عمارة الجاسكان - ش الفردوس, سموحة, الاسكندرية.",373752
كهرباء ميكانيكية,المجموعة المصرية الايطالية للمقاولات,"2 ب ش سعيد زكريا, حى السفارات, مدينة نصر, القاهرة.",336271
كهرباء ميكانيكية,المجموعة المصرية للاستثمارات الهندسية - إى إى آى جى,"28 ش عبد الرحمن صدقى, متفرع من ش مكرم عبيد, مدينة نصر, القاهرة.",44578
كهرباء ميكانيكية,المجموعة المصرية للاليكتروميكانيكال - ايجى ميك,"24 ش محمد المقريفى, الحى السادس, مدينة نصر, القاهرة.",644348
كهرباء ميكانيكية,المجموعة المصرية للهندسة والمقاولات,"13 عمارات المروة - - الدور 10 شقة 1008, كلية البنات, مصر الجديدة, القاهرة.",118386
كهرباء ميكانيكية,المجموعة الهندسية للمقاولات والتجارة,"8 /8 الشطر الثانى, زهراء المعادى, المعادى, القاهرة.",132922
كهرباء ميكانيكية,المركز الهندسى للتجارة والتوريدات الكهربائية والصناعية - اداكس,"66 ش ابى الدرداء - المدينة التجارية, المنشية, الاسكندرية.",204409
كهرباء ميكانيكية,المستقبل للخدمات الصناعية,"1 ش احمد العاقل متفرع من ش جسر السويس, جسر السويس, القاهرة.",345326
كهرباء ميكانيكية,المشكاة,", المحور المركزى, الحى العاشر, السادس من اكتوبر, الجيزة.",642049
كهرباء ميكانيكية,المصرية العربية للتوريدات العمومية,"121 ش شبرا, شبرا, القاهرة.",138709
كهرباء ميكانيكية,المصرية للانظمة الصناعية - اى اى اس,"26 ش النزهة, مدينة نصر, القاهرة.",118901
كهرباء ميكانيكية,المصرية للصناعات الهندسية والكهربائية,"9 ش عماد الدين, وسط البلد, القاهرة.",122976
كهرباء ميكانيكية,المصرية للنظم الهندسية - E. E. S,"13 ش بدر, متفرع من ش اديب معقد, السيوف شماعة, الاسكندرية.",631552
كهرباء ميكانيكية,المصطفى للادوات الكهربائية والميكانيكية,"10 ش زكريا احمد, وسط البلد, القاهرة.",58802
كهرباء ميكانيكية,المعايرجى للتجارة والتوريدات الكهروميكانيكية,"87 ش مصدق, الدقى, الجيزة.",216285
كهرباء ميكانيكية,المكتب الاستشارى ثروت - تى سى او,"162 ب ش 26 يوليو ميدان سفنكس, العجوزة, الجيزة.",436972
كهرباء ميكانيكية,المكتب العلمى للهندسة الكهروميكانيكية,"برج 119 الطريق الدائرى, وان قطامية, القطامية, القاهرة.",459774
كهرباء ميكانيكية,المكتب المصرى,"ش احمد عيسى, قليوب, القليوبية.",601986
كهرباء ميكانيكية,المكتب المصرى للهندسة واعمال الكهروميكانيكا,"المحور المركزى - ميدان ليلة القدر, الحى 12, السادس من اكتوبر, الجيزة.",428278
كهرباء ميكانيكية,المكتب الهندسى للاعمال الميكانيكية والكهربائية,"25 عمارات اسكان شباب المهندسين - - الدور 6 شقة 61, مدينة نصر, القاهرة.",429757
كهرباء ميكانيكية,المكتب الهندسى للنظم الكهروميكانيكية,"6 ش كلية الزراعة متفرع من ش الجامعة, الجيزة, الجيزة.",388832
كهرباء ميكانيكية,الملك للمحركات الكهربائية,"28 ش نجيب الريحانى, وسط البلد, القاهرة.",627435
كهرباء ميكانيكية,المنار للمقاولات - اى ام سى,"ش الشهيد فريد ندا, حى الافرنج, الاسماعيلية.",427967
كهرباء ميكانيكية,المناهرى للتوريدات الكهربائية,"الاردنية, العاشر من رمضان, الشرقية.",208442
كهرباء ميكانيكية,النور الدولية للتجارة والمقاولات,"115 /2 طريق مصر حلوان الزراعى, حدائق المعادى, المعادى, القاهرة.",164999
كهرباء ميكانيكية,النورس للاستيراد والتصدير,"6 عمارات النقابات - - الطوب الرملى, الحى العاشر, مدينة نصر, القاهرة.",141591
كهرباء ميكانيكية,النيل للهندسة والتجارة,"281, امتداد جاردنيا, حدائق الاهرام, الهرم, الجيزة.",410515
كهرباء ميكانيكية,الهندسية,"7 ش مرسى بدر, العطارين, الاسكندرية.",264213
كهرباء ميكانيكية,الهندسية الكهربائية والتوريدات العامة,"26 ش الزهار, السبتية, القاهرة.",49061
كهرباء ميكانيكية,الهندسية للكهرباء والميكانيكا,"8 ش المتوكل, مينا البصل, الاسكندرية.",152073
كهرباء ميكانيكية,الهندسية للمقاولات الميكانيكية - بريما,"27 عمارات الجمارك - ش ادموند فيرمونت, سموحة, الاسكندرية.",127339
كهرباء ميكانيكية,الوادى للهندسة والتجارة,"9 عمارات طراد النيل, الشقة 7, الدور 4, منطقة الفلل, بنها, القليوبية.",468874
كهرباء ميكانيكية,الورشة الكهربائية الميكانيكية,"8 ش السيد البكرى, الزمالك, القاهرة.",221640
كهرباء ميكانيكية,اليانزا للتجارة والمقاولات,", كمباوند وان قطامية, القطامية, القاهرة.",660287
كهرباء ميكانيكية,اليكتروبالك للهندسة والتوريدات,"29 ش الجاحظ, متفرع من ش عبد الله العربى, الحى السابع, مدينة نصر, القاهرة.",626912
كهرباء ميكانيكية,اليكس للتجارة والتوريدات,"25 ش صديقات الكتاب المقدس, العصافرة بحرى, الاسكندرية.",137848
كهرباء ميكانيكية,ام اند اس تكنولوجى,"64 ش الفراهدة, اللبان, الاسكندرية.",581900
كهرباء ميكانيكية,ام اى بى ريسورسيس,"بلوك 11 - عمارة 4 - ش 3 - حى الواحة شقة 1, الحى العاشر, مدينة نصر, القاهرة.",518313
كهرباء ميكانيكية,ام تى اى - المصرية لتكنولوجيا الكهرباء,", المحور المركزى - ميدان ليلة القدر, السادس من اكتوبر, الجيزة.",463379
كهرباء ميكانيكية,ام جى اى سى ايجيبت,"14 ش عبد الحكيم الرفاعى, مدينة نصر, القاهرة.",683552
كهرباء ميكانيكية,امبيشن,"10 ش ابو بكر الصديق, مصر الجديدة, القاهرة.",501297
