Category,Name,Address,ID
محركات ديزل,مارين تك,"2 ش كامل يونس, متفرع من طريق الكيلو 26, ابو رواش, الجيزة.",51451
محركات ديزل,نجاتى للاستيراد وتأجير الاوناش والمولدات الكهربائية,"كم 26, طريق الاسكندرية القاهرة الصحراوى, الاسكندرية.",534528
محركات ديزل,المؤسسة المتحدة للاستيراد والتصدير,"2 ش ال يوسف, المريوطية, فيصل, الجيزة.",379246
محركات ديزل,الشركة العربية لخدمة الديزل - سفن ديزل - وديد فهمى,"14 ش المهدى, متفرع من ش الجمهورية, وسط البلد, القاهرة.",300206
محركات ديزل,شركة الاسكندرية للصيانة الميكانيكية,"كم 28 طريق اسكندرية القاهرة الصحراوى, نهاية ش بلال بن رباح, العامرية, الاسكندرية.",199450
محركات ديزل,الشركة المصرية العالمية للسيارات - تربوتشارجر,"طريق الاوتوستراد, اول الطريق الصاعد للمقطم, المقطم, القاهرة.",111829
محركات ديزل,الشناوى لاستيراد المعدات الثقيلة,"ك 26 طريق اسكندرية القاهرة الصحراوى, مرغم, الاسكندرية.",689931
محركات ديزل,الدولية للهندسة والتجارة,"برج نوبل - ش البحر الاعظم - جزيرة الدهب شقة 11, المنيب, الجيزة.",22071
محركات ديزل,شركة الديزل لقطع غيار محركات الديزل,"2, ميدان الخلفاوى متفرع من ش البشير, شبرا, القاهرة.",511345
محركات ديزل,ابناء انور بسطا للاستيراد والتصدير,"29 ش عماد الدين, وسط البلد, القاهرة.",14900
محركات ديزل,ابو دياب لقطع غيار الديزل,"99 ش جسر البحر, شبرا, القاهرة.",434083
محركات ديزل,احمد حشاش واولاده,"ش السنترال, الاردنية - مركز المدينة, العاشر من رمضان, الشرقية.",618909
محركات ديزل,احمد رشوان عبد العال,"6 ش على باشا مبارك متفرع من ش صلاح الدين, العطارين, الاسكندرية.",265486
محركات ديزل,اخوان مطر,"امتداد ش مسجد القبارى, القبارى, الاسكندرية.",27851
محركات ديزل,اس اتش لمحركات الديزل,", المحور المركزى - ميدان ليلة القدر, الحى 12, السادس من اكتوبر, الجيزة.",651363
محركات ديزل,افريقيا متالوك,"ش 9 - عزبة العرب, بهتيم, القليوبية.",330231
محركات ديزل,اكسبريس,"8 عمارات الاتصالات - طريق الاوتوستراد, المعادى الجديدة, المعادى, القاهرة.",101415
محركات ديزل,الاخوة المتحدين,"طريق المريوطية - شبرامنت, المريوطية, الهرم, الجيزة.",347100
محركات ديزل,الامريكية باور للهندسة الميكانيكية,"10 ش ابو غابة متفرع من ش المنشية, الطوابق, فيصل, الجيزة.",483494
محركات ديزل,البدر,"ش الحرية, تلا, المنوفية.",318956
محركات ديزل,البطل لقطع غيار الديزل,"ش الجيش, الصف, الجيزة.",114978
محركات ديزل,الحمد للاستيراد والتجارة,"129 ج ش جسر البحر, شبرا, القاهرة.",48822
محركات ديزل,الدولية,"ش المطار, المعصرة, القاهرة.",379267
محركات ديزل,الرجاء,"45 ش الخشاب متفرع من ش البلينى, شبرا, القاهرة.",311501
محركات ديزل,الزهراء لقطع الغيار,"ش السنترال الاردنية, العاشر من رمضان, الشرقية.",635194
محركات ديزل,السنوسى لخدمة الديزل,"31 أ ش شامبليون تقاطع ش معروف, وسط البلد, القاهرة.",61104
محركات ديزل,السويدى لتأجير الديزل,"47 ش الامام عيد, الهرم, الجيزة.",168774
محركات ديزل,الشرق الهندسية للتجارة وخدمة الديزل,"35, 37 ش عماد الدين, وسط البلد, القاهرة.",45114
محركات ديزل,الشركة الحديثة للهندسة والتجارة,"7 ش الانصارى, المعادى الجديدة, المعادى, القاهرة.",17048
محركات ديزل,الشركة العالمية للديزل,"القطعة 594 - امتداد المنطقة الصناعية الثالثة, المنطقة الصناعية, السادس من اكتوبر, الجيزة.",168780
محركات ديزل,الشركة العصرية للهندسة التجارية,"31 ش جمال عبد الناصر تقسيم عمرو بن العاص الثالث, فيصل, الجيزة.",135697
محركات ديزل,الشركة الفنية لخدمة الديزل,"5 ش البشير الخلفاوى, شبرا, القاهرة.",151361
محركات ديزل,الشركة المتحدة لتجارة قطع غيار المعدات الثقيلة,"ش مدارس الالسن, طريق سقارة, المريوطية, الهرم, الجيزة.",412539
محركات ديزل,الشركة المتحدة لخدمة الديزل,"ش 15 مايو, شبرا الخيمة, القليوبية.",680210
محركات ديزل,الشركة المتحدة لقطع غيار السيارات,"151 ش جسر البحر, الخلفاوى, شبرا, القاهرة.",641083
محركات ديزل,الشركة المتحدة للخراطة الميكانيكية,"48 ش حلوان المنيرة, السيدة عائشة, القاهرة.",175116
محركات ديزل,الشركة الهندسية للديزل وقطع الغيار,"20 ش عماد الدين تقاطع ش نجيب الريحانى, وسط البلد, القاهرة.",123248
محركات ديزل,العربية للهندسة والتجارة - اتيكو,"43 ش القللى, السبتية, القاهرة.",13149
محركات ديزل,العسال التجارية,"99 ش رمسيس - الدور 7, وسط البلد, القاهرة.",42667
محركات ديزل,الفادى,"مساكن النيل - ش المرور, مدينة السلام, القاهرة.",390587
محركات ديزل,القاهرة للتجارة و الاستيراد – كايرو هيدروليك,"45 ش القللى, السبتية, القاهرة.",10304
محركات ديزل,الكريم للتجارة والتوزيع,"13 ش دولتيان, اغاخان, القاهرة.",63308
محركات ديزل,المؤسسة الهندسية للتجارة والتوريدات,"45 ش السبتية, السبتية, القاهرة.",198203
محركات ديزل,المارينا للتجارة والاستيراد,"طريق النصر, الدهار, الغردقة.",146022
محركات ديزل,المجموعة الهندسية الحديثة,"25 ش اسراء المعلمين - الدور 2, المهندسين, الجيزة.",153602
محركات ديزل,المحلاوى لخدمات الديزل,"26 ش مصنع 45, المعصرة, القاهرة.",441909
محركات ديزل,المركز الحديث لمحركات الديزل,"206 عمارات صقر قريش -, المعادى الجديدة, المعادى, القاهرة.",222970
محركات ديزل,المركز الفنى,"ش الحيطة الحمرا - شبرامنت, الهرم, الجيزة.",347639
محركات ديزل,المركز الفنى لصيانة التربو,"65 مساكن اسكو - ش معاز المرشدى ناصية البنزينة - بهتيم, شبرا الخيمة, القليوبية.",268980
محركات ديزل,المركز الفنى للتوريدات,"33 أ عمارات الشركة الكويتية ش الجزائر, المعادى الجديدة, المعادى, القاهرة.",59302
محركات ديزل,المركز الهندسى,"114 ش شركات البترول, الزاوية الحمراء, القاهرة.",404160
محركات ديزل,المركز الهندسى,"طريق القناطر الخيرية, القناطر الخيرية, القليوبية.",298802
محركات ديزل,المصرية للهندسة والتجارة,"45 ش شامبليون, وسط البلد, القاهرة.",13302
محركات ديزل,المكتب العربى للتجارة والوكالة,"33 ش عماد الدين, وسط البلد, القاهرة.",46387
محركات ديزل,النصر لصيانة المواتير الديزل,"15 ش البوستة - كفر الحما, الوراق, الجيزة.",599419
محركات ديزل,الورشة الفنية,"36 ش العروبة, الطالبية, الهرم, الجيزة.",415746
محركات ديزل,الورشة الفنية لخراطة المعادن,"المدينة الصناعية, السيل شرق, اسوان.",124412
محركات ديزل,الورشة الهندسية,"3 ش العدل, المرج, القاهرة.",483956
محركات ديزل,الورشة الهندسية,"., السادس من اكتوبر, الجيزة.",438936
محركات ديزل,الورشة الهندسية لخدمة الديزل,"155 ش ترعة الزمر, المنيب, الجيزة.",659258
محركات ديزل,الولسن للديزل,"17 ش سليمان الحلبىالتوفيقية، الدور 1, وسط البلد, القاهرة.",176154
محركات ديزل,اليسر الهندسية,"4 ش محمد مرسى, متفرع من ش فيصل, الهرم, الجيزة.",14576
محركات ديزل,اليوسف,"طريق الاوتوستراد, دجلة, المعادى, القاهرة.",449661
محركات ديزل,ام اتش سبلاى,"فيلا 127 ش د. على مشرفة, النرجس 6, النرجس, القاهرة الجديدة, القاهرة.",560023
محركات ديزل,امارات نايل اويل كومبانى,"67 طريق القاهرة اسكندرية الزراعى, قليوب, القليوبية.",450325
محركات ديزل,امريكان بارتس,"16 ش المماليك, شبرا, القاهرة.",51873
محركات ديزل,امريكان باور جروب - م. ناصر اللقانى,"كم 25 - طريق اسكندرية القاهرة الصحراوى, مرغم, الاسكندرية.",295769
محركات ديزل,اوميجا موتور,"بلوك 6 ,7 طريق بلبيس, المنطقة الصناعية - منطقة 80 فدان, العاشر من رمضان, الشرقية.",131512
محركات ديزل,اى ام اف,"17 أ ش يحيى ابراهيم, الزمالك, القاهرة.",17799
محركات ديزل,ايجيبت ديزل,"46 ش 231, دجلة, المعادى, القاهرة.",67090
محركات ديزل,باور ماتيك,"ش تانيس, كامب شيزار, الاسكندرية.",437208
محركات ديزل,بحرى ديزل,"القطعة الثالثة - ش الكابلات, العامرية, الاسكندرية.",588460
محركات ديزل,بيكروان لخدمات الديزل,"ش 15 مايو, شبرا الخيمة, القليوبية.",425799
محركات ديزل,تراست,"ش نجيب الريحانى, وسط البلد, القاهرة.",384965
محركات ديزل,جنرال ديزل,"17 ش سليمان الحلبى - الازبكية - الدور 3 شقة 35, وسط البلد, القاهرة.",192060
محركات ديزل,حلوان لمحركات الديزل,"18 ش عماد الدين, وسط البلد, القاهرة.",14169
محركات ديزل,حلوان لمحركات الديزل,"ش كريستال عصفور, شبرا الخيمة, القليوبية.",249184
محركات ديزل,حلوان لمحركات الديزل,"ش احد متفرع من ش جامعة الدول العربية, المنصورة, الدقهلية.",287407
محركات ديزل,ديزل باور,"طريق سقارة - شبرامنت, الهرم, الجيزة.",148414
محركات ديزل,شركة النيل للادوات البحرية - وسلك واير,"11 ممر العزبى - - وكالة البلح, بولاق, القاهرة.",519832
محركات ديزل,شركة بولس لتجارة الديزل,"31 ش عماد الدين, وسط البلد, القاهرة.",12857
محركات ديزل,طلعت عزيز وشركاه,"26 ممر جلال باشا - ش عماد الدين, وسط البلد, القاهرة.",154394
محركات ديزل,عباد الرحمن للديزل,"., الحى السادس, السادس من اكتوبر, الجيزة.",437199
محركات ديزل,عبيد للمقاولات,"16 أ عمارات العبور - متفرع من ش صلاح سالم, مصر الجديدة, القاهرة.",187902
محركات ديزل,فكرى اخوان للهندسة والتجارة,"12 ش نجيب الريحانى, وسط البلد, القاهرة.",13542
محركات ديزل,فيشر جروب للاستيراد والتصدير,"3 ش الباب البحرى ، متفرع من ش نجيب الريحانى, وسط البلد, القاهرة.",191296
محركات ديزل,قلعة مصر ديزل,"كم 16 - طريق مصر اسكندرية الزراعى, قليوب, القليوبية.",50247
محركات ديزل,كابيتال ديزل,"40 ش الحجاز, الدور 1, ميدان المحكمة, مصر الجديدة, القاهرة.",448753
محركات ديزل,كات جروب,"12 أ عمارات الكويتية - المرحلة الثانية - المعادى الجديدة, المعادى, القاهرة.",123639
محركات ديزل,كارلين الشرق الاوسط,"2 أ ش بنى عامر, الجيزة, الجيزة.",19797
محركات ديزل,مؤسسة الايمان,"31 ش محطة المياه - قرية الزيدية, اوسيم, الجيزة.",350776
محركات ديزل,مؤسسة عيسى لخدمات الديزل,"16 ش احمد حلمى, شبرا, القاهرة.",11853
محركات ديزل,مؤسسة فؤاد نجيب للتجارة والاستيراد,"234 ش شبرا ميدان الخلفاوى, شبرا, القاهرة.",10862
محركات ديزل,مؤسسة مكرم وايهاب التجارية,"28 ش عماد الدين, وسط البلد, القاهرة.",13147
محركات ديزل,مبروك مطر,"كم 21 - طريق اسكندرية القاهرة الصحراوى, مرغم, الاسكندرية.",115503
محركات ديزل,مركز ابناء كفر الشيخ,"طريق ناهيا كرداسة, كرداسة, الجيزة.",366706
محركات ديزل,مركز خدمة الديزل,"كم 22 طريق مصر اسيوط الزراعى, البدرشين, الجيزة.",182438
محركات ديزل,مركز نصر لخدمة الديزل,"طريق القناطر, شبرا الخيمة, القليوبية.",63312
محركات ديزل,مصر تراكتورز,"1 ش احمد بدوى, شبرا, القاهرة.",176200
محركات ديزل,ممدوح لقطع غيار الديزل,"50 برج الفاو - ش باحثة البادية, الساحل, القاهرة.",432941
محركات ديزل,موتورز هاوس,"111 ش جسر البحر, الساحل, القاهرة.",232989
محركات ديزل,نجمة للديزل,"طريق القناطر الخيرية, القناطر الخيرية, القليوبية.",298924
محركات ديزل,نسيم انور الجندى,"70 ش جسر السويس - المنطقة الصناعية, جسر السويس, القاهرة.",93682
محركات ديزل,نصار للاستيراد والتصدير,"1 ش زكى متفرع من ميدان عرابى, وسط البلد, القاهرة.",514727
محركات ديزل,نصار للتجارة والتوريدات,"ش المطرى, دمياط, دمياط.",612740
محركات ديزل,نيو مينا موتورز لتجارة الديزل,"119 ش رمسيس, وسط البلد, القاهرة.",452807
محركات ديزل,هندسة الشنابر,"119 ش رمسيس, وسط البلد, القاهرة.",153082
محركات ديزل,وادى النيل لمحركات الديزل,"123 ش رمسيس, وسط البلد, القاهرة.",50960
محركات ديزل,ورشة ابناء المنصورة,"8 ش المرور, مدينة السلام, القاهرة.",178174
محركات ديزل,ويلكو الهندسية,"30 ش عماد الدين, وسط البلد, القاهرة.",12888
محركات ديزل,يثرب لاصلاح طلمبات الديزل,"96 ش طلمبات الخزان, المرج, القاهرة.",434455
