Category,Name,Address,ID
مدارس رياضية,ابو حطب جيم,"21, الحى السويسرى ب, الحى العاشر, مدينة نصر, القاهرة.",449868
مدارس رياضية,اكاديمة توب فايتر,"50 ش زاكر حسين, مدينة نصر, القاهرة.",675882
مدارس رياضية,اكاديمية ابطال المستقبل,"ش السيد ابو الحسن, متفرع من ش الخصوص, الخصوص, القليوبية.",493879
مدارس رياضية,اكاديمية ابلاما مارتيال ارتس,"ش 216, تقاطع ش 253 - ميدان فيكتوريا, المعادى, القاهرة.",396111
مدارس رياضية,اكاديمية اسباير كاراتيه,"341 ش 10, المجاورة الثانية, الحى الثالث, السادس من اكتوبر, الجيزة.",670620
مدارس رياضية,اكاديمية البرلسى للاسكواش,"ش التسعين الجنوبى, التجمع الخامس, القاهرة الجديدة, القاهرة.",666281
مدارس رياضية,اكاديمية الجمباز,"كورنيش النيل, كورنيش المعادى, المعادى, القاهرة.",680251
مدارس رياضية,اكاديمية الحزام الاسود للكاراتيه,"6 ب ش الثروة المعدنية, حدائق الاهرام, الهرم, الجيزة.",665173
مدارس رياضية,اكاديمية السامبا لكرة القدم,"167 ش الترعة السلطوحية, المرج, القاهرة.",563444
مدارس رياضية,اكاديمية الضوى لكرة القدم,"محلية 3, التجمع الثالث - المنطقة الثانية, التجمع الثالث, القاهرة الجديدة, القاهرة.",633972
مدارس رياضية,اكاديمية العارف لكرة القدم,"18 ش حمام الفرماوى, المرج, القاهرة.",563993
مدارس رياضية,اكاديمية الكابتن,"ش جسر السويس, جسر السويس, القاهرة.",562767
مدارس رياضية,اكاديمية الملاكمة,"., مدينة الرحاب, القاهرة.",195648
مدارس رياضية,اكاديمية المهدى,"ش المركز الاجتماعى, ميدان ابو طالب, كفر الشرفا, المرج, القاهرة.",479832
مدارس رياضية,اكاديمية النجوم الرياضية,"2 ش ريحان متفرع من ش ترعة البطحة, منوف, المنوفية.",573456
مدارس رياضية,اكاديمية النجوم لكرة القدم,"1 ش الصاعقة, مدينة نصر, القاهرة.",562771
مدارس رياضية,اكاديمية ايجى رو للتجديف,"147 ش النيل, الدقى, الجيزة.",509194
مدارس رياضية,اكاديمية بداية,"364 ن, حدائق الاهرام, الهرم, الجيزة.",655730
مدارس رياضية,اكاديمية برشلونة,"157 ش بورسعيد, الشهداء, المنوفية.",548077
مدارس رياضية,اكاديمية برشلونة لكرة القدم,"ش طراد النيل, العزبة الشرقية, الحوامدية, الجيزة.",615158
مدارس رياضية,اكاديمية بطل مصر للكاراتية,"1 ش الحسن, العمرانية الغربية, الهرم, الجيزة.",648843
مدارس رياضية,اكاديمية تايجرز لكرة اليد,"الطريق الدائرى, القطامية, القاهرة.",666260
مدارس رياضية,اكاديمية تايكوندو,"كورنيش النيل, كورنيش المعادى, المعادى, القاهرة.",680244
مدارس رياضية,اكاديمية ذكى غانم لتعليم السباحة,", محور 26 يوليو, السادس من اكتوبر, الجيزة.",513307
مدارس رياضية,اكاديمية ستار وان,"47 ش الجيش - العزبة الشرقية, الحوامدية, الجيزة.",614840
مدارس رياضية,اكاديمية ستريكرز لكرة القدم,"ش التسعين, التجمع الخامس, القاهرة الجديدة, القاهرة.",467017
مدارس رياضية,اكاديمية ستيب سبورتس,"5410 ش 33, الهضبة الوسطى - الحى الرابع, المقطم, القاهرة.",637887
مدارس رياضية,اكاديمية سماش للتنس,"طريق المطار, منطقة المطار, مصر الجديدة, القاهرة.",63075
مدارس رياضية,اكاديمية صن للجمباز,"35 ش اسماعيل الفنجرى, متفرع من ش احمد عصمت, جسر السويس, القاهرة.",478524
مدارس رياضية,اكاديمية عادل عباس لكرة القدم,"3 ش السودان, الكيت كات, الجيزة.",591148
مدارس رياضية,اكاديمية عالم الرياضة,"ش احمد الزمر, الحى الثامن, مدينة نصر, القاهرة.",136248
مدارس رياضية,اكاديمية عالم الرياضة,"61 طريق مساكن ابو زعبل, ابو زعبل, القليوبية.",516957
مدارس رياضية,اكاديمية علوانى للسباحة,"1, ميدان الحجاز, برج الصفا, المهندسين, الجيزة.",565890
مدارس رياضية,اكاديمية عليا لقفز المظلات والرياضات الجوية,"ش محمد شفيق, مصر الجديدة, القاهرة.",471404
مدارس رياضية,اكاديمية فوكسز حازم امام لكرة القدم,"12 ش الجبلاية, الجزيرة, القاهرة.",598694
مدارس رياضية,اكاديمية فيتنس جيم,"ش الثلاثينى الجديد, المريوطية, الهرم, الجيزة.",416222
مدارس رياضية,اكاديمية كونغ فو,"كورنيش النيل, كورنيش المعادى, المعادى, القاهرة.",680245
مدارس رياضية,اكاديمية لا ليجا,"ش التسعين الجنوبى, التجمع الخامس, القاهرة الجديدة, القاهرة.",666279
مدارس رياضية,اكاديمية لايف سبورت,"17 ش اولاد ابو عميرة, متفرع من ش 10, وراق العرب, الوراق, الجيزة.",593822
مدارس رياضية,اكاديمية مانشيستر يونايتيد,"كورنيش النيل, كورنيش المعادى, المعادى, القاهرة.",680242
مدارس رياضية,اكاديمية موردن سبورت,"47 ش ابراهيم نوار, متفرع من ش احمد فخرى, المنطقة السادسة, مدينة نصر, القاهرة.",185980
مدارس رياضية,اكاديمية نابولى,"كورنيش النيل, كورنيش المعادى, المعادى, القاهرة.",624611
مدارس رياضية,اكاديمية وينرز للتنس,"ش التسعين الجنوبى, المستثمرين الجنوبية, القاهرة الجديدة, القاهرة.",666255
مدارس رياضية,اكتوبر اسيورت اكاديمى,"عمارة 161, الاسكان العائلى 71 فدان, الحى السادس, السادس من اكتوبر, الجيزة.",669947
مدارس رياضية,الاكاديمية الدولية للرياضة,"ش ابو بكر الصديق, الاردنية - مركز المدينة, العاشر من رمضان, الشرقية.",619601
مدارس رياضية,الاكاديمية الدولية للكاراتيه,"30 ش ترعة زنين - زنين, بولاق الدكرور, الجيزة.",589855
مدارس رياضية,الاكاديمية المصرية لسباحة الاطفال,", المرحلة الثانية, الهضبة الوسطى, المقطم, القاهرة.",627906
مدارس رياضية,الحياة سبورتس اكاديمى,"., التجمع الخامس, القاهرة الجديدة, القاهرة.",440175
مدارس رياضية,اللواء سبورت,"35 ش ترعة الزمر, البراجيل, الجيزة.",547510
مدارس رياضية,المركز الاوليمبى,"ش الشبان المسلمين, بنها الجديدة, القليوبية.",520468
مدارس رياضية,الملكى لكرة القدم,"ش ترعة الجبل, المطرية, القاهرة.",635757
مدارس رياضية,اوبتيمام للتسويق والادارة الرياضية,", بفرلى هيلز, الشيخ زايد, السادس من اكتوبر, الجيزة.",671354
مدارس رياضية,اوليمبيا لتدريب البوكس,"طريق المطار, مساكن شيراتون, مصر الجديدة, القاهرة.",682007
مدارس رياضية,ايبون جودو اكاديمى,"ش التسعين الشمالى, قطامية هيلز, التجمع الخامس, القاهرة الجديدة, القاهرة.",581089
مدارس رياضية,بادلبود اكاديمى,"ش التسعين الجنوبى, التجمع الخامس, القاهرة الجديدة, القاهرة.",666269
مدارس رياضية,بروفيشنز سبورتس سنتر,"38 ش د. محمد محمد الفحام, الدور 2, الابراهيمية, الاسكندرية.",670436
مدارس رياضية,بنجوين سويم سكول,"ش اخناتون, متفرع من ش التسعين, الحى الخامس, التجمع الخامس, القاهرة الجديدة, القاهرة.",447571
مدارس رياضية,بيبي بلاير اكاديمى,", محور جمال عبد الناصر, التجمع الخامس, القاهرة الجديدة, القاهرة.",626481
مدارس رياضية,بىيونيتد سبورتس اكاديمى,"ش 5 أ, حدائق الاهرام, الهرم, الجيزة.",668574
مدارس رياضية,تايجر شوتوكان كاراتية,"2 ش حمودة, متفرع من ش خالد ابن الوليد, حدائق حلوان, القاهرة.",383346
مدارس رياضية,تايجرز اكاديمى للفنون القتالية,"ش احمد الزمر, مدينة الوفاء والامل, مدينة نصر, القاهرة.",638073
مدارس رياضية,توب سبورتس,"كورنيش النيل, كورنيش المعادى, المعادى, القاهرة.",680367
مدارس رياضية,توب فايتر اكاديمى,"16 عمارات صقر قريش, مساكن شيراتون, مصر الجديدة, القاهرة.",680004
مدارس رياضية,توب فتنيس جيم,"70 ش عين شمس, عين شمس, القاهرة.",592862
مدارس رياضية,ثرى تى تنس اكاديمى,", مدينة الرحاب - كمباوند ماونتن فيو, القاهرة الجديدة, القاهرة.",639501
مدارس رياضية,ذا هنجر,", ابيس, الاسكندرية.",670682
مدارس رياضية,رويال بيراميدز سبورتس اكاديمى,", مبنى 22ن, حدائق الاهرام, الهرم, الجيزة.",580888
مدارس رياضية,زد اكاديمى لكرة القدم,"محور المشير طنطاوى, المنطقة الاولى, مدينة نصر, القاهرة.",677577
مدارس رياضية,سبورت اكاديمى للسباحة والانقاذ,"96 مساكن الضباط ش 5, شبرا الخيمة, القليوبية.",563304
مدارس رياضية,سبورت ستار اكاديمى,"5 ش محمد رشدى, الكيت كات, الجيزة.",630052
مدارس رياضية,سبورتس بلانت,", الشطر الرابع, زهراء المعادى, المعادى, القاهرة.",691211
مدارس رياضية,ستيب سبورت جروب,"8 أ عمارات نيركو, الشطر الثالث, زهراء المعادى, المعادى, القاهرة.",611918
مدارس رياضية,ستيدى سبورت اكاديمى,"12 ش طارق بن زياد, التعاون, الهرم, الجيزة.",534675
مدارس رياضية,سماش سويمنج سكولز,"طريق المطار, منطقة المطار, مصر الجديدة, القاهرة.",602740
مدارس رياضية,سيزون سويمينج اكاديمى,"ش الزعيم مصطفى كامل, متفرع من ش الطالبية, الطالبية, الهرم, الجيزة.",656320
مدارس رياضية,سيلتك ستارز اكاديمى,"65 ش الساحة, الحوامدية, الجيزة.",604372
مدارس رياضية,فايت كلوب,"2 ش احمد عبد النبى, النزهة الجديدة, القاهرة.",359311
مدارس رياضية,فى ار للتدريب الكونغ فو,"ميدان الحصرى - ابراج زمزم - برج 3 - الدور 3, الحى السابع, السادس من اكتوبر, الجيزة.",598831
مدارس رياضية,مدرسة المواهب لكرة القدم,"طريق المطار, منطقة المطار, مصر الجديدة, القاهرة.",490536
مدارس رياضية,مركز التايكوندو الدولى,"24 ش 200, المعادى, القاهرة.",348872
مدارس رياضية,مركز كيه او هارد سلف ديفنس,"طريق صلاح سالم, مصر القديمة, القاهرة.",405396
مدارس رياضية,ملاعب واكاديمية كابتن احمد دويدار,"142 ش ناهيا, بولاق الدكرور, الجيزة.",495258
مدارس رياضية,منطقة القاهرة لكرة السلة,"23 ش يوسف عباس, مدينة نصر, القاهرة.",671827
مدارس رياضية,منطقة القاهرة لكرة اليد,"41 ش المدينة الجديدة, مدينة نصر, القاهرة.",674295
مدارس رياضية,ووتر بارك,"كورنيش النيل, كورنيش المعادى, المعادى, القاهرة.",678973
