Category,Name,Address,ID
مطاعم ايطالية,صديقى كافيه,"ش الرياضات البحرية, هضبة ام السيد, شرم الشيخ.",105497
مطاعم ايطالية,صلصة,"108 ش الشهيد احمد حمدى - ش الثلاثينى سابقا, فيصل, الجيزة.",582553
مطاعم ايطالية,صلصة جريل اند كوفى شوب,"ش شرم ليزيه, هضبة ام السيد, شرم الشيخ.",257592
مطاعم ايطالية,صولو ريستورن اند لونج,"طريق الكورنيش, جبل الحريم, الدهار, الغردقة.",679931
مطاعم ايطالية,طبلة لاونج,"فيلا 7 ش 257, المعادى الجديدة, المعادى, القاهرة.",616678
مطاعم ايطالية,طيباس,"48 ش عمر لطفى, كامب شيزار, الاسكندرية.",296376
مطاعم ايطالية,ع الاريكة,"1 و/1 ش سيد ندا تقسيم اللاسلكى, المعادى الجديدة, المعادى, القاهرة.",581581
مطاعم ايطالية,ع السخان,"ش سليمان الطماوى, مساكن شيراتون, مصر الجديدة, القاهرة.",569842
مطاعم ايطالية,ع القهوة,"5 ش عامر ميدان المساحة, الدقى, الجيزة.",142830
مطاعم ايطالية,على الحطب,"6 ش 205, دجلة, المعادى, القاهرة.",632170
مطاعم ايطالية,عند العربى,"29 ش ابراهيم ابو النجا, امتداد ش عباس العقاد, الحى السابع, مدينة نصر, القاهرة.",563449
مطاعم ايطالية,عيش وملح,"20 ش عدلى, وسط البلد, القاهرة.",461128
مطاعم ايطالية,فابيانو,"الطريق الدائرى, كايرو فيستيفال, القاهرة الجديدة, القاهرة.",469572
مطاعم ايطالية,فابيانو ايطاليانو,"كم 28 - طريق القاهرة اسكندرية الصحراوى, ابو رواش, الجيزة.",463881
مطاعم ايطالية,فابينى,"الطريق الدائرى, التجمع الاول, القاهرة الجديدة, القاهرة.",431054
مطاعم ايطالية,فابيو كوتشينا ايطاليانا,"ش عمر بن الخطاب، متفرع من ش الثورة, ارض الجولف, مصر الجديدة, القاهرة.",628911
مطاعم ايطالية,فاست ان هيلثى,"5 ش الشهيد الطيار محمود شاكر عبد المنعم, سموحة, الاسكندرية.",563560
مطاعم ايطالية,فاسويو رستوران اند كافيه,"8 ش لبنان, المهندسين, الجيزة.",443163
مطاعم ايطالية,فافيلا لاونج,"المحور المركزى - المجاورة الثالثة - الحى الثالث, الشيخ زايد, السادس من اكتوبر, الجيزة.",558390
مطاعم ايطالية,فاير ستون,"66 ش عمر بن الخطاب متفرع من طريق صلاح سالم - ميدان السبع عمارات, مصر الجديدة, القاهرة.",443696
مطاعم ايطالية,فتاتشينى,"9 ش الفرات متفرع من ش جامعة الدول العربية, المهندسين, الجيزة.",453039
مطاعم ايطالية,فتوح راس البر,"106 ش عباس العقاد, تقاطع ش مصطفى النحاس, المنطقة السادسة, مدينة نصر, القاهرة.",456659
مطاعم ايطالية,فراتيلى,"4 ش الثمار, المهندسين, الجيزة.",151076
مطاعم ايطالية,فراستينو,"ش اكاسيا, محرم بك, الاسكندرية.",379667
مطاعم ايطالية,فرايداى,"ش طه حسين, الدور 2, برج الايمان, ارض سلطان, المنيا.",575744
مطاعم ايطالية,فرناندوز,"48 ش فؤاد, محطة الرمل, الاسكندرية.",489909
مطاعم ايطالية,فرى ميكس,"60 ش الجيزة, الدقى, الجيزة.",236694
مطاعم ايطالية,فريدة,"امتداد طريق الاوسط, المنيا الجديدة, المنيا.",574557
مطاعم ايطالية,فريش فوود ماركت,"ش العبور متفرع من ش التسعين, التجمع الخامس, القاهرة الجديدة, القاهرة.",489826
مطاعم ايطالية,فطاطرى السلال,"80 ش اسيوط, عرب جسر السويس, جسر السويس, القاهرة.",653264
مطاعم ايطالية,فنيسيا تشيكن,"برج الياسمين أ، ش المريوطية, المريوطية, الهرم, الجيزة.",625767
مطاعم ايطالية,فود جوب,"كمبوند القطامية بلازا, التجمع الخامس, القاهرة الجديدة, القاهرة.",574189
مطاعم ايطالية,فوكاتشا,"111 عمارات الميريلاند ش جسر السويس, جسر السويس, القاهرة.",131962
مطاعم ايطالية,فوكتشاريا,"ش فؤاد, محطة الرمل, الاسكندرية.",584108
مطاعم ايطالية,فولتا,"ش المشير محمد على فهمى, سموحة, الاسكندرية.",582293
مطاعم ايطالية,فوود موود,"14 عمارات المروة - ش نبيل الوقاد, كلية البنات, مصر الجديدة, القاهرة.",494368
مطاعم ايطالية,فيرانو كافيه,"13 ش البكوات متفرع من ش 5, البيطاش, الاسكندرية.",233097
مطاعم ايطالية,فيردى بيسترو,"ش الفنار, هضبة ام السيد, شرم الشيخ.",55682
مطاعم ايطالية,فيرسال كانترى كوزين,"37 أ ش التسعين الشمالى, التجمع الخامس, القاهرة الجديدة, القاهرة.",466939
مطاعم ايطالية,فيرو تراتوريا,"., مدينة الرحاب, القاهرة.",515418
مطاعم ايطالية,فيرو كافيه,"10 محمد يوسف موسى, مدينة نصر, القاهرة.",602920
مطاعم ايطالية,فيفا كافيه,"3, ميدان اسوان, المهندسين, الجيزة.",396032
مطاعم ايطالية,فيفو,"1113 كورنيش النيل ميدان التحرير, وسط البلد, القاهرة.",475862
مطاعم ايطالية,فيكا,"ش الجهاز المجاورة الثالثة - الحى الثانى, الشيخ زايد, السادس من اكتوبر, الجيزة.",490181
مطاعم ايطالية,فيلا,"ميدان جهينة, السادس من اكتوبر, الجيزة.",409754
مطاعم ايطالية,فيلا فورتى فايف,"62 ش هارون الرشيد, الكوربة, مصر الجديدة, القاهرة.",592376
مطاعم ايطالية,فيلا فيروز,"11 ش زكريا عثمان, الحى الثامن, مدينة نصر, القاهرة.",527131
مطاعم ايطالية,فيلا يعقوب,"ش بورسعيد متفرع من ش الدلتا, سبورتنج الكبرى, الاسكندرية.",574420
مطاعم ايطالية,فيلوتشى,", الشطر الثالث, عمارات نيركو, المعادى الجديدة, المعادى, القاهرة.",674893
مطاعم ايطالية,فيلينى,"ش عبد الحميد بدوى, مساكن شيراتون, مصر الجديدة, القاهرة.",228139
مطاعم ايطالية,فيلينى,"كم 23 - محور التعمير - مجمع اليكس ويست, طريق اسكندرية مطروح الصحراوى, الساحل الشمالى.",200691
مطاعم ايطالية,فيما,"4 أ كورنيش النيل, بولاق, القاهرة.",518808
مطاعم ايطالية,فيمانا كافيه,"106 ش عباس العقاد, مدينة نصر, القاهرة.",393744
مطاعم ايطالية,فينيس,"ش كورنيش النيل, وسط البلد, اسوان.",144314
مطاعم ايطالية,فينيسيا,"., هضبة ام السيد, شرم الشيخ.",546022
مطاعم ايطالية,فيورى,"محور محمد نجيب, بالم هيلز كمباوند, التجمع الخامس, القاهرة الجديدة, القاهرة.",673331
مطاعم ايطالية,فيينا كافيه,"الطريق الدائرى, التجمع الاول, القاهرة الجديدة, القاهرة.",431334
مطاعم ايطالية,قصر الاليزيه,"1 ش جمال قدرى, متفرع من ش الملكة ناظلى, فيصل, الجيزة.",342702
مطاعم ايطالية,قهوة طأطوؤه,"ش 29, الحى الثانى - المنطقة الثالثة, التجمع الخامس, القاهرة الجديدة, القاهرة.",568372
مطاعم ايطالية,كاب دور,"15 ش النهضة تقاطع ش الجمهورية, حى الشرق, بور سعيد.",316070
مطاعم ايطالية,كابانو ريستوران اند كافيه,"المحور المركزى, الشيخ زايد, السادس من اكتوبر, الجيزة.",481062
مطاعم ايطالية,كابرى كافيه,"ش عبد الحميد الديب, سان استيفانو, الاسكندرية.",628311
مطاعم ايطالية,كابريتشى ايجيبت,"9 ب ش 216, دجلة, المعادى, القاهرة.",471679
مطاعم ايطالية,كابيلو,"ش محمد سلمى متفرع من ش شكرى القواتلى, المحلة الكبرى, الغربية.",576486
مطاعم ايطالية,كارملينا كافيه,"42 ش عزت سلامة, مدينة نصر, القاهرة.",603155
مطاعم ايطالية,كارينوز بيتزاريا,"كم 48، طريق السويس الغردقةالزعفرانة, العين السخنة, العين السخنة.",148457
مطاعم ايطالية,كارينوس ايطاليان جريل,"كم 48 - طريق السويس الغردقة - بورتو السخنة, العين السخنة, العين السخنة.",230155
مطاعم ايطالية,كاريوكى كافيه,"32 ش عز الدين سند, متفرع من ش عبد المنعم سند, المنطقة الاولى, مدينة نصر, القاهرة.",253205
مطاعم ايطالية,كازا بيستو,"ش الميناء, الميناء, نويبع.",130315
مطاعم ايطالية,كازا دى نابولى,"ش خالد بن الوليد - العوامية, الاقصر, الاقصر.",144484
مطاعم ايطالية,كازا روزا,"7 ش البحر, المحلة الكبرى, الغربية.",655057
مطاعم ايطالية,كازا لا باستا,"9 ش د. المحروقى, متفرع من ش البطل احمد عبد العزيز, المهندسين, الجيزة.",592386
مطاعم ايطالية,كازا ميا,"., شاركس باى, شرم الشيخ.",109949
مطاعم ايطالية,كازا نووفا,"كم 225 - طريق القاهرة الغردقة, العين السخنة, العين السخنة.",514931
مطاعم ايطالية,كازاميا مطعم وكافيه,"7 ش محمد الادهم, سان استيفانو, الاسكندرية.",334135
مطاعم ايطالية,كازانوفا,"كم 17 - طريق سفاجا الغردقة, طريق القرى, الغردقة.",228729
مطاعم ايطالية,كازينو,"1 ش النيل, الجيزة, الجيزة.",129749
مطاعم ايطالية,كازينو,"52 ش الحرية متفرع من ش الامام على - منطقة السلطان حسين, وسط البلد, الاسماعيلية.",576760
مطاعم ايطالية,كاسا ميا,"كم 32 - طريق الغردقة سفاجا, مكادى باى, الغردقة.",272233
مطاعم ايطالية,كافارتزى,"3 ش عثمان ابن عفان متفرع من ش جزيرة العرب, المهندسين, الجيزة.",447152
مطاعم ايطالية,كافالينو,"فيلا 6 - ش 291 متفرع من ش اللاسلكى, المعادى الجديدة, المعادى, القاهرة.",519113
مطاعم ايطالية,كافيار لاونج,"ش طرح البحر, حى الشرق, بور سعيد.",667452
مطاعم ايطالية,كافينو كافيه,"75 ش عبد العزيز فهمى, سانت فاتيما, مصر الجديدة, القاهرة.",236436
مطاعم ايطالية,كافيه ايفينتو,"83 ش محمد حسنين هيكل, متفرع من ش عباس العقاد, مدينة نصر, القاهرة.",297263
مطاعم ايطالية,كافية تايم اوت,"277 ش 263, المعادى الجديدة, المعادى, القاهرة.",606433
مطاعم ايطالية,كافيه تباسكو,"9 ش عبد المنعم حافظ متفرع من ش النزهة, مصر الجديدة, القاهرة.",452856
مطاعم ايطالية,كافيه ديل مار,"كم 23 - , طريق نويبع طابا, طابا.",547011
مطاعم ايطالية,كافيه ريبر,"ش العبور متفرع من ش التسعين, التجمع الخامس, القاهرة الجديدة, القاهرة.",511860
مطاعم ايطالية,كافيه سوريسو,"173 ش الحجاز, مصر الجديدة, القاهرة.",675646
مطاعم ايطالية,كافيه سول,"256 طريق الجيش, ستانلى, الاسكندرية.",582148
مطاعم ايطالية,كافيه فريسكو,"33 ش ابو داوود الظاهرى, الدور 1, متفرع من ش مكرم عبيد, المنطقة السادسة, مدينة نصر, القاهرة.",448379
مطاعم ايطالية,كافيه كلاسيك,"المحور المركزى - ميدان الحصرى, الحى السابع, السادس من اكتوبر, الجيزة.",347310
مطاعم ايطالية,كافيه وجلاتيريا فريسكا,"399 طريق الجيش, سان استيفانو, الاسكندرية.",144333
مطاعم ايطالية,كافيه ومطعم 911,"ابراج الوطنية - - عزبة النزهة, سيدى جابر, الاسكندرية.",582089
مطاعم ايطالية,كافيه ومطعم ال باركو,"82 ش الثورة, ارض الجولف, مصر الجديدة, القاهرة.",624455
مطاعم ايطالية,كافيه ومطعم البيرو,"ش حسن رضوان, طنطا, الغربية.",624811
مطاعم ايطالية,كافيه ومطعم اوتيمو,"3 ش كفر عبده, رشدى, الاسكندرية.",152370
مطاعم ايطالية,كافيه ومطعم برونتو اونو,", المنتزة, المنتزه, الاسكندرية.",112750
مطاعم ايطالية,كافيه ومطعم بيلا فيستا,"ش قطر الندى، متفرع من ش الصحافة، الحى التاسع, مدينة العبور, القليوبية.",550214
مطاعم ايطالية,كافيه ومطعم تسعيناتى,"الحى السادس - المنطقة الثالثة, التجمع الخامس, القاهرة الجديدة, القاهرة.",556691
مطاعم ايطالية,كافيه ومطعم تورى,"القطعة السابعة - بلوك 12001 - - المنطقة الصناعية الاولى - الامتداد الشمالى, مدينة العبور, القليوبية.",603577
مطاعم ايطالية,كافيه ومطعم تيو,"18 ش عزت سلامة, متفرع من ش عباس العقاد, الحى الثامن, مدينة نصر, القاهرة.",526240
مطاعم ايطالية,كافية ومطعم جاميكا,"18 ش 77ج متفرع من ش النادى, المعادى, القاهرة.",617350
مطاعم ايطالية,كافيه ومطعم جستو,"17 ش ابراهيم عبد السيد, باب شرق, الاسكندرية.",461883
مطاعم ايطالية,كافيه ومطعم جولدن بلاك,", كمباوند الخمائل - المرحلة الثانية, السادس من اكتوبر, الجيزة.",673534
مطاعم ايطالية,كافيه ومطعم داتشو,"19 ش كمال الدين صلاح, سموحة, الاسكندرية.",553176
مطاعم ايطالية,كافيه ومطعم ديل فينتو,"4 ش عماد الدين كامل متفرع من ش عباس العقاد, المنطقة الاولى, مدينة نصر, القاهرة.",188965
مطاعم ايطالية,كافيه ومطعم سوريسو,"محور المشير طنطاوى, التجمع الخامس, القاهرة الجديدة, القاهرة.",594558
مطاعم ايطالية,كافيه ومطعم لافيتا,"ش الخمسين, الشطر 13, زهراء المعادى, المعادى, القاهرة.",635998
مطاعم ايطالية,كافيه ومطعم لتيندا ايطاليانو,"1229 ش الشيخ على جاد الحق, مساكن شيراتون, مصر الجديدة, القاهرة.",381623
مطاعم ايطالية,كافيه ومطعم ماجز,"18 ش الشهيد سيد زكريا خليل, مساكن شيراتون, مصر الجديدة, القاهرة.",598192
مطاعم ايطالية,كافيه ومطعم مراسى,", الحى الثانى - المنطقة الاولى, التجمع الخامس, القاهرة الجديدة, القاهرة.",580934
مطاعم ايطالية,كالدو,"ش عادل الرفاعى, متفرع من ش شكرى القواتلى, المحلة الكبرى, الغربية.",631204
مطاعم ايطالية,كاليمار,"طريق مصر اسماعيلية الصحراوى, جولف سيتى, مدينة العبور, القليوبية.",534284
مطاعم ايطالية,كالينته,"ش الخزان, هضبة ام السيد, شرم الشيخ.",142555
مطاعم ايطالية,كان زمان,"المحور المركزى - ميدان الحصرى, الحى السابع, السادس من اكتوبر, الجيزة.",150711
مطاعم ايطالية,كانديلا,"4 ش محمد يوسف موسى, المنطقة الاولى, مدينة نصر, القاهرة.",128632
مطاعم ايطالية,كانوفا كافيه,"7 ميدان عمان, الدقى, الجيزة.",575252
مطاعم ايطالية,كايروما,"19 ش يوسف الجندى متفرع من ش هدى شعراوى, باب اللوق, القاهرة.",490014
مطاعم ايطالية,كراست بيتزا,"6 هـ/5 ش شوقى عبد المنعم تقسيم اللاسلكى, المعادى الجديدة, المعادى, القاهرة.",580854
مطاعم ايطالية,كراكيب,"2 ميدان عمان, الدقى, الجيزة.",449195
مطاعم ايطالية,كريوسيز,"4 ش اسماعيل محمد, الزمالك, القاهرة.",433279
مطاعم ايطالية,كزارولا,"5 ش المسرة متفرع من ش شبرا, شبرا, القاهرة.",495868
مطاعم ايطالية,كلاش,"ش العبور متفرع من ش التسعين, التجمع الخامس, القاهرة الجديدة, القاهرة.",613070
مطاعم ايطالية,كلاينا,"الغرقانة, خليج نبق, شرم الشيخ.",449019
مطاعم ايطالية,كلمنجى,"مربع 1258ف - طريق الاوتوستراد, مساكن شيراتون, مصر الجديدة, القاهرة.",514479
مطاعم ايطالية,كلوب 88 بول اند بيتش رستوران,"مارينا الجديدة, ابو تيج مارينا, الجونة.",385923
مطاعم ايطالية,كوتشينا,"الطريق الدائرى تقاطع طريق القاهرة السويس - ميراج سيتى, التجمع الاول, القاهرة الجديدة, القاهرة.",64437
مطاعم ايطالية,كوزى كافيه,"ش قناة السويس - الحديقة الدولية, محرم بك, الاسكندرية.",117141
مطاعم ايطالية,كوزين كولكشن,"المحور المركزى, الحى الاول, السادس من اكتوبر, الجيزة.",626656
مطاعم ايطالية,كوفى شوب شيروتى,"ش عمر بن الخطاب, مدينة نصر, القاهرة.",600556
مطاعم ايطالية,كوفى ورستوران قمرين,"100 ش مصطفى النحاس, الحى السابع, مدينة نصر, القاهرة.",316026
مطاعم ايطالية,كويك بيتزا,"ش التليفزيون, الاقصر, الاقصر.",659377
مطاعم ايطالية,كيان كافيه,"37 ص ش حورس, حدائق الاهرام, الهرم, الجيزة.",584471
مطاعم ايطالية,كيفايرو,"19 ش الكروم, المهندسين, الجيزة.",625200
مطاعم ايطالية,كيفنز جازيبو,"ش الشباب, الشيخ زايد, السادس من اكتوبر, الجيزة.",627687
مطاعم ايطالية,كينزو كلوب كافيه,"الشطر السابع - عمارة 36/10, زهراء المعادى, المعادى, القاهرة.",580704
مطاعم ايطالية,كيه لونج,"ش 17, متفرع من ش 82, منطقة خدمات الحى الاول, التجمع الخامس, القاهرة الجديدة, القاهرة.",427749
مطاعم ايطالية,لا باتيسريا,"كم 90 - طريق القصير مرسى علم, خليج كورايا, مرسى علم.",196625
مطاعم ايطالية,لا برجولا,"., شاركس باى, شرم الشيخ.",413316
مطاعم ايطالية,لا برجولا,"طريق سقارة - الحرانية, سقارة, الجيزة.",141068
مطاعم ايطالية,لا برجولا,"كم 45 - طريق الغردقة سفاجا, سومة باى, سفاجا.",258675
مطاعم ايطالية,لا بريمافيرا,"طريق المطار, منطقة المطار, مصر الجديدة, القاهرة.",166706
مطاعم ايطالية,لا بوتيكا ايطاليانو,"27 ش 231, دجلة, المعادى, القاهرة.",286969
مطاعم ايطالية,لا بيازيتا,"طريق السلام, شاركس باى, شرم الشيخ.",55633
مطاعم ايطالية,لا بيترا,"34 ش الحجاز, المهندسين, الجيزة.",64891
مطاعم ايطالية,لا بيتزاريا,"كم 105 - طريق اسكندرية مطروح الصحراوى - مارينا 3, مارينا, الساحل الشمالى.",448735
مطاعم ايطالية,لا بيرلا,"كورنيش النيل - جزيرة الافانتين, الكورنيش, اسوان.",144507
مطاعم ايطالية,لا بيسترو,"الممشى السياحى, طريق القرى, الغردقة.",449095
مطاعم ايطالية,لا تراتوريا,"طريق السلام, شاركس باى, شرم الشيخ.",130436
مطاعم ايطالية,لا تراتوريا,"كم 30 - طريق سفاجا الغردقة, مكادى باى, الغردقة.",204394
مطاعم ايطالية,لا تراتوريا,"كم 32 - طريق القصير مرسى علم, جنوب قصير, القصير.",247398
مطاعم ايطالية,لا تيرازا,"طريق السلام, خليج نبق, شرم الشيخ.",105962
مطاعم ايطالية,لا تيرازا,"طريق الواحات, السادس من اكتوبر, الجيزة.",144006
مطاعم ايطالية,لا تيرازا,"كم 4.5 -, طريق القاهرة الاسكندرية الصحرا, طريق القاهرة الاسكندرية الصحراوى, الجيزة.",64426
مطاعم ايطالية,لا تيرازا ريستورانت ايطاليانو,"كم 2.5 -, طريق القاهرة الاسكندرية الصحرا, طريق القاهرة الاسكندرية الصحراوى, الجيزة.",7456
مطاعم ايطالية,لا تيراس,"22 ش طه حسين, الزمالك, القاهرة.",66231
مطاعم ايطالية,لا جران كونتى,"9 ش ابو بكر الصديق متفرع من ش محيى الدين ابو العز, المهندسين, الجيزة.",475022
مطاعم ايطالية,لا جندولا,"طريق المطار, سهل حشيش, الغردقة.",167048
مطاعم ايطالية,لا جوستا,"47 ش ابراهيم نوار, المنطقة السادسة, مدينة نصر, القاهرة.",622177
مطاعم ايطالية,لا جوندولا,"3 ش الطيران, متفرع من طريق صلاح سالم, مدينة نصر, القاهرة.",60631
مطاعم ايطالية,لا جيوكوندا,"ش الرياضات البحرية, هضبة ام السيد, شرم الشيخ.",142775
مطاعم ايطالية,لا دولشى فيتا,"كم 16 - طريق الغردقة سفاجا, طريق القرى, الغردقة.",193166
مطاعم ايطالية,لا دولشى فيتا,"كم 46 - طريق الغردقة العين السخنة, العين السخنة, العين السخنة.",193549
مطاعم ايطالية,لا دولشى فيتا,"ش الجيش, المنصورة, الدقهلية.",433316
مطاعم ايطالية,لا سبرانزا,"طريق السلام, شاركس باى, شرم الشيخ.",248239
مطاعم ايطالية,لا سكالا,"الطريق الدائرى, التجمع الاول, القاهرة الجديدة, القاهرة.",439812
مطاعم ايطالية,لا سكالا,"., ابو تيج مارينا, الجونة.",188103
مطاعم ايطالية,لا سيتا,"طريق الواحات, السادس من اكتوبر, الجيزة.",527119
مطاعم ايطالية,لا فورشيتا,"3 ش ابراهيم تقاطع ش الثورة, الكوربة, مصر الجديدة, القاهرة.",577044
مطاعم ايطالية,لا كازا,"كم 17 - طريق الغردقة سفاجا, طريق القرى, سفاجا.",244857
مطاعم ايطالية,لا كازا تراس,"كم 65 - طريق القصير مرسى علم, خليج كورايا, مرسى علم.",247053
مطاعم ايطالية,لا كاسكاتا,"الغرقانة, خليج نبق, شرم الشيخ.",55655
مطاعم ايطالية,لا كاسكادا ريستورن,"ش محمد سعيد, الكوثر, الغردقة.",679952
مطاعم ايطالية,لا كوتشينا,"59 ش الميرغنى, الماظة, مصر الجديدة, القاهرة.",487770
مطاعم ايطالية,لا كوتشينا,"., سهل حشيش, الغردقة.",237394
