Category,Name,Address,ID
مطاعم ايطالية,بيتزا كلوب,"106 ش حسن المامون, الحى السادس, مدينة نصر, القاهرة.",632067
مطاعم ايطالية,بيتزا كوين,"5 ش طارق بن زياد، متفرع من ش الهرم, التعاون, الهرم, الجيزة.",567597
مطاعم ايطالية,بيتزا ميا,"2 ش طه حسين, الزمالك, القاهرة.",321366
مطاعم ايطالية,بيتزا مينوش,"242 طريق الجيش, ستانلى, الاسكندرية.",36656
مطاعم ايطالية,بيتزا يالا,"9 أ ش سراى الجزيرة, الزمالك, القاهرة.",246746
مطاعم ايطالية,بيتزاريا لا فيتا اى بيلا,"32 ش شجرة الدر, الزمالك, القاهرة.",654446
مطاعم ايطالية,بيتزانيا,"52 ش على عبد الرازق متفرع من ش عمار بن ياسر, ميدان الحجاز, مصر الجديدة, القاهرة.",487886
مطاعم ايطالية,بيتزريوم,"8 /2 ش النصر, المعادى الجديدة, المعادى, القاهرة.",584733
مطاعم ايطالية,بيتزيريا بيلا نابولى,"كم 8 - طريق سفاجا الغردقة , شمال سفاجا, سفاجا.",107811
مطاعم ايطالية,بيتش بار - فندق ستيلا دى مارى سى كلوب,"كم 46 طريق السويس الغردقة, العين السخنة, العين السخنة.",193555
مطاعم ايطالية,بيتشولينو,"كم 34 - طريق الغردقة سفاجا, مكادى باى, الغردقة.",194249
مطاعم ايطالية,بيتى,"4 أ كورنيش النيل, رملة بولاق, القاهرة.",519284
مطاعم ايطالية,بير توتى,"القطعة 835 - ش 9, المقطم, القاهرة.",440999
مطاعم ايطالية,بيرلز لاونج,"القطعة 18 - محور 26 يوليو, الشيخ زايد, السادس من اكتوبر, الجيزة.",569312
مطاعم ايطالية,بيروس كافيه,"عمارات مصر للتعمير - - المنطقة الرابعة, مساكن شيراتون, مصر الجديدة, القاهرة.",351371
مطاعم ايطالية,بيرى هاوس,"المرحلة الثالثة, مدينة الرحاب, القاهرة.",452392
مطاعم ايطالية,بيستو,"2 عمارات مصر للتعمير - - المنطقة الثانية, مساكن شيراتون, مصر الجديدة, القاهرة.",428341
مطاعم ايطالية,بيسكارا,"ش مصطفى كامل, تقاطع ش رمسيس, برج الشرق, حى الشرق, بور سعيد.",638600
مطاعم ايطالية,بيكلو مندو,"4 ش سراى الجزيرة, الزمالك, القاهرة.",60555
مطاعم ايطالية,بيكولو,"17 ش 269 متفرع من ش النصر, المعادى الجديدة, المعادى, القاهرة.",451806
مطاعم ايطالية,بيلا,"1089 كورنيش النيل, جاردن سيتى, القاهرة.",123732
مطاعم ايطالية,بيلا,"طريق الغردقة سفاجا, سهل حشيش, الغردقة.",246597
مطاعم ايطالية,بيلا بلو كافيه,"7 ش الحجاز متفرع من ش جامعة الدول العربية, المهندسين, الجيزة.",379695
مطاعم ايطالية,بيلا فيستا,"المنتزة, رأس نصرانى, شرم الشيخ.",55671
مطاعم ايطالية,بيلا فيستا,"ش صلاح طاهر, هضبة ام السيد, شرم الشيخ.",131014
مطاعم ايطالية,بينو,"فيلا 3E - - كمبوند ميروزا, محرم بك, الاسكندرية.",573230
مطاعم ايطالية,بيير 88,"112 ش سراى الجزيرة, الزمالك, القاهرة.",571460
مطاعم ايطالية,بييرو ايجيبت,"32 ش محمد صفوت, كفر عبده, الاسكندرية.",582210
مطاعم ايطالية,تارتوريا,"طريق المطار, خليج نبق, شرم الشيخ.",247597
مطاعم ايطالية,تافرنا,"1 ميدان سعد زغلول, محطة الرمل, الاسكندرية.",301890
مطاعم ايطالية,تافولا ريستوران اند لاونج,"ش التسعين الجنوبى, التجمع الخامس, القاهرة الجديدة, القاهرة.",449430
مطاعم ايطالية,تافولينو,"5 ش ابو الفدا, الزمالك, القاهرة.",517231
مطاعم ايطالية,تايكوون,"القطعة A ش التسعين, مركز المدينة, التجمع الخامس, القاهرة الجديدة, القاهرة.",413198
مطاعم ايطالية,تبيستى التسعين,"ش التسعين, النرجس, القاهرة الجديدة, القاهرة.",573422
مطاعم ايطالية,تبيستى بلس,"., التجمع الخامس, القاهرة الجديدة, القاهرة.",584644
مطاعم ايطالية,ترامونتو,"كم 7 - طريق القاهرة السويس الصحراوى, التجمع الاول, القاهرة الجديدة, القاهرة.",521166
مطاعم ايطالية,ترانزيت,"7 ش عبد العزيز الهوارى متفرع من ش النزهة, ارض الجولف, مصر الجديدة, القاهرة.",506302
مطاعم ايطالية,تربيل بلاى,"طريق 14 مايو, سموحة, الاسكندرية.",488071
مطاعم ايطالية,تروبيزيرا ايطاليانا,"ش مارينا, خليج نعمة, شرم الشيخ.",246675
مطاعم ايطالية,تروفو,"141 ش عمر بن الخطاب, الماظة, مصر الجديدة, القاهرة.",454181
مطاعم ايطالية,تروكاديرو كافيه اند ريستوران,"182 ش عمر لطفى, سبورتنج, الاسكندرية.",559562
مطاعم ايطالية,ترى بون,"14 ش غرناطة, متفرع من ش دمشق, روكسى, مصر الجديدة, القاهرة.",63991
مطاعم ايطالية,ترى لاونج,"فيلا 21 ش 6, المعادى, القاهرة.",607434
مطاعم ايطالية,ترى ميكس,"43, ميدان الجزائر, المعادى, القاهرة.",356120
مطاعم ايطالية,تشاو,"ابراج ريجنسى -, سموحة, الاسكندرية.",386947
مطاعم ايطالية,تشاو تشاو,"كم 27 - طريق القصير مرسى علم, جنوب قصير, القصير.",146662
مطاعم ايطالية,تشيزى بان,"ش الخمسين، الشطر 13, زهراء المعادى, المعادى, القاهرة.",609192
مطاعم ايطالية,تشيلو,"طريق المطار, منطقة المطار, مصر الجديدة, القاهرة.",268299
مطاعم ايطالية,تقلية,"ش التسعين الشمالى, جنوب الاكاديمية, القاهرة الجديدة, القاهرة.",531488
مطاعم ايطالية,توتى فروتى,"الممشى السياحى, طريق القرى, الغردقة.",509522
مطاعم ايطالية,توتى ماتى,"49 ش 9, ثكنات المعادى, المعادى, القاهرة.",351291
مطاعم ايطالية,تورتيلينى,"منطقة B52 - واحة مدينتى, مدينتى, القاهرة.",617300
مطاعم ايطالية,توسكا,"ش الاقبال, تقاطع طريق الجيش, لوران, الاسكندرية.",647580
مطاعم ايطالية,توسكانا,"السوق القديم, شرم المياه, شرم الشيخ.",55651
مطاعم ايطالية,توسكانيني,"ش صفية زغلول, بنى سويف, بنى سويف.",574272
مطاعم ايطالية,توسكانينى,"ش كورنيش النيل, الكورنيش, المنيا.",574565
مطاعم ايطالية,توسكانينى,"ش طرح البحر, حى الشرق, بور سعيد.",627787
مطاعم ايطالية,تونيك ريستوران اند كافيه,"7 عمارات صقر قريش -, مساكن شيراتون, مصر الجديدة, القاهرة.",480163
مطاعم ايطالية,تيتاس,"14 ش عزت سلامة, متفرع من ش عباس العقاد, مدينة نصر, القاهرة.",463123
مطاعم ايطالية,تيكى تاكا,"طريق 14 مايو, سموحة, الاسكندرية.",582282
مطاعم ايطالية,تيو كافيه,"38 ش هالومى, خليج نعمة, شرم الشيخ.",572179
مطاعم ايطالية,جاست راب,"منطقة خدمات B7, مدينتى, القاهرة.",582622
مطاعم ايطالية,جاليرى بار,"التبة, وسط البلد, الجونة.",196255
مطاعم ايطالية,جراسياس,"38 /40 ش النادى الجديد, المعادى الجديدة, المعادى, القاهرة.",62939
مطاعم ايطالية,جرانيز,"ش سعيد, تقاطع ش معتصم, طنطا, الغربية.",509302
مطاعم ايطالية,جرينو كافيه,"33 ش الهرم متفرع من ش ابو الهول السياحى, مشعل, الهرم, الجيزة.",236237
مطاعم ايطالية,جول كافيه,"34 ش المنصور محمد, الزمالك, القاهرة.",136811
مطاعم ايطالية,جوليوس,"136 ش 26 يوليو, الزمالك, القاهرة.",398550
مطاعم ايطالية,جويز,"ش 250, دجلة, المعادى, القاهرة.",627712
مطاعم ايطالية,جى اند كو,"ابراج نايل سيتى كورنيش النيل, رملة بولاق, القاهرة.",584114
مطاعم ايطالية,جيانيز,"., سهل حشيش, الغردقة.",148212
مطاعم ايطالية,جيتا جروتو,"كم 46 - طريق الغردقة العين السخنة, العين السخنة, العين السخنة.",248219
مطاعم ايطالية,جيستو,"ش جرين تاورز, سموحة, الاسكندرية.",526043
مطاعم ايطالية,جيلاتيريا روما,"برج النزهة، ش جامعة الازهر، ميدان اسماء الله الحسنى, اسيوط, اسيوط.",625494
مطاعم ايطالية,جيوفانيز,"طريق الجيش, المنتزة, المنتزه, الاسكندرية.",513148
مطاعم ايطالية,حلاوة وزعتر,"ش عبد العزيز ال سعود, المنيل, القاهرة.",584049
مطاعم ايطالية,حمادة مكرونة,"16 ش شامبليون، تقاطع ش محمود بسيونى, وسط البلد, القاهرة.",553561
مطاعم ايطالية,دا بابا,"ش التسعين الشمالى, التجمع الخامس, القاهرة الجديدة, القاهرة.",629130
مطاعم ايطالية,دا ريكاردو بيتزيريا,"4 ش سراى الجزيرة, الزمالك, القاهرة.",506528
مطاعم ايطالية,دا فرانكو,"ش السلام, خليج نعمة, شرم الشيخ.",55704
مطاعم ايطالية,دا نونا,"ش التسعين الشمالى, كمباوند الصفوة, المستثمرين الشمالية, القاهرة الجديدة, القاهرة.",638169
مطاعم ايطالية,دارينادو,"كم 30 - طريق سفاجا الغردقة, مكادى باى, الغردقة.",379531
مطاعم ايطالية,دافنشى هاوس,"ش الكورنيش الجديد, حى السويس, السويس.",614585
مطاعم ايطالية,دايفر سناك بار,"كم 8 - طريق سفاجا الغردقة, سومة باى, سفاجا.",108970
مطاعم ايطالية,دايلى موون,"49 ش 218, دجلة, المعادى, القاهرة.",459945
مطاعم ايطالية,دكة,"ش كورنيش النيل, الاقصر, الاقصر.",235474
مطاعم ايطالية,دوديسى,"عمارات ضباط مصطفى كامل - ش المشير احمد اسماعيل تقاطع طريق الجيش, مصطفى كامل, الاسكندرية.",614452
مطاعم ايطالية,دولش ايه سلاتو,"38 ش هالومى, خليج نعمة, شرم الشيخ.",534135
مطاعم ايطالية,دولشى فيتا,"طريق الشيراتون, الهضبة, الغردقة.",415334
مطاعم ايطالية,دولشى فيتا,"., وسط البلد, الجونة.",108615
مطاعم ايطالية,دولشى فيتا,"., ابو تيج مارينا, الجونة.",130486
مطاعم ايطالية,دولشى فيتا,"ش الكورنيش, الدهار, الغردقة.",205821
مطاعم ايطالية,دولشى فيتا,"طريق السلام, خليج نعمة, شرم الشيخ.",229206
مطاعم ايطالية,دون كاميلوز كافيه,"106 ش النيل, العجوزة, الجيزة.",433885
مطاعم ايطالية,دون كيشوت,"44 ش برهان تقاطع ش راغب باشا, حلوان, القاهرة.",193820
مطاعم ايطالية,دونا اونيستا,"32 ش 7 تقاطع ش 82, المعادى, القاهرة.",496954
مطاعم ايطالية,دوناتوس,"كم 19 -, طريق القاهرة الاسكندرية الصحرا, طريق القاهرة الاسكندرية الصحراوى, الجيزة.",485542
مطاعم ايطالية,دى بليك,"50 عمارات ضباط مصطفى كامل - ش المشير احمد اسماعيل تقاطع طريق الجيش, مصطفى كامل, الاسكندرية.",593278
مطاعم ايطالية,دى كاسترو,"ش عبد المنعم رياض, الحى المتميز, السادس من اكتوبر, الجيزة.",627865
مطاعم ايطالية,ديدوس ال دينتى,"26 ش بهجت على, الزمالك, القاهرة.",17460
مطاعم ايطالية,ديسباسيتو,"104 ش حسن المأمون, المنطقة السادسة, مدينة نصر, القاهرة.",604033
مطاعم ايطالية,ديفاس كافيه,", عمارة 189 ص, حدائق الاهرام, الهرم, الجيزة.",522298
مطاعم ايطالية,ديلا باستا,"ش محمد نجيب, سيدى بشر, الاسكندرية.",584070
مطاعم ايطالية,ديلايت,"37 ش الفردوس تقسيم سموحة, سموحة, الاسكندرية.",191667
مطاعم ايطالية,ذا ايطالين بياتزا,"الطريق الدائرى تقاطع طريق القاهرة السويس - ميراج سيتى, التجمع الاول, القاهرة الجديدة, القاهرة.",228749
مطاعم ايطالية,ذا باستا بار,"فيلا 10 - ش 275 تقاطع ش 261, المعادى الجديدة, المعادى, القاهرة.",581766
مطاعم ايطالية,ذا باستا بيكرى,"102 ب ش الميرغنى, مصر الجديدة, القاهرة.",622619
مطاعم ايطالية,ذا براون باج,"ش البنوك قطاع 1 - مركز المدينة, التجمع الخامس, القاهرة الجديدة, القاهرة.",583122
مطاعم ايطالية,ذا بلو,"12 ش احمد راغب, جاردن سيتى, القاهرة.",229112
مطاعم ايطالية,ذا جيت,"طريق القاهرة اسكندرية الصحراوى, طريق القاهرة الاسكندرية الصحرا, طريق القاهرة الاسكندرية الصحراوى, الجيزة.",586532
مطاعم ايطالية,ذا ريبابليك,"25 ش عبد المنعم رياض متفرع من ش البطل احمد عبد العزيز, المهندسين, الجيزة.",559652
مطاعم ايطالية,ذا فيو,"طريق السلام, شاركس باى, شرم الشيخ.",248233
مطاعم ايطالية,ذا فيو كافيه,"كم 33 - طريق القاهرة السويس, مدينتى, القاهرة.",573430
مطاعم ايطالية,ذا كلوب هاوس,"., كفر الجونة, الجونة.",117917
مطاعم ايطالية,ذا كوكرى كو,"كم 126 - , طريق اسكندرية مطروح الصحراوى, الساحل الشمالى.",590329
مطاعم ايطالية,ذا كيف,"10 ش كمال الدين حسين, مساكن شيراتون, مصر الجديدة, القاهرة.",295954
مطاعم ايطالية,ذا كيو,"3 عمارات طابية سيدى بشر - طريق الجيش - محل 12, سيدى بشر بحرى, الاسكندرية.",563401
مطاعم ايطالية,ذا لونج,"43 عمارات مصر للتعمير ش انقرة, المنطقة الاولى, مساكن شيراتون, مصر الجديدة, القاهرة.",180270
مطاعم ايطالية,ذا موتو كافيه,"كم 1 - طريق طنطا المحلة, طنطا, الغربية.",575070
مطاعم ايطالية,ذا وايت اول,"17 ش 216, تقاطع ش 206, دجلة, المعادى, القاهرة.",567895
مطاعم ايطالية,ذاتز امورى,"70 ش عمر بن الخطاب ميدان الماظة, الماظة, مصر الجديدة, القاهرة.",358137
مطاعم ايطالية,راديكيو,"الممشى السياحى, طريق القرى, الغردقة.",229113
مطاعم ايطالية,رافايلو,"11 ش سيزوستريس متفرع من ش بغداد, الكوربة, مصر الجديدة, القاهرة.",475094
مطاعم ايطالية,روستيكا,"3 ش القاضى الفاضل متفرع من ش قصر النيل, وسط البلد, القاهرة.",582609
مطاعم ايطالية,روسوبومودورو,"القطعة A ش التسعين, مركز المدينة, التجمع الخامس, القاهرة الجديدة, القاهرة.",401495
مطاعم ايطالية,روسينى,"كم 36 - طريق الغردقة سفاجا, مكادى باى, الغردقة.",195811
مطاعم ايطالية,روكو,"1 ابراج الياسمين - ش عمارات الشرطة متفرع من ش قنال المحمودية, سموحة, الاسكندرية.",584260
مطاعم ايطالية,روما كافيه,"24 ش الحرية تقاطع ش النزهة, مصر الجديدة, القاهرة.",359057
مطاعم ايطالية,روما كافيه اند بيسترو,"24 ش الحرية تقاطع ش النزهة, ارض الجولف, مصر الجديدة, القاهرة.",53791
مطاعم ايطالية,روما واى,"ميدان جهينة, السادس من اكتوبر, الجيزة.",316005
مطاعم ايطالية,رومرز كافيه,"14 ش نخلة المطيعى, تريومف, مصر الجديدة, القاهرة.",143674
مطاعم ايطالية,رى بون,"95 ش الميرغنى, مصر الجديدة, القاهرة.",462687
مطاعم ايطالية,ريترو مطعم وكافيه,"2 ش سليمان اباظة, متفرع من ش مكة, المهندسين, الجيزة.",60709
مطاعم ايطالية,ريجاستا,"القطعة 82 - ش اخناتون - الحى الاول, التجمع الخامس, القاهرة الجديدة, القاهرة.",584919
مطاعم ايطالية,ريجنسى كافيه,"63 ش الحجاز, ميدان المحكمة, مصر الجديدة, القاهرة.",583052
مطاعم ايطالية,ريد بيرى,"82 ش مكرم عبيد, مدينة نصر, القاهرة.",506868
مطاعم ايطالية,ريستورانت دا ماريو,"القطعة 53 - طريق بلو هول, عصلة, دهب.",247173
مطاعم ايطالية,زاد,"3 ش نوال, الدقى, الجيزة.",388681
مطاعم ايطالية,زودياك,"1 ش اسوان, ميدان المحكمة, مصر الجديدة, القاهرة.",121645
مطاعم ايطالية,زى كافيه,"ش انقرة, مساكن شيراتون, مصر الجديدة, القاهرة.",675975
مطاعم ايطالية,زيجولينى,"الممشى السياحى, خليج نعمة, شرم الشيخ.",61389
مطاعم ايطالية,زين,"49 ش حسن افلاطون, متفرع من ش النزهة, ارض الجولف, مصر الجديدة, القاهرة.",180276
مطاعم ايطالية,زيوس لاونج,"ش التسعين, التجمع الخامس, القاهرة الجديدة, القاهرة.",443684
مطاعم ايطالية,سابورى,"12 ش مصطفى رفعت, مساكن شيراتون, مصر الجديدة, القاهرة.",560850
مطاعم ايطالية,سابورى دى كارلو,"49 ش محمد مظهر, الزمالك, القاهرة.",623286
مطاعم ايطالية,سابوريتو روما,"29 ش مصطفى كامل, المعادى, القاهرة.",485124
مطاعم ايطالية,ساشو بيسترو,"6 ج ش العادل ابو بكر متفرع من ش الملك الافضل, الزمالك, القاهرة.",403376
مطاعم ايطالية,سان كارلو,"2 ش فؤاد, محطة الرمل, الاسكندرية.",625960
مطاعم ايطالية,سان مارينو,"1 طريق ريتز كارلتون, هضبة ام السيد, شرم الشيخ.",202803
مطاعم ايطالية,سانتورينى,"3 عمارات مصر للتعمير - ش انقرة, مساكن شيراتون, مصر الجديدة, القاهرة.",443694
مطاعم ايطالية,ساندوكريب,"118 ش ترعة القبة, حدائق القبة, القاهرة.",568445
مطاعم ايطالية,سبارو,"الطريق الدائرى, كايرو فيستيفال, القاهرة الجديدة, القاهرة.",525670
مطاعم ايطالية,سبيسس,"15 ش 9, ثكنات المعادى, المعادى, القاهرة.",578197
مطاعم ايطالية,ستريو ريستوران اند كافيه,"55 ش هجرس متفرع من ش المشاية السفلية, المنصورة, الدقهلية.",468722
مطاعم ايطالية,ستون وود,"14 ش 218 تقاطع ش 231, دجلة, المعادى, القاهرة.",583967
مطاعم ايطالية,ستيشن,"1229 ش الشيخ على جاد الحق, مساكن شيراتون, مصر الجديدة, القاهرة.",308827
مطاعم ايطالية,ستيك كلوب كافيه اند ريستوران,"28 ش عبد الحميد لطفى تقاطع ش الكروم, المهندسين, الجيزة.",439822
مطاعم ايطالية,سفن دورز,"ش الصاعقة, متفرع من ش الثورة, مساكن شيراتون, مصر الجديدة, القاهرة.",590309
مطاعم ايطالية,سكالينى,"فيلا 1 ش 20, ميدان فيكتوريا, المعادى الجديدة, المعادى, القاهرة.",420256
مطاعم ايطالية,سكالينى,"كم 14 - , طريق نويبع طابا, طابا.",109180
مطاعم ايطالية,سكانيرو,"طريق وصلة دهشور, الشيخ زايد, السادس من اكتوبر, الجيزة.",683326
مطاعم ايطالية,سكاى كافيه,"59 ش لبنان ميدان لبنان - الدور 5, المهندسين, الجيزة.",320135
مطاعم ايطالية,سكوير اند سيركل,"80 ش 9, المعادى, القاهرة.",586521
مطاعم ايطالية,سنووز,"طريق الشباب - زايد 2000, الشيخ زايد, السادس من اكتوبر, الجيزة.",586779
مطاعم ايطالية,سوانكى,"9 ش مصدق ميدان هيئة التدريس, الدقى, الجيزة.",428600
مطاعم ايطالية,سوبرانو,"ش الخليفة المأمون تقاطع ش احسان عبد القدوس, روكسى, مصر الجديدة, القاهرة.",288460
مطاعم ايطالية,سولو بيتزا,"ابراج الاسمنت شارع عزام, تقاطع شارع جعفر, حلوان, القاهرة.",621538
مطاعم ايطالية,سى باستا,"33 ش 151, المعادى الجديدة, المعادى, القاهرة.",506727
مطاعم ايطالية,سى كافيه,"., طريق المزرعة, نويبع.",119453
مطاعم ايطالية,سى هاوس ميلانوا,"ش التسعين الشمالى, التجمع الخامس, القاهرة الجديدة, القاهرة.",566568
مطاعم ايطالية,سيرانو كافيه,"11 ش عمر بن الخطاب, الدقى, الجيزة.",376740
مطاعم ايطالية,سيزر,"1 ش العمدة, فيصل, الجيزة.",390006
مطاعم ايطالية,سيفين ايليفين,"92 ش فريد سميكة, مصر الجديدة, القاهرة.",377520
مطاعم ايطالية,سيفين داى,"12 ش عبد المنعم رياض, المهندسين, الجيزة.",448805
مطاعم ايطالية,سيليجيو رستورانت اند لاونج,"القاهرة الجديدة - ش التسعين داخل ميتينج بوينت مول - الدور الثالث, القاهرة الجديدة, القاهرة.",457994
مطاعم ايطالية,سيليستيانو كافيه,"الطريق الدائرى - كمباوند جراند جيت - برج A3, زهراء المعادى, المعادى, القاهرة.",582798
مطاعم ايطالية,سينتو بينى,"9 ش فهمى فوزى, محطة الرمل, الاسكندرية.",596760
مطاعم ايطالية,سينو كافيه,"المجاورة الاولى - الحى الثانى, الشيخ زايد, السادس من اكتوبر, الجيزة.",418426
مطاعم ايطالية,شاتس سوشيال هاوس,"55 ش الشهيد عبد المنعم حافظ, الماظة, مصر الجديدة, القاهرة.",66467
مطاعم ايطالية,شاتوه جيناش,"5 ش الشهيد محمود شكرى, سموحة, الاسكندرية.",58826
مطاعم ايطالية,شى جابى او ريتروفو,"22 طريق الحرية, العطارين, الاسكندرية.",31001
مطاعم ايطالية,شيتشو,"15 ش سوريا تقاطع ش جزيرة العرب, المهندسين, الجيزة.",139089
مطاعم ايطالية,شيروتى الكافيه,"ش عمر بن الخطاب, مدينة نصر, القاهرة.",431350
مطاعم ايطالية,شيل اوت,"طريق البلاجات, جبل مريم, الاسماعيلية.",576770
مطاعم ايطالية,شينوس مطعم وكافيه,"28 عمارات صقر قريش -, مساكن شيراتون, مصر الجديدة, القاهرة.",271147
مطاعم ايطالية,صانى داى,"34 ش 231 متفرع من ش 213, دجلة, المعادى, القاهرة.",199243
