Category,Name,Address,ID
معالجة مياه,سيفتى لمعالجة المياه,"30 ش المحروسة , حدائق القبة, القاهرة.",203988
معالجة مياه,سيكو دينماك,"., الحى السادس, السادس من اكتوبر, الجيزة.",448684
معالجة مياه,سيلف انسر,"المحور المركزى - الدور 3, السادس من اكتوبر, الجيزة.",359002
معالجة مياه,سيلفر واتر,"33 ش عمر زعفان, المنطقة الاولى, مدينة نصر, القاهرة.",143165
معالجة مياه,سيلين واتر,"4 ش حمدى, شبرا, القاهرة.",434144
معالجة مياه,سيوة بيور لايف,"ش سيف, برج زهرة المدائن, سيدى بشر, الاسكندرية.",649968
معالجة مياه,شامبيون لفلاتر المياه,"39 ش الخصوص العمومى, الخصوص, القليوبية.",498627
معالجة مياه,شاهين جروب لمعالجة المياه,"60 ش جمال عبد الناصر, جسر السويس, القاهرة.",671351
معالجة مياه,شركة ابو هاشم للتجارة والتوزيع,"ش 19 متفرع من ش 45, العصافرة قبلى, الاسكندرية.",670348
معالجة مياه,شركة اكوا الايطالية,"الامتداد الغربى - المنطقة الصناعية الثانية, مدينة العبور, القليوبية.",465610
معالجة مياه,شركة البحر الاحمر لصناعة المواسير ولوازمها,"28 ش جمال عبد الناصر, القرية السياحية الاولى, السادس من اكتوبر, الجيزة.",59327
معالجة مياه,شركة الشامي للتجارة والتكييفات وفلاتر المياه,"43, حى الزهور, المحمودية, البحيرة.",621715
معالجة مياه,شركة الشامي للتجارة والتكييفات وفلاتر المياه,"حى الزهور - عمارة 43, المحمودية, البحيرة.",622908
معالجة مياه,شركة الفريد لجميع انواع القفيز والتجارة و المقاولات,"29 ش الشريفة, القللى, السبتية, القاهرة.",581945
معالجة مياه,شركة الملكة لفلاتر المياه,"20 ش الكنيسة المرقسية, وسط البلد, القاهرة.",627763
معالجة مياه,شركة النيل الدولية - انتينايل,"53 ش جسر السويس, عمارات الفاروقية, جسر السويس, القاهرة.",107977
معالجة مياه,شركة النيل لمعالجة المياه,"58 ش الواحة, مدينة الشروق, القاهرة.",626107
معالجة مياه,شركة ايس هوم للتكييف,"4 ع ش سيد زكريا, مساكن شيراتون, مصر الجديدة, القاهرة.",471
معالجة مياه,شركة بست اكوا لفلاتر و مواتير و مبردات المياه,"23 ش 15 مايو, ارض نوبار, شبرا الخيمة, القليوبية.",654224
معالجة مياه,شركة بيور ووتر,"ش سينما ريفيرا, الابراهيمية, الاسكندرية.",590765
معالجة مياه,شركة تطوير تكنولوجيا المياه,"4 ش معروف متفرع من ش طلعت حرب, وسط البلد, القاهرة.",545009
معالجة مياه,شركة مياه الاسكندرية,"61 طريق الحرية, الشلالات, الاسكندرية.",66126
معالجة مياه,شركة نفرتارى للزراعة بالماء المالح,", الاردنية, العاشر من رمضان, الشرقية.",467763
معالجة مياه,شركة نیو ویف لتكنولوجیا المیاه,"122 ش جلال الدسوقى, وابور المياه, الاسكندرية.",672498
معالجة مياه,شركة ينابيع مصر لتحسين ومعالجة خواص المياه,"3 أ ش صوة - شبرا البلد, شبرا الخيمة, القليوبية.",389183
معالجة مياه,شطفة لانظمة معالجة المياة,"56 ش مصطفي كامل, فلمينج, الاسكندرية.",157727
معالجة مياه,شطفة لانظمة معالجة المياه,"76 ش مصطفى كامل تقاطع ش حسن رضوان, طنطا, الغربية.",249271
معالجة مياه,شمس,"الشارع العمومى سيدى سالم, وسط البلد, كفر الشيخ.",345046
معالجة مياه,شمس جروب,"ش الهانوفيل, الهانوفيل, الاسكندرية.",524551
معالجة مياه,صافى,"ش الجلاء, اشمون, المنوفية.",313258
معالجة مياه,صحارا سبرينج لتحلية المياة واللاند سكيب,"3 ابراج الريادة - ش ابن سلامة, فيكتوريا, الاسكندرية.",178621
معالجة مياه,صنى صن تريد,"15 عمارات 1200 -, برج العرب, الاسكندرية.",416644
معالجة مياه,ضحكتك بالدنيا لفلاتر المياه,"14 ش الجسر الغربى, الخصوص, القليوبية.",498455
معالجة مياه,طبريا,"6 ش جمال الدين دويدار, الحى الثامن, مدينة نصر, القاهرة.",146934
معالجة مياه,طيبة للفلاتر,"9 ش معمل الالبان, شبرا, القاهرة.",230508
معالجة مياه,طيبة للفلاتر وتنقية المياة,"ش محمد نور الدين, العرب, المعادى, القاهرة.",409684
معالجة مياه,طيبة ووتر,"41 ش طلعت حرب, الشهداء, المنوفية.",555431
معالجة مياه,عالم الفلاتر,"ش صلاح سالم, طلخا, الدقهلية.",178652
معالجة مياه,عالم المياه النقية,"27 ش حموده محمود متفرع من ش مكرم عبيد, مدينة نصر, القاهرة.",56776
معالجة مياه,عالم النقاء لفلاتر المياة,"6 ش الثلاثى - عزبة الحفير, الخصوص, القليوبية.",500427
معالجة مياه,عامر,"ش الجوازات, كفر صقر, الشرقية.",351558
معالجة مياه,عباد الرحمن لمعالجة المياة,"3 ش الاديب محمد السباعى, النزهة الجديدة, القاهرة.",260095
معالجة مياه,عبد الفتاح للتكييف والتجارة,"الحى الاول, مدينة العبور, القليوبية.",465003
معالجة مياه,عبدة الهلاوى لفلاتر المياة,"1 ش عبد الرحمن الكردى, فيصل, الجيزة.",631309
معالجة مياه,عدلى يوسف للاستيراد,"134 ش فيصل, الكوم الاخضر, فيصل, الجيزة.",119966
معالجة مياه,عرب تريد,"9 ش جامعة الدول العربية تقاطع ش جزيرة العرب - الدور 7 شقة 14, المهندسين, الجيزة.",19500
معالجة مياه,عسكر سر الحياة,"., كفر صقر, الشرقية.",362027
معالجة مياه,عيون اكوا سانا,"ميدان المحكمة, بركة السبع, المنوفية.",317238
معالجة مياه,عيون حلوان,"30 ش عبد الله, حلوان, القاهرة.",459838
معالجة مياه,فاست لانظمة معالجة المياه والحلول البيئية,"128 ش مصطفى النحاس, مدينة نصر, القاهرة.",425961
معالجة مياه,فاميلى كير لفلاتر المياه,"2 ش عثمان بن عفان, شبين الكوم, المنوفية.",533628
معالجة مياه,فايت,"23 ش الجزيرة الوسطى, الزمالك, القاهرة.",17147
معالجة مياه,فرى ووتر لفلاتر المياه,"8 ش الحرية, قرية بشتيل, اوسيم, الجيزة.",541472
معالجة مياه,فريش اير,"2 ش الامير, متفرع من ش الشهيد احمد حمدى, فيصل, الجيزة.",670686
معالجة مياه,فريش ووتر,"7 بلوك 35 - ش مصطفى النحاس, مدينة نصر, القاهرة.",466928
معالجة مياه,فريش ووتر لتكنولوجيا معالجة المياه,"4 ش الايمان, الدور 1, متفرع من ش مسجد سيدى بشر, برج المصطفى, سيدى بشر, الاسكندرية.",435710
معالجة مياه,فريش ووتر لحلول معالجة المياه - بلو بوينت,"13 ش حسان بن ثابت, تقاطع ش المتوكل, طنطا, الغربية.",114316
معالجة مياه,فريش ووتر لفلاتر المياة,"15 ش المعتصم بالله - صفط اللبن, بولاق الدكرور, الجيزة.",576617
معالجة مياه,فلاتر سو بيور,"75 ش 23 يوليو, الباجور, المنوفية.",559294
معالجة مياه,فلاتر مياه,"96 ش جسر السويسالالف مسكن, جسر السويس, القاهرة.",623854
معالجة مياه,فلاتر مياه اتش تو او,"21 ش الجلاء البحرى, شبين الكوم, المنوفية.",532217
معالجة مياه,فلتر هاوس,"26 ش نجيب الريحانى, وسط البلد, القاهرة.",627551
معالجة مياه,فلترك لفلاتر المياه,"كم 21 طريق الساحل الشمالى, العجمى, الاسكندرية.",667568
معالجة مياه,فلو جيتس,"247 ش شبرا, شبرا, القاهرة.",505906
معالجة مياه,فلوتك للحلول البيئية,"9 ش مسجد عباد الرحمن, مساكن شيراتون, مصر الجديدة, القاهرة.",567141
معالجة مياه,فلوويل تك لمعالجة المياة,"6 ش 288, المعادى الجديدة, المعادى, القاهرة.",688083
معالجة مياه,فوتيك,"7 ميدان الحجاز, مصر الجديدة, القاهرة.",146875
معالجة مياه,فور برازرز لفلاتر المياه,"14 الشارع الجديد, كرداسة, الجيزة.",558266
معالجة مياه,فورمنج,"32 ش احمد ابراهيم مدكور, فيصل, الجيزة.",235019
معالجة مياه,فيرزاسكا لتكنولوجيا معالجة المياه,"6 ش شحات منطاوى, المرج, القاهرة.",518270
معالجة مياه,فيرست,"عمارة 6, اطلس, اسوان.",522210
معالجة مياه,فيوتشر,"القطعة 8912 - ش 9, المقطم, القاهرة.",368138
معالجة مياه,فيوتشر انترناشيونال,"2 ش حسن افلاطون, ارض الجولف, مصر الجديدة, القاهرة.",119406
معالجة مياه,فيوتشر انترناشيونال لمعالجة المياه,"60 ش 18 متفرع من ش العيسوى - برج سرايا, سيدى بشر, الاسكندرية.",141330
معالجة مياه,فيوتشر برودكتس,"4 ش قمبيز, ميدان الاسماعيلية, مصر الجديدة, القاهرة.",62057
معالجة مياه,فيوتشر جروب,"4 عمارات العبور طريق صلاح سالم, مدينة نصر, القاهرة.",150104
معالجة مياه,فيوتشر لفلاتر المياه,"ش المنياوى, غمره, القاهرة.",635650
معالجة مياه,فيوتشر لفلاتر المياة,"41 ش بورسعيد, الشهداء, المنوفية.",547684
معالجة مياه,فيوتشر لمعالجة المياه,"27 ش اسماعيل ذكى, كفر عبده, الاسكندرية.",229649
معالجة مياه,فيوتشر معالجة المياه,"21 ش محمد ابراهيم, الالف مسكن, جسر السويس, القاهرة.",664817
معالجة مياه,فيوتشر وتر,"ش سيد ابو النجا, عين شمس الشرقية, القاهرة.",320504
معالجة مياه,فيوليا ووتر,"3 وحدة 8 - ش التسعين - مجمع داون تاون - الدور 2, التجمع الخامس, القاهرة الجديدة, القاهرة.",47651
معالجة مياه,قطرات لفلاتر المياه,"101 ش مونت كايرو, الحى الثالث, المقطم, القاهرة.",640304
معالجة مياه,قطرة مياه لفلاتر المياه,"191 ش الجيش, الباجور, المنوفية.",559755
معالجة مياه,قطرة ندى لفلاتر المياه,"26 ش الصوفى, اشمون, المنوفية.",560319
معالجة مياه,كاراس اير للتكييف و تنقية المياه,"ابراج فيكتوريا ش عبد الرزاق السنهورى, تقاطع صلاح الدين, السيوف شماعة, الاسكندرية.",468081
معالجة مياه,كايرو تك,"51 سور نادى العياط الرياضى - ش شكرى القواتلى, العياط, الجيزة.",613218
معالجة مياه,كايروماتيك - الشركة العربية للاعمال الهندسية,"33 ش احمد تيسير, كلية البنات, مصر الجديدة, القاهرة.",55978
معالجة مياه,كراون كيميكال,"6 ش عبد المعطى خيال, ميدان هليوبوليس, مصر الجديدة, القاهرة.",15855
معالجة مياه,كرمى جروب لتنقية المياة,"27 ش اسعد متفرع من ش شبرا - الدور 4 شقة 8, روض الفرج, القاهرة.",384230
معالجة مياه,كريستال,"ش الثورة, بلقاس, الدقهلية.",360648
معالجة مياه,كريستال بيور,"7 ش سيدى رمضان, شبرا, القاهرة.",467454
معالجة مياه,كريستال ووتر,"عمارة 55ج, حدائق الاهرام, الهرم, الجيزة.",437129
معالجة مياه,كريستال ووتر,"59 ش كلية التربية, شبين الكوم, المنوفية.",535442
معالجة مياه,كريم الحسينى لمبردات المياه,"5 ش المهدى متفرع من ش الجمهورية, وسط البلد, القاهرة.",353235
معالجة مياه,كريم لفلاتر المياه,"1 ش الجمل متفرع من ش البترول, عزبة النخل, القاهرة.",528227
معالجة مياه,كلير ووتر للفلاتر,"6 ش احمد ماهر, شبين الكوم, المنوفية.",532055
معالجة مياه,كلير ووتر لمعالجة المياه,", امتداد ش مدرسة الفتح, منطقة الفلل - برج العسال, بنها, القليوبية.",673084
معالجة مياه,كليرو جروب,"42 طريق مسطرد, المطرية, القاهرة.",464838
معالجة مياه,كلين ووتر لمعالجة المياه,"325 ش خالد ابن الوليد, ميامى, الاسكندرية.",638897
معالجة مياه,كواليتى اند بيور,"38 ش حسن المأمون, الحى الثامن, مدينة نصر, القاهرة.",495849
معالجة مياه,كوماتسو,"22 ش ابو الدرداء, العطارين, الاسكندرية.",483233
معالجة مياه,كومباك فلتر,"3 ش ابو سيف, متفرع من ش الخليج المصرى, حدائق القبة, القاهرة.",635020
معالجة مياه,كونتراست الدولية,"64 ش المنتزة, الشقة 2, الدور 1, ميدان هليوبوليس, مصر الجديدة, القاهرة.",193504
معالجة مياه,كونسبت انترناشيونال,"20 ابراج الخليج - برج - ج - ش مسجد الهداية, بولكلى, الاسكندرية.",372803
معالجة مياه,كونسبت ايجيبت لانظمة معالجة المياه,"38 ش راغب - الدور 4, حلوان, القاهرة.",459840
معالجة مياه,كونكورد ايجيبت,"81 أ ش سليم الاول ميدان حلمية الزيتون - برج الفهيم - الدور 8 شقة 82, حلمية الزيتون, القاهرة.",284122
معالجة مياه,كيان للتكييف وفلاتر المياه,"88 ش العشرين, فيصل, الجيزة.",684048
معالجة مياه,كيربى,"22 ش ذاكر حسين, الحى السابع, مدينة نصر, القاهرة.",146941
معالجة مياه,كيربى,"38 ش مكرم عبيد عمارة على البدرى, مدينة نصر, القاهرة.",448154
معالجة مياه,كيربى اكوا كير,"2 ش حسن افلاطون, ارض الجولف, مصر الجديدة, القاهرة.",132092
معالجة مياه,كيربى ايجيبت,"229 ش رمسيس, غمره, القاهرة.",142670
معالجة مياه,كيما كونسلت تكنولوجى,"38 ش عباس العقاد, الدور 4, المنطقة السادسة, مدينة نصر, القاهرة.",55003
معالجة مياه,كيمات للتجارة والمقاولات,"76 ش عبد السلام عارف - الدور 2, جليم, الاسكندرية.",572542
معالجة مياه,كيمكس للخدمات العلمية والصناعية,"6 ش طلعت حرب, العطارين, الاسكندرية.",20547
معالجة مياه,كيميا ستور,"23 ش النزهة المنشية, بنها, القليوبية.",414745
معالجة مياه,كيميت لتكنولوجيا معالجة المياه,"عمارت نجوم الصفا, الاردنية, العاشر من رمضان, الشرقية.",628763
معالجة مياه,كيميكون ايجيبت - سى سى اى,"186 و, حدائق الاهرام, الهرم, الجيزة.",670708
معالجة مياه,لاف ووتر,"ش مصطفى كامل, شدس, الاسكندرية.",533811
معالجة مياه,لايت هاوس انترناشيونال,"1 ابراج ضباط الشرطة - امتداد ش عباس العقاد, مدينة نصر, القاهرة.",55209
معالجة مياه,لايف بيور,"57 ش سليم الاول, الزيتون, القاهرة.",420448
معالجة مياه,لايف دروبس,"49 ش صلاح سالم, الحوامدية, الجيزة.",614976
معالجة مياه,لايف سورس ايجيبت,"325 ابراج بنك مصر - ش ترعة الزمر - الدور 1, الهرم, الجيزة.",458689
معالجة مياه,لايف ووتر,"18 ش عين شمس, عين شمس, القاهرة.",658471
معالجة مياه,لوتس لمعالجة المياة,"4 ش الفرات, المهندسين, الجيزة.",413171
معالجة مياه,ليتس درينك,"70 ش هشام لبيب, الحى الثامن, مدينة نصر, القاهرة.",253954
معالجة مياه,مؤسسة اكواريا للكيماويات,"2 ش نوقراطيس, الشقة 8, كامب شيزار, الاسكندرية.",686357
معالجة مياه,مؤسسة الاسراء,"189 ش فيصل, الطوابق, فيصل, الجيزة.",492014
معالجة مياه,مؤسسة الدلتا,"7 عمارات الفتح - عمارة الاطباء - - المحور المركزى, السادس من اكتوبر, الجيزة.",582554
معالجة مياه,مؤسسة الطارق للمقاولات العامة والتوريدات,"ش على ابن ابى طالب, العريش, شمال سيناء.",651026
معالجة مياه,مؤسسة العروبة للمقاولات والتوريدات,"2 ش الجمهورية متفرع من ش ترعة الجلاد - ارض الجنينة - الدور 1 شقة 1, الزاوية الحمراء, القاهرة.",239699
معالجة مياه,مؤسسة تاج الدين,"الطريق الدائرى - عزبة الامير, الخصوص, القليوبية.",484482
معالجة مياه,مؤسسة كلين هاوس,"ش 27 متفرع من ش الخمسين, النزهة الجديدة, القاهرة.",280149
معالجة مياه,ماء الحياة,"11 ش فرغلى محمد حسنين متفرع من ش مصطفى الشريف, عزبة النخل, القاهرة.",532848
معالجة مياه,ماتريكس للخدمات العلمية,"56 طريق مصر حلوان الزراعى, الشقة 17, الدور 3, برج بدر, كورنيش المعادى, المعادى, القاهرة.",432783
معالجة مياه,ماتيتو,"كم 22 - - مرتفعات الاهرام - مبنى 7, طريق القاهرة الاسكندرية الصحرا, طريق القاهرة الاسكندرية الصحراوى, الجيزة.",18642
معالجة مياه,ماجيك تك,"12 ش المدينة المنورة متفرع من ش الجمهورية, سوهاج, سوهاج.",485237
معالجة مياه,ماجيك ووتر لفلاتر المياه,"28 ش فاطمة الزهراء, الخصوص, القليوبية.",499775
معالجة مياه,ماس لفلاتر المياه,"19 ش عبد العزيز حامد, المعصرة, القاهرة.",645039
معالجة مياه,ماستر اكوا,"13 ش شحاتة العطار, متفرع من ش الورشة, مدينة نصر, القاهرة.",670272
معالجة مياه,ماستر بيور,"ش شيتى بك متفرع من ش الاقبال - برج السراى كابيتال, لوران, الاسكندرية.",544093
معالجة مياه,ماستر ووتر فلتر,"8 ش ابو سعدة متفرع من ش الخصوص العمومى, الخصوص, القليوبية.",499310
معالجة مياه,ماك,"1 امتداد ش ولى العهد - برج الصحفيين, حدائق القبة, القاهرة.",611536
معالجة مياه,ماكس ووتر,"19 ش حسنين دسوقى, متفرع من ش احمد زكى, حدائق المعادى, المعادى, القاهرة.",694616
معالجة مياه,ماكسيم,"90 ب ش احمد عرابى - الدور 3 شقة 25, المهندسين, الجيزة.",107120
معالجة مياه,مالتى بيور لتكنولوجيا معالجة المياه,"105 ش جمال الدين زكى - التجاريين, جسر السويس, القاهرة.",430328
معالجة مياه,ماى تريد اكوامنت,"كم 8 - طريق سفاجا الغردقة تقسيم الظهير السياحى, وسط البلد, الغردقة.",158256
معالجة مياه,ماى ووتر لفلاتر المياه,"60 ش جمال عبد الناصر, الخصوص, القليوبية.",495464
معالجة مياه,مايزنر للمرشحات الامريكية,"1 ابراج سيتى ستارز - المحور المركزى - الدور 5 شقة 504, السادس من اكتوبر, الجيزة.",487490
معالجة مياه,متواست,"22 ش ابو المحاسن الشاذلى, العجوزة, الجيزة.",67668
معالجة مياه,مجموعة اكوا الصناعية مصر,"10 عمارات مصر للتعمير, المنطقة الثانية, مساكن شيراتون, مصر الجديدة, القاهرة.",440066
معالجة مياه,مجموعة اى تى اى للاعمال الهندسية,"40 ش الطيران, الدور 9, المنطقة الاولى, مدينة نصر, القاهرة.",313940
معالجة مياه,مجموعة فاروس للاعمال,"17 ش مصطفى المصرى, متفرع من ش الوفاء والامل, فيصل, الجيزة.",507260
معالجة مياه,مجموعة كواليتى ووتر,"طريق المنصورية, مشعل, الهرم, الجيزة.",563694
معالجة مياه,مجموعة نورما,"ش خير الله متفرع من طريق اسكندرية مطروح, الهانوفيل, الاسكندرية.",447170
معالجة مياه,محطة مياه الروضة,"ش منيل الروضة, منيل الروضة, القاهرة.",148632
معالجة مياه,محطة مياة العبور,"كم 19 - طريق بلبيس الصحراوى, مدينة العبور, القليوبية.",167666
معالجة مياه,محطة مياه المرج,"12 ش محمد نجيب, المرج, القاهرة.",148654
معالجة مياه,محطة مياه جزيرة الذهب,"ش البحر الاعظم, الجيزة, الجيزة.",515783
معالجة مياه,مركز الاستشارات والتحاليل البيئية,"56 ش العروبة - الدور 2 شقة 6, المريوطية, الهرم, الجيزة.",214811
معالجة مياه,مركز الناصر,"10 ش الناصر متفرع من ش حسن رضوان, طنطا, الغربية.",338392
معالجة مياه,مركز بريجر ووتر,"8 ش الجباخنكى, المنيل, القاهرة.",427087
معالجة مياه,مرموتك للاستيراد والتصدير,"92 ابراج الشرطة - امتداد ش عمارات الامل, زهراء المعادى, المعادى, القاهرة.",176825
معالجة مياه,مريم جروب للاستيراد والتوكيلات التجارية,"قطعة 258 - نموذج ج, المنطقة الجنوبية, العاشر من رمضان, الشرقية.",587299
معالجة مياه,مريم للاستيراد والتصدير,"4 ش المهدى, متفرع من ش الجمهورية, وسط البلد, القاهرة.",145449
معالجة مياه,مستر ووتر,"4 ش الاشول - الدور 3, مشعل, الهرم, الجيزة.",386904
معالجة مياه,مسكوب العالمية للمقاولات,"القطعة 8311 ش الخزان, متفرع من ش 9, المقطم, القاهرة.",536169
معالجة مياه,مصر الدولية لفلاتر المياه,"8 ش الجامع, المرج, القاهرة.",562138
معالجة مياه,مصر امريكول لتكنولوجيا معالجة المياه,"ش المنشية - الدور 2, ابشواى, الفيوم.",487463
معالجة مياه,مصر هاى تك لمعالجة المياه,"27 ش افريقيا امتداد ش مصطفى النحاس , مدينة نصر, القاهرة.",191544
معالجة مياه,مصنع صقر للصناعات المتطورة,"كم 4.5 -, طريق القاهرة السويس, القاهرة.",124735
معالجة مياه,معامل المؤسسة المصرية لتحليل المياه,"21 طريق القاهرة اسكندرية الزراعى, شبرا الخيمة, القليوبية.",618826
