Category,Name,Address,ID
معالجة مياه,البركة للفلاتر,"7 ش فتحى الاباصيرى, المرج, القاهرة.",443653
معالجة مياه,البرهانية الالمانية باكو لمعالجة المياة,"كم 180 -, طريق القاهرة الاسكندرية الزراع, طريق القاهرة الاسكندرية الزراعى, القليوبية.",271625
معالجة مياه,البسمة,"قرية شبراملس, زفتى, الغربية.",404141
معالجة مياه,البطل,"درب الابراهيمى, العتبة, القاهرة.",268324
معالجة مياه,البطل الرومانى,"ش الكنيسة المرقصية, العتبة, القاهرة.",268335
معالجة مياه,البطل لتجارة المياه,"ش محمد نجيب, المرج, القاهرة.",432513
معالجة مياه,البطل لفلاتر المياة,"24 ش ابراهيم الخليل, مدينة قباء, جسر السويس, القاهرة.",633162
معالجة مياه,البطل للتجارة وانظمة معالجة المياه,"39 طريق مشتول الرئيسى, مشتول السوق, الشرقية.",602459
معالجة مياه,البغدادى للتجارة وانظمة معالجة المياه,"14 ش احمد ماهر, حى السويس, السويس.",136736
معالجة مياه,التخصصية,"26 ش سيد جاد, عين شمس, القاهرة.",187841
معالجة مياه,الترا بيور,"48 ش التحرير, النمسا, السويس.",298678
معالجة مياه,الترا بيور - المجموعة العربية,"114 ش جسر السويس, جسر السويس, القاهرة.",143618
معالجة مياه,الترا بيور لمعالجة مياه الشرب,"8 ش فتحى الجزيرى, متفرع من ش فريد سميكة, الالف مسكن, مصر الجديدة, القاهرة.",171964
معالجة مياه,التركى لفلاتر المياه,"ش الاربعين, عزبة النخل, القاهرة.",590582
معالجة مياه,التسنيم لمعالجة المياه,"ش السنترالالاردنية, العاشر من رمضان, الشرقية.",621025
معالجة مياه,التكنولوجيا المتقدمة لحلول حماية البيئة - هاى تك,"الطريق الدائرى, المرج الجديدة, القاهرة.",493681
معالجة مياه,التوحيد,"4 ش على الكسار, الازبكية, القاهرة.",267310
معالجة مياه,الثورة لتكنولوجيا معالجة المياه,"ابراج اسكندرية للتشييد والبناء -, السيوف, الاسكندرية.",398108
معالجة مياه,الجمال,"19 ش الجلاء - الدور 2, فيكتوريا, الاسكندرية.",551653
معالجة مياه,الجندى لفلاتر المياه,"14 ش ابو النجا حسنين الدسوقى, حدائق المعادى, المعادى, القاهرة.",637362
معالجة مياه,الحاجرى للخدمات العلمية والاستشارات الصناعية,"19 ش 2, المرماح, بنى سويف.",155095
معالجة مياه,الحجازية لمعالجة المياه,"33 ش المشربية, الدور 1, متفرع من ش المريوطية الرئيسى, المريوطية, فيصل, الجيزة.",331077
معالجة مياه,الحمد لفلاتر المياه,"1 ش عيد عبد الله الجبالى, متفرع من ش الترعة السلطوحية, المرج, القاهرة.",666529
معالجة مياه,الحياة لانظمة معالجة المياه,"اتريب, بنها, القليوبية.",453309
معالجة مياه,الحياة لفلاتر المياه,"2 ش 8 متفرع من ش الصرف الصحى, الخصوص, القليوبية.",497162
معالجة مياه,الحياة للتكييف وفلاتر المياة,"ش الحوار, المنصورة, الدقهلية.",665072
معالجة مياه,الحياة للمضخات و المواتير,"20 ش الكنيسة المرقصية -كلوت بك, الازبكية, القاهرة.",648623
معالجة مياه,الدخيلة للتجارة والمقاولات,"ش 15 مايو - ابراج سيدى جابر - برج القضاة 4, سموحة, الاسكندرية.",26234
معالجة مياه,الدكتور,"ش النقراشى, ابو كبير, الشرقية.",329688
معالجة مياه,الدكتور للتجارة والتوزيع,"البستان, وسط البلد, الجونة.",483090
معالجة مياه,الدلتا,"ش احمد عرابى, دمنهور, البحيرة.",356834
معالجة مياه,الدلتا للتجارة والخدمات,"34 ش مصطفى كامل, المحلة الكبرى, الغربية.",135736
معالجة مياه,الدولية,"ش سعد زغلول, منيا القمح, الشرقية.",326100
معالجة مياه,الدولية اكوا بيور لمعالجة المياة,"5 طريق القاهرة اسكندرية الزراعى امتداد ش شبرا, شبرا الخيمة, القليوبية.",159234
معالجة مياه,الدولية لتكنولوجيا المياه والبيئة,"بلوك 5, المحور المركزى, الحى الرابع, السادس من اكتوبر, الجيزة.",56605
معالجة مياه,الدولية للتجارة الحديثة ومعالجة المياه,"مفارق المنصورة, الزقازيق, الشرقية.",169482
معالجة مياه,الدولية للتوريدات,"55 ش النادى الرياضى - برج الاطباء - الدور 1, فيصل, الجيزة.",509542
معالجة مياه,الدولية للكيماويات المتخصصة,"13 ش ابناء الفيوم, متفرع من ش القدس, المريوطية, الهرم, الجيزة.",536154
معالجة مياه,الدولية للمياه الامنة,"27 ش الصواف, الحى العاشر, مدينة نصر, القاهرة.",348037
معالجة مياه,الدويك لانظمة معالجة المياة,"14 عمارات المدفعية - , مدينة نصر, القاهرة.",168407
معالجة مياه,الرؤى للتجارة والتوريدات العمومية,"2 ش الاربعين, الطوابق, فيصل, الجيزة.",591208
معالجة مياه,الرائد جيت ماستر,"القطعة 149, امتداد المنطقة الصناعية السادسة, المنطقة الصناعية, السادس من اكتوبر, الجيزة.",146001
معالجة مياه,الربوة مصر لتكنولوجيا المياة,"طريق القاهرة شبين الكوم الزراعى, عزبة زايد, اشمون, المنوفية.",485225
معالجة مياه,الرحاب,"ش الجمهورية, القلج, القليوبية.",278952
معالجة مياه,الرحاب,"ش 23 يوليو, بسيون, الغربية.",347460
معالجة مياه,الرحاب لتشغيل وصيانة المرافق,"11 عمارات مصر للتعمير - - المنطقة الرابعة, مساكن شيراتون, مصر الجديدة, القاهرة.",132495
معالجة مياه,الرحمن للفلاتر,"31 ش الصفا والمروة, متفرع من ش فيصل, فيصل, الجيزة.",567948
معالجة مياه,الرحمة لفلاتر المياه,"106 ش التحرير - صفط اللبن, بولاق الدكرور, الجيزة.",575914
معالجة مياه,الرضوان جروب,"27 ش على باشا اللالة, النعام, حلمية الزيتون, القاهرة.",437693
معالجة مياه,الزمزم,"كم 16 - , طريق القاهرة الاسكندرية الزراعى, القليوبية.",157510
معالجة مياه,الزهراء,"ش العاشر من رمضان متفرع من ش الزهراء, المنزلة, الدقهلية.",471011
معالجة مياه,السعد لمعالجة المياه,"ش محمد حافظ, الاردنية, العاشر من رمضان, الشرقية.",654561
معالجة مياه,السعودى لفلاتر المياه,"94 ش جمال الدين زكى تقسيم التجاريين, جسر السويس, القاهرة.",477941
معالجة مياه,السلام لاعمال التكييف وفلاتر المياه,"5 ش فيكتور عمانويل - برج شهرزاد مينا ب, سموحة, الاسكندرية.",356480
معالجة مياه,السلام لفلاتر المياه,"12 ش الامام محمد عبده, النعام, حلمية الزيتون, القاهرة.",654913
معالجة مياه,السلام لفلاتر المياه,"28 ش شونة الملح, شبين القناطر, القليوبية.",517867
معالجة مياه,السماحى لمعالجة المياه,"67 برج مصر للتعمير - , الهرم, الجيزة.",118493
معالجة مياه,الشال لمعالجة المياه,"ش قناة السويس, جديلة, المنصورة, الدقهلية.",654970
معالجة مياه,الشرق الاوسط,"16 ش ابن كثير متفرع من ش الحجاز, ميدان الحجاز, مصر الجديدة, القاهرة.",63654
معالجة مياه,الشرق الاوسط لتكنولوجيا المياه والصرف - ميدووتر,"16 عمارات الاتصالات - ش مجدى سلامة متفرع من طريق الاوتوستراد - الدور 1 شقة 14, المعادى, القاهرة.",162099
معالجة مياه,الشرق الاوسط لفلاتر المياه,"36 ش حسب الله الكفراوى - مركز الحى الثانى, دمياط الجديدة, دمياط.",528933
معالجة مياه,الشركة الايطالية الحديثة,"57 ش المعتمدية - قرية المعتمدية, كرداسة, الجيزة.",555737
معالجة مياه,الشركة التجارية الدولية,"10 ش الامين الرافعى, الدقى, الجيزة.",63190
معالجة مياه,الشركة الدولية لانتاج محطات تحلية المياه,"القطعة 11 - ش 9, المنطقة الحرة, مدينة نصر, القاهرة.",67759
معالجة مياه,الشركة الدولية للنظم البيئية نقاء,"23 ش عبد الحكيم الرفاعى, الحى الثامن, مدينة نصر, القاهرة.",144569
معالجة مياه,الشركة العربية لتكنولوجيا معالجة مياه الشرب,"10 ش ابو بكر الصديق, مصر الجديدة, القاهرة.",293545
معالجة مياه,الشركة العربية هيلثى ووتر,", الدور 3, ميدان قريطم, برج الاماراتية, دمنهور, البحيرة.",641137
معالجة مياه,الشركة المتحدة لاعمال ابار المياه,"كم 43.5 -, طريق اسكندرية مطروح الصحراوى, الساحل الشمالى.",447041
معالجة مياه,الشركة المتحدة لحمامات السباحة,"طريق القاهرة اسكندرية الزراعى, الشقة 2, الدور 1, برج المدينة المنورة, طوخ, القليوبية.",283431
معالجة مياه,الشركة المتحدة لفلاتر المياه,"6 ش المدارس, عزبة النخل, القاهرة.",527499
معالجة مياه,الشركة المصرية الامارتية,"3067 ش المعراج الرئيسى مجاورة الثالثة, المعادى, القاهرة.",480049
معالجة مياه,الشركة المصرية الهندسية - م. طارق ابراهيم عادل وشركاه,"القطعة 139, امتداد المنطقة الصناعية السادسة, السادس من اكتوبر, الجيزة.",45456
معالجة مياه,الشركة المصرية للاستيراد والتصدير,"ش الخلفاء, المنصورة, الدقهلية.",181500
معالجة مياه,الشركة المصرية لمعالجة السوائل والغازات - اى اف تى,"25 أ عمارات العبور - ش صلاح سالم, مدينة نصر, القاهرة.",9327
معالجة مياه,الشركة المصرية لمعالجة المياه وحمامات السباحة,"300 ش الهرم, الهرم, الجيزة.",104002
معالجة مياه,الشركة الهندسية لانظمة معالجة المياه - اى سى دابيليو تى اس,"23 ب ش سويلم - الدور 7, فيصل, الجيزة.",432168
معالجة مياه,الشركة الهندسية لتكنولوجيا المياه,"2 عمارات ميلسا - ش حسن افلاطون, ارض الجولف, مصر الجديدة, القاهرة.",211576
معالجة مياه,الشركة الهندسية للتجارة والتوريدات,"ش محمود شاهين تقاطع ش طه حسين - الدور 1, شبين الكوم, المنوفية.",341404
معالجة مياه,الشركة الوطنية لتكنولوجيا معالجة المياه,"239 ش فيصل, فيصل, الجيزة.",155039
معالجة مياه,الشريف لفلاتر المياه,"ش عرب الساحة, البدرشين, الجيزة.",654405
معالجة مياه,الشعراوى لفلاتر المياه,"6 طريق الشيخ عتمان متفرع من ش طراد النيل - العزبة الشرقية, الحوامدية, الجيزة.",615281
معالجة مياه,الشماع للمقاولات ومعالجة المياه,"22 ش 269, المعادى الجديدة, المعادى, القاهرة.",11242
معالجة مياه,الشوربجى لفلاتر المياه,"6457 ش الجامعة الحديثة, الحى الخامس, المقطم, القاهرة.",637753
معالجة مياه,الشوربجى لفلاتر المياه,"ش عبد السلام عارف, المنصورة, الدقهلية.",178971
معالجة مياه,الشيخ لتنقية المياه,"ش بور سعيد متفرع من ش كفور, الابراهيمية, الشرقية.",568385
معالجة مياه,الصادق لتكنولوجيا معالجة المياه,"109 ش جمال عبد الناصر تقاطع ش محمد نجيب, سيدى بشر, الاسكندرية.",340623
معالجة مياه,الصباح للاستيراد والتصدير والتوكيلات التجارية,"27 ش 18 متفرع من ش العيسوى - الدور 1 شقة 2, سيدى بشر بحرى, الاسكندرية.",255668
معالجة مياه,الصحابة لفلاتر المياة,"7 ش رجب الطويل - عزبة الحفير, الخصوص, القليوبية.",500564
معالجة مياه,الصحابة لفلاتر المياه,"1 ش رجب الطويل متفرع من ش الصحابة, الخصوص, القليوبية.",499010
معالجة مياه,الصفا لفلاتر المياه,"79 ش الجمعية - ش الزاوية سابقا, القلج, القليوبية.",514745
معالجة مياه,الصفتى,"ش 23 يوليو, بسيون, الغربية.",348577
معالجة مياه,الصفوة,"67 ش مصطفى فهمى, حلوان, القاهرة.",459117
معالجة مياه,الصقر,"ابراج سيتى ستار - المحور المركزى, السادس من اكتوبر, الجيزة.",353546
معالجة مياه,الصقر جروب للسقالات والشدات المعدنية ش.م.م,"برج 6, الدور 5, المحور المركزى, السادس من اكتوبر, الجيزة.",63460
معالجة مياه,الصياد لفلاتر المياه,"4 ش شعبان موسى, عزبة النخل, القاهرة.",658012
معالجة مياه,الصياد لفلاتر المياه,"1 ش سعيد السيد سعد متفرع من ش مسجد عثمان, كرداسة, الجيزة.",560547
معالجة مياه,الضبع للاستيراد والتصدير,"7 عمارات المصرية للاتصالات - طريق الاوتوستراد تقسيم اللاسلكى - مشروع 16 عمارة - الدور 1 شقة 11, المعادى الجديدة, المعادى, القاهرة.",228822
معالجة مياه,الضحى,"61 التقسيم السياحى, القناطر الخيرية, القليوبية.",302755
معالجة مياه,الطارق لمعالجة المياه,"44, المنطقة الخامسة - المجاورة الثالثة, مدينة الشروق, القاهرة.",651024
معالجة مياه,الطلخاوى ستار لمعالجة المياه وصيانة الغلايات,"., العاشر من رمضان, الشرقية.",156336
معالجة مياه,العائلة السعيدة لفلاتر المياه,"19 ش محمد عبد العزيز القرشى - صفط اللبن, بولاق الدكرور, الجيزة.",580050
معالجة مياه,العالمية تك لمعالجة المياة,"ش السوق, قويسنا, المنوفية.",551842
معالجة مياه,العالمية للمقاولات,"1 ش زكى شبانة - البر الشرقى, شبين الكوم, المنوفية.",332621
معالجة مياه,العالمية للهندسة الكيميائية,"156 د برج الفرقان - ش فيصل شقة 44, الكوم الاخضر, فيصل, الجيزة.",63248
معالجة مياه,العبد جروب,"62 ش كمال الشاذلى - ش الجيش سابقا, الباجور, المنوفية.",558621
معالجة مياه,العربية,"6 ش ابو السعود, الدقى, الجيزة.",387188
معالجة مياه,العلياء لمعالجة المياه وحماية البيئة,"المنطقة 11, مدينة السادات, المنوفية.",453465
معالجة مياه,العليمى للتجارة,"ش كفر عنان, زفتى, الغربية.",333908
معالجة مياه,العمدة,"6 /4 الشطر العاشر, المعادى, القاهرة.",378181
معالجة مياه,العمدة للفلاتر,"54 ش رايل, حلوان, القاهرة.",255754
معالجة مياه,الغدير,"52 برج الفراج - ش جمال الدين الافغانى متفرع من ش الجيش, المنصورة, الدقهلية.",104866
معالجة مياه,الغريب,"ش سيدى عقيل, سمنود, الغربية.",345424
معالجة مياه,الفا انترناشيونال,"61 ش محمود خاطر, حلوان, القاهرة.",452229
معالجة مياه,الفا بلس,"61 ش مصطفى النحاس تقاطع ش مكرم عبيد - الدور 5, الحى الثامن, مدينة نصر, القاهرة.",183131
معالجة مياه,الفا بينو,"6 ش التحرير, المهندسين, الجيزة.",637325
معالجة مياه,الفا ميديكال للتوريدات ومعالجة المياة,"25 ش سلوانس, متفرع من ش شبرا, بجوار سوبر ماركت خير زمان, شبرا, القاهرة.",630800
معالجة مياه,الفادى لفلاتر المياه,"40 ش الشيخ منصور, عزبة النخل, القاهرة.",523056
معالجة مياه,الفارس جروب,"17 ش الكوم الاخضر, متفرع من ش الهرم, الهرم, الجيزة.",672865
معالجة مياه,الفرات,"54 ش النادى تقاطع ش على مبارك, طنطا, الغربية.",155502
معالجة مياه,الفرات ووتر جروب,"ش الرشاح, ابو زعبل, القليوبية.",356048
معالجة مياه,الفراعنة للاعمال الهندسية,"19 ش حسن محمد متفرع من ش الهرم - ابراج الزهور - برج د, حسن محمد, الهرم, الجيزة.",136888
معالجة مياه,الفراعنة نيل,"31 ش احمد انسى, حلوان, القاهرة.",246095
معالجة مياه,الفرسان لفلاتر المياه,"80 ش الجمهورية - عرب العيايدة, القلج, القليوبية.",515599
معالجة مياه,الفريد,"20 ش المحكمة القديمة, البدرشين, الجيزة.",378903
معالجة مياه,الفنار للتكييف وفلاتر المياه,"30 ش سعد زغلول, ميدان بسيسة, المحلة الكبرى, الغربية.",636919
معالجة مياه,الفنى لتكنولوجيا تنقية و معالجة مياه الشرب,"261 هـ ش الضغط العالى, حدائق الاهرام, الهرم, الجيزة.",442551
معالجة مياه,الفيروز لمعالجة المياه,"1 أ ش مكرم عبيد, الدور 3, المنطقة السادسة, مدينة نصر, القاهرة.",151334
معالجة مياه,القاهرة الحديثة - ام سى,"طريق دهشور الرئيسى, البدرشين, الجيزة.",682771
معالجة مياه,الكنج مريوط لفلاتر المياه,"ش عمر المختار, كينج مريوط, الاسكندرية.",674756
معالجة مياه,الكوثر لفلاتر المياه,"25 ش العمدة, ابو النمرس, الجيزة.",603055
معالجة مياه,الكوثر لفلاتر المياه,"12 طريق ابو صير, الحوامدية, الجيزة.",605779
معالجة مياه,المؤسسة الاستشارية للخدمات الصناعية,"2 ب ابراج الشرطة كورنيش النيل, كورنيش المعادى, المعادى, القاهرة.",638576
معالجة مياه,المؤسسة العالمية زمزم لمعالجة المياه,"تقسيم الزهراء, القناطر الخيرية, القليوبية.",305837
معالجة مياه,المؤسسة المصرية للتجارة والتوريدات العمومية,"156 ش مصر والسودان, حدائق القبة, القاهرة.",156609
معالجة مياه,المؤسسة الهندسية للخدمات الصناعية - اى اى اس,"6 ى ش 272, متفرع من ش الجزائر, المعادى, القاهرة.",179869
معالجة مياه,الما مصر,"19 ش 151 ميدان الحرية, المعادى, القاهرة.",231758
معالجة مياه,الماسة للتأجير ومعالجة المياه,"178 طريق سقارة السياحى - الحرانية, المريوطية, الهرم, الجيزة.",202441
معالجة مياه,المتحدة لفلاتر المياه,"28 ش محمد ابراهيم - عزبة الحفير, الخصوص, القليوبية.",500962
معالجة مياه,المتحدة لفلاتر المياه,"29 ش الشريف - صفط اللبن, بولاق الدكرور, الجيزة.",588284
معالجة مياه,المتوكل,"ش الخصوص العمومى, المرج, القاهرة.",433581
معالجة مياه,المجموعة المتكاملة للخدمات الفنية - اى تى اس جروب,"44 أ عمارات مصر للتأمين, الشقة 111, الدور 11, الدقى, الجيزة.",5806
معالجة مياه,المجموعة المصرية,"ش الصادق, ميت غمر, الدقهلية.",339604
معالجة مياه,المحلة لفلاتر المياه,"الحى الاول - مركز المدينة, العاشر من رمضان, الشرقية.",622217
معالجة مياه,المحمدى,"ش ماهر محمد عايد متفرع من ش بشتيل, امبابة, الجيزة.",265936
معالجة مياه,المحمدية الحديثة,"القطعة 82 - - منطقة الصناعات الخفيفة, بنى سويف الجديدة, بنى سويف.",527489
معالجة مياه,المحمود,"10 ش 5 يمين متفرع من ش 45, العصافرة قبلى, الاسكندرية.",471244
معالجة مياه,المحيط الهادى,"35 ش 269 متفرع من ش النصر - الدور 1, المعادى الجديدة, المعادى, القاهرة.",610369
معالجة مياه,المركز العربى,"4 ش مجلس المدينة, اشمون, المنوفية.",313251
معالجة مياه,المركز المصرى لتكنولوجيا معالجة المياة والبيئة,"18 ب عمارات العبور - ش صلاح سالم, مدينة نصر, القاهرة.",61524
معالجة مياه,المركز المصرى للاعمال الهندسية,"24 ش عبد الحميد لطفى, المهندسين, الجيزة.",50939
معالجة مياه,المركز الهندسى لخدمة محطات المياه,"330 ش ملك حفنى, ميامى, الاسكندرية.",172893
معالجة مياه,المروة لتنقية المياه,"5 ش خالد بن الوليد, سيدى بشر, الاسكندرية.",222269
معالجة مياه,المروة للخدمات الصناعية,", الأردنية, العاشر من رمضان, الشرقية.",385666
معالجة مياه,المستقبل لفلاتر المياه,"3 ش ابو قايد, طوخ, القليوبية.",515265
معالجة مياه,المصرى جروب لتجارة التكييف وفلاتر المياه,"1 ش احمد عرابى, شبرا الخيمة, القليوبية.",478194
معالجة مياه,المصرى لفلاتر المياه,"47 ش سيدى عواض, قليوب, القليوبية.",526392
معالجة مياه,المصرية الامريكية,"30 ش جلال حماد متفرع من ش جمال عبد الناصر - الدور 1, ميامى, الاسكندرية.",355930
معالجة مياه,المصرية الامريكية لانظمة معالجة المياة,"5 أ/3, تقسيم اللاسكلي, المعادى الجديدة, المعادى, القاهرة.",555620
معالجة مياه,المصرية الاوروبية لفلاتر المياه,", علم الروم, مرسى مطروح.",620802
معالجة مياه,المصرية الدولية زيستا لمعالجة المياة,"ش التيسير - منشية البكرى, المحلة الكبرى, الغربية.",268908
معالجة مياه,المصرية الدولية للتجارة والمقاولات - م. ياسر فتحى,"368 ش عبد السلام عارف, الدور 2, فيكتوريا, الاسكندرية.",267864
معالجة مياه,المصرية السعودية لتكنولوجيا المياه,"كم 12 - طريق الاحياء, منطقة الاحياء, الغردقة.",228968
