Category,Name,Address,ID
معالجة مياه,بامب تك 2000 الوكيل الوحيد لطلمبات ماس داف ودان بامب,"برج تريومف ش المختار, متفرع من ش الجزائر, المعادى الجديدة, المعادى, القاهرة.",54014
معالجة مياه,اوليمبيك بولز للمقاولات,"1 عمارات الدفاع الوطنى, حدائق القبة, القاهرة.",678462
معالجة مياه,بى دبليو تى انترناشيونال,"12 أبراج زهراء سموحة ش مسجد ناصر - 314 سابقا -, سموحة, الاسكندرية.",96616
معالجة مياه,تويك لحمامات السباحة ومعالجة المياه,"131 ش التحرير, الدقى, الجيزة.",526264
معالجة مياه,ناس تك للمشروعات المتكاملة ش.م.م,"فيلا 99, المجاورة الثانية, الحي الثانى, الشيخ زايد, السادس من اكتوبر, الجيزة.",167865
معالجة مياه,مؤسسة المهندس الدولية لبيع وصيانة الطلمبات وأنظمة المياه,"2, ميدان بوابة بهيج, برج العرب, الاسكندرية.",581488
معالجة مياه,سيستمز تكنولوجى للتكييف,", البنفسج 4, التجمع الاول, القاهرة الجديدة, القاهرة.",581341
معالجة مياه,اكواتك لمعالجة المياه والصناعات الهندسية,"1 ش ترعة الجاويش - الطريق البطئ, قليوب, القليوبية.",693502
معالجة مياه,سوتير جروب لمعالجة المياه,"68 ش د. حلمى النمر , نهاية ش جسر السويس, التجاريين, جسر السويس, القاهرة.",63790
معالجة مياه,هيدروتك لتكنولوجيا معالجة المياه,"18 ش عماد الدين كامل, مدينة نصر, القاهرة.",693173
معالجة مياه,اكوا فاين لانظمة معالجة المياه,"24 ش السرايات, عباسية, القاهرة.",130692
معالجة مياه,كولينج لانظمة التكييف,"عمارة مسعود طريق المعاهدة, الدور 1, طلخا, المنصورة, الدقهلية.",312561
معالجة مياه,هليوباور تكنولوجى اتش بى تى,"القطعة 7 - بلوك 12004, المنطقة الصناعية, مدينة العبور, القليوبية.",56561
معالجة مياه,اخوان رزق للتبريد والتكييف والتجارة والاستيراد,"ش عبد السلام عارف, ميدان الساعة, المنصورة, الدقهلية.",115282
معالجة مياه,المركز العلمى للاستيراد والتصدير - اونست,"29 ش النبى دانيال, الدور 3, مركز الغنيمى الادارى, محطة الرمل, الاسكندرية.",189441
معالجة مياه,الندى للخدمات الهندسية,"قطعة 1602, منطقة الشروق الصناعية, الخانكة, القليوبية.",270689
معالجة مياه,الشركة الهندسية لتكنولوجيا المياة والبيئة - اوتيكو,"4 ش جامع الازهر, متفرع من ش جمال عبد الناصر, جسر السويس, القاهرة.",387127
معالجة مياه,الفلتر ملكو,"121 ش رمسيس, وسط البلد, القاهرة.",51083
معالجة مياه,الامريكية للخدمات الفنية,"49 ش موسى بن نصير, الحى السابع, مدينة نصر, القاهرة.",51170
معالجة مياه,بى اس ايجيبت ووتر اند اينرجى,"9 ش الشهيد محمود صبري, الدور 1, رشدى, الاسكندرية.",406516
معالجة مياه,شركة هاميس لانشاء و صيانة حمامات السباحة ومعالجة المياه,"عمارة رقم 519 - , الجيزة, الجيزة.",315249
معالجة مياه,ابراهيم يعقوب للوازم شبكات المياه,"18 ش السبتية, السبتية, القاهرة.",202681
معالجة مياه,آبل ووتر لجميع أنواع فلاتر المياه,"أبراج الصفوة بلازا شارع الأتوبيس الجديد, أمام موقف ميت غمر - داخل المول, المنصورة, الدقهلية.",651254
معالجة مياه,ابو الحسن لفلاتر المياة,"2 ش ترعة الخشاب, حلوان البلد, حلوان, القاهرة.",643110
معالجة مياه,ابو العزم اير تك لفلاتر المياه,"ش سكة الصنابيت, العجيزى, طنطا, الغربية.",647136
معالجة مياه,ابو العمدة لفلاتر المياه,"68 ش جسر المنوات, المنوات, الجيزة.",616863
معالجة مياه,ابو عليم لفلاتر المياه,"11 ش محطة المياه - مدينة الاحرار, المرج, القاهرة.",561559
معالجة مياه,ابو يوسف لفلاتر المياه,"ش الشباب - حى الشباب, مدينة العبور, القليوبية.",521663
معالجة مياه,ابيكو - شركة هندسة ومشروعات البيئة,"10 ش الطيران, مدينة نصر, القاهرة.",43355
معالجة مياه,اتش تو او - اصل الحياة,"13 ش امين يحيى, زيزينيا, الاسكندرية.",192908
معالجة مياه,اتش تو او لفلاتر المياه,"8 ش انس بن مالك - عزبة الحفير, الخصوص, القليوبية.",500366
معالجة مياه,اتلانتك جروب - افريقيا والشرق الاوسط,"17 ش عبد الله بن طاهر متفرع من ش مكرم عبيد, مدينة نصر, القاهرة.",399857
معالجة مياه,احمد اسماعيل لمعالجة المياه,"ش المحلج, ابو كبير, الشرقية.",151881
معالجة مياه,احمد طارق لفلاتر المياه,"53 ش عبد الحافظ - كفر مناقر, بنها, القليوبية.",521794
معالجة مياه,ادفانس لمعالجة المياه,"35 عمارات التوفيق - ش يوسف عباس, مدينة نصر, القاهرة.",67741
معالجة مياه,اربسيما لتكنولوجيا معالجة المياه,"مبني عمر بن الخطاب - المجاورة الثالثة, العاشر من رمضان, الشرقية.",426743
معالجة مياه,اس ان اف ايجيبت,"ش 1, الدور 2, المنطقة الثالثة - المركز التجارى, مساكن شيراتون, مصر الجديدة, القاهرة.",675984
معالجة مياه,اسبرينج ووتر,"4 ش نعيم, شبين الكوم, المنوفية.",535672
معالجة مياه,اسيسكو - الشركة العلمية للتوريدات والخدمات الصناعية,"9 ش د. احمد محمد كمال, الحى الثامن, مدينة نصر, القاهرة.",166792
معالجة مياه,اشرف لفلاتر المياه,"64 ش الحرية, المعادى, القاهرة.",681208
معالجة مياه,اغابى ووتر,"56 ش احمد عبد ربه - منطقة السعادة, شبرا الخيمة, القليوبية.",212923
معالجة مياه,اكسبريس للتصنيع,"11 طريق الحرية, الدور 6, تقاطع ش النبى دانيال, محطة الرمل, الاسكندرية.",192884
معالجة مياه,اكسبونت,"328 عمارات الشروق - ش فيصل - الدور 2 شقة 13, حسن محمد, فيصل, الجيزة.",440299
معالجة مياه,اكسترا بيور,"115 ش سليم الاول, الزيتون, القاهرة.",321931
معالجة مياه,اكوا الفا لمعالجة المياة,"41 ش كمال هويدى, متفرع من ش خاتم المرسلين, العمرانية الغربية, الهرم, الجيزة.",489516
معالجة مياه,اكوا اليكس,"5 ش 13 متفرع من ش 45, العصافرة قبلى, الاسكندرية.",172681
معالجة مياه,اكوا ايجيبت,"2 ش طه حسين, الزمالك, القاهرة.",17585
معالجة مياه,اكوا ايجيبت,"2 ش العيسوى, ميامى, الاسكندرية.",471460
معالجة مياه,اكوا ايجيبت يونايتد,"6 ش الطيار محمود شكرى, سموحة, الاسكندرية.",279769
معالجة مياه,اكوا باور,"11 ش مصطفى علام, غمره, القاهرة.",683524
معالجة مياه,اكوا برو,"4 ش المدينة المنورة متفرع من ش المعهد الدينى, المعادى الجديدة, المعادى, القاهرة.",397692
معالجة مياه,اكوا بست,"28 عمارات المنتصر - , فيصل, الجيزة.",138484
معالجة مياه,اكوا بيانكو,"2 ش عادل الهرميل متفرع من ش سعيد, طنطا, الغربية.",546962
معالجة مياه,اكوا بينو,"ش المحطة, ميت غمر, الدقهلية.",135715
معالجة مياه,اكوا بيور,"50 ش نصوح متفرع من ش جسر السويس, حدائق الزيتون, القاهرة.",581896
معالجة مياه,اكوا بيور,"12 تقسيم الاوقاف - الدور 1, حدائق القبة, القاهرة.",420419
معالجة مياه,اكوا بيور,"برج الزينى - ش محمد على والتجارى - الدور 3 شقة 1, العرب, بور سعيد.",157697
معالجة مياه,اكوا بيور,"ش الزهراء, مدينة بدر, البحيرة.",370628
معالجة مياه,اكوا بيور,"ش الساحة, الحوامدية, الجيزة.",409275
معالجة مياه,اكوا بيور,"21 ش مصطفى كامل - برج سيتى سنتر, شبين الكوم, المنوفية.",535697
معالجة مياه,اكوا بيور النيل,"3 كورنيش النيل - الدواجن, حدائق حلوان, القاهرة.",462596
معالجة مياه,اكوا بيور انترناشيونال,"44, 46 ش السبتية, السبتية, القاهرة.",57523
معالجة مياه,اكوا بيور جروب,"96 ش رايل, تقاطع ش محمود خاطر, حلوان, القاهرة.",397283
معالجة مياه,اكوا بيور سيتى,"ش بورسعيد, سرس الليان, المنوفية.",186844
معالجة مياه,اكوا بيور لفلاتر المياه,"1 ش الحاج سيد على, الشهداء, المنوفية.",550358
معالجة مياه,اكوا بيور نيل,"5 ش عيد عليان, متفرع من ش 77, العرب, المعادى, القاهرة.",225345
معالجة مياه,اكوا بيور ويل لتكنولوجيا معالجة مياه الشرب,"تقاطع ش اسكندر ابراهيم مع جمال عبد الناصر متفرع من ميدان الاكاديمية - برج نفرتيتى - الدور 1 شقة 1, ميامى, الاسكندرية.",333208
معالجة مياه,اكوا تاب - العربية لمعالجة وتعبئة المياه,"92 ش الميرغنى, الشقة 12, الدور 3, كلية البنات, مصر الجديدة, القاهرة.",42727
معالجة مياه,اكوا تاتش لفلاتر المياه,"ش العهد الجديد, المرج, القاهرة.",668884
معالجة مياه,اكوا تراست لمعالجة المياه,"57 ش هشام لبيب, الحى الثامن, مدينة نصر, القاهرة.",2986
معالجة مياه,اكوا ترايت,"11 ش على شلبى، متفرع من ش فريد سميكة, ميدان الحجاز, مصر الجديدة, القاهرة.",621375
معالجة مياه,اكوا تركس لانظمة معالجة المياه,"القطعة 172, المنطقة الصناعية الاولى, مدينة بدر, القاهرة.",68066
معالجة مياه,اكوا تريت,"35 ش اسراء المعلمين, المهندسين, الجيزة.",133010
معالجة مياه,اكوا تريتمنت,"29 ش مصطفى كامل , سموحة, الاسكندرية.",181817
معالجة مياه,اكوا تك,"ش المركز, الحسينية, الشرقية.",366001
معالجة مياه,اكوا تك,"ش عمر شاهين, برج الهجرة, الزقازيق, الشرقية.",688834
معالجة مياه,اكوا تك لمعالجة المياه,"1 ش البطراوى متفرع من ش عباس العقاد, المنطقة الاولى, مدينة نصر, القاهرة.",65224
معالجة مياه,اكوا تكنولوجى انترناشيونال,"12 ش الربيع, الدور 3, متفرع من ش الطيران, المنطقة الاولى, مدينة نصر, القاهرة.",185247
معالجة مياه,اكوا جروب,"8 ش محمود زهير, الزاوية الحمراء, القاهرة.",617748
معالجة مياه,اكوا جروب لفلاتر المياه,"70 ش المدرسة - عرب العيايدة, القلج, القليوبية.",515209
معالجة مياه,اكوا جودى,"9 ش عمرو بن العاص, ميامى, الاسكندرية.",396193
معالجة مياه,اكوا جولد لمعالجة المياة,"ش احمد عرابى برج الصفا، الدور 3, كفر الدوار, البحيرة.",525734
معالجة مياه,اكوا جيت,"فيلا 8, المجاورة 24, مدينة 15 مايو, القاهرة.",466866
معالجة مياه,اكوا رام,"15 ش جوهر القائد, البدرشين, الجيزة.",608746
معالجة مياه,اكوا روزا لمعالجة المياة,"8 ش بخيت هوارى, شبرا, القاهرة.",669541
معالجة مياه,اكوا ريما لمعالجة وتنقية المياه,"ش 45، تقاطع ش 10, العصافرة قبلى, الاسكندرية.",228232
معالجة مياه,اكوا زد,"ش الاستاد, الدهار, الغردقة.",564324
معالجة مياه,اكوا زمزم,"29 ش كفر عصام تقاطع ش النحاس, طنطا, الغربية.",152988
معالجة مياه,اكوا زمزم,"الشارع الجديد, فايد, الاسماعيلية.",159199
معالجة مياه,اكوا زمزم,"ش البنك الاهلى, الشهداء, المنوفية.",317260
معالجة مياه,اكوا زمزم,"1 ش بلقس - الجعافرة, قليوب, القليوبية.",477762
معالجة مياه,اكوا سانا لتكنولوجيا معالجة المياه,"29 ش محمد عبيد ميدان السبع عمارات, مصر الجديدة, القاهرة.",48924
معالجة مياه,اكوا سانو ايجيبت,"14 ش عمر المختار - الحرس الوطنى, بنها, القليوبية.",459138
معالجة مياه,اكوا سبرنج,"42 ش عين شمس, حلمية الزيتون, القاهرة.",134051
معالجة مياه,اكوا ستاندرد لانظمة المياة,"28 ش عمر بن الخطاب, الدهار, الغردقة.",146006
معالجة مياه,اكوا سمارت مصر,"20 مساكن زهراء مدينة نصر - المرحلة الاولى, الحى العاشر, مدينة نصر, القاهرة.",583501
معالجة مياه,اكوا سولو لتكنولوجيا معالجة المياه,"ش محمد نجيب, ميامى, الاسكندرية.",398109
معالجة مياه,اكوا سيتى,"52 ش عبد السلام كساب, بنها, القليوبية.",135620
معالجة مياه,اكوا سيتى,"طريق القاهرة اسكندرية الصحراوى - المنطقة الرابعة, مدينة السادات, المنوفية.",490523
معالجة مياه,اكوا سيتى تكنولوجى,"6 ش 105, ميدان الحرية, المعادى, القاهرة.",668425
معالجة مياه,اكوا سيرفيس ايجيبت,"7 أ عمارات اول مايو - طريق الاوتوستراد ميدان الساعة, مدينة نصر, القاهرة.",168346
معالجة مياه,اكوا سيفتى,"6 د ابراج عثمان - ش الجمهورية, اسيوط, اسيوط.",247559
معالجة مياه,اكوا صافى,"7 ش الشيخ القويسنى متفرع من ش مصر والسودان, حدائق القبة, القاهرة.",498639
معالجة مياه,اكوا فاميلى لفلاتر المياة,"قرية منشأة سلطان, منوف, المنوفية.",546583
معالجة مياه,اكوا فريش لتكنولوجيا معالجة المياه,"1 عمارات جاردنيا الدور 1, السيوف, الاسكندرية.",585054
معالجة مياه,اكوا فلتر لانظمة معالجة المياه,"3 ش الجمهورية, المرج, القاهرة.",518659
معالجة مياه,اكوا فونتانا,"1216 ش الخلفاء الراشدين المجاورة السادسة, الحى الرابع, السادس من اكتوبر, الجيزة.",414052
معالجة مياه,اكوا فيتا لمعالجة المياه,"32 ش محمد بخيت, الزيتون, القاهرة.",171934
معالجة مياه,اكوا فيوتشر,"12 ش البلدية متفرع من ميدان مصطفى كامل, حى الافرنج, الاسماعيلية.",118620
معالجة مياه,اكوا فيوتشر لتنقية مياه الشرب,"5 ش بدر الدين, متفرع من ش التحرير, الدقى, الجيزة.",331401
معالجة مياه,اكوا كايرو لتكنولوجيا معالجة المياه,"4 ش ابو العرب, سيدى بشر, الاسكندرية.",112936
معالجة مياه,اكوا كريستال,"37 ش الحسينى - الدور 3, المهندسين, الجيزة.",341980
معالجة مياه,اكوا كواليتى جروب,"22 ش حسن حسنين, شبرا, القاهرة.",328736
معالجة مياه,اكوا كيارا,"20 عمارات العبور - طريق صلاح سالم - الدور 12, مدينة نصر, القاهرة.",58056
معالجة مياه,اكوا كيرو لفلاتر المياه,"58 ش كابينة النور, عزبة النخل, القاهرة.",528387
معالجة مياه,اكوا كيور,"ش المحلج ميدان الشون - السبع بنات, المحلة الكبرى, الغربية.",583513
معالجة مياه,اكوا لاشين للفلاتر,"1 ش ابراهيم سلام, متفرع من ش د. لاشين, الكوم الاخضر, فيصل, الجيزة.",645928
معالجة مياه,اكوا لايت لفلاتر المياه,"8 ش عبد المنعم رياض, كفر شكر, القليوبية.",519900
معالجة مياه,اكوا لايف,"211 ب ش مسجد التقوى, القاهرة الجديدة, القاهرة.",129421
معالجة مياه,اكوا لايف,"81 ش سليم الاول, حلمية الزيتون, القاهرة.",511307
معالجة مياه,اكوا لايف,"440 طريق الحرية, رشدى, الاسكندرية.",143828
معالجة مياه,اكوا لايف,"ش مصنع الحديد, ابو زعبل, القليوبية.",421949
معالجة مياه,اكوا لايف,"1 ش الاشرف متفرع من ش سعيد, طنطا, الغربية.",513255
معالجة مياه,اكوا لايف لتكنولجيا المياه,"ش زاهر جلال - برج ج, وسط البلد, مرسى مطروح.",541306
معالجة مياه,اكوا لايف لفلاتر المياه,"78 ش العشرين, فيصل, الجيزة.",684032
معالجة مياه,اكوا لايف للمعالجة وتنقية مياة الشرب,"ارض مريم - الشهابية, دمياط, دمياط.",583523
معالجة مياه,اكوا لاين ستار,"121 ش شبرا, الشقة 6, الدور 3, شبرا, القاهرة.",419260
معالجة مياه,اكوا لفلاتر المياة,"15 ش المعهد الدينى, الحوامدية, الجيزة.",604583
معالجة مياه,اكوا لفلاتر المياه,"20 ش عمر بن الخطاب - ارض الجمعية, امبابة, الجيزة.",571509
معالجة مياه,اكوا ليما لفلاتر المياه,"36 ش شريف, حلوان, القاهرة.",580230
معالجة مياه,اكوا مارينا,"61 ش د. احمد كمال, العجمى, الاسكندرية.",156691
معالجة مياه,اكوا ماس,"4 ش الجلاء ميدان عبد المنعم رياض, وسط البلد, القاهرة.",177704
معالجة مياه,اكوا مصر لفلاتر المياه,"32 ش الجمهورية, القلج, القليوبية.",514910
معالجة مياه,اكوا مكة لفلاتر المياه,"26 ش طلعت حرب, الشهداء, المنوفية.",555422
معالجة مياه,اكوا منا لفلاتر المياه,"14 ش 23 يوليو, العياط, الجيزة.",613529
معالجة مياه,اكوا ميراج,"67 أ عمارات رئاسة الجمهورية - ش التقوى, الاميرية, القاهرة.",512859
معالجة مياه,اكوا ميسا للتجارة والتوريدات ومعالجة المياة,"16 ش محمد بك الصيرفى متفرع من ش البكباشى العيسوى, سيدى بشر قبلى, الاسكندرية.",131320
معالجة مياه,اكوا نيل,"47 ش مصدق - الدور 9, الدقى, الجيزة.",68274
معالجة مياه,اكوا نيل,"ش دنشواى, وسط البلد, كفر الشيخ.",345029
معالجة مياه,اكوا وتر,"16 ش عبد الرحمن امين, متفرع من ش جسر السويس, المريلاند, مصر الجديدة, القاهرة.",657546
معالجة مياه,اكوا ووتر,"ش 16, متفرع من ش مصطفى كامل, العصافرة قبلى, الاسكندرية.",632581
معالجة مياه,اكوا وولف,"100 ش رائل, حلوان, القاهرة.",668437
معالجة مياه,اكواتريت,"20 ش القدس الشريف - جديلة, المنصورة, الدقهلية.",60795
معالجة مياه,اكواتك,"47 ش محمد عبد الشافى متفرع من ش كلية الاداب, المنصورة, الدقهلية.",425393
معالجة مياه,اكواستار لفلاتر المياه,"387 ش فيصل, المطبعة, فيصل, الجيزة.",487438
معالجة مياه,اكوافريش لتكنولوجيا معالجة المياه,"16 ش محمد امين ابو زيد متفرع من ش جسر السويس - حى التجاريين, جسر السويس, القاهرة.",139929
معالجة مياه,اكوامنت بلس,"ش عبد السلام الشاذلى, دمنهور, البحيرة.",285775
معالجة مياه,اكوامنت لتكنولوجيا المياه والبيئة,"723 طريق الحرية, الشقة 2, الدور 1, برج فينيسيا, لوران, الاسكندرية.",64553
معالجة مياه,اكواميد ايجيبت,", امام باب 5 ميناء الدخيله, الدخيلة, الاسكندرية.",650512
معالجة مياه,ال عيسى,"ش الشيخ فياض, ابو زعبل, القليوبية.",421297
معالجة مياه,الاخلاص للاستيراد والتصدير,"2 ش طلعت حرب, الشهداء, المنوفية.",555574
معالجة مياه,الاخلاص لمعالجة المياه,"18 أ ش كمال حسن على, مساكن شيراتون, مصر الجديدة, القاهرة.",681687
معالجة مياه,الاخوة لمعالجة مياه الشرب,"ش الساحة, الحوامدية, الجيزة.",406340
معالجة مياه,الاخوين,"ش مصطفى كامل, تلا, المنوفية.",319491
معالجة مياه,الاستاذ,"ش محب, المحلة الكبرى, الغربية.",170475
معالجة مياه,الاسراء لفلاتر المياه,"1 ى ش الخمسين, تقسيم تنفيذ الاحكام, زهراء المعادى, المعادى, القاهرة.",493820
معالجة مياه,الاسراء لفلاتر المياه,"3 ش رند - الحى الغربى, شبين الكوم, المنوفية.",546892
معالجة مياه,الاسراء للتوريدات,"9 ش صلاح الدين, العطارين, الاسكندرية.",483440
معالجة مياه,الاسلامية لمعالجة المياه,"37 ش عماد الدين - الدور 9, وسط البلد, القاهرة.",174340
معالجة مياه,الاصدقاء لفلاتر المياة,"83 ش ملك حفنى, العصافرة قبلى, الاسكندرية.",553103
معالجة مياه,الاصيل للفلاتر,", محور ابو بكر الصديق, الاردنية, العاشر من رمضان, الشرقية.",618644
معالجة مياه,الاعتماد لشبكات المياه,"16 ش محمد حنفى, السبتية, القاهرة.",424528
معالجة مياه,الافق للفلاتر,"257 ش شبرا, شبرا, القاهرة.",670661
معالجة مياه,الافق لمعالجة المياه,"7 ش سليمان نجيب, متفرع من طريق الحرية, بولكلى, الاسكندرية.",65211
معالجة مياه,الالفى وتر للفلاتر,"ش الميناء النهرى, وسط البلد, قنا.",603249
معالجة مياه,الامانة للمقاولات ومعالجة المياه,"2 عمارات البترول - ش احمد عرابى - الدور 1 شقة 3, المهندسين, الجيزة.",110794
معالجة مياه,الاندلس,"9 ش المدينة المنورة, الخصوص, القليوبية.",494039
معالجة مياه,الانقى فرست,"37 ابراج التعمير -, المعمورة, الاسكندرية.",140139
معالجة مياه,الاهرام,"ش احمد ماهر, ميت غمر, الدقهلية.",337466
معالجة مياه,الايطالية,"227 ش ربيع الجيزى, جزيرة الذهب, الجيزة.",281786
معالجة مياه,الايطالية للمحركات,"83 ش خالد بن الوليد, سيدى بشر, الاسكندرية.",234175
معالجة مياه,الايمان بيور,"طريق شوبر, السنطة, الغربية.",332000
