Category,Name,Address,ID
مكرونة,احلى اكلة,"42 ش احمد حافظ متفرع من ش جمال عبد الناصر, سيدى بشر بحرى, الاسكندرية.",614601
مكرونة,البان سويزا,"10 ش خالد بن الوليد, سيدى بشر بحرى, الاسكندرية.",646676
مكرونة,بابور العمدة,"فيلا 7 - ش 257, العرب, المعادى, القاهرة.",614915
مكرونة,باستا,"ش حافظ ابراهيم, حى السويس, السويس.",626638
مكرونة,باستا بار,", المجاورة الثالثة, كمباوند وسط البلد, مدينة 15 مايو, القاهرة.",635636
مكرونة,باستا كب,"6 ش شيكولانى, شبرا, القاهرة.",630850
مكرونة,باستاويش,"4 ش الاثرى محمد بن نافع متفرع من ش الحجاز, روكسى, مصر الجديدة, القاهرة.",584236
مكرونة,باستو فريسكو,"11 ش الشرطة العسكرية, سموحة, الاسكندرية.",621728
مكرونة,بساطة,"45 ش 9, ثكنات المعادى, المعادى, القاهرة.",584214
مكرونة,بيتزا العمدة,"201 ش الترعة البولاقية, شبرا, القاهرة.",629023
مكرونة,بيتزا الكابتن,"18 ش بورسعيد, تقاطع ش الثلاثينى, الثلاثينى, الاسماعيلية.",637910
مكرونة,بيتزا بيستو,"ش القومية العربية, امبابة, الجيزة.",642988
مكرونة,بيتزا جار,"ش الشهيد الطيار محمود شاكر, سموحة, الاسكندرية.",632907
مكرونة,بيستو,"ش عمار بن ياسرفلل الجامعة, الزقازيق, الشرقية.",628359
مكرونة,تسعيناتى,"ش عبد العزيز على غيط, الشيخ زايد, الاسماعيلية.",626592
مكرونة,تشيزيرز,"6036 ش 9, المقطم, القاهرة.",622506
مكرونة,تن اليفن بيتزاريا,"ش الشباب, الحى 12, الشيخ زايد, السادس من اكتوبر, الجيزة.",586659
مكرونة,تيك اواى ياسين,"ش بورسعيد, السيدة زينب, القاهرة.",588814
مكرونة,جست كب,"ش سعيد, تقاطع ش حسن رضوان, طنطا, الغربية.",621562
مكرونة,جوجوز باستا,"ش الشباب, ميدان الجامعة, مدينة الشروق, القاهرة.",584120
مكرونة,خلطبيطة بالصلصة,"4 ش عبد الله سالم, متفرع من ش احمد ذكى, حدائق المعادى, المعادى, القاهرة.",635619
مكرونة,رونيز,", قشلاق السواحل, حى المناخ, بور سعيد.",621478
مكرونة,سوب اند باستا,"20 مساكن التعاونيات - ش الجلاء البحرى, شبين الكوم, المنوفية.",544273
مكرونة,طواجن سكر,"94 ش التحرير, ميدان الدقى, الدقى, الجيزة.",661381
مكرونة,ع الحديدة,"الشطر 13 - عمارة 27, زهراء المعادى, المعادى, القاهرة.",587345
مكرونة,ع الناصية,"منطقة خدمات الحى الاول, التجمع الخامس, القاهرة الجديدة, القاهرة.",584156
مكرونة,غالى للمكرونة والمشويات,", ميدان الزراعة, المحلة الكبرى, الغربية.",649703
مكرونة,فيدرز,"المحور المركزى, ميدان ماجدة, الحى الثامن, السادس من اكتوبر, الجيزة.",642646
مكرونة,فيلوتشى,", الشطر الثالث, عمارات نيركو, المعادى الجديدة, المعادى, القاهرة.",674893
مكرونة,كازا لا باستا,"9 ش د. المحروقى, متفرع من ش البطل احمد عبد العزيز, المهندسين, الجيزة.",592386
مكرونة,كريباستا,"., الحى السابع, السادس من اكتوبر, الجيزة.",618674
مكرونة,كزا باستا,"18 مساكن التعاونيات - ش الجلاء البحرى, شبين الكوم, المنوفية.",544281
مكرونة,لى جاردن,"115 ش الاندلس التعاونيات, سموحة, الاسكندرية.",632965
مكرونة,ماك اند تشيز فاكتورى,"ش المعسكر الرومانى, رشدى, الاسكندرية.",632455
مكرونة,مايسترو,"ش الخليفة المأمون, وسط البلد, كفر الشيخ.",617168
مكرونة,مستر باستا,"برج الملتقى، ش توت عنخ امون, سموحة, الاسكندرية.",629088
مكرونة,مسيو سجؤه,"ش 29, الحى الثانى - المنطقة الثالثة, التجمع الخامس, القاهرة الجديدة, القاهرة.",586897
مكرونة,مطعم لينجوينى,"ش 304, المعادى الجديدة, المعادى, القاهرة.",633595
مكرونة,مطعم ابو حمادة,"71 مساكن الدلتا ش صبحى حسين, المقطم, القاهرة.",681893
مكرونة,مطعم ابو شهد,"37 ش ترعة زنين - زنين, بولاق الدكرور, الجيزة.",589123
مكرونة,مطعم العم سيد,"218 أ ش 15, حدائق الاهرام, الهرم, الجيزة.",670529
مكرونة,مطعم العمدة,"42 ش بين البلدين, ميت عقبة, المهندسين, الجيزة.",590383
مكرونة,مطعم بابا خالد,"64 ح ش الضغط العالى, حدائق الاهرام, الهرم, الجيزة.",636623
مكرونة,مطعم باستيسان,", المجاورة الثانية, الحى 12, الشيخ زايد, السادس من اكتوبر, الجيزة.",632502
مكرونة,مطعم برايم,", مدينة مبارك, المنصورة, الدقهلية.",637892
مكرونة,مطعم بوستو,"ش بطرس, طنطا, الغربية.",630480
مكرونة,مطعم حجاج,"6 عمارات اول مايو, مدينة نصر, القاهرة.",676845
مكرونة,مطعم شوكة وسكينة,"42 ش عمر طوسون متفرع من احمد عرابى, المهندسين, الجيزة.",594070
مكرونة,مطعم فريداى,", مجمع المحاكم, المنصورة, الدقهلية.",642576
مكرونة,مطعم كروستى,"18 عمارات المدفعية ش كيلانى محمد كيلانى, مدينة نصر, القاهرة.",635424
مكرونة,مطعم وكافيه فيوجن,", الممشى السياحى, طريق القرى, الغردقة.",634500
مكرونة,مطعم ويل دان,"245 ش فيصل, التعاون, فيصل, الجيزة.",632716
مكرونة,معكرونة,"ش كفر عصام, طنطا, الغربية.",621491
مكرونة,مكرونتو,"2 ش فرج عبد الخالق، متفرع من ش المسلة, مصر الجديدة, القاهرة.",620917
مكرونة,مكرونة ادم,", تقسيم شلبى, ارض شلبى, المنيا.",628322
مكرونة,مكرونة الافندى,"مساكن الزلزال - ش 9, المقطم, القاهرة.",273733
مكرونة,مكرونة الانسجام,"2 ش سمير, متفرع من ش المحطة, الجيزة, الجيزة.",630530
مكرونة,مكرونة الزعيم,"112 ش ترعة الخشاب, المعصرة, القاهرة.",656166
مكرونة,مكرونى,"سور نادى المنتزة, الشيخ زايد, الاسماعيلية.",626560
مكرونة,ميات فرينش بيكرى,"6 ج ش العادل ابو بكر, متفرع من ش الملك الافضل, الزمالك, القاهرة.",559757
مكرونة,ميجاس,"كم 33 طريق القاهرة السويس, مدينتى, القاهرة.",628929
مكرونة,ميجز ميل,"المجاورة الثانية، الحى 12, الشيخ زايد, السادس من اكتوبر, الجيزة.",621431
